id,title,selftext,created_utc,score,num_comments,link_flair_text,upvote_ratio,permalink,url,is_self,over_18,spoiler,stickied,locked,subreddit,full_text,created_date,year,month,day,day_of_week,day_name,week_of_year,hour,season,platform_period,cleaned_text,text_length,word_count,contains_crime_keywords,contains_weather_keywords,crime_keyword_count,weather_keyword_count,crime_and_weather,engagement_rate,controversy_score,is_2022,is_2023,pre_api_announcement,post_api_announcement,during_blackout,pre_api_changes,post_api_changes,quarter,author_hash,sentiment_compound,sentiment_positive,sentiment_neutral,sentiment_negative,sentiment_category
143j3ww,Child-Friendly dentist (not pediatric),"My son (5) has cavities in his molars. (Which is super disappointing because we tried so hard to be vigilant) He has cavities in all four molars. He had one fixed at the regular dentist with freezing. He did a great job but he was wiggling. I was outside the room and I heard everything. They did ask him to stop moving multiple times, but no tears, no fighting and they got the job done. 

However; the dentist recommended a pediatric dentist. This seemed a bit excessive to me (They wanted to knock him out, which is standard, I guess.) After the consult, sending in all the estimates, etc. they are now telling me it would be at least a six month wait. They are booking into the new year. 

Does anyone have experience with a dentist who knows how to work well with kids? But not a specific pediatric dentist, more about bedside manner?

Hoping for another alternative and would love to hear the experience of any other parents.

Thanks so much.",1686158240.0,1,10,Question,0.6,/r/regina/comments/143j3ww/childfriendly_dentist_not_pediatric/,https://www.reddit.com/r/regina/comments/143j3ww/childfriendly_dentist_not_pediatric/,True,False,False,False,False,Regina,"Child-Friendly dentist (not pediatric) My son (5) has cavities in his molars. (Which is super disappointing because we tried so hard to be vigilant) He has cavities in all four molars. He had one fixed at the regular dentist with freezing. He did a great job but he was wiggling. I was outside the room and I heard everything. They did ask him to stop moving multiple times, but no tears, no fighting and they got the job done. 

However; the dentist recommended a pediatric dentist. This seemed a bit excessive to me (They wanted to knock him out, which is standard, I guess.) After the consult, sending in all the estimates, etc. they are now telling me it would be at least a six month wait. They are booking into the new year. 

Does anyone have experience with a dentist who knows how to work well with kids? But not a specific pediatric dentist, more about bedside manner?

Hoping for another alternative and would love to hear the experience of any other parents.

Thanks so much.",2023-06-07 17:17:20+00:00,2023,6,7,2,Wednesday,23,17,summer,2022-2023_api_transition,child friendly dentist not pediatric my son has cavities in his molars. which is super disappointing because we tried so hard to be vigilant he has cavities in all four molars. he had one fixed at the regular dentist with freezing. he did a great job but he was wiggling. i was outside the room and i heard everything. they did ask him to stop moving multiple times but no tears no fighting and they got the job done. however the dentist recommended a pediatric dentist. this seemed a bit excessive to me they wanted to knock him out which is standard i guess. after the consult sending in all the estimates etc. they are now telling me it would be at least a six month wait. they are booking into the new year. does anyone have experience with a dentist who knows how to work well with kids? but not a specific pediatric dentist more about bedside manner? hoping for another alternative and would love to hear the experience of any other parents. thanks so much.,963,177,False,True,0,1,False,5.0,0.4,False,True,False,True,False,True,False,2023_Q2,c9a3bfac557d7743,0.976,0.163,0.799,0.037,positive
14milam,Winnipeg couple disappointed after ‘dismissive’ police response to attempted break-in,,1688077727.0,415,138,Community,0.97,/r/Winnipeg/comments/14milam/winnipeg_couple_disappointed_after_dismissive/,https://globalnews.ca/news/9802275/winnipeg-couple-police-response-attempted-break-in/amp/,False,False,False,False,False,Winnipeg,Winnipeg couple disappointed after ‘dismissive’ police response to attempted break-in ,2023-06-29 22:28:47+00:00,2023,6,29,3,Thursday,26,22,summer,2022-2023_api_transition,winnipeg couple disappointed after dismissive police response to attempted break in,83,11,True,False,2,0,False,0.3317307692307692,0.030000000000000027,False,True,False,True,False,True,False,2023_Q2,b4774b7f9ba496a7,-0.4767,0.0,0.763,0.237,negative
14fl02h,Police called after anti-LGBTTQ+ group upends school board meeting,,1687385223.0,206,148,News,0.91,/r/Winnipeg/comments/14fl02h/police_called_after_antilgbttq_group_upends/,https://www.winnipegfreepress.com/breakingnews/2023/06/21/police-called-after-anti-lgbttq-group-upends-school-board-meeting,False,False,False,False,False,Winnipeg,Police called after anti-LGBTTQ+ group upends school board meeting ,2023-06-21 22:07:03+00:00,2023,6,21,2,Wednesday,25,22,summer,2022-2023_api_transition,police called after anti lgbttq group upends school board meeting,65,10,True,False,1,0,False,0.714975845410628,0.08999999999999997,False,True,False,True,False,True,False,2023_Q2,2dc898ced0c8ea31,-0.3182,0.0,0.796,0.204,negative
14h9r33,Bike theft in Winnipeg sucks,"Second bike in 9 months from inside my locked garage, I cried this time.

I’m literally buying the most garbage used bike from now on.

Rant over.",1687554265.0,132,88,Community,0.94,/r/Winnipeg/comments/14h9r33/bike_theft_in_winnipeg_sucks/,https://www.reddit.com/r/Winnipeg/comments/14h9r33/bike_theft_in_winnipeg_sucks/,True,False,False,False,False,Winnipeg,"Bike theft in Winnipeg sucks Second bike in 9 months from inside my locked garage, I cried this time.

I’m literally buying the most garbage used bike from now on.

Rant over.",2023-06-23 21:04:25+00:00,2023,6,23,4,Friday,25,21,summer,2022-2023_api_transition,bike theft in winnipeg sucks second bike in months from inside my locked garage i cried this time. i m literally buying the most garbage used bike from now on. rant over.,170,32,True,False,1,0,False,0.6616541353383458,0.06000000000000005,False,True,False,True,False,True,False,2023_Q2,5822f9fd14b52a0a,-0.7579,0.0,0.795,0.205,negative
141wm4p,"My car was stolen, MPI says I ‘falsified my statement’ of the theft and won’t pay for the damages","I’ve been dogged around by MPI since early march when my car was stolen from my garage. I’ve been lied to, left without a call back for days and not updated when I should have been. I have several witnesses to confirm I was home during the time of the theft and did not falsify my statement so I’m planning to take them to small claims court. Coming here in hopes of getting any information from someone who has gone through this process.",1686009127.0,99,94,Ask Winnipeg,0.82,/r/Winnipeg/comments/141wm4p/my_car_was_stolen_mpi_says_i_falsified_my/,https://www.reddit.com/r/Winnipeg/comments/141wm4p/my_car_was_stolen_mpi_says_i_falsified_my/,True,False,False,False,False,Winnipeg,"My car was stolen, MPI says I ‘falsified my statement’ of the theft and won’t pay for the damages I’ve been dogged around by MPI since early march when my car was stolen from my garage. I’ve been lied to, left without a call back for days and not updated when I should have been. I have several witnesses to confirm I was home during the time of the theft and did not falsify my statement so I’m planning to take them to small claims court. Coming here in hopes of getting any information from someone who has gone through this process.",2023-06-05 23:52:07+00:00,2023,6,5,0,Monday,23,23,summer,2022-2023_api_transition,my car was stolen mpi says i falsified my statement of the theft and won t pay for the damages i ve been dogged around by mpi since early march when my car was stolen from my garage. i ve been lied to left without a call back for days and not updated when i should have been. i have several witnesses to confirm i was home during the time of the theft and did not falsify my statement so i m planning to take them to small claims court. coming here in hopes of getting any information from someone who has gone through this process.,532,106,True,False,3,0,False,0.94,0.18000000000000005,False,True,False,True,False,True,False,2023_Q2,11b1214e1b7149a4,-0.7114,0.074,0.796,0.13,negative
146174w,"Winnipeg mayor calls for new, free bike registry to help curb thefts",,1686406050.0,209,60,News,0.97,/r/Winnipeg/comments/146174w/winnipeg_mayor_calls_for_new_free_bike_registry/,https://www.cbc.ca/news/canada/manitoba/winnipeg-bike-registry-thefts-1.6872087,False,False,False,False,False,Winnipeg,"Winnipeg mayor calls for new, free bike registry to help curb thefts ",2023-06-10 14:07:30+00:00,2023,6,10,5,Saturday,23,14,summer,2022-2023_api_transition,winnipeg mayor calls for new free bike registry to help curb thefts,67,12,True,False,1,0,False,0.2857142857142857,0.030000000000000027,False,True,False,True,False,True,False,2023_Q2,6c5014a40848480d,0.7184,0.375,0.625,0.0,positive
14dt3hm,‘All of them fought for their lives’: teen stabbed in group assault after concert,,1687214253.0,129,77,News,0.93,/r/Winnipeg/comments/14dt3hm/all_of_them_fought_for_their_lives_teen_stabbed/,https://www.winnipegfreepress.com/breakingnews/2023/06/19/teen-assaulted-seriously-injured-after-downtown-concert,False,False,False,False,False,Winnipeg,‘All of them fought for their lives’: teen stabbed in group assault after concert ,2023-06-19 22:37:33+00:00,2023,6,19,0,Monday,25,22,summer,2022-2023_api_transition,all of them fought for their lives teen stabbed in group assault after concert,78,14,True,False,1,0,False,0.5923076923076923,0.06999999999999995,False,True,False,True,False,True,False,2023_Q2,2dc898ced0c8ea31,-0.8402,0.0,0.55,0.45,negative
147drqj,two-men-arrested-in-connection-with-robbery | CBC News,,1686540614.0,7,0,News,0.89,/r/Winnipeg/comments/147drqj/twomenarrestedinconnectionwithrobbery_cbc_news/,https://www.cbc.ca/news/canada/manitoba/winnipeg-convenience-store-employees-attacked-in-hospital-after-robbery-1.6872983,False,False,False,False,False,Winnipeg,two-men-arrested-in-connection-with-robbery | CBC News ,2023-06-12 03:30:14+00:00,2023,6,12,0,Monday,24,3,summer,2022-2023_api_transition,two men arrested in connection with robbery cbc news,52,9,True,False,2,0,False,0.0,0.10999999999999999,False,True,False,True,True,True,False,2023_Q2,8079a3d5f143a1fa,-0.4767,0.0,0.721,0.279,negative
144q2t9,"'It breaks my heart that this happened': Man accused of driving stolen truck in crash that seriously injured police officers addicted to meth, mother says",,1686270293.0,4,27,News,0.58,/r/Winnipeg/comments/144q2t9/it_breaks_my_heart_that_this_happened_man_accused/,https://www.winnipegfreepress.com/breakingnews/2023/06/08/it-breaks-my-heart-that-this-happened,False,False,False,False,False,Winnipeg,"'It breaks my heart that this happened': Man accused of driving stolen truck in crash that seriously injured police officers addicted to meth, mother says ",2023-06-09 00:24:53+00:00,2023,6,9,4,Friday,23,0,summer,2022-2023_api_transition,it breaks my heart that this happened man accused of driving stolen truck in crash that seriously injured police officers addicted to meth mother says,150,25,True,False,3,0,False,5.4,0.42000000000000004,False,True,False,True,False,True,False,2023_Q2,2d2d2c982e604272,-0.743,0.118,0.532,0.35,negative
146mlu0,"Hey Winnipeg! I’m visiting for a weekend in August. I’m looking at booking a hotel and wondering where the safest places would be (little to no car break ins, etc). And if you have any recommendations for a hotel. Thanks!!",,1686465321.0,0,17,Ask Winnipeg,0.38,/r/Winnipeg/comments/146mlu0/hey_winnipeg_im_visiting_for_a_weekend_in_august/,https://www.reddit.com/r/Winnipeg/comments/146mlu0/hey_winnipeg_im_visiting_for_a_weekend_in_august/,True,False,False,False,False,Winnipeg,"Hey Winnipeg! I’m visiting for a weekend in August. I’m looking at booking a hotel and wondering where the safest places would be (little to no car break ins, etc). And if you have any recommendations for a hotel. Thanks!! ",2023-06-11 06:35:21+00:00,2023,6,11,6,Sunday,23,6,summer,2022-2023_api_transition,hey winnipeg! i m visiting for a weekend in august. i m looking at booking a hotel and wondering where the safest places would be little to no car break ins etc . and if you have any recommendations for a hotel. thanks!!,220,43,True,True,1,1,True,17.0,0.62,False,True,False,True,False,True,False,2023_Q2,ecc0a46b06427046,0.6761,0.134,0.826,0.04,positive
14n8rxi,Best cold drink for a hot weather in Winnipeg,What is your go-to drink during a hot weather in Winnipeg?,1688151122.0,39,164,Food,0.84,/r/Winnipeg/comments/14n8rxi/best_cold_drink_for_a_hot_weather_in_winnipeg/,https://www.reddit.com/r/Winnipeg/comments/14n8rxi/best_cold_drink_for_a_hot_weather_in_winnipeg/,True,False,False,False,False,Winnipeg,Best cold drink for a hot weather in Winnipeg What is your go-to drink during a hot weather in Winnipeg?,2023-06-30 18:52:02+00:00,2023,6,30,4,Friday,26,18,summer,2022-2023_api_transition,best cold drink for a hot weather in winnipeg what is your go to drink during a hot weather in winnipeg?,104,21,False,True,0,3,False,4.1,0.16000000000000003,False,True,False,True,False,True,False,2023_Q2,32fe5638f17b9353,0.6369,0.174,0.826,0.0,positive
141x1m5,Leaf on hot seat after heat-induced closure,,1686010074.0,41,46,News,0.74,/r/Winnipeg/comments/141x1m5/leaf_on_hot_seat_after_heatinduced_closure/,https://www.winnipegfreepress.com/breakingnews/2023/06/05/leaf-in-hot-seat-after-heat-induced-closure,False,False,False,False,False,Winnipeg,Leaf on hot seat after heat-induced closure ,2023-06-06 00:07:54+00:00,2023,6,6,1,Tuesday,23,0,summer,2022-2023_api_transition,leaf on hot seat after heat induced closure,43,8,False,True,0,1,False,1.0952380952380953,0.26,False,True,False,True,False,True,False,2023_Q2,5861eba84721135e,0.0,0.0,1.0,0.0,neutral
141t8sv,Is it too hot for a cat to be outside?,"My indoor cat has grown incredibly fond of  going outside on his aerial runner and will now cry all day to go out or lay around depressed af until he does. It’s literally the highlight of his day.

So far I’ve only gone out with him in the evenings when it’s a bit cooler but I felt bad for him today. So here I am, outside with him right now, sweating my ass off yet he seems just fine. 

Is he somehow cooler than me out in this heat? What is a reasonable amount of time he can be outside in the heat like this?",1686002065.0,27,42,Winni-Pets,0.8,/r/Winnipeg/comments/141t8sv/is_it_too_hot_for_a_cat_to_be_outside/,https://www.reddit.com/r/Winnipeg/comments/141t8sv/is_it_too_hot_for_a_cat_to_be_outside/,True,False,False,False,False,Winnipeg,"Is it too hot for a cat to be outside? My indoor cat has grown incredibly fond of  going outside on his aerial runner and will now cry all day to go out or lay around depressed af until he does. It’s literally the highlight of his day.

So far I’ve only gone out with him in the evenings when it’s a bit cooler but I felt bad for him today. So here I am, outside with him right now, sweating my ass off yet he seems just fine. 

Is he somehow cooler than me out in this heat? What is a reasonable amount of time he can be outside in the heat like this?",2023-06-05 21:54:25+00:00,2023,6,5,0,Monday,23,21,summer,2022-2023_api_transition,is it too hot for a cat to be outside? my indoor cat has grown incredibly fond of going outside on his aerial runner and will now cry all day to go out or lay around depressed af until he does. it s literally the highlight of his day. so far i ve only gone out with him in the evenings when it s a bit cooler but i felt bad for him today. so here i am outside with him right now sweating my ass off yet he seems just fine. is he somehow cooler than me out in this heat? what is a reasonable amount of time he can be outside in the heat like this?,546,118,False,True,0,1,False,1.5,0.19999999999999996,False,True,False,True,False,True,False,2023_Q2,15aa0f0b9b57cf24,-0.7902,0.069,0.824,0.107,negative
14f8vb4,City urged to boost snow-clearing budget to $54M,,1687356796.0,43,40,News,0.9,/r/Winnipeg/comments/14f8vb4/city_urged_to_boost_snowclearing_budget_to_54m/,https://www.winnipegfreepress.com/breakingnews/2023/06/21/city-urged-to-boost-snow-clearing-budget-to-54m,False,False,False,False,False,Winnipeg,City urged to boost snow-clearing budget to $54M ,2023-06-21 14:13:16+00:00,2023,6,21,2,Wednesday,25,14,summer,2022-2023_api_transition,city urged to boost snow clearing budget to m,45,9,False,True,0,1,False,0.9090909090909091,0.09999999999999998,False,True,False,True,False,True,False,2023_Q2,5861eba84721135e,0.4019,0.252,0.748,0.0,positive
13zqotl,"YSK, that running your furnace fan during the summer makes one hell of difference in temperature if all your ductwork is in concrete, under the house","Might be common knowledge, but you should know that running your furnace fan during the summer months makes one hell of difference in temperature if all your ductwork is in concrete, under the house.

Even if it’s not, it’s probably not a bad idea to just keep the air moving if you don’t have ceiling fans. 

Made this discovery today and wanted to share.",1685828653.0,37,8,Community,0.82,/r/Winnipeg/comments/13zqotl/ysk_that_running_your_furnace_fan_during_the/,https://www.reddit.com/r/Winnipeg/comments/13zqotl/ysk_that_running_your_furnace_fan_during_the/,True,False,False,False,False,Winnipeg,"YSK, that running your furnace fan during the summer makes one hell of difference in temperature if all your ductwork is in concrete, under the house Might be common knowledge, but you should know that running your furnace fan during the summer months makes one hell of difference in temperature if all your ductwork is in concrete, under the house.

Even if it’s not, it’s probably not a bad idea to just keep the air moving if you don’t have ceiling fans. 

Made this discovery today and wanted to share.",2023-06-03 21:44:13+00:00,2023,6,3,5,Saturday,22,21,summer,2022-2023_api_transition,ysk that running your furnace fan during the summer makes one hell of difference in temperature if all your ductwork is in concrete under the house might be common knowledge but you should know that running your furnace fan during the summer months makes one hell of difference in temperature if all your ductwork is in concrete under the house. even if it s not it s probably not a bad idea to just keep the air moving if you don t have ceiling fans. made this discovery today and wanted to share.,498,93,False,True,0,2,False,0.21052631578947367,0.18000000000000005,False,True,False,True,False,True,False,2023_Q2,7fb9a633caf47260,-0.0065,0.104,0.81,0.086,neutral
14ln4zh,"Wow, looks like we are finally gonna be getting a storm!","Super dark in this area, some thunder. No rain yet but the sky looks promising. How about the rest of you? ",1687991058.0,36,50,Ask Winnipeg,0.77,/r/Winnipeg/comments/14ln4zh/wow_looks_like_we_are_finally_gonna_be_getting_a/,https://www.reddit.com/r/Winnipeg/comments/14ln4zh/wow_looks_like_we_are_finally_gonna_be_getting_a/,True,False,False,False,False,Winnipeg,"Wow, looks like we are finally gonna be getting a storm! Super dark in this area, some thunder. No rain yet but the sky looks promising. How about the rest of you? ",2023-06-28 22:24:18+00:00,2023,6,28,2,Wednesday,26,22,summer,2022-2023_api_transition,wow looks like we are finally gonna be getting a storm! super dark in this area some thunder. no rain yet but the sky looks promising. how about the rest of you?,161,32,False,True,0,2,False,1.3513513513513513,0.22999999999999998,False,True,False,True,False,True,False,2023_Q2,df6410df587d6ee5,0.8335,0.267,0.692,0.041,positive
14epfaq,"Ugh, looks like the Winnipeg Storm Shield is at it again .... 30 min difference",,1687300114.0,91,22,Community,0.96,/r/Winnipeg/comments/14epfaq/ugh_looks_like_the_winnipeg_storm_shield_is_at_it/,https://www.reddit.com/gallery/14epfaq,False,False,False,False,False,Winnipeg,"Ugh, looks like the Winnipeg Storm Shield is at it again .... 30 min difference ",2023-06-20 22:28:34+00:00,2023,6,20,1,Tuesday,25,22,summer,2022-2023_api_transition,ugh looks like the winnipeg storm shield is at it again .... min difference,75,14,False,True,0,1,False,0.2391304347826087,0.040000000000000036,False,True,False,True,False,True,False,2023_Q2,dd6ef897984274e9,-0.0772,0.145,0.694,0.162,negative
143bki3,Storm Clouds From Monday,"Here I am to rate Mother Nature's storm clouds from Monday. 

The first picture has stellar height and base but the curves are lacking. Mostly just hair like a Disney Princess, too pink 6/10

In the second display with our other model, full body, billowy for days, and  could get lost in their blue skies for days. But the subject is a bit shy, hiding behind our Millennium Library. If you're in the heart of downtown strut your stuff! 9.5/10",1686140010.0,96,1,Pictures/Video,0.95,/r/Winnipeg/comments/143bki3/storm_clouds_from_monday/,https://www.reddit.com/gallery/143bki3,False,False,False,False,False,Winnipeg,"Storm Clouds From Monday Here I am to rate Mother Nature's storm clouds from Monday. 

The first picture has stellar height and base but the curves are lacking. Mostly just hair like a Disney Princess, too pink 6/10

In the second display with our other model, full body, billowy for days, and  could get lost in their blue skies for days. But the subject is a bit shy, hiding behind our Millennium Library. If you're in the heart of downtown strut your stuff! 9.5/10",2023-06-07 12:13:30+00:00,2023,6,7,2,Wednesday,23,12,summer,2022-2023_api_transition,storm clouds from monday here i am to rate mother nature s storm clouds from monday. the first picture has stellar height and base but the curves are lacking. mostly just hair like a disney princess too pink in the second display with our other model full body billowy for days and could get lost in their blue skies for days. but the subject is a bit shy hiding behind our millennium library. if you re in the heart of downtown strut your stuff! .,448,85,False,True,0,1,False,0.010309278350515464,0.050000000000000044,False,True,False,True,False,True,False,2023_Q2,adb852f602b74d4f,0.4753,0.096,0.82,0.085,positive
14h3nz5,They said this at the Riel Trustee meeting🙄,Sounds ridiculous but they were so ernest and hate filled. Very dangerous and will lead to violence. Source is WAM.,1687539411.0,386,260,Community,0.9,/r/Winnipeg/comments/14h3nz5/they_said_this_at_the_riel_trustee_meeting/,https://i.redd.it/dyezp1n2ts7b1.jpg,False,False,False,False,False,Winnipeg,They said this at the Riel Trustee meeting🙄 Sounds ridiculous but they were so ernest and hate filled. Very dangerous and will lead to violence. Source is WAM.,2023-06-23 16:56:51+00:00,2023,6,23,4,Friday,25,16,summer,2022-2023_api_transition,they said this at the riel trustee meeting sounds ridiculous but they were so ernest and hate filled. very dangerous and will lead to violence. source is wam.,158,28,True,False,2,0,False,0.6718346253229974,0.09999999999999998,False,True,False,True,False,True,False,2023_Q2,cd677484ff1c76d7,-0.958,0.036,0.548,0.416,negative
14578dh,Point Douglas parents want city to open water park to provide relief from extreme heat (CBC),,1686322059.0,107,28,News,0.89,/r/Winnipeg/comments/14578dh/point_douglas_parents_want_city_to_open_water/,https://v.redd.it/t0oy23t5905b1,False,False,False,False,False,Winnipeg,Point Douglas parents want city to open water park to provide relief from extreme heat (CBC) ,2023-06-09 14:47:39+00:00,2023,6,9,4,Friday,23,14,summer,2022-2023_api_transition,point douglas parents want city to open water park to provide relief from extreme heat cbc,90,16,False,True,0,1,False,0.25925925925925924,0.10999999999999999,False,True,False,True,False,True,False,2023_Q2,e5314724810f15a2,0.5267,0.239,0.761,0.0,positive
