id,title,selftext,created_utc,score,num_comments,link_flair_text,upvote_ratio,permalink,url,is_self,over_18,spoiler,stickied,locked,subreddit,full_text,created_date,year,month,day,day_of_week,day_name,week_of_year,hour,season,platform_period,cleaned_text,text_length,word_count,contains_crime_keywords,contains_weather_keywords,crime_keyword_count,weather_keyword_count,crime_and_weather,engagement_rate,controversy_score,is_2022,is_2023,pre_api_announcement,post_api_announcement,during_blackout,pre_api_changes,post_api_changes,quarter,author_hash,sentiment_compound,sentiment_positive,sentiment_neutral,sentiment_negative,sentiment_category
ul9poy,Posting this here as well because police told me that what normally happens with these trailer thefts is that they are brought to the hells angels in Sask who then bring it down to the US for sale. Please let me know if you find or see anything related to this truck and trailer so I can contact RCMP,,1652039678.0,33,2,General,0.88,/r/saskatoon/comments/ul9poy/posting_this_here_as_well_because_police_told_me/,https://www.reddit.com/gallery/uk5cu1,False,False,False,False,False,Saskatoon,Posting this here as well because police told me that what normally happens with these trailer thefts is that they are brought to the hells angels in Sask who then bring it down to the US for sale. Please let me know if you find or see anything related to this truck and trailer so I can contact RCMP ,2022-05-08 19:54:38+00:00,2022,5,8,6,Sunday,18,19,spring,2022-2023_api_transition,posting this here as well because police told me that what normally happens with these trailer thefts is that they are brought to the hells angels in sask who then bring it down to the us for sale. please let me know if you find or see anything related to this truck and trailer so i can contact rcmp,300,59,True,False,3,0,False,0.058823529411764705,0.12,True,False,True,False,False,True,False,2022_Q2,3582f954ec01ff7e,0.5267,0.072,0.928,0.0,positive
ug227p,Spring weather & views in the city along the river,,1651418274.0,131,9,Photos of Saskatoon,0.95,/r/saskatoon/comments/ug227p/spring_weather_views_in_the_city_along_the_river/,https://www.reddit.com/gallery/ug227p,False,False,False,False,False,Saskatoon,Spring weather & views in the city along the river ,2022-05-01 15:17:54+00:00,2022,5,1,6,Sunday,17,15,spring,2022-2023_api_transition,spring weather views in the city along the river,48,9,False,True,0,2,False,0.06818181818181818,0.050000000000000044,True,False,True,False,False,True,False,2022_Q2,f17ee5039b094195,0.0,0.0,1.0,0.0,neutral
ukhlmq,The weather forecasts around here when it comes to rain are terrible,"Just want to know if it's going to start raining, 4 different websites have 4 different forecasts.",1651942949.0,4,12,Weather,0.57,/r/saskatoon/comments/ukhlmq/the_weather_forecasts_around_here_when_it_comes/,https://www.reddit.com/r/saskatoon/comments/ukhlmq/the_weather_forecasts_around_here_when_it_comes/,True,False,False,False,False,Saskatoon,"The weather forecasts around here when it comes to rain are terrible Just want to know if it's going to start raining, 4 different websites have 4 different forecasts.",2022-05-07 17:02:29+00:00,2022,5,7,5,Saturday,18,17,spring,2022-2023_api_transition,the weather forecasts around here when it comes to rain are terrible just want to know if it s going to start raining different websites have different forecasts.,162,28,False,True,0,2,False,2.4,0.43000000000000005,True,False,True,False,False,True,False,2022_Q2,9bf36ac959b4075e,-0.4215,0.043,0.855,0.102,negative
ug7hor,Finally nice spring weather... and some Prairie crocus flowers in bloom,,1651433698.0,75,1,Photos of Saskatoon,0.95,/r/saskatoon/comments/ug7hor/finally_nice_spring_weather_and_some_prairie/,https://www.reddit.com/gallery/ug7hor,False,False,False,False,False,Saskatoon,Finally nice spring weather... and some Prairie crocus flowers in bloom ,2022-05-01 19:34:58+00:00,2022,5,1,6,Sunday,17,19,spring,2022-2023_api_transition,finally nice spring weather... and some prairie crocus flowers in bloom,71,11,False,True,0,2,False,0.013157894736842105,0.050000000000000044,True,False,True,False,False,True,False,2022_Q2,f17ee5039b094195,0.4215,0.219,0.781,0.0,positive
uqk0wy,"Tired, annoyed, and frustrated of continuously getting harassed as to why I am still wearing a mask.","Anybody else? 

I've been going for walks and bike rides to enjoy the nice weather. Passed by an old man today saying that I'm crazy for wearing a mask. I also passed by some kids saying ""covid's fake"".

I already get harassed enough at work by coworkers and customers, and it doesn't help that I work for the government as well.",1652662906.0,161,279,Rants,0.73,/r/saskatoon/comments/uqk0wy/tired_annoyed_and_frustrated_of_continuously/,https://www.reddit.com/r/saskatoon/comments/uqk0wy/tired_annoyed_and_frustrated_of_continuously/,True,False,False,False,False,Saskatoon,"Tired, annoyed, and frustrated of continuously getting harassed as to why I am still wearing a mask. Anybody else? 

I've been going for walks and bike rides to enjoy the nice weather. Passed by an old man today saying that I'm crazy for wearing a mask. I also passed by some kids saying ""covid's fake"".

I already get harassed enough at work by coworkers and customers, and it doesn't help that I work for the government as well.",2022-05-16 01:01:46+00:00,2022,5,16,0,Monday,20,1,spring,2022-2023_api_transition,tired annoyed and frustrated of continuously getting harassed as to why i am still wearing a mask. anybody else? i ve been going for walks and bike rides to enjoy the nice weather. passed by an old man today saying that i m crazy for wearing a mask. i also passed by some kids saying covid s fake . i already get harassed enough at work by coworkers and customers and it doesn t help that i work for the government as well.,423,83,False,True,0,1,False,1.7222222222222223,0.27,True,False,True,False,False,True,False,2022_Q2,5210c5639c32ecd9,-0.891,0.104,0.691,0.205,negative
v0pdl8,Mountain Dew: Flaming hot location,If you’re looking for the new Flamin hot Dew here in Saskatoon. Head on over to the Gas Plus on central ( the one beside dominos and across the street from taco time). They also have ghost energy drinks and specialty pops from the states.,1653874907.0,11,18,General,0.77,/r/saskatoon/comments/v0pdl8/mountain_dew_flaming_hot_location/,https://www.reddit.com/r/saskatoon/comments/v0pdl8/mountain_dew_flaming_hot_location/,True,False,True,False,False,Saskatoon,Mountain Dew: Flaming hot location If you’re looking for the new Flamin hot Dew here in Saskatoon. Head on over to the Gas Plus on central ( the one beside dominos and across the street from taco time). They also have ghost energy drinks and specialty pops from the states.,2022-05-30 01:41:47+00:00,2022,5,30,0,Monday,22,1,spring,2022-2023_api_transition,mountain dew flaming hot location if you re looking for the new flamin hot dew here in saskatoon. head on over to the gas plus on central the one beside dominos and across the street from taco time . they also have ghost energy drinks and specialty pops from the states.,270,51,False,True,0,1,False,1.5,0.22999999999999998,True,False,True,False,False,True,False,2022_Q2,903a6483d0cc3d65,-0.0516,0.039,0.918,0.043,negative
ufpe94,Hot Tub Permit?,Just wondering if anyone has experience with this. Do you need a permit for an above ground hot tub? The guides on city of Saskatoon are quite vague,1651369839.0,3,19,Question,0.67,/r/saskatoon/comments/ufpe94/hot_tub_permit/,https://www.reddit.com/r/saskatoon/comments/ufpe94/hot_tub_permit/,True,False,False,False,False,Saskatoon,Hot Tub Permit? Just wondering if anyone has experience with this. Do you need a permit for an above ground hot tub? The guides on city of Saskatoon are quite vague,2022-05-01 01:50:39+00:00,2022,5,1,6,Sunday,17,1,spring,2022-2023_api_transition,hot tub permit? just wondering if anyone has experience with this. do you need a permit for an above ground hot tub? the guides on city of saskatoon are quite vague,164,31,False,True,0,1,False,4.75,0.32999999999999996,True,False,True,False,False,True,False,2022_Q2,1374e60532192a76,-0.2624,0.0,0.936,0.064,negative
uq7v5o,“Temperaturen in Saskatoon” found in Physics Building at U of S,,1652626778.0,39,13,Photos of Saskatoon,0.85,/r/saskatoon/comments/uq7v5o/temperaturen_in_saskatoon_found_in_physics/,https://i.redd.it/t08yphbdmnz81.jpg,False,False,False,False,False,Saskatoon,“Temperaturen in Saskatoon” found in Physics Building at U of S ,2022-05-15 14:59:38+00:00,2022,5,15,6,Sunday,19,14,spring,2022-2023_api_transition,temperaturen in saskatoon found in physics building at u of s,61,11,False,True,0,1,False,0.325,0.15000000000000002,True,False,True,False,False,True,False,2022_Q2,3422300e0e4a8116,0.0,0.0,1.0,0.0,neutral
uyerai,Dodge Sport 1500 stolen from Silverspring. Plate ending JLH.,,1653591523.0,25,8,PSA,0.82,/r/saskatoon/comments/uyerai/dodge_sport_1500_stolen_from_silverspring_plate/,https://www.reddit.com/gallery/uyerai,False,False,False,False,False,Saskatoon,Dodge Sport 1500 stolen from Silverspring. Plate ending JLH. ,2022-05-26 18:58:43+00:00,2022,5,26,3,Thursday,21,18,spring,2022-2023_api_transition,dodge sport stolen from silverspring. plate ending jlh.,55,8,True,True,2,1,True,0.3076923076923077,0.18000000000000005,True,False,True,False,False,True,False,2022_Q2,dab67e110d12518d,-0.4939,0.0,0.686,0.314,negative
uh0k2s,Rentals in Regina. Am I missing something?,"Family is moving to Regina. I have done some research and some kind redditor gave me the link to the crime map. We are looking to move July but could move as early as June or as late as August.

Problem is all the homes for rent seem to be in North Central with very few homes (that are within our budget anyway - around 1500) anywhere else. I do not mean to belittle North Central but I have 2 young children and would love them to be able to play outside freely.

I have been checking Marketplace, Kijiji and reached out to some property managers (Kodiak, Shawn's, etc.)

Am I missing any other places I should be looking?

Edit: Should have mentioned we are looking for a house, duplex or townhome. We have a dog. Could do a main floor but wouldn't want the four year old's pitter patter to be a disturbance.",1651527877.0,8,83,Question,0.7,/r/regina/comments/uh0k2s/rentals_in_regina_am_i_missing_something/,https://www.reddit.com/r/regina/comments/uh0k2s/rentals_in_regina_am_i_missing_something/,True,False,False,False,False,Regina,"Rentals in Regina. Am I missing something? Family is moving to Regina. I have done some research and some kind redditor gave me the link to the crime map. We are looking to move July but could move as early as June or as late as August.

Problem is all the homes for rent seem to be in North Central with very few homes (that are within our budget anyway - around 1500) anywhere else. I do not mean to belittle North Central but I have 2 young children and would love them to be able to play outside freely.

I have been checking Marketplace, Kijiji and reached out to some property managers (Kodiak, Shawn's, etc.)

Am I missing any other places I should be looking?

Edit: Should have mentioned we are looking for a house, duplex or townhome. We have a dog. Could do a main floor but wouldn't want the four year old's pitter patter to be a disturbance.",2022-05-02 21:44:37+00:00,2022,5,2,0,Monday,18,21,spring,2022-2023_api_transition,rentals in regina. am i missing something? family is moving to regina. i have done some research and some kind redditor gave me the link to the crime map. we are looking to move july but could move as early as june or as late as august. problem is all the homes for rent seem to be in north central with very few homes that are within our budget anyway around anywhere else. i do not mean to belittle north central but i have young children and would love them to be able to play outside freely. i have been checking marketplace kijiji and reached out to some property managers kodiak shawn s etc. am i missing any other places i should be looking? edit should have mentioned we are looking for a house duplex or townhome. we have a dog. could do a main floor but wouldn t want the four year old s pitter patter to be a disturbance.,832,161,True,False,1,0,False,9.222222222222221,0.30000000000000004,True,False,True,False,False,True,False,2022_Q2,c9a3bfac557d7743,0.8346,0.117,0.809,0.074,positive
ut8dhn,How common is licence plate theft/switching in Regina?,"Just wondering if anyone knows since I've reported both a drunk driver and (just last week) a hit and run on my car, but the police tell me both licence plates belong to completely different vehicles?? I know for the future to try and take a picture instead, but in the heat of the moment both times my first instinct was to write down the plates. The guy who hit my car was a bit slow escaping, so I actually had time to verify the plate, so I KNOW it was right...

Any thoughts?",1652980885.0,26,21,Question,1.0,/r/regina/comments/ut8dhn/how_common_is_licence_plate_theftswitching_in/,https://www.reddit.com/r/regina/comments/ut8dhn/how_common_is_licence_plate_theftswitching_in/,True,False,False,False,False,Regina,"How common is licence plate theft/switching in Regina? Just wondering if anyone knows since I've reported both a drunk driver and (just last week) a hit and run on my car, but the police tell me both licence plates belong to completely different vehicles?? I know for the future to try and take a picture instead, but in the heat of the moment both times my first instinct was to write down the plates. The guy who hit my car was a bit slow escaping, so I actually had time to verify the plate, so I KNOW it was right...

Any thoughts?",2022-05-19 17:21:25+00:00,2022,5,19,3,Thursday,20,17,spring,2022-2023_api_transition,how common is licence plate theft switching in regina? just wondering if anyone knows since i ve reported both a drunk driver and just last week a hit and run on my car but the police tell me both licence plates belong to completely different vehicles?? i know for the future to try and take a picture instead but in the heat of the moment both times my first instinct was to write down the plates. the guy who hit my car was a bit slow escaping so i actually had time to verify the plate so i know it was right... any thoughts?,528,104,True,False,2,0,False,0.7777777777777778,0.0,True,False,True,False,False,True,False,2022_Q2,f144104d89cef4a5,-0.3313,0.012,0.963,0.025,negative
uj5vxl,"With the weather warming up please remember to donate items such as water, water bottles, freezies and sunscreen :)",,1651780873.0,26,3,Community,0.75,/r/regina/comments/uj5vxl/with_the_weather_warming_up_please_remember_to/,https://www.reddit.com/r/regina/comments/uj5vxl/with_the_weather_warming_up_please_remember_to/,True,False,False,False,False,Regina,"With the weather warming up please remember to donate items such as water, water bottles, freezies and sunscreen :) ",2022-05-05 20:01:13+00:00,2022,5,5,3,Thursday,18,20,spring,2022-2023_api_transition,with the weather warming up please remember to donate items such as water water bottles freezies and sunscreen,110,18,False,True,0,2,False,0.1111111111111111,0.25,True,False,True,False,False,True,False,2022_Q2,572c1e29b69b44d9,0.4404,0.196,0.804,0.0,positive
uiy7gs,Commuting by Bicycle,I am moving to Regina soon and I was wondering how realistic is it to commute using a bicycle? Is the city bicycle friendly? How about in winter?,1651759513.0,25,45,Community,0.84,/r/regina/comments/uiy7gs/commuting_by_bicycle/,https://www.reddit.com/r/regina/comments/uiy7gs/commuting_by_bicycle/,True,False,False,False,False,Regina,Commuting by Bicycle I am moving to Regina soon and I was wondering how realistic is it to commute using a bicycle? Is the city bicycle friendly? How about in winter?,2022-05-05 14:05:13+00:00,2022,5,5,3,Thursday,18,14,spring,2022-2023_api_transition,commuting by bicycle i am moving to regina soon and i was wondering how realistic is it to commute using a bicycle? is the city bicycle friendly? how about in winter?,166,31,False,True,0,1,False,1.7307692307692308,0.16000000000000003,True,False,True,False,False,True,False,2022_Q2,16496a605514716a,0.5775,0.111,0.889,0.0,positive
usgpke,Spring snow expected in parts of Saskatchewan prior to May long weekend,,1652890971.0,36,22,News,1.0,/r/regina/comments/usgpke/spring_snow_expected_in_parts_of_saskatchewan/,https://www.cbc.ca/news/canada/saskatchewan/snow-expected-thursday-in-southern-sask-1.6457660,False,False,False,False,False,Regina,Spring snow expected in parts of Saskatchewan prior to May long weekend ,2022-05-18 16:22:51+00:00,2022,5,18,2,Wednesday,20,16,spring,2022-2023_api_transition,spring snow expected in parts of saskatchewan prior to may long weekend,71,12,False,True,0,2,False,0.5945945945945946,0.0,True,False,True,False,False,True,False,2022_Q2,c52f4df34252155f,0.0,0.0,1.0,0.0,neutral
uoxgvs,Missing Cat Cathedral Area,"**Cordelia**

1.5 year old Female (fixed)

Colouration: Calico (grey, orange, white)

Green Eyes Pink nose and paws

Smaller cat with mom body (chubby)

Last seen May 12 around 2100 block Pasqua (7/11 area)

Demeanour is friendly with some attitude.

She is chipped.**Any information please post here or PM me**

She snuck out before the storm and so may be holed up somewhere or have been taken in.

https://preview.redd.it/o0jq6bzn8az81.jpg?width=480&format=pjpg&auto=webp&s=ca830e35f644b6df69972585f9d0165d95475212

https://preview.redd.it/vjvn2ezn8az81.jpg?width=3024&format=pjpg&auto=webp&s=e831826e6889741e48d9da338c4e806189132721",1652464738.0,51,14,Community,0.98,/r/regina/comments/uoxgvs/missing_cat_cathedral_area/,https://www.reddit.com/r/regina/comments/uoxgvs/missing_cat_cathedral_area/,True,False,False,False,False,Regina,"Missing Cat Cathedral Area **Cordelia**

1.5 year old Female (fixed)

Colouration: Calico (grey, orange, white)

Green Eyes Pink nose and paws

Smaller cat with mom body (chubby)

Last seen May 12 around 2100 block Pasqua (7/11 area)

Demeanour is friendly with some attitude.

She is chipped.**Any information please post here or PM me**

She snuck out before the storm and so may be holed up somewhere or have been taken in.

https://preview.redd.it/o0jq6bzn8az81.jpg?width=480&format=pjpg&auto=webp&s=ca830e35f644b6df69972585f9d0165d95475212

https://preview.redd.it/vjvn2ezn8az81.jpg?width=3024&format=pjpg&auto=webp&s=e831826e6889741e48d9da338c4e806189132721",2022-05-13 17:58:58+00:00,2022,5,13,4,Friday,19,17,spring,2022-2023_api_transition,missing cat cathedral area cordelia . year old female fixed colouration calico grey orange white green eyes pink nose and paws smaller cat with mom body chubby last seen may around block pasqua area demeanour is friendly with some attitude. she is chipped. any information please post here or pm me she snuck out before the storm and so may be holed up somewhere or have been taken in.,385,69,False,True,0,1,False,0.2692307692307692,0.020000000000000018,True,False,True,False,False,True,False,2022_Q2,5c4420b819dab918,0.1531,0.088,0.844,0.067,positive
up6ot2,Centre Square Safety?,"Hello everyone,

I'm moving to a place in the Centre Square neighbourhood for a few months. I've been told it's really sketchy. What should I expect when I move here? Any tips and tricks on getting around safely?

Thanks!",1652492509.0,5,18,Discussion,0.73,/r/regina/comments/up6ot2/centre_square_safety/,https://www.reddit.com/r/regina/comments/up6ot2/centre_square_safety/,True,False,False,False,False,Regina,"Centre Square Safety? Hello everyone,

I'm moving to a place in the Centre Square neighbourhood for a few months. I've been told it's really sketchy. What should I expect when I move here? Any tips and tricks on getting around safely?

Thanks!",2022-05-14 01:41:49+00:00,2022,5,14,5,Saturday,19,1,spring,2022-2023_api_transition,centre square safety? hello everyone i m moving to a place in the centre square neighbourhood for a few months. i ve been told it s really sketchy. what should i expect when i move here? any tips and tricks on getting around safely? thanks!,240,45,True,False,1,0,False,3.0,0.27,True,False,True,False,False,True,False,2022_Q2,8e2819d58bcbdeb1,0.8493,0.186,0.785,0.029,positive
umbtk7,Stolen Bag with Travel Docs - Reward for Return,"A pink and brown Vera Bradley bag was taken out of my vehicle Monday May 9th between 4 and 10 pm. It contains my study permit and my passport which are obviously incredibly important to me. I know this is a long shot, but I will offer a reward for its return, no questions asked. I can pick it up at a location or you can anonymously drop it off to me. For more info you can message me here or email at lesliemiller3313@gmail.com. I can’t stress how much that case means to me, please please consider retuning. Thank you.",1652162655.0,37,9,Community,0.93,/r/regina/comments/umbtk7/stolen_bag_with_travel_docs_reward_for_return/,https://www.reddit.com/r/regina/comments/umbtk7/stolen_bag_with_travel_docs_reward_for_return/,True,False,False,False,False,Regina,"Stolen Bag with Travel Docs - Reward for Return A pink and brown Vera Bradley bag was taken out of my vehicle Monday May 9th between 4 and 10 pm. It contains my study permit and my passport which are obviously incredibly important to me. I know this is a long shot, but I will offer a reward for its return, no questions asked. I can pick it up at a location or you can anonymously drop it off to me. For more info you can message me here or email at lesliemiller3313@gmail.com. I can’t stress how much that case means to me, please please consider retuning. Thank you.",2022-05-10 06:04:15+00:00,2022,5,10,1,Tuesday,19,6,spring,2022-2023_api_transition,stolen bag with travel docs reward for return a pink and brown vera bradley bag was taken out of my vehicle monday may th between and pm. it contains my study permit and my passport which are obviously incredibly important to me. i know this is a long shot but i will offer a reward for its return no questions asked. i can pick it up at a location or you can anonymously drop it off to me. for more info you can message me here or email at EMAIL . i can t stress how much that case means to me please please consider retuning. thank you.,538,108,True,True,2,1,True,0.23684210526315788,0.06999999999999995,True,False,True,False,False,True,False,2022_Q2,9f5ca27a9743fca1,0.8379,0.143,0.776,0.08,positive
