id,title,selftext,created_utc,score,num_comments,link_flair_text,upvote_ratio,permalink,url,is_self,over_18,spoiler,stickied,locked,subreddit,full_text,created_date,year,month,day,day_of_week,day_name,week_of_year,hour,season,platform_period,cleaned_text,text_length,word_count,contains_crime_keywords,contains_weather_keywords,crime_keyword_count,weather_keyword_count,crime_and_weather,engagement_rate,controversy_score,is_2022,is_2023,pre_api_announcement,post_api_announcement,during_blackout,pre_api_changes,post_api_changes,quarter,author_hash,sentiment_compound,sentiment_positive,sentiment_neutral,sentiment_negative,sentiment_category
u30ecr,Even the snow can’t stop Rusty from having fun and living his best life,,1649884009.0,298,31,Pictures/Video,0.87,/r/Winnipeg/comments/u30ecr/even_the_snow_cant_stop_rusty_from_having_fun_and/,https://v.redd.it/f0a7y05o2dt81,False,False,False,False,False,Winnipeg,Even the snow can’t stop Rusty from having fun and living his best life ,2022-04-13 21:06:49+00:00,2022,4,13,2,Wednesday,15,21,spring,2022-2023_api_transition,even the snow can t stop rusty from having fun and living his best life,71,15,False,True,0,1,False,0.10367892976588629,0.13,True,False,True,False,False,True,False,2022_Q2,765729f90ff4063a,0.743,0.346,0.553,0.101,positive
uanq3i,This storm has a little bit of everything. Lightning. Downpours. Snow. A radar penis wearing a cape…,,1650778476.0,397,20,Satire/Humour,0.98,/r/Winnipeg/comments/uanq3i/this_storm_has_a_little_bit_of_everything/,https://i.redd.it/9bqtbpbfyev81.jpg,False,False,False,False,False,Winnipeg,This storm has a little bit of everything. Lightning. Downpours. Snow. A radar penis wearing a cape… ,2022-04-24 05:34:36+00:00,2022,4,24,6,Sunday,16,5,spring,2022-2023_api_transition,this storm has a little bit of everything. lightning. downpours. snow. a radar penis wearing a cape,99,17,False,True,0,2,False,0.05025125628140704,0.020000000000000018,True,False,True,False,False,True,False,2022_Q2,c9e3587f7ea760a9,0.0,0.0,1.0,0.0,neutral
u1l0co,How much snow do you think we will get?,"With this being potentially the worst snowstorm in decades, we might as well predict how much snow we'll get!

Personally, I think we will get 45 cm.",1649720341.0,8,76,Ask Winnipeg,0.59,/r/Winnipeg/comments/u1l0co/how_much_snow_do_you_think_we_will_get/,https://www.reddit.com/r/Winnipeg/comments/u1l0co/how_much_snow_do_you_think_we_will_get/,True,False,False,False,False,Winnipeg,"How much snow do you think we will get? With this being potentially the worst snowstorm in decades, we might as well predict how much snow we'll get!

Personally, I think we will get 45 cm.",2022-04-11 23:39:01+00:00,2022,4,11,0,Monday,15,23,spring,2022-2023_api_transition,how much snow do you think we will get? with this being potentially the worst snowstorm in decades we might as well predict how much snow we ll get! personally i think we will get cm.,183,36,False,True,0,2,False,8.444444444444445,0.41000000000000003,True,False,True,False,False,True,False,2022_Q2,aa3f1dfc4c9631d7,-0.5093,0.052,0.84,0.108,negative
u1idv6,Snow Storm Preparation,Wondering what everyone is doing to prepare. Stocking up on food? Batteries? Working from home? Sending thoughts and prayers?,1649713127.0,7,77,Ask Winnipeg,0.59,/r/Winnipeg/comments/u1idv6/snow_storm_preparation/,https://www.reddit.com/r/Winnipeg/comments/u1idv6/snow_storm_preparation/,True,False,False,False,False,Winnipeg,Snow Storm Preparation Wondering what everyone is doing to prepare. Stocking up on food? Batteries? Working from home? Sending thoughts and prayers?,2022-04-11 21:38:47+00:00,2022,4,11,0,Monday,15,21,spring,2022-2023_api_transition,snow storm preparation wondering what everyone is doing to prepare. stocking up on food? batteries? working from home? sending thoughts and prayers?,148,22,False,True,0,2,False,9.625,0.41000000000000003,True,False,True,False,False,True,False,2022_Q2,9b2423046d7b923b,0.0,0.0,1.0,0.0,neutral
u907s0,Winnipeg's entire 2022 snow-clearing budget wiped out in first 3 months,,1650582701.0,82,51,News,0.9,/r/Winnipeg/comments/u907s0/winnipegs_entire_2022_snowclearing_budget_wiped/,https://www.cbc.ca/news/canada/manitoba/snow-clearing-winnipeg-budget-over-2022-1.6426020,False,False,False,False,False,Winnipeg,Winnipeg's entire 2022 snow-clearing budget wiped out in first 3 months ,2022-04-21 23:11:41+00:00,2022,4,21,3,Thursday,16,23,spring,2022-2023_api_transition,winnipeg s entire snow clearing budget wiped out in first months,64,11,False,True,0,1,False,0.6144578313253012,0.09999999999999998,True,False,True,False,False,True,False,2022_Q2,2dc898ced0c8ea31,0.0,0.0,1.0,0.0,neutral
u2uwac,My timelapse before the snow ruined it.,,1649869031.0,221,24,Pictures/Video,0.95,/r/Winnipeg/comments/u2uwac/my_timelapse_before_the_snow_ruined_it/,https://v.redd.it/44p8aw63ubt81,False,False,False,False,False,Winnipeg,My timelapse before the snow ruined it. ,2022-04-13 16:57:11+00:00,2022,4,13,2,Wednesday,15,16,spring,2022-2023_api_transition,my timelapse before the snow ruined it.,39,7,False,True,0,1,False,0.10810810810810811,0.050000000000000044,True,False,True,False,False,True,False,2022_Q2,d8f10a6a17c823d1,-0.4767,0.0,0.659,0.341,negative
u36gej,So how much snow have you received so far on your side of the city?,,1649901734.0,94,37,Ask Winnipeg,0.87,/r/Winnipeg/comments/u36gej/so_how_much_snow_have_you_received_so_far_on_your/,https://v.redd.it/t724t1c2jet81,False,False,False,False,False,Winnipeg,So how much snow have you received so far on your side of the city? ,2022-04-14 02:02:14+00:00,2022,4,14,3,Thursday,15,2,spring,2022-2023_api_transition,so how much snow have you received so far on your side of the city?,67,15,False,True,0,1,False,0.3894736842105263,0.13,True,False,True,False,False,True,False,2022_Q2,5ea37009ca041743,0.0,0.0,1.0,0.0,neutral
tyeh04,Major Colorado Low with potential for heavy snow possible for next Thursday. Sorry 😢,,1649342258.0,59,42,News,0.88,/r/Winnipeg/comments/tyeh04/major_colorado_low_with_potential_for_heavy_snow/,https://i.imgur.com/6mVAmeb.jpg,False,False,False,False,False,Winnipeg,Major Colorado Low with potential for heavy snow possible for next Thursday. Sorry 😢 ,2022-04-07 14:37:38+00:00,2022,4,7,3,Thursday,14,14,spring,2022-2023_api_transition,major colorado low with potential for heavy snow possible for next thursday. sorry,82,13,False,True,0,1,False,0.7,0.12,True,False,True,False,False,True,False,2022_Q2,1f0d4cd74ae758a8,-0.3976,0.0,0.749,0.251,negative
u5ojph,🥇Today's ~4am low of -13.7°C is the lowest temperature Winnipeg has recorded on Apr 17th since records began in 1872.,,1650206886.0,96,15,News,0.95,/r/Winnipeg/comments/u5ojph/todays_4am_low_of_137c_is_the_lowest_temperature/,https://i.redd.it/7dzu2gzqq3u81.png,False,False,False,False,False,Winnipeg,🥇Today's ~4am low of -13.7°C is the lowest temperature Winnipeg has recorded on Apr 17th since records began in 1872. ,2022-04-17 14:48:06+00:00,2022,4,17,6,Sunday,15,14,spring,2022-2023_api_transition,today s am low of . c is the lowest temperature winnipeg has recorded on apr th since records began in .,104,22,False,True,0,1,False,0.15463917525773196,0.050000000000000044,True,False,True,False,False,True,False,2022_Q2,bdd9cecfabd99654,-0.5719,0.0,0.81,0.19,negative
u15e1j,“Do not plan to travel - this storm has the potential to be the worst blizzard in decades”,,1649675969.0,450,221,Alerts,0.98,/r/Winnipeg/comments/u15e1j/do_not_plan_to_travel_this_storm_has_the/,https://i.imgur.com/4VEZoZp.jpg,False,False,False,False,False,Winnipeg,“Do not plan to travel - this storm has the potential to be the worst blizzard in decades” ,2022-04-11 11:19:29+00:00,2022,4,11,0,Monday,15,11,spring,2022-2023_api_transition,do not plan to travel this storm has the potential to be the worst blizzard in decades,86,17,False,True,0,2,False,0.49002217294900224,0.020000000000000018,True,False,True,False,False,True,False,2022_Q2,1f0d4cd74ae758a8,-0.6249,0.0,0.796,0.204,negative
u27vqd,Completely unserious question about the storm.,"Has anyone tried honking at it and telling it we don’t want it?

Our province, our choice. 

Go away storm.

Edit: holy hell, I just wanted us to have a bit of fun!  Thank you for all the upvotes on this!  :)",1649793395.0,649,121,Satire/Humour,0.88,/r/Winnipeg/comments/u27vqd/completely_unserious_question_about_the_storm/,https://www.reddit.com/r/Winnipeg/comments/u27vqd/completely_unserious_question_about_the_storm/,True,False,False,False,False,Winnipeg,"Completely unserious question about the storm. Has anyone tried honking at it and telling it we don’t want it?

Our province, our choice. 

Go away storm.

Edit: holy hell, I just wanted us to have a bit of fun!  Thank you for all the upvotes on this!  :)",2022-04-12 19:56:35+00:00,2022,4,12,1,Tuesday,15,19,spring,2022-2023_api_transition,completely unserious question about the storm. has anyone tried honking at it and telling it we don t want it? our province our choice. go away storm. edit holy hell i just wanted us to have a bit of fun! thank you for all the upvotes on this!,243,48,False,True,0,1,False,0.18615384615384614,0.12,True,False,True,False,False,True,False,2022_Q2,a35aaabb5ef9aa70,0.2695,0.137,0.782,0.082,positive
u2qre8,"when I went to get groceries yesterday almost all the milk was gone. I get when people wanna stock up on water & toilet paper, even if it's just a storm that will last 3 days or whatever. but why horde milk? it doesn't even last that long.",,1649857786.0,185,83,Community,0.86,/r/Winnipeg/comments/u2qre8/when_i_went_to_get_groceries_yesterday_almost_all/,https://i.redd.it/l1hbrctpwat81.jpg,False,False,False,False,False,Winnipeg,"when I went to get groceries yesterday almost all the milk was gone. I get when people wanna stock up on water & toilet paper, even if it's just a storm that will last 3 days or whatever. but why horde milk? it doesn't even last that long. ",2022-04-13 13:49:46+00:00,2022,4,13,2,Wednesday,15,13,spring,2022-2023_api_transition,when i went to get groceries yesterday almost all the milk was gone. i get when people wanna stock up on water toilet paper even if it s just a storm that will last days or whatever. but why horde milk? it doesn t even last that long.,234,48,False,True,0,1,False,0.44623655913978494,0.14,True,False,True,False,False,True,False,2022_Q2,5d0061cc618b77a6,0.0,0.0,1.0,0.0,neutral
u1deue,Province to give winter storm update @ 3PM,,1649699193.0,88,106,News,0.93,/r/Winnipeg/comments/u1deue/province_to_give_winter_storm_update_3pm/,https://winnipeg.ctvnews.ca/province-to-give-winter-storm-update-ahead-of-coming-blizzard-1.5857363?cid=sm%3Atrueanthem%3Actvwinnipeg%3Amanualpost&utm_campaign=trueAnthem%3A+New+Content+%28Feed%29&utm_medium=trueAnthem&utm_source=facebook,False,False,False,False,False,Winnipeg,Province to give winter storm update @ 3PM ,2022-04-11 17:46:33+00:00,2022,4,11,0,Monday,15,17,spring,2022-2023_api_transition,province to give winter storm update pm,39,7,False,True,0,2,False,1.1910112359550562,0.06999999999999995,True,False,True,False,False,True,False,2022_Q2,5432761b69bc281a,0.0,0.0,1.0,0.0,neutral
u34vlm,When the super Storm that is anticipated never shows but you already told everyone to stay home,,1649896802.0,232,56,Satire/Humour,0.89,/r/Winnipeg/comments/u34vlm/when_the_super_storm_that_is_anticipated_never/,https://i.redd.it/ugocai8r4et81.jpg,False,False,False,False,False,Winnipeg,When the super Storm that is anticipated never shows but you already told everyone to stay home ,2022-04-14 00:40:02+00:00,2022,4,14,3,Thursday,15,0,spring,2022-2023_api_transition,when the super storm that is anticipated never shows but you already told everyone to stay home,95,17,False,True,0,1,False,0.24034334763948498,0.10999999999999999,True,False,True,False,False,True,False,2022_Q2,b313e587b6e223dd,0.3506,0.133,0.867,0.0,positive
u21wgk,Manitoba storm could close Winnipeg schools for 1st time since 1997,,1649777720.0,116,54,News,0.96,/r/Winnipeg/comments/u21wgk/manitoba_storm_could_close_winnipeg_schools_for/,https://www.cbc.ca/news/canada/manitoba/snow-day-winnipeg-school-storm-blizzard-1.6416733,False,False,False,False,False,Winnipeg,Manitoba storm could close Winnipeg schools for 1st time since 1997 ,2022-04-12 15:35:20+00:00,2022,4,12,1,Tuesday,15,15,spring,2022-2023_api_transition,manitoba storm could close winnipeg schools for st time since,61,10,False,True,0,1,False,0.46153846153846156,0.040000000000000036,True,False,True,False,False,True,False,2022_Q2,5861eba84721135e,0.0,0.0,1.0,0.0,neutral
u3jebl,"Staying home during Manitoba storm may have saved lives, officials say - Winnipeg",,1649948175.0,133,51,News,0.88,/r/Winnipeg/comments/u3jebl/staying_home_during_manitoba_storm_may_have_saved/,https://globalnews.ca/news/8759654/manitoba-blizzard-shared-health/,False,False,False,False,False,Winnipeg,"Staying home during Manitoba storm may have saved lives, officials say - Winnipeg ",2022-04-14 14:56:15+00:00,2022,4,14,3,Thursday,15,14,spring,2022-2023_api_transition,staying home during manitoba storm may have saved lives officials say winnipeg,78,12,False,True,0,1,False,0.3805970149253731,0.12,True,False,True,False,False,True,False,2022_Q2,2c22ab6d595ea5db,0.4215,0.203,0.797,0.0,positive
u4rfg4,"only 6 hours away from winnipeg, looks like we dodged a bullet on that storm that everyone complaining about us NOT getting, thank gosh we didn't!!!!!",,1650089251.0,185,36,News,0.95,/r/Winnipeg/comments/u4rfg4/only_6_hours_away_from_winnipeg_looks_like_we/,https://youtu.be/EZ61pdHnX6Y,False,False,False,False,False,Winnipeg,"only 6 hours away from winnipeg, looks like we dodged a bullet on that storm that everyone complaining about us NOT getting, thank gosh we didn't!!!!! ",2022-04-16 06:07:31+00:00,2022,4,16,5,Saturday,15,6,spring,2022-2023_api_transition,only hours away from winnipeg looks like we dodged a bullet on that storm that everyone complaining about us not getting thank gosh we didn t!!!!!,146,26,False,True,0,1,False,0.1935483870967742,0.050000000000000044,True,False,True,False,False,True,False,2022_Q2,ae7af2a72ed8245e,-0.3773,0.082,0.752,0.166,negative
u45wbc,April storm in Winnipeg,,1650021951.0,395,19,Where in WPG?,0.98,/r/Winnipeg/comments/u45wbc/april_storm_in_winnipeg/,https://v.redd.it/utxz70ovgot81,False,False,False,False,False,Winnipeg,April storm in Winnipeg ,2022-04-15 11:25:51+00:00,2022,4,15,4,Friday,15,11,spring,2022-2023_api_transition,april storm in winnipeg,23,4,False,True,0,1,False,0.047979797979797977,0.020000000000000018,True,False,True,False,False,True,False,2022_Q2,ed888489b601a246,0.0,0.0,1.0,0.0,neutral
ub9t75,"Winnipeg homeowners grapple with damaged homes, ruined basements amid flooding from spring storm",,1650851000.0,96,47,News,0.94,/r/Winnipeg/comments/ub9t75/winnipeg_homeowners_grapple_with_damaged_homes/,https://www.cbc.ca/news/canada/manitoba/winnipeg-spring-flood-2022-1.6429625,False,False,False,False,False,Winnipeg,"Winnipeg homeowners grapple with damaged homes, ruined basements amid flooding from spring storm ",2022-04-25 01:43:20+00:00,2022,4,25,0,Monday,17,1,spring,2022-2023_api_transition,winnipeg homeowners grapple with damaged homes ruined basements amid flooding from spring storm,95,13,False,True,0,3,False,0.4845360824742268,0.06000000000000005,True,False,True,False,False,True,False,2022_Q2,5861eba84721135e,-0.7184,0.0,0.647,0.353,negative
u87c7w,Impending storm could create moderate to major flooding in Red River Valley | CBC News,,1650491013.0,56,53,News,0.9,/r/Winnipeg/comments/u87c7w/impending_storm_could_create_moderate_to_major/,https://www.cbc.ca/news/canada/manitoba/manitoba-flood-forecast-snowstorm-1.6424643,False,False,False,False,False,Winnipeg,Impending storm could create moderate to major flooding in Red River Valley | CBC News ,2022-04-20 21:43:33+00:00,2022,4,20,2,Wednesday,16,21,spring,2022-2023_api_transition,impending storm could create moderate to major flooding in red river valley cbc news,84,14,False,True,0,2,False,0.9298245614035088,0.09999999999999998,True,False,True,False,False,True,False,2022_Q2,82ffbd4e570c071e,0.2732,0.139,0.861,0.0,positive
u3gyyh,Snowfall amounts downgraded as Manitoba storm expected to weaken,,1649941115.0,81,45,News,0.91,/r/Winnipeg/comments/u3gyyh/snowfall_amounts_downgraded_as_manitoba_storm/,https://www.cbc.ca/news/canada/manitoba/manitoba-snowstorm-warnings-weather-1.6419498,False,False,False,False,False,Winnipeg,Snowfall amounts downgraded as Manitoba storm expected to weaken ,2022-04-14 12:58:35+00:00,2022,4,14,3,Thursday,15,12,spring,2022-2023_api_transition,snowfall amounts downgraded as manitoba storm expected to weaken,64,9,False,True,0,3,False,0.5487804878048781,0.08999999999999997,True,False,True,False,False,True,False,2022_Q2,5861eba84721135e,-0.4215,0.0,0.741,0.259,negative
ucr0bw,60 million litres of RAW SEWAGE released into Red River during storm,,1651019641.0,69,35,News,0.86,/r/Winnipeg/comments/ucr0bw/60_million_litres_of_raw_sewage_released_into_red/,https://www.winnipegfreepress.com/local/60-m-litres-of-sewage-released-into-red-river-during-storm-576437752.html,False,False,False,False,False,Winnipeg,60 million litres of RAW SEWAGE released into Red River during storm ,2022-04-27 00:34:01+00:00,2022,4,27,2,Wednesday,17,0,spring,2022-2023_api_transition,ADDRESS orm,11,2,False,True,0,1,False,0.5,0.14,True,False,True,False,False,True,False,2022_Q2,2d2d2c982e604272,0.0,0.0,1.0,0.0,neutral
u2k3t7,This storm is as late as our transit buses,,1649831927.0,251,16,Satire/Humour,0.94,/r/Winnipeg/comments/u2k3t7/this_storm_is_as_late_as_our_transit_buses/,https://i.redd.it/tne7cmkur8t81.jpg,False,False,False,False,False,Winnipeg,This storm is as late as our transit buses ,2022-04-13 06:38:47+00:00,2022,4,13,2,Wednesday,15,6,spring,2022-2023_api_transition,this storm is as late as our transit buses,42,9,False,True,0,1,False,0.06349206349206349,0.06000000000000005,True,False,True,False,False,True,False,2022_Q2,5eb5178e4b15c672,0.0,0.0,1.0,0.0,neutral
u2g5pt,Got my Chinese food & storm chips #iykyk,,1649817752.0,163,24,Events,0.88,/r/Winnipeg/comments/u2g5pt/got_my_chinese_food_storm_chips_iykyk/,https://i.redd.it/hgw2e2vnl7t81.jpg,False,False,False,False,False,Winnipeg,Got my Chinese food & storm chips #iykyk ,2022-04-13 02:42:32+00:00,2022,4,13,2,Wednesday,15,2,spring,2022-2023_api_transition,got my chinese food storm chips iykyk,37,7,False,True,0,1,False,0.14634146341463414,0.12,True,False,True,False,False,True,False,2022_Q2,a31afd1fd6df5df9,0.0,0.0,1.0,0.0,neutral
ub49yt,Advice for exam during the storm?,"Like everyone here, my backyard is full of water and the lights have been blinking all day. I’m a UW student and have my last exam tomorrow evening. It’s virtual, and I’m petrified that my power is going to go out and prevent me from finishing the exam. I live in the south end and don’t often get power outage, but I’m still pretty anxious. Wondering if anyone has any advice- is this a serious concern? How should I prepare for this possibility? Any help would be greatly appreciated 😊",1650834200.0,8,28,Ask Winnipeg,0.62,/r/Winnipeg/comments/ub49yt/advice_for_exam_during_the_storm/,https://www.reddit.com/r/Winnipeg/comments/ub49yt/advice_for_exam_during_the_storm/,True,False,False,False,False,Winnipeg,"Advice for exam during the storm? Like everyone here, my backyard is full of water and the lights have been blinking all day. I’m a UW student and have my last exam tomorrow evening. It’s virtual, and I’m petrified that my power is going to go out and prevent me from finishing the exam. I live in the south end and don’t often get power outage, but I’m still pretty anxious. Wondering if anyone has any advice- is this a serious concern? How should I prepare for this possibility? Any help would be greatly appreciated 😊",2022-04-24 21:03:20+00:00,2022,4,24,6,Sunday,16,21,spring,2022-2023_api_transition,advice for exam during the storm? like everyone here my backyard is full of water and the lights have been blinking all day. i m a uw student and have my last exam tomorrow evening. it s virtual and i m petrified that my power is going to go out and prevent me from finishing the exam. i live in the south end and don t often get power outage but i m still pretty anxious. wondering if anyone has any advice is this a serious concern? how should i prepare for this possibility? any help would be greatly appreciated,515,100,False,True,0,1,False,3.111111111111111,0.38,True,False,True,False,False,True,False,2022_Q2,3a7a5bd8b5861c1d,0.8974,0.141,0.805,0.054,positive
u409r8,Winnipeg Transit Storm Service (an idea),"According to MPI, there was only 1/4 of the expected accidents during this storm (106/400) due to the lack of vehicles on the road. This got me to thinking about how we could repeat that when we aren't shutting the city down. 

What if, during significant snowfalls of 10cm or more, we prioritized the clearing of bus routes and sidewalks, while *increasing* bus frequency on all routes and canceling fares?

Would people take the bus instead of driving?

What significant barriers would need to be overcome? For instance, how many busses (and operators) could we actually mobilize? Would it make snow clearing operations more efficient with fewer vehicles travelling on the roads?

Am I crazy? Tell me Winnipeg!",1649998232.0,27,27,Ask Winnipeg,0.74,/r/Winnipeg/comments/u409r8/winnipeg_transit_storm_service_an_idea/,https://www.reddit.com/r/Winnipeg/comments/u409r8/winnipeg_transit_storm_service_an_idea/,True,False,False,False,False,Winnipeg,"Winnipeg Transit Storm Service (an idea) According to MPI, there was only 1/4 of the expected accidents during this storm (106/400) due to the lack of vehicles on the road. This got me to thinking about how we could repeat that when we aren't shutting the city down. 

What if, during significant snowfalls of 10cm or more, we prioritized the clearing of bus routes and sidewalks, while *increasing* bus frequency on all routes and canceling fares?

Would people take the bus instead of driving?

What significant barriers would need to be overcome? For instance, how many busses (and operators) could we actually mobilize? Would it make snow clearing operations more efficient with fewer vehicles travelling on the roads?

Am I crazy? Tell me Winnipeg!",2022-04-15 04:50:32+00:00,2022,4,15,4,Friday,15,4,spring,2022-2023_api_transition,winnipeg transit storm service an idea according to mpi there was only ADDRESS orm due to the lack of vehicles on the road. this got me to thinking about how we could repeat that when we aren t shutting the city down. what if during significant snowfalls of cm or more we prioritized the clearing of bus routes and sidewalks while increasing bus frequency on all routes and canceling fares? would people take the bus instead of driving? what significant barriers would need to be overcome? for instance how many busses and operators could we actually mobilize? would it make snow clearing operations more efficient with fewer vehicles travelling on the roads? am i crazy? tell me winnipeg!,689,118,False,True,0,3,False,0.9642857142857143,0.26,True,False,True,False,False,True,False,2022_Q2,ac72ec88fc77b15a,0.5015,0.063,0.899,0.037,positive
u2i2j0,Can someone please tell me where the heck this storm is?? I’m just outside the south end of the city and I’ve been waiting for this thing to hit since like 4:30 today. When I check Doppler it shows a big system just sitting over North Dakota but not moving. When is it supposed to hit Winnipeg?,,1649824079.0,0,24,Community,0.37,/r/Winnipeg/comments/u2i2j0/can_someone_please_tell_me_where_the_heck_this/,https://www.reddit.com/r/Winnipeg/comments/u2i2j0/can_someone_please_tell_me_where_the_heck_this/,True,False,False,False,False,Winnipeg,Can someone please tell me where the heck this storm is?? I’m just outside the south end of the city and I’ve been waiting for this thing to hit since like 4:30 today. When I check Doppler it shows a big system just sitting over North Dakota but not moving. When is it supposed to hit Winnipeg? ,2022-04-13 04:27:59+00:00,2022,4,13,2,Wednesday,15,4,spring,2022-2023_api_transition,can someone please tell me where the heck this storm is?? i m just outside the south end of the city and i ve been waiting for this thing to hit since like today. when i check doppler it shows a big system just sitting over north dakota but not moving. when is it supposed to hit winnipeg?,289,58,False,True,0,1,False,24.0,0.63,True,False,True,False,False,True,False,2022_Q2,a3ce7b8f2b1c2758,0.4479,0.066,0.934,0.0,positive
u32rvc,Storm posts tomorrow,"What's the over/under on amount of posts we will see tomorrow about people being surprised that the storm wasn't over?

I'll be disappointed if we don't see five at least *shrug*",1649890499.0,31,20,Satire/Humour,0.72,/r/Winnipeg/comments/u32rvc/storm_posts_tomorrow/,https://www.reddit.com/r/Winnipeg/comments/u32rvc/storm_posts_tomorrow/,True,False,False,False,False,Winnipeg,"Storm posts tomorrow What's the over/under on amount of posts we will see tomorrow about people being surprised that the storm wasn't over?

I'll be disappointed if we don't see five at least *shrug*",2022-04-13 22:54:59+00:00,2022,4,13,2,Wednesday,15,22,spring,2022-2023_api_transition,storm posts tomorrow what s the over under on amount of posts we will see tomorrow about people being surprised that the storm wasn t over? i ll be disappointed if we don t see five at least shrug,196,39,False,True,0,1,False,0.625,0.28,True,False,True,False,False,True,False,2022_Q2,71333a42b4b8d144,-0.296,0.045,0.881,0.074,negative
