id,title,selftext,created_utc,score,num_comments,link_flair_text,upvote_ratio,permalink,url,is_self,over_18,spoiler,stickied,locked,subreddit,full_text,created_date,year,month,day,day_of_week,day_name,week_of_year,hour,season,platform_period,cleaned_text,text_length,word_count,contains_crime_keywords,contains_weather_keywords,crime_keyword_count,weather_keyword_count,crime_and_weather,engagement_rate,controversy_score,is_2022,is_2023,pre_api_announcement,post_api_announcement,during_blackout,pre_api_changes,post_api_changes,quarter,author_hash,sentiment_compound,sentiment_positive,sentiment_neutral,sentiment_negative,sentiment_category
17qaxy9,Condo Break Ins,"Hey neighbours! Just wondering if any fellow condo dwellers have come up with a really solid way to deter thieves from entering your parkade. I’m west-central, love my building and my area but every morning when I go down to my underground parkade I wonder if I’m going to see more smashed windows. It’s kind of exhausting. 

Many of my neighbours won’t keep anything in their storage units and keep their bikes in their spare bedroom. 

If I’m out late I won’t go down there past 11 pm. I park on the street and use my front door to go inside. 

My board is good and has made upgrades to the man doors etc and one time we even had to pay an additional 800$ on top of our condo fees so we can accommodate this. The cops don’t worry too much about this which I get and cameras don’t do much. Just gives you a grainy picture of people covered head to toe in a hoodie. 

We have signage and occasionally remind folks to not go flying in and out of the parkade and to watch the door as they leave until it closes behind them. 

I suppose no bldg is 100% bulletproof. And not sure it’s just a condo thing. I know garages and houses get broken into. But perhaps you have your own experiences and feedback that may help? Or at least reduce the stress it causes ?

Thanks in advance 😊",1699408704.0,4,13,Question,0.7,/r/Edmonton/comments/17qaxy9/condo_break_ins/,https://www.reddit.com/r/Edmonton/comments/17qaxy9/condo_break_ins/,True,False,False,False,False,Edmonton,"Condo Break Ins Hey neighbours! Just wondering if any fellow condo dwellers have come up with a really solid way to deter thieves from entering your parkade. I’m west-central, love my building and my area but every morning when I go down to my underground parkade I wonder if I’m going to see more smashed windows. It’s kind of exhausting. 

Many of my neighbours won’t keep anything in their storage units and keep their bikes in their spare bedroom. 

If I’m out late I won’t go down there past 11 pm. I park on the street and use my front door to go inside. 

My board is good and has made upgrades to the man doors etc and one time we even had to pay an additional 800$ on top of our condo fees so we can accommodate this. The cops don’t worry too much about this which I get and cameras don’t do much. Just gives you a grainy picture of people covered head to toe in a hoodie. 

We have signage and occasionally remind folks to not go flying in and out of the parkade and to watch the door as they leave until it closes behind them. 

I suppose no bldg is 100% bulletproof. And not sure it’s just a condo thing. I know garages and houses get broken into. But perhaps you have your own experiences and feedback that may help? Or at least reduce the stress it causes ?

Thanks in advance 😊",2023-11-08 01:58:24+00:00,2023,11,8,2,Wednesday,45,1,fall,2022-2023_api_transition,condo break ins hey neighbours! just wondering if any fellow condo dwellers have come up with a really solid way to deter thieves from entering your parkade. i m west central love my building and my area but every morning when i go down to my underground parkade i wonder if i m going to see more smashed windows. it s kind of exhausting. many of my neighbours won t keep anything in their storage units and keep their bikes in their spare bedroom. if i m out late i won t go down there past pm. i park on the street and use my front door to go inside. my board is good and has made upgrades to the man doors etc and one time we even had to pay an additional on top of our condo fees so we can accommodate this. the cops don t worry too much about this which i get and cameras don t do much. just gives you a grainy picture of people covered head to toe in a hoodie. we have signage and occasionally remind folks to not go flying in and out of the parkade and to watch the door as they leave until it closes behind them. i suppose no bldg is bulletproof. and not sure it s just a condo thing. i know garages and houses get broken into. but perhaps you have your own experiences and feedback that may help? or at least reduce the stress it causes ? thanks in advance,1265,254,True,True,2,1,True,2.6,0.30000000000000004,False,True,False,True,False,False,True,2023_Q4,99c8d19598202f58,0.6615,0.097,0.811,0.092,positive
17n8nzm,Millwoods Break In,"
Home Broken Into on Wednesday, November 1st, 23 between 
8:10 AM – 1:42 (Kiniski Gardens/ Millwoods) 
If you saw anything or have cameras in your front or alley please call 780-423-4567 Non Urgent EPS and say its about
 File: 23-830210",1699055388.0,9,7,Discussion,0.76,/r/Edmonton/comments/17n8nzm/millwoods_break_in/,https://www.reddit.com/r/Edmonton/comments/17n8nzm/millwoods_break_in/,True,False,False,False,False,Edmonton,"Millwoods Break In 
Home Broken Into on Wednesday, November 1st, 23 between 
8:10 AM – 1:42 (Kiniski Gardens/ Millwoods) 
If you saw anything or have cameras in your front or alley please call 780-423-4567 Non Urgent EPS and say its about
 File: 23-830210",2023-11-03 23:49:48+00:00,2023,11,3,4,Friday,44,23,fall,2022-2023_api_transition,millwoods break in home broken into on wednesday november st between am kiniski gardens millwoods if you saw anything or have cameras in your front or alley please call PHONE non urgent eps and say its about file,212,38,True,False,1,0,False,0.7,0.24,False,True,False,True,False,False,True,2023_Q4,c35912002badfcff,0.0,0.097,0.829,0.073,neutral
182t8yc,Is this weather normal?,"I'm from vancouver and have lived here for 4 years now, The weather feels uncharacteristically warm for this time of year. Like no complaints here but Im frankly worried about the amount of wildfires we're gonna get next year from the lack of rain and snowfall this year.

Is there any explanation for what's going on or am I overthrowing this?",1700835949.0,160,200,Question,0.8,/r/Edmonton/comments/182t8yc/is_this_weather_normal/,https://www.reddit.com/r/Edmonton/comments/182t8yc/is_this_weather_normal/,True,False,False,False,False,Edmonton,"Is this weather normal? I'm from vancouver and have lived here for 4 years now, The weather feels uncharacteristically warm for this time of year. Like no complaints here but Im frankly worried about the amount of wildfires we're gonna get next year from the lack of rain and snowfall this year.

Is there any explanation for what's going on or am I overthrowing this?",2023-11-24 14:25:49+00:00,2023,11,24,4,Friday,47,14,fall,2022-2023_api_transition,is this weather normal? i m from vancouver and have lived here for years now the weather feels uncharacteristically warm for this time of year. like no complaints here but im frankly worried about the amount of wildfires we re gonna get next year from the lack of rain and snowfall this year. is there any explanation for what s going on or am i overthrowing this?,364,67,False,True,0,6,False,1.2422360248447204,0.19999999999999996,False,True,False,True,False,False,True,2023_Q4,15495ae56c514e59,-0.5075,0.066,0.85,0.084,negative
17udboq,Hopes for Edmonton's ski season are going downhill with no snow or cold - The Weather Network,,1699889972.0,91,53,News,0.93,/r/Edmonton/comments/17udboq/hopes_for_edmontons_ski_season_are_going_downhill/,https://www.theweathernetwork.com/en/news/nature/outdoors/with-no-cold-or-snow-in-the-forecast-hopes-for-edmontons-ski-season-are-going-downhill,False,False,False,False,False,Edmonton,Hopes for Edmonton's ski season are going downhill with no snow or cold - The Weather Network ,2023-11-13 15:39:32+00:00,2023,11,13,0,Monday,46,15,fall,2022-2023_api_transition,hopes for edmonton s ski season are going downhill with no snow or cold the weather network,91,17,False,True,0,3,False,0.5760869565217391,0.06999999999999995,False,True,False,True,False,False,True,2023_Q4,36595391243f35d5,0.1531,0.14,0.75,0.11,positive
17mlxd7,I absolutely love how cold the tap water is during Winter!!,"I just had the most perfectly chilled cup of water straight out of the tap. It got me thinking, and it made me realize I'd always underrated this aspect of winter. What are some of your guys' favorite underrated parts of winter? ",1698982208.0,260,121,General,0.95,/r/Edmonton/comments/17mlxd7/i_absolutely_love_how_cold_the_tap_water_is/,https://www.reddit.com/r/Edmonton/comments/17mlxd7/i_absolutely_love_how_cold_the_tap_water_is/,True,False,False,False,False,Edmonton,"I absolutely love how cold the tap water is during Winter!! I just had the most perfectly chilled cup of water straight out of the tap. It got me thinking, and it made me realize I'd always underrated this aspect of winter. What are some of your guys' favorite underrated parts of winter? ",2023-11-03 03:30:08+00:00,2023,11,3,4,Friday,44,3,fall,2022-2023_api_transition,i absolutely love how cold the tap water is during winter!! i just had the most perfectly chilled cup of water straight out of the tap. it got me thinking and it made me realize i d always underrated this aspect of winter. what are some of your guys favorite underrated parts of winter?,286,54,False,True,0,2,False,0.46360153256704983,0.050000000000000044,False,True,False,True,False,False,True,2023_Q4,9a4e858b2c97c7fe,0.9379,0.224,0.776,0.0,positive
17t14mo,Best Hot Pot in the city?,"I don’t care how far I have to travel for it haha, I just wanna have the best hot pot I can find. Please give me your recs!",1699729160.0,35,57,Question,0.79,/r/Edmonton/comments/17t14mo/best_hot_pot_in_the_city/,https://www.reddit.com/r/Edmonton/comments/17t14mo/best_hot_pot_in_the_city/,True,False,False,False,False,Edmonton,"Best Hot Pot in the city? I don’t care how far I have to travel for it haha, I just wanna have the best hot pot I can find. Please give me your recs!",2023-11-11 18:59:20+00:00,2023,11,11,5,Saturday,45,18,fall,2022-2023_api_transition,best hot pot in the city? i don t care how far i have to travel for it haha i just wanna have the best hot pot i can find. please give me your recs!,148,35,False,True,0,1,False,1.5833333333333333,0.20999999999999996,False,True,False,True,False,False,True,2023_Q4,0009956ce147c52d,0.9531,0.364,0.636,0.0,positive
17pk6if,Hot Apartment,"Hello, 

So I’ve living in my apartment for 4 years. I like the building and location, but the heat has always been horrible. I’ve put up with it but I know I have to do something because I believe it’s wrecking my sleep and therefore my quality of life. 

I’ve known it’s always been hot. Even my friends who all have lived in different apartments noted how hot it was. This summer I got an ac unit which helped tremendously. 

But now that winter is approaching, I’m back to this heat. I thought it was humidity causing my dry throat and bad sleep, but I got a thermometer and found out my apartment is at a steady 25 degrees. This was more than I ever thought and now I see why this has been affecting my health and life. 

Having windows open is not an option when it gets really cold because the pipes may burst. 

How can I deal with this? Is it even legal for the heat to be this hot? The optimal sleep temperature is 16-18 degrees, but that’s an impossibility with this high level of heat.

I spoke with the landlords before but they mostly just shrug it off and tell me to use a fan. Which is utterly useless for cooling the room. 

Any help would be greatly appreciated 🙏",1699324239.0,8,49,Question,0.68,/r/Edmonton/comments/17pk6if/hot_apartment/,https://www.reddit.com/r/Edmonton/comments/17pk6if/hot_apartment/,True,False,False,False,False,Edmonton,"Hot Apartment Hello, 

So I’ve living in my apartment for 4 years. I like the building and location, but the heat has always been horrible. I’ve put up with it but I know I have to do something because I believe it’s wrecking my sleep and therefore my quality of life. 

I’ve known it’s always been hot. Even my friends who all have lived in different apartments noted how hot it was. This summer I got an ac unit which helped tremendously. 

But now that winter is approaching, I’m back to this heat. I thought it was humidity causing my dry throat and bad sleep, but I got a thermometer and found out my apartment is at a steady 25 degrees. This was more than I ever thought and now I see why this has been affecting my health and life. 

Having windows open is not an option when it gets really cold because the pipes may burst. 

How can I deal with this? Is it even legal for the heat to be this hot? The optimal sleep temperature is 16-18 degrees, but that’s an impossibility with this high level of heat.

I spoke with the landlords before but they mostly just shrug it off and tell me to use a fan. Which is utterly useless for cooling the room. 

Any help would be greatly appreciated 🙏",2023-11-07 02:30:39+00:00,2023,11,7,1,Tuesday,45,2,fall,2022-2023_api_transition,hot apartment hello so i ve living in my apartment for years. i like the building and location but the heat has always been horrible. i ve put up with it but i know i have to do something because i believe it s wrecking my sleep and therefore my quality of life. i ve known it s always been hot. even my friends who all have lived in different apartments noted how hot it was. this summer i got an ac unit which helped tremendously. but now that winter is approaching i m back to this heat. i thought it was humidity causing my dry throat and bad sleep but i got a thermometer and found out my apartment is at a steady degrees. this was more than i ever thought and now i see why this has been affecting my health and life. having windows open is not an option when it gets really cold because the pipes may burst. how can i deal with this? is it even legal for the heat to be this hot? the optimal sleep temperature is degrees but that s an impossibility with this high level of heat. i spoke with the landlords before but they mostly just shrug it off and tell me to use a fan. which is utterly useless for cooling the room. any help would be greatly appreciated,1164,230,False,True,0,6,False,5.444444444444445,0.31999999999999995,False,True,False,True,False,False,True,2023_Q4,79d7f22d203840da,0.7912,0.088,0.858,0.053,positive
186bjlt,Best hot chocolate in Edmonton?,"Open to anything but would like if it’s made with milk instead of water. Preferably with whipped cream, but not a non-negotiable :p

Where’s the best in Edmonton or what’s your favorite? ",1701217278.0,17,25,Restaurants/Food,0.8,/r/Edmonton/comments/186bjlt/best_hot_chocolate_in_edmonton/,https://www.reddit.com/r/Edmonton/comments/186bjlt/best_hot_chocolate_in_edmonton/,True,False,False,False,False,Edmonton,"Best hot chocolate in Edmonton? Open to anything but would like if it’s made with milk instead of water. Preferably with whipped cream, but not a non-negotiable :p

Where’s the best in Edmonton or what’s your favorite? ",2023-11-29 00:21:18+00:00,2023,11,29,2,Wednesday,48,0,fall,2022-2023_api_transition,best hot chocolate in edmonton? open to anything but would like if it s made with milk instead of water. preferably with whipped cream but not a non negotiable p where s the best in edmonton or what s your favorite?,215,41,False,True,0,1,False,1.3888888888888888,0.19999999999999996,False,True,False,True,False,False,True,2023_Q4,c2dac2661ef5f15b,0.9517,0.302,0.698,0.0,positive
180ij1v,Some snow history in Edmonton,"I see a lot of posts on here in regards to the snow (lack there of) and how common it is/isin’t and what years this has happened. Posting some interesting facts from Josh Classen this morning. 

The last time we had no snow on the ground by November 21st (today) was 2015. Made it to November 25th that year. 

The last time we had no snow in the month of November was 2008. (December 5th) 

2007 first snowfall on the ground December 3rd.

2005 Last time we had no snow on the ground for Christmas 

6 times in the past 25 years there has been no snow on the ground today. (Nov 21st) 

This year looking to be the 4th November since 2000 with no snow on the ground in November.

The latest “snow on the ground” in Edmonton records was 1977. When there grass was bare until Jan 13th

Will have to wait and see how much of an effect this “super El Niño” will have on the next 4 months. ",1700577722.0,179,50,General,0.97,/r/Edmonton/comments/180ij1v/some_snow_history_in_edmonton/,https://www.reddit.com/r/Edmonton/comments/180ij1v/some_snow_history_in_edmonton/,True,False,False,False,False,Edmonton,"Some snow history in Edmonton I see a lot of posts on here in regards to the snow (lack there of) and how common it is/isin’t and what years this has happened. Posting some interesting facts from Josh Classen this morning. 

The last time we had no snow on the ground by November 21st (today) was 2015. Made it to November 25th that year. 

The last time we had no snow in the month of November was 2008. (December 5th) 

2007 first snowfall on the ground December 3rd.

2005 Last time we had no snow on the ground for Christmas 

6 times in the past 25 years there has been no snow on the ground today. (Nov 21st) 

This year looking to be the 4th November since 2000 with no snow on the ground in November.

The latest “snow on the ground” in Edmonton records was 1977. When there grass was bare until Jan 13th

Will have to wait and see how much of an effect this “super El Niño” will have on the next 4 months. ",2023-11-21 14:42:02+00:00,2023,11,21,1,Tuesday,47,14,fall,2022-2023_api_transition,some snow history in edmonton i see a lot of posts on here in regards to the snow lack there of and how common it is isin t and what years this has happened. posting some interesting facts from josh classen this morning. the last time we had no snow on the ground by november st today was . made it to november th that year. the last time we had no snow in the month of november was . december th first snowfall on the ground december rd. last time we had no snow on the ground for christmas times in the past years there has been no snow on the ground today. nov st this year looking to be the th november since with no snow on the ground in november. the latest snow on the ground in edmonton records was . when there grass was bare until jan th will have to wait and see how much of an effect this super el ni o will have on the next months.,844,174,False,True,0,2,False,0.2777777777777778,0.030000000000000027,False,True,False,True,False,False,True,2023_Q4,10c92ccc81559379,-0.4543,0.039,0.889,0.071,negative
183jayi,No-snow November: El Niño could mean a warm and dry winter for Edmonton | CBC News,,1700917388.0,166,50,News,0.98,/r/Edmonton/comments/183jayi/nosnow_november_el_niño_could_mean_a_warm_and_dry/,https://www.cbc.ca/news/canada/edmonton/no-snow-november-el-ni%C3%B1o-could-mean-a-warm-and-dry-winter-for-edmonton-1.7039500,False,False,False,False,False,Edmonton,No-snow November: El Niño could mean a warm and dry winter for Edmonton | CBC News ,2023-11-25 13:03:08+00:00,2023,11,25,5,Saturday,47,13,fall,2022-2023_api_transition,no snow november el ni o could mean a warm and dry winter for edmonton cbc news,79,17,False,True,0,3,False,0.2994011976047904,0.020000000000000018,False,True,False,True,False,False,True,2023_Q4,c27a5099dfbee753,-0.0772,0.099,0.785,0.115,negative
184gjfy,Edmonton bike lanes coated but didn’t prevent snow/ice.,Edmonton added a coating to the bikes lanes a few weeks ago. We suspected it was de-icing spray added to all the bike lanes. Here’s a bike lane that was sprayed. It’s currently -1 outside. What was purpose of the coating they added? It doesn’t seem to prevent snow on lanes.,1701021607.0,0,44,Discussion,0.32,/r/Edmonton/comments/184gjfy/edmonton_bike_lanes_coated_but_didnt_prevent/,https://i.redd.it/lx9ovkhkeq2c1.jpeg,False,False,False,False,False,Edmonton,Edmonton bike lanes coated but didn’t prevent snow/ice. Edmonton added a coating to the bikes lanes a few weeks ago. We suspected it was de-icing spray added to all the bike lanes. Here’s a bike lane that was sprayed. It’s currently -1 outside. What was purpose of the coating they added? It doesn’t seem to prevent snow on lanes.,2023-11-26 18:00:07+00:00,2023,11,26,6,Sunday,47,18,fall,2022-2023_api_transition,edmonton bike lanes coated but didn t prevent snow ice. edmonton added a coating to the bikes lanes a few weeks ago. we suspected it was de icing spray added to all the bike lanes. here s a bike lane that was sprayed. it s currently outside. what was purpose of the coating they added? it doesn t seem to prevent snow on lanes.,327,64,False,True,0,1,False,44.0,0.6799999999999999,False,True,False,True,False,False,True,2023_Q4,53d97f31e57b79ba,-0.2617,0.035,0.929,0.036,negative
183rnlk,Should I still water my phone trees when temperature is around 0?,"Last year two of my young trees died because of winter burn. Is it a good idea to still water my new young trees daily when the temperature is around (slightly below and above) degree Celsius?

*Title is supposed to say ""pine"" trees",1700941182.0,2,7,Question,0.63,/r/Edmonton/comments/183rnlk/should_i_still_water_my_phone_trees_when/,https://www.reddit.com/r/Edmonton/comments/183rnlk/should_i_still_water_my_phone_trees_when/,True,False,False,False,False,Edmonton,"Should I still water my phone trees when temperature is around 0? Last year two of my young trees died because of winter burn. Is it a good idea to still water my new young trees daily when the temperature is around (slightly below and above) degree Celsius?

*Title is supposed to say ""pine"" trees",2023-11-25 19:39:42+00:00,2023,11,25,5,Saturday,47,19,fall,2022-2023_api_transition,should i still water my phone trees when temperature is around ? last year two of my young trees died because of winter burn. is it a good idea to still water my new young trees daily when the temperature is around slightly below and above degree celsius? title is supposed to say pine trees,291,55,False,True,0,3,False,2.3333333333333335,0.37,False,True,False,True,False,False,True,2023_Q4,9fe5461edc048850,-0.264,0.048,0.885,0.066,negative
17pjdwp,Family traumatized after false allegation leads to tactical team storming north Edmonton home,,1699321853.0,145,94,News,0.93,/r/Edmonton/comments/17pjdwp/family_traumatized_after_false_allegation_leads/,https://globalnews.ca/news/10074867/edmonton-police-alberta-rcmp-tactical-team-false-allegation/,False,False,False,False,False,Edmonton,Family traumatized after false allegation leads to tactical team storming north Edmonton home ,2023-11-07 01:50:53+00:00,2023,11,7,1,Tuesday,45,1,fall,2022-2023_api_transition,family traumatized after false allegation leads to tactical team storming north edmonton home,93,13,False,True,0,1,False,0.6438356164383562,0.06999999999999995,False,True,False,True,False,False,True,2023_Q4,b1a2b867fc146846,-0.4019,0.0,0.816,0.184,negative
