id,title,selftext,created_utc,score,num_comments,link_flair_text,upvote_ratio,permalink,url,is_self,over_18,spoiler,stickied,locked,subreddit,full_text,created_date,year,month,day,day_of_week,day_name,week_of_year,hour,season,platform_period,cleaned_text,text_length,word_count,contains_crime_keywords,contains_weather_keywords,crime_keyword_count,weather_keyword_count,crime_and_weather,engagement_rate,controversy_score,is_2022,is_2023,pre_api_announcement,post_api_announcement,during_blackout,pre_api_changes,post_api_changes,quarter,author_hash,sentiment_compound,sentiment_positive,sentiment_neutral,sentiment_negative,sentiment_category
u0wtnn,New to Saskatoon weather - Backyard maintenance tips,"I am new to Saskatoon weather and I need timeline/tips to maintain my backyard. I moved from condo to house and never had to maintain my backyard. I need help with when to do what timeline and any resources help The youtube videos don't seem much helpful, seems everyone there is in Florida lol",1649642635.0,13,14,General,0.84,/r/saskatoon/comments/u0wtnn/new_to_saskatoon_weather_backyard_maintenance_tips/,https://www.reddit.com/r/saskatoon/comments/u0wtnn/new_to_saskatoon_weather_backyard_maintenance_tips/,True,False,False,False,False,Saskatoon,"New to Saskatoon weather - Backyard maintenance tips I am new to Saskatoon weather and I need timeline/tips to maintain my backyard. I moved from condo to house and never had to maintain my backyard. I need help with when to do what timeline and any resources help The youtube videos don't seem much helpful, seems everyone there is in Florida lol",2022-04-11 02:03:55+00:00,2022,4,11,0,Monday,15,2,spring,2022-2023_api_transition,new to saskatoon weather backyard maintenance tips i am new to saskatoon weather and i need timeline tips to maintain my backyard. i moved from condo to house and never had to maintain my backyard. i need help with when to do what timeline and any resources help the youtube videos don t seem much helpful seems everyone there is in florida lol,344,63,False,True,0,1,False,1.0,0.16000000000000003,True,False,True,False,False,True,False,2022_Q2,af088646a41530eb,0.875,0.157,0.843,0.0,positive
u7hblj,I guess I'll just put my snow tires on forever then.,,1650407277.0,103,31,Traffic/Road Conditions,0.93,/r/saskatoon/comments/u7hblj/i_guess_ill_just_put_my_snow_tires_on_forever_then/,https://www.reddit.com/r/saskatoon/comments/u7hblj/i_guess_ill_just_put_my_snow_tires_on_forever_then/,True,False,False,False,False,Saskatoon,I guess I'll just put my snow tires on forever then. ,2022-04-19 22:27:57+00:00,2022,4,19,1,Tuesday,16,22,spring,2022-2023_api_transition,i guess i ll just put my snow tires on forever then.,52,12,False,True,0,1,False,0.2980769230769231,0.06999999999999995,True,False,True,False,False,True,False,2022_Q2,5d687c8d14968286,0.0,0.0,1.0,0.0,neutral
u2804t,downtown discourse/rant,"i feel like im one of the only people who actually really adores downtown and has no problem with homeless people or noise. there’s always people here, stores, etc. it keeps me grounded in my periods of isolation. the homeless aren’t even an issue either. the way people talk about them on social media is really dehumanizing and dangerously lacks empathy. what makes us better? we give them change, cigs, food. theyre human too. 

who cares if they spend the buck i gave them on some drugs, i was gonna do the same thing too at tweed",1649793690.0,96,87,General,0.77,/r/saskatoon/comments/u2804t/downtown_discourserant/,https://www.reddit.com/r/saskatoon/comments/u2804t/downtown_discourserant/,True,False,False,False,False,Saskatoon,"downtown discourse/rant i feel like im one of the only people who actually really adores downtown and has no problem with homeless people or noise. there’s always people here, stores, etc. it keeps me grounded in my periods of isolation. the homeless aren’t even an issue either. the way people talk about them on social media is really dehumanizing and dangerously lacks empathy. what makes us better? we give them change, cigs, food. theyre human too. 

who cares if they spend the buck i gave them on some drugs, i was gonna do the same thing too at tweed",2022-04-12 20:01:30+00:00,2022,4,12,1,Tuesday,15,20,spring,2022-2023_api_transition,downtown discourse rant i feel like im one of the only people who actually really adores downtown and has no problem with homeless people or noise. there s always people here stores etc. it keeps me grounded in my periods of isolation. the homeless aren t even an issue either. the way people talk about them on social media is really dehumanizing and dangerously lacks empathy. what makes us better? we give them change cigs food. theyre human too. who cares if they spend the buck i gave them on some drugs i was gonna do the same thing too at tweed,551,102,True,False,1,0,False,0.8969072164948454,0.22999999999999998,True,False,True,False,False,True,False,2022_Q2,bed88cfc6fe0012b,0.1266,0.114,0.784,0.102,positive
u3grk8,"SLGA sends businesses 1st direct warning credit card data may have been stolen, almost 3 months after hack",,1649940469.0,51,15,News,0.93,/r/saskatoon/comments/u3grk8/slga_sends_businesses_1st_direct_warning_credit/,https://www.cbc.ca/news/canada/saskatchewan/slga-warns-business-partners-credit-card-data-may-have-been-stolen-1.6418954?cmp=rss,False,False,False,False,False,Saskatoon,"SLGA sends businesses 1st direct warning credit card data may have been stolen, almost 3 months after hack ",2022-04-14 12:47:49+00:00,2022,4,14,3,Thursday,15,12,spring,2022-2023_api_transition,slga sends businesses st direct warning credit card data may have been stolen almost months after hack,102,17,True,False,2,0,False,0.28846153846153844,0.06999999999999995,True,False,True,False,False,True,False,2022_Q2,2028f49ed3cbe51b,-0.4588,0.117,0.631,0.252,negative
ufjki4,Stolen Bike at 7th and Preston,"My bike was stolen. It has a broken gear change on the left side of the handle bars that is covered with blue tape. The water bottle holder is bent with some of the tabs messed up. 1 tire is worn out while the others is new. Both grips are new. There is a small round thing on the front wheel. Slightly bigger than your average bike. Every so often the chain skips a beat. 

If anyone sees it please leave a comment, I love this bike.

https://preview.redd.it/7t8v1imx8qw81.jpg?width=956&format=pjpg&auto=webp&s=e5839f86dc006628c64f06a29d5b69b10f02e163",1651351225.0,13,5,Events,0.81,/r/saskatoon/comments/ufjki4/stolen_bike_at_7th_and_preston/,https://www.reddit.com/r/saskatoon/comments/ufjki4/stolen_bike_at_7th_and_preston/,True,False,False,False,False,Saskatoon,"Stolen Bike at 7th and Preston My bike was stolen. It has a broken gear change on the left side of the handle bars that is covered with blue tape. The water bottle holder is bent with some of the tabs messed up. 1 tire is worn out while the others is new. Both grips are new. There is a small round thing on the front wheel. Slightly bigger than your average bike. Every so often the chain skips a beat. 

If anyone sees it please leave a comment, I love this bike.

https://preview.redd.it/7t8v1imx8qw81.jpg?width=956&format=pjpg&auto=webp&s=e5839f86dc006628c64f06a29d5b69b10f02e163",2022-04-30 20:40:25+00:00,2022,4,30,5,Saturday,17,20,spring,2022-2023_api_transition,stolen bike at th and preston my bike was stolen. it has a broken gear change on the left side of the handle bars that is covered with blue tape. the water bottle holder is bent with some of the tabs messed up. tire is worn out while the others is new. both grips are new. there is a small round thing on the front wheel. slightly bigger than your average bike. every so often the chain skips a beat. if anyone sees it please leave a comment i love this bike.,459,92,True,False,2,0,False,0.35714285714285715,0.18999999999999995,True,False,True,False,False,True,False,2022_Q2,636786886ff0c1c7,-0.7783,0.061,0.794,0.145,negative
u9er6a,Chicken Fried Rice - Help,"Hello, I am wondering if there are Saskatoon cooks that really know their fried rice recipes that can tell me the best rice to buy IN Saskatoon , for fried rice. Do you go to big box stores or to some of the Chinese food stores? There are so many brands and types that I keep freezing up when I get to the rice aisle in the store. Please be as specific with brand as possible (speaks as you would to a puppy or a small child). Thanks in advance Toonsters.",1650634283.0,4,18,Question,0.67,/r/saskatoon/comments/u9er6a/chicken_fried_rice_help/,https://www.reddit.com/r/saskatoon/comments/u9er6a/chicken_fried_rice_help/,True,False,False,False,False,Saskatoon,"Chicken Fried Rice - Help Hello, I am wondering if there are Saskatoon cooks that really know their fried rice recipes that can tell me the best rice to buy IN Saskatoon , for fried rice. Do you go to big box stores or to some of the Chinese food stores? There are so many brands and types that I keep freezing up when I get to the rice aisle in the store. Please be as specific with brand as possible (speaks as you would to a puppy or a small child). Thanks in advance Toonsters.",2022-04-22 13:31:23+00:00,2022,4,22,4,Friday,16,13,spring,2022-2023_api_transition,chicken fried rice help hello i am wondering if there are saskatoon cooks that really know their fried rice recipes that can tell me the best rice to buy in saskatoon for fried rice. do you go to big box stores or to some of the chinese food stores? there are so many brands and types that i keep freezing up when i get to the rice aisle in the store. please be as specific with brand as possible speaks as you would to a puppy or a small child . thanks in advance toonsters.,475,95,False,True,0,1,False,3.6,0.32999999999999996,True,False,True,False,False,True,False,2022_Q2,32a2b80f350e153a,0.8934,0.117,0.87,0.014,positive
u5szuz,Regina police resorts to private purchase of airplane,,1650219930.0,36,88,Community,0.87,/r/regina/comments/u5szuz/regina_police_resorts_to_private_purchase_of/,https://leaderpost.com/news/local-news/regina-police-service-resorts-to-private-purchase-of-airplane,False,False,False,False,False,Regina,Regina police resorts to private purchase of airplane ,2022-04-17 18:25:30+00:00,2022,4,17,6,Sunday,15,18,spring,2022-2023_api_transition,regina police resorts to private purchase of airplane,53,8,True,False,1,0,False,2.3783783783783785,0.13,True,False,True,False,False,True,False,2022_Q2,4300d12ac5a01d73,0.0,0.0,1.0,0.0,neutral
uahd87,Funded Research Project about Police Reform (Mod Approved),"Hi,

I am a MacEwan University marketing graduate doing a funded research project on the best way to go about making police reforms in Canada. The research is funded by the Canadian government, but I am providing the research findings to a not-for-profit organization that is lobbying for police reform.

Below are some reasons to participate in the survey:

1. The information you provide helps strengthen the not-for-profit that I truly believe can make a difference
2. The not-for-profit is supported by former police chiefs and commissioners looking for police reform
3. If you disagree with police reform, we need to hear all sides and perspectives on the topic in our democratic community
4. If you feel like you shouldn’t participate because you are not informed about the topic, it is still important for us to know that you don’t feel informed, and we hope you still try to offer what you can when filling in the survey
5. The research findings will likely be used to justify funding for further, more intensive research at a doctorate level
6. The survey is hosted by Google Forms which will keep you anonymous and secure

If you would like to help the not-for-profit organization in their efforts to improve our community, please find the link to the survey below. It should take you 5-10 minutes to complete.

Survey Link: [https://forms.gle/3ghuDtFtMuiF4LDG8](https://forms.gle/3ghuDtFtMuiF4LDG8)

Regards,

Grant",1650755788.0,3,42,Community,0.56,/r/regina/comments/uahd87/funded_research_project_about_police_reform_mod/,https://www.reddit.com/r/regina/comments/uahd87/funded_research_project_about_police_reform_mod/,True,False,False,False,False,Regina,"Funded Research Project about Police Reform (Mod Approved) Hi,

I am a MacEwan University marketing graduate doing a funded research project on the best way to go about making police reforms in Canada. The research is funded by the Canadian government, but I am providing the research findings to a not-for-profit organization that is lobbying for police reform.

Below are some reasons to participate in the survey:

1. The information you provide helps strengthen the not-for-profit that I truly believe can make a difference
2. The not-for-profit is supported by former police chiefs and commissioners looking for police reform
3. If you disagree with police reform, we need to hear all sides and perspectives on the topic in our democratic community
4. If you feel like you shouldn’t participate because you are not informed about the topic, it is still important for us to know that you don’t feel informed, and we hope you still try to offer what you can when filling in the survey
5. The research findings will likely be used to justify funding for further, more intensive research at a doctorate level
6. The survey is hosted by Google Forms which will keep you anonymous and secure

If you would like to help the not-for-profit organization in their efforts to improve our community, please find the link to the survey below. It should take you 5-10 minutes to complete.

Survey Link: [https://forms.gle/3ghuDtFtMuiF4LDG8](https://forms.gle/3ghuDtFtMuiF4LDG8)

Regards,

Grant",2022-04-23 23:16:28+00:00,2022,4,23,5,Saturday,16,23,spring,2022-2023_api_transition,funded research project about police reform mod approved hi i am a macewan university marketing graduate doing a funded research project on the best way to go about making police reforms in canada. the research is funded by the canadian government but i am providing the research findings to a not for profit organization that is lobbying for police reform. below are some reasons to participate in the survey . the information you provide helps strengthen the not for profit that i truly believe can make a difference . the not for profit is supported by former police chiefs and commissioners looking for police reform . if you disagree with police reform we need to hear all sides and perspectives on the topic in our democratic community . if you feel like you shouldn t participate because you are not informed about the topic it is still important for us to know that you don t feel informed and we hope you still try to offer what you can when filling in the survey . the research findings will likely be used to justify funding for further more intensive research at a doctorate level . the survey is hosted by google forms which will keep you anonymous and secure if you would like to help the not for profit organization in their efforts to improve our community please find the link to the survey below. it should take you minutes to complete. survey link regards grant,1380,246,True,False,1,0,False,10.5,0.43999999999999995,True,False,True,False,False,True,False,2022_Q2,7c9b11e582bda9a7,0.9781,0.155,0.785,0.06,positive
tweoxe,Garage flooding/icing over from snow melt,What can I do to fix this add another layer of concrete to slant it more or is there something else I can do?,1649110409.0,14,16,Question,0.94,/r/regina/comments/tweoxe/garage_floodingicing_over_from_snow_melt/,https://www.reddit.com/r/regina/comments/tweoxe/garage_floodingicing_over_from_snow_melt/,True,False,False,False,False,Regina,Garage flooding/icing over from snow melt What can I do to fix this add another layer of concrete to slant it more or is there something else I can do?,2022-04-04 22:13:29+00:00,2022,4,4,0,Monday,14,22,spring,2022-2023_api_transition,garage flooding icing over from snow melt what can i do to fix this add another layer of concrete to slant it more or is there something else i can do?,151,31,False,True,0,2,False,1.0666666666666667,0.06000000000000005,True,False,True,False,False,True,False,2022_Q2,73bb0bca23592cdf,0.0,0.0,1.0,0.0,neutral
txgtxw,southalbert SLGA store and other Stores,"southalbert SLGA store and other Stores: I am a person of color living in Regina and wonder why store staff once in a while come and ask ""Are you finding everything ok?"" when taking time to choose what I want to buy. Then later another comes, ""is everything ok?"" This really makes me uncomfortable and kind of pressures me to just pick something and go mostly when the 3rd person walking near me happens to be a security guard. When I need help, I want to be the one to seek help but otherwise would really appreciate the peace of mind to just grab a bottle or product, read ingridients return it to the shelf or buy without catching someone looking at me as if I am gonna storm out with a bottle of wine or a bag of rice :)

I understand people could be trying to be helpful but it is questionable because I rarely see staff members walking up to everyone asking if they are finding things ok.",1649231087.0,0,21,Community,0.23,/r/regina/comments/txgtxw/southalbert_slga_store_and_other_stores/,https://www.reddit.com/r/regina/comments/txgtxw/southalbert_slga_store_and_other_stores/,True,False,False,False,False,Regina,"southalbert SLGA store and other Stores southalbert SLGA store and other Stores: I am a person of color living in Regina and wonder why store staff once in a while come and ask ""Are you finding everything ok?"" when taking time to choose what I want to buy. Then later another comes, ""is everything ok?"" This really makes me uncomfortable and kind of pressures me to just pick something and go mostly when the 3rd person walking near me happens to be a security guard. When I need help, I want to be the one to seek help but otherwise would really appreciate the peace of mind to just grab a bottle or product, read ingridients return it to the shelf or buy without catching someone looking at me as if I am gonna storm out with a bottle of wine or a bag of rice :)

I understand people could be trying to be helpful but it is questionable because I rarely see staff members walking up to everyone asking if they are finding things ok.",2022-04-06 07:44:47+00:00,2022,4,6,2,Wednesday,14,7,spring,2022-2023_api_transition,southalbert slga store and other stores southalbert slga store and other stores i am a person of color living in regina and wonder why store staff once in a while come and ask are you finding everything ok? when taking time to choose what i want to buy. then later another comes is everything ok? this really makes me uncomfortable and kind of pressures me to just pick something and go mostly when the rd person walking near me happens to be a security guard. when i need help i want to be the one to seek help but otherwise would really appreciate the peace of mind to just grab a bottle or product read ingridients return it to the shelf or buy without catching someone looking at me as if i am gonna storm out with a bottle of wine or a bag of rice i understand people could be trying to be helpful but it is questionable because i rarely see staff members walking up to everyone asking if they are finding things ok.,921,176,True,True,1,1,True,21.0,0.77,True,False,True,False,False,True,False,2022_Q2,19126cedf6f9c12e,0.9241,0.109,0.857,0.034,positive
tvgteb,SK renovation tax credit,"Knowing how many homes were damaged in the hail storm last August and many have since received an insurance payout and will be getting work done this year, is it proper to use those repair expenses that were paid out by insurance for the tax credit? To me it's not but can't find anything about it on the website.",1649012504.0,4,15,Question,0.64,/r/regina/comments/tvgteb/sk_renovation_tax_credit/,https://www.reddit.com/r/regina/comments/tvgteb/sk_renovation_tax_credit/,True,False,False,False,False,Regina,"SK renovation tax credit Knowing how many homes were damaged in the hail storm last August and many have since received an insurance payout and will be getting work done this year, is it proper to use those repair expenses that were paid out by insurance for the tax credit? To me it's not but can't find anything about it on the website.",2022-04-03 19:01:44+00:00,2022,4,3,6,Sunday,13,19,spring,2022-2023_api_transition,sk renovation tax credit knowing how many homes were damaged in the hail storm last august and many have since received an insurance payout and will be getting work done this year is it proper to use those repair expenses that were paid out by insurance for the tax credit? to me it s not but can t find anything about it on the website.,337,65,False,True,0,1,False,3.0,0.36,True,False,True,False,False,True,False,2022_Q2,5cedf3b386fd54a7,0.2023,0.07,0.901,0.029,positive
uf9fon,STOLEN Blue 2006 Saturn Ion - please let me know if you see it!,,1651319191.0,23,8,Question,0.8,/r/regina/comments/uf9fon/stolen_blue_2006_saturn_ion_please_let_me_know_if/,https://m.facebook.com/story.php?story_fbid=10160303967958615&id=569268614&sfnsn=mo,False,False,False,False,False,Regina,STOLEN Blue 2006 Saturn Ion - please let me know if you see it! ,2022-04-30 11:46:31+00:00,2022,4,30,5,Saturday,17,11,spring,2022-2023_api_transition,stolen blue saturn ion please let me know if you see it!,56,12,True,False,2,0,False,0.3333333333333333,0.19999999999999996,True,False,True,False,False,True,False,2022_Q2,cedf1b16414b9b38,-0.2942,0.146,0.633,0.221,negative
u3gqjw,"SLGA sends businesses 1st direct warning credit card data may have been stolen, almost 3 months after hack",,1649940363.0,40,2,News,0.93,/r/regina/comments/u3gqjw/slga_sends_businesses_1st_direct_warning_credit/,https://www.cbc.ca/news/canada/saskatchewan/slga-warns-business-partners-credit-card-data-may-have-been-stolen-1.6418954?cmp=rss,False,False,False,False,False,Regina,"SLGA sends businesses 1st direct warning credit card data may have been stolen, almost 3 months after hack ",2022-04-14 12:46:03+00:00,2022,4,14,3,Thursday,15,12,spring,2022-2023_api_transition,slga sends businesses st direct warning credit card data may have been stolen almost months after hack,102,17,True,False,2,0,False,0.04878048780487805,0.06999999999999995,True,False,True,False,False,True,False,2022_Q2,2028f49ed3cbe51b,-0.4588,0.117,0.631,0.252,negative
ud9mbd,Canine Tick Medication,"Is there a Veterinarian in Regina area that will sell Bravecto without taking the dog in for a full checkup?  Maybe they will just take their weight measurement instead?  We can’t make the trip to their regular vet until mid-May and I expect the ticks to be out after the deep freeze is over next week.

Thanks!",1651082245.0,6,11,Question,0.87,/r/regina/comments/ud9mbd/canine_tick_medication/,https://www.reddit.com/r/regina/comments/ud9mbd/canine_tick_medication/,True,False,False,False,False,Regina,"Canine Tick Medication Is there a Veterinarian in Regina area that will sell Bravecto without taking the dog in for a full checkup?  Maybe they will just take their weight measurement instead?  We can’t make the trip to their regular vet until mid-May and I expect the ticks to be out after the deep freeze is over next week.

Thanks!",2022-04-27 17:57:25+00:00,2022,4,27,2,Wednesday,17,17,spring,2022-2023_api_transition,canine tick medication is there a veterinarian in regina area that will sell bravecto without taking the dog in for a full checkup? maybe they will just take their weight measurement instead? we can t make the trip to their regular vet until mid may and i expect the ticks to be out after the deep freeze is over next week. thanks!,331,62,False,True,0,1,False,1.5714285714285714,0.13,True,False,True,False,False,True,False,2022_Q2,e1bc40e807b992ad,0.5792,0.073,0.927,0.0,positive
u9dilf,"Bartley Kives - “Demand for autopsies in Manitoba up 20% due to pandemic deaths at home, spike in violent crime and increase in fatal overdoses.”",,1650630584.0,54,15,News,0.84,/r/Winnipeg/comments/u9dilf/bartley_kives_demand_for_autopsies_in_manitoba_up/,https://twitter.com/bkives/status/1517320289817968640,False,False,False,False,False,Winnipeg,"Bartley Kives - “Demand for autopsies in Manitoba up 20% due to pandemic deaths at home, spike in violent crime and increase in fatal overdoses.” ",2022-04-22 12:29:44+00:00,2022,4,22,4,Friday,16,12,spring,2022-2023_api_transition,bartley kives demand for autopsies in manitoba up due to pandemic deaths at home spike in violent crime and increase in fatal overdoses.,136,23,True,False,1,0,False,0.2727272727272727,0.16000000000000003,True,False,True,False,False,True,False,2022_Q2,2dc898ced0c8ea31,-0.8779,0.07,0.55,0.379,negative
