id,title,selftext,created_utc,score,num_comments,link_flair_text,upvote_ratio,permalink,url,is_self,over_18,spoiler,stickied,locked,subreddit,full_text,created_date,year,month,day,day_of_week,day_name,week_of_year,hour,season,platform_period,cleaned_text,text_length,word_count,contains_crime_keywords,contains_weather_keywords,crime_keyword_count,weather_keyword_count,crime_and_weather,engagement_rate,controversy_score,is_2022,is_2023,pre_api_announcement,post_api_announcement,during_blackout,pre_api_changes,post_api_changes,quarter,author_hash,sentiment_compound,sentiment_positive,sentiment_neutral,sentiment_negative,sentiment_category
u3ccm0,"My neighbour just shared me a footage of ""theft from vehicles"" inside a van an hour ago in Bridgewater, Winnipeg. (01:44 a.m - 14/APR/22) Police were notified and anyone who knows who this man is please inform the police on 204-986-6222. Thanks & keep your vehicles locked.",,1649924156.0,122,30,Community,0.94,/r/Winnipeg/comments/u3ccm0/my_neighbour_just_shared_me_a_footage_of_theft/,https://v.redd.it/lqhbmxgydgt81,False,False,False,False,False,Winnipeg,"My neighbour just shared me a footage of ""theft from vehicles"" inside a van an hour ago in Bridgewater, Winnipeg. (01:44 a.m - 14/APR/22) Police were notified and anyone who knows who this man is please inform the police on 204-986-6222. Thanks & keep your vehicles locked. ",2022-04-14 08:15:56+00:00,2022,4,14,3,Thursday,15,8,spring,2022-2023_api_transition,my neighbour just shared me a footage of theft from vehicles inside a van an hour ago in bridgewater winnipeg. a.m apr police were notified and anyone who knows who this man is please inform the police on PHONE . thanks keep your vehicles locked.,246,45,True,False,2,0,False,0.24390243902439024,0.06000000000000005,True,False,True,False,False,True,False,2022_Q2,0b612aeaad4a760b,0.765,0.153,0.847,0.0,positive
ttzrfy,"Off-duty Winnipeg officers assaulted, sprayed with bear spray while attempting to stop theft",,1648842613.0,40,38,News,0.84,/r/Winnipeg/comments/ttzrfy/offduty_winnipeg_officers_assaulted_sprayed_with/,https://winnipeg.ctvnews.ca/off-duty-winnipeg-officers-assaulted-sprayed-with-bear-spray-while-attempting-to-stop-theft-1.5844857,False,False,False,False,False,Winnipeg,"Off-duty Winnipeg officers assaulted, sprayed with bear spray while attempting to stop theft ",2022-04-01 19:50:13+00:00,2022,4,1,4,Friday,13,19,spring,2022-2023_api_transition,off duty winnipeg officers assaulted sprayed with bear spray while attempting to stop theft,91,14,True,False,2,0,False,0.926829268292683,0.16000000000000003,True,False,True,False,False,True,False,2022_Q2,a896cdbed88d4dd3,-0.6808,0.0,0.682,0.318,negative
u317mz,Man hurt in arrest by off-duty police after alleged catalytic convertor theft,"[https://www.winnipegfreepress.com/breakingnews/this-just-in/576393691.html](https://www.winnipegfreepress.com/breakingnews/this-just-in/576393691.html)

Not sure if this is posted correctly not sure how to use flairs  but gave it a try any way.",1649886147.0,42,28,News,0.92,/r/Winnipeg/comments/u317mz/man_hurt_in_arrest_by_offduty_police_after/,https://www.reddit.com/r/Winnipeg/comments/u317mz/man_hurt_in_arrest_by_offduty_police_after/,True,False,False,False,False,Winnipeg,"Man hurt in arrest by off-duty police after alleged catalytic convertor theft [https://www.winnipegfreepress.com/breakingnews/this-just-in/576393691.html](https://www.winnipegfreepress.com/breakingnews/this-just-in/576393691.html)

Not sure if this is posted correctly not sure how to use flairs  but gave it a try any way.",2022-04-13 21:42:27+00:00,2022,4,13,2,Wednesday,15,21,spring,2022-2023_api_transition,man hurt in arrest by off duty police after alleged catalytic convertor theft not sure if this is posted correctly not sure how to use flairs but gave it a try any way.,168,33,True,False,3,0,False,0.6511627906976745,0.07999999999999996,True,False,True,False,False,True,False,2022_Q2,c5491d92b70832d4,-0.5943,0.0,0.809,0.191,negative
u2viju,"Kelsey Mckay arrested for sexually assaulting students - April 13, 2022 - Media Release",,1649870685.0,149,89,News,0.96,/r/Winnipeg/comments/u2viju/kelsey_mckay_arrested_for_sexually_assaulting/,https://www.winnipeg.ca/police/press/2022/04apr/2022_04_13.stm,False,False,False,False,False,Winnipeg,"Kelsey Mckay arrested for sexually assaulting students - April 13, 2022 - Media Release ",2022-04-13 17:24:45+00:00,2022,4,13,2,Wednesday,15,17,spring,2022-2023_api_transition,kelsey mckay arrested for sexually assaulting students april media release,74,10,True,False,2,0,False,0.5933333333333334,0.040000000000000036,True,False,True,False,False,True,False,2022_Q2,3b252b9b00f6fbdf,-0.7506,0.0,0.556,0.444,negative
tz2lic,Winnipeg man cleared of assaulting officers after judge finds 'inconsistencies' in police testimony,,1649421496.0,173,51,News,0.95,/r/Winnipeg/comments/tz2lic/winnipeg_man_cleared_of_assaulting_officers_after/,https://www.cbc.ca/news/canada/manitoba/winnipeg-man-not-guilty-assault-officer-testimonies-1.6411064,False,False,False,False,False,Winnipeg,Winnipeg man cleared of assaulting officers after judge finds 'inconsistencies' in police testimony ,2022-04-08 12:38:16+00:00,2022,4,8,4,Friday,14,12,spring,2022-2023_api_transition,winnipeg man cleared of assaulting officers after judge finds inconsistencies in police testimony,97,13,True,False,2,0,False,0.29310344827586204,0.050000000000000044,True,False,True,False,False,True,False,2022_Q2,e452a261716337aa,-0.4404,0.089,0.701,0.21,negative
tz8sid,"Armed robbery suspect, 13, in Winnipeg police custody after series of repeat incidents at same business",,1649439098.0,54,47,News,0.92,/r/Winnipeg/comments/tz8sid/armed_robbery_suspect_13_in_winnipeg_police/,https://globalnews.ca/news/8746321/armed-robbery-suspect-13-winnipeg-police-series-incidents/,False,False,False,False,False,Winnipeg,"Armed robbery suspect, 13, in Winnipeg police custody after series of repeat incidents at same business ",2022-04-08 17:31:38+00:00,2022,4,8,4,Friday,14,17,spring,2022-2023_api_transition,armed robbery suspect in winnipeg police custody after series of repeat incidents at same business,98,15,True,False,2,0,False,0.8545454545454545,0.07999999999999996,True,False,True,False,False,True,False,2022_Q2,2d2d2c982e604272,-0.296,0.0,0.864,0.136,negative
uf96du,Attempted “breaking in” /misunderstanding?,"We just had two guys violently yank on our door and ring our doorbell trying aggressively to get in. My husband yelled at the window for them to go away and they kept saying they are “looking for Mercedes”. They persisted that they were trying to get inside to take a look. After my husband kept yelling at them they left as it was probably drawing attention at this point. 

It was super rattling especially at 6am in the morning. Could they have genuinely be looking for someone? Or was that just a scam to get into our place?

Edit: they came back a second time an hour later. Cops should be on the way now. They’ve started throwing rocks at our windows.

Update: the guys didn’t come back after their second attempt (around 7am) and the police never showed up. My husband and I are ok… just a little rattled when our doorbell rings now lol it was pretty scary in the moment tho. Just hoping this doesn’t happen again. I don’t think this was just a house party / drunk scenario. Their words were quite coherent and they wore coordinated black hoodies. They persisted that their friend Mercedes sent them here and when my husband asked what the address was they couldn’t answer him and instead insisted that they need to get in. 🤷🏻‍♀️",1651318056.0,222,136,Ask Winnipeg,0.94,/r/Winnipeg/comments/uf96du/attempted_breaking_in_misunderstanding/,https://www.reddit.com/r/Winnipeg/comments/uf96du/attempted_breaking_in_misunderstanding/,True,False,False,False,False,Winnipeg,"Attempted “breaking in” /misunderstanding? We just had two guys violently yank on our door and ring our doorbell trying aggressively to get in. My husband yelled at the window for them to go away and they kept saying they are “looking for Mercedes”. They persisted that they were trying to get inside to take a look. After my husband kept yelling at them they left as it was probably drawing attention at this point. 

It was super rattling especially at 6am in the morning. Could they have genuinely be looking for someone? Or was that just a scam to get into our place?

Edit: they came back a second time an hour later. Cops should be on the way now. They’ve started throwing rocks at our windows.

Update: the guys didn’t come back after their second attempt (around 7am) and the police never showed up. My husband and I are ok… just a little rattled when our doorbell rings now lol it was pretty scary in the moment tho. Just hoping this doesn’t happen again. I don’t think this was just a house party / drunk scenario. Their words were quite coherent and they wore coordinated black hoodies. They persisted that their friend Mercedes sent them here and when my husband asked what the address was they couldn’t answer him and instead insisted that they need to get in. 🤷🏻‍♀️",2022-04-30 11:27:36+00:00,2022,4,30,5,Saturday,17,11,spring,2022-2023_api_transition,attempted breaking in misunderstanding? we just had two guys violently yank on our door and ring our doorbell trying aggressively to get in. my husband yelled at the window for them to go away and they kept saying they are looking for mercedes . they persisted that they were trying to get inside to take a look. after my husband kept yelling at them they left as it was probably drawing attention at this point. it was super rattling especially at am in the morning. could they have genuinely be looking for someone? or was that just a scam to get into our place? edit they came back a second time an hour later. cops should be on the way now. they ve started throwing rocks at our windows. update the guys didn t come back after their second attempt around am and the police never showed up. my husband and i are ok just a little rattled when our doorbell rings now lol it was pretty scary in the moment tho. just hoping this doesn t happen again. i don t think this was just a house party drunk scenario. their words were quite coherent and they wore coordinated black hoodies. they persisted that their friend mercedes sent them here and when my husband asked what the address was they couldn t answer him and instead insisted that they need to get in.,1256,234,True,False,3,0,False,0.6098654708520179,0.06000000000000005,True,False,True,False,False,True,False,2022_Q2,0195c91268352d26,0.4836,0.082,0.848,0.07,positive
u029u6,"Stonewall RCMP seek suspect in break-ins, property theft",,1649538250.0,2,0,News,0.6,/r/Winnipeg/comments/u029u6/stonewall_rcmp_seek_suspect_in_breakins_property/,https://globalnews.ca/news/8746168/stonewall-rcmp-seek-suspect-break-ins-property-theft/,False,False,False,False,False,Winnipeg,"Stonewall RCMP seek suspect in break-ins, property theft ",2022-04-09 21:04:10+00:00,2022,4,9,5,Saturday,14,21,spring,2022-2023_api_transition,stonewall rcmp seek suspect in break ins property theft,55,9,True,False,3,0,False,0.0,0.4,True,False,True,False,False,True,False,2022_Q2,2d2d2c982e604272,-0.296,0.0,0.784,0.216,negative
u3hqpm,All the Reddit meteorology “experts” today after their heated debates with people who “didn’t know shit about weather modelling” yesterday,,1649943444.0,244,124,Satire/Humour,0.84,/r/Winnipeg/comments/u3hqpm/all_the_reddit_meteorology_experts_today_after/,https://i.redd.it/lgcv6b5gzht81.jpg,False,False,False,False,False,Winnipeg,All the Reddit meteorology “experts” today after their heated debates with people who “didn’t know shit about weather modelling” yesterday ,2022-04-14 13:37:24+00:00,2022,4,14,3,Thursday,15,13,spring,2022-2023_api_transition,all the reddit meteorology experts today after their heated debates with people who didn t know shit about weather modelling yesterday,134,21,False,True,0,1,False,0.5061224489795918,0.16000000000000003,True,False,True,False,False,True,False,2022_Q2,5c5789b63c251105,-0.5574,0.0,0.847,0.153,negative
ublhtm,Feeling singled out with the bad weather on the weekend? We were!,,1650894250.0,274,42,Pictures/Video,0.95,/r/Winnipeg/comments/ublhtm/feeling_singled_out_with_the_bad_weather_on_the/,https://i.redd.it/93hhk8pdiov81.jpg,False,False,False,False,False,Winnipeg,Feeling singled out with the bad weather on the weekend? We were! ,2022-04-25 13:44:10+00:00,2022,4,25,0,Monday,17,13,spring,2022-2023_api_transition,feeling singled out with the bad weather on the weekend? we were!,65,12,False,True,0,1,False,0.15272727272727274,0.050000000000000044,True,False,True,False,False,True,False,2022_Q2,d773c4b4bb2a657f,-0.5093,0.098,0.654,0.248,negative
uddq0v,You can take your Special Weather Statement and shove it straight up your Colorado Low.,,1651093100.0,159,55,Pictures/Video,0.93,/r/Winnipeg/comments/uddq0v/you_can_take_your_special_weather_statement_and/,https://i.redd.it/1s2655hyx4w81.jpg,False,False,False,False,False,Winnipeg,You can take your Special Weather Statement and shove it straight up your Colorado Low. ,2022-04-27 20:58:20+00:00,2022,4,27,2,Wednesday,17,20,spring,2022-2023_api_transition,you can take your special weather statement and shove it straight up your colorado low.,87,15,False,True,0,1,False,0.34375,0.06999999999999995,True,False,True,False,False,True,False,2022_Q2,7cb3d115759bc64f,0.3612,0.246,0.642,0.112,positive
u2bre0,Even more Winter Weather Coming x2,"Looking at the latest GFS Model, there is a chance 2 more snow events next week.

https://www.pivotalweather.com/model.php?rh=2022040818&fh=loop&dpdt=&mc=&r=ca_c&p=sn10_024h_cm&m=gfs

The current storm is expected to bring about 43 cm in Winnipeg.
However come next Monday we could see another 8 cm of snow and another 17 cm of snow next Wednesday. (For a total of 68 cm in the next week and a bit)

These are just current models and could change within the next week.",1649804417.0,44,30,News,0.87,/r/Winnipeg/comments/u2bre0/even_more_winter_weather_coming_x2/,https://www.reddit.com/r/Winnipeg/comments/u2bre0/even_more_winter_weather_coming_x2/,True,False,False,False,False,Winnipeg,"Even more Winter Weather Coming x2 Looking at the latest GFS Model, there is a chance 2 more snow events next week.

https://www.pivotalweather.com/model.php?rh=2022040818&fh=loop&dpdt=&mc=&r=ca_c&p=sn10_024h_cm&m=gfs

The current storm is expected to bring about 43 cm in Winnipeg.
However come next Monday we could see another 8 cm of snow and another 17 cm of snow next Wednesday. (For a total of 68 cm in the next week and a bit)

These are just current models and could change within the next week.",2022-04-12 23:00:17+00:00,2022,4,12,1,Tuesday,15,23,spring,2022-2023_api_transition,even more winter weather coming x looking at the latest gfs model there is a chance more snow events next week. the current storm is expected to bring about cm in winnipeg. however come next monday we could see another cm of snow and another cm of snow next wednesday. for a total of cm in the next week and a bit these are just current models and could change within the next week.,382,74,False,True,0,4,False,0.6666666666666666,0.13,True,False,True,False,False,True,False,2022_Q2,bf4f835198b64b18,0.25,0.027,0.973,0.0,positive
uchgc9,We are freezing our asses here in Minnesota because of this La Niña. Makes me respect Canadians that much more - how do y’all handle such long winters and cold springs??! (Pic for attention),,1650992948.0,80,61,Satire/Humour,0.84,/r/Winnipeg/comments/uchgc9/we_are_freezing_our_asses_here_in_minnesota/,https://i.redd.it/r0d9xbu5owv81.jpg,False,False,False,False,False,Winnipeg,We are freezing our asses here in Minnesota because of this La Niña. Makes me respect Canadians that much more - how do y’all handle such long winters and cold springs??! (Pic for attention) ,2022-04-26 17:09:08+00:00,2022,4,26,1,Tuesday,17,17,spring,2022-2023_api_transition,we are freezing our asses here in minnesota because of this la ni a. makes me respect canadians that much more how do y all handle such long winters and cold springs??! pic for attention,186,35,False,True,0,4,False,0.7530864197530864,0.16000000000000003,True,False,True,False,False,True,False,2022_Q2,5edf509e0be09046,0.5191,0.098,0.865,0.037,positive
tyrtoe,"Stone Cold, a Winnipeg icon | The Manitoban",,1649380402.0,22,22,Food,0.74,/r/Winnipeg/comments/tyrtoe/stone_cold_a_winnipeg_icon_the_manitoban/,https://www.themanitoban.com/posts/stone-cold-a-winnipeg-icon,False,False,False,False,False,Winnipeg,"Stone Cold, a Winnipeg icon | The Manitoban ",2022-04-08 01:13:22+00:00,2022,4,8,4,Friday,14,1,spring,2022-2023_api_transition,stone cold a winnipeg icon the manitoban,40,7,False,True,0,1,False,0.9565217391304348,0.26,True,False,True,False,False,True,False,2022_Q2,c8577ddf9f5ddffc,0.0,0.0,1.0,0.0,neutral
txm0sd,Where has the best hot dog in the city?,,1649251210.0,8,82,Ask Winnipeg,0.64,/r/Winnipeg/comments/txm0sd/where_has_the_best_hot_dog_in_the_city/,https://www.reddit.com/r/Winnipeg/comments/txm0sd/where_has_the_best_hot_dog_in_the_city/,True,False,False,False,False,Winnipeg,Where has the best hot dog in the city? ,2022-04-06 13:20:10+00:00,2022,4,6,2,Wednesday,14,13,spring,2022-2023_api_transition,where has the best hot dog in the city?,39,9,False,True,0,1,False,9.11111111111111,0.36,True,False,True,False,False,True,False,2022_Q2,7e43dc58bc1ae178,0.6369,0.344,0.656,0.0,positive
u0llj1,"And if we set up hot tubs and bouncy castles, that should keep the snow at bay.",,1649609400.0,310,15,Satire/Humour,0.83,/r/Winnipeg/comments/u0llj1/and_if_we_set_up_hot_tubs_and_bouncy_castles_that/,https://i.redd.it/zb44peu5eqs81.jpg,False,False,False,False,False,Winnipeg,"And if we set up hot tubs and bouncy castles, that should keep the snow at bay. ",2022-04-10 16:50:00+00:00,2022,4,10,6,Sunday,14,16,spring,2022-2023_api_transition,and if we set up hot tubs and bouncy castles that should keep the snow at bay.,78,17,False,True,0,2,False,0.04823151125401929,0.17000000000000004,True,False,True,False,False,True,False,2022_Q2,1702858c5cf3591a,0.0,0.0,1.0,0.0,neutral
twzryx,Couching health-care criticisms - Critics warn sofa-touting gimmick may instead become hot seat for health minister,,1649178505.0,48,33,News,0.82,/r/Winnipeg/comments/twzryx/couching_healthcare_criticisms_critics_warn/,https://www.winnipegfreepress.com/local/couching-health-care-criticisms-576363212.html,False,False,False,False,False,Winnipeg,Couching health-care criticisms - Critics warn sofa-touting gimmick may instead become hot seat for health minister ,2022-04-05 17:08:25+00:00,2022,4,5,1,Tuesday,14,17,spring,2022-2023_api_transition,couching health care criticisms critics warn sofa touting gimmick may instead become hot seat for health minister,113,17,False,True,0,1,False,0.673469387755102,0.18000000000000005,True,False,True,False,False,True,False,2022_Q2,2dc898ced0c8ea31,-0.25,0.143,0.536,0.321,negative
tv9nz2,Hot tub owners,"Question for hot tub owners here.

Planning on installing a hot tub in the next year and just trying to gauge and plan a budget.

How much did your hydro bill increase per month?

How much do you spend on chemicals per month/year?",1648993681.0,14,32,Ask Winnipeg,0.75,/r/Winnipeg/comments/tv9nz2/hot_tub_owners/,https://www.reddit.com/r/Winnipeg/comments/tv9nz2/hot_tub_owners/,True,False,False,False,False,Winnipeg,"Hot tub owners Question for hot tub owners here.

Planning on installing a hot tub in the next year and just trying to gauge and plan a budget.

How much did your hydro bill increase per month?

How much do you spend on chemicals per month/year?",2022-04-03 13:48:01+00:00,2022,4,3,6,Sunday,13,13,spring,2022-2023_api_transition,hot tub owners question for hot tub owners here. planning on installing a hot tub in the next year and just trying to gauge and plan a budget. how much did your hydro bill increase per month? how much do you spend on chemicals per month year?,242,47,False,True,0,1,False,2.1333333333333333,0.25,True,False,True,False,False,True,False,2022_Q2,beea77539fed016b,0.3939,0.055,0.945,0.0,positive
u2oy29,"Dr Leslea - “I’m just a little confused, is all. In the middle of an actual pandemic, all protection measures are abandoned… and yet, we close schools for a snow storm that hasn’t even started yet? When did meteorology become our most trusted science?”",,1649852069.0,418,184,COVID-19,0.84,/r/Winnipeg/comments/u2oy29/dr_leslea_im_just_a_little_confused_is_all_in_the/,https://twitter.com/DrLeslea/status/1514074155473424384,False,False,False,False,False,Winnipeg,"Dr Leslea - “I’m just a little confused, is all. In the middle of an actual pandemic, all protection measures are abandoned… and yet, we close schools for a snow storm that hasn’t even started yet? When did meteorology become our most trusted science?” ",2022-04-13 12:14:29+00:00,2022,4,13,2,Wednesday,15,12,spring,2022-2023_api_transition,dr leslea i m just a little confused is all. in the middle of an actual pandemic all protection measures are abandoned and yet we close schools for a snow storm that hasn t even started yet? when did meteorology become our most trusted science?,244,45,False,True,0,2,False,0.43914081145584727,0.16000000000000003,True,False,True,False,False,True,False,2022_Q2,2dc898ced0c8ea31,-0.2439,0.067,0.827,0.106,negative
u6ip0m,"So sorry, southern Manitoba, but there's more snow on the way",,1650303308.0,150,101,News,0.91,/r/Winnipeg/comments/u6ip0m/so_sorry_southern_manitoba_but_theres_more_snow/,https://www.cbc.ca/news/canada/manitoba/snow-manitoba-rain-colorado-low-1.6422456,False,False,False,False,False,Winnipeg,"So sorry, southern Manitoba, but there's more snow on the way ",2022-04-18 17:35:08+00:00,2022,4,18,0,Monday,16,17,spring,2022-2023_api_transition,so sorry southern manitoba but there s more snow on the way,59,12,False,True,0,1,False,0.6688741721854304,0.08999999999999997,True,False,True,False,False,True,False,2022_Q2,f21fc221de163e8c,-0.0763,0.0,0.895,0.105,negative
tzocsw,A Colorado low could dump 30+cm of snow in southern Manitoba by the end of next week,,1649490471.0,166,88,News,0.96,/r/Winnipeg/comments/tzocsw/a_colorado_low_could_dump_30cm_of_snow_in/,https://twitter.com/scottdkehler/status/1512432146832580608?s=21&t=gjLJU30QTDqa5lNklWWZVg,False,False,False,False,False,Winnipeg,A Colorado low could dump 30+cm of snow in southern Manitoba by the end of next week ,2022-04-09 07:47:51+00:00,2022,4,9,5,Saturday,14,7,spring,2022-2023_api_transition,a colorado low could dump cm of snow in southern manitoba by the end of next week,81,17,False,True,0,1,False,0.5269461077844312,0.040000000000000036,True,False,True,False,False,True,False,2022_Q2,95c79ffe1e35e9a7,-0.5719,0.0,0.761,0.239,negative
u2h8wd,Still no snow!,"What if we're being punked and bought all those chips, pizza, and beers for nothing??",1649821308.0,113,91,Ask Winnipeg,0.79,/r/Winnipeg/comments/u2h8wd/still_no_snow/,https://www.reddit.com/r/Winnipeg/comments/u2h8wd/still_no_snow/,True,False,False,False,False,Winnipeg,"Still no snow! What if we're being punked and bought all those chips, pizza, and beers for nothing??",2022-04-13 03:41:48+00:00,2022,4,13,2,Wednesday,15,3,spring,2022-2023_api_transition,still no snow! what if we re being punked and bought all those chips pizza and beers for nothing??,98,19,False,True,0,1,False,0.7982456140350878,0.20999999999999996,True,False,True,False,False,True,False,2022_Q2,b4229f628eb090e8,-0.4314,0.0,0.863,0.137,negative
u9vl51,Tomorrow’s rain will be a good or bad test for all Winnipeg’s basements. With an estimated 20-30mm expected and the continuing melting snow is a bad combo,,1650682290.0,104,89,Article/Opinion,0.91,/r/Winnipeg/comments/u9vl51/tomorrows_rain_will_be_a_good_or_bad_test_for_all/,https://www.reddit.com/r/Winnipeg/comments/u9vl51/tomorrows_rain_will_be_a_good_or_bad_test_for_all/,True,False,False,False,False,Winnipeg,Tomorrow’s rain will be a good or bad test for all Winnipeg’s basements. With an estimated 20-30mm expected and the continuing melting snow is a bad combo ,2022-04-23 02:51:30+00:00,2022,4,23,5,Saturday,16,2,spring,2022-2023_api_transition,tomorrow s rain will be a good or bad test for all winnipeg s basements. with an estimated mm expected and the continuing melting snow is a bad combo,149,29,False,True,0,2,False,0.8476190476190476,0.08999999999999997,True,False,True,False,False,True,False,2022_Q2,d89415a5ae62a334,-0.6249,0.081,0.724,0.195,negative
txyk20,"Ok, which one of you noobs put your snow-brush away before May long weekend? I though we had an understanding.",,1649285536.0,218,50,Satire/Humour,0.94,/r/Winnipeg/comments/txyk20/ok_which_one_of_you_noobs_put_your_snowbrush_away/,https://www.reddit.com/r/Winnipeg/comments/txyk20/ok_which_one_of_you_noobs_put_your_snowbrush_away/,True,False,False,False,False,Winnipeg,"Ok, which one of you noobs put your snow-brush away before May long weekend? I though we had an understanding. ",2022-04-06 22:52:16+00:00,2022,4,6,2,Wednesday,14,22,spring,2022-2023_api_transition,ok which one of you noobs put your snow brush away before may long weekend? i though we had an understanding.,109,21,False,True,0,1,False,0.228310502283105,0.06000000000000005,True,False,True,False,False,True,False,2022_Q2,512cb4535c72970b,0.296,0.099,0.901,0.0,positive
