id,title,selftext,created_utc,score,num_comments,link_flair_text,upvote_ratio,permalink,url,is_self,over_18,spoiler,stickied,locked,subreddit,full_text,created_date,year,month,day,day_of_week,day_name,week_of_year,hour,season,platform_period,cleaned_text,text_length,word_count,contains_crime_keywords,contains_weather_keywords,crime_keyword_count,weather_keyword_count,crime_and_weather,engagement_rate,controversy_score,is_2022,is_2023,pre_api_announcement,post_api_announcement,during_blackout,pre_api_changes,post_api_changes,quarter,author_hash,sentiment_compound,sentiment_positive,sentiment_neutral,sentiment_negative,sentiment_category
ulj0p1,Balcony safety - locking door?,"In Madrid, it’s generally considered safe to leave balcony doors a little open at night to let the breeze in during the summer. I was wondering if this applies to a third floor apartment in Edmonton, assuming there’s no valuable items in the balcony? Or would you advise against this? (Asking because certain crimes are more common in certain cities!)",1652069872.0,12,55,Question,0.76,/r/Edmonton/comments/ulj0p1/balcony_safety_locking_door/,https://www.reddit.com/r/Edmonton/comments/ulj0p1/balcony_safety_locking_door/,True,False,True,False,False,Edmonton,"Balcony safety - locking door? In Madrid, it’s generally considered safe to leave balcony doors a little open at night to let the breeze in during the summer. I was wondering if this applies to a third floor apartment in Edmonton, assuming there’s no valuable items in the balcony? Or would you advise against this? (Asking because certain crimes are more common in certain cities!)",2022-05-09 04:17:52+00:00,2022,5,9,0,Monday,19,4,spring,2022-2023_api_transition,balcony safety locking door? in madrid it s generally considered safe to leave balcony doors a little open at night to let the breeze in during the summer. i was wondering if this applies to a third floor apartment in edmonton assuming there s no valuable items in the balcony? or would you advise against this? asking because certain crimes are more common in certain cities!,376,66,True,True,2,1,True,4.230769230769231,0.24,True,False,True,False,False,True,False,2022_Q2,514a890271afa812,0.8043,0.147,0.803,0.05,positive
uj18pt,Editorial: LRT safety needs stepping up,,1651767963.0,56,32,Discussion,0.82,/r/Edmonton/comments/uj18pt/editorial_lrt_safety_needs_stepping_up/,https://edmontonjournal.com/opinion/editorials/editorial-lrt-safety-needs-stepping-up,False,False,False,False,False,Edmonton,Editorial: LRT safety needs stepping up ,2022-05-05 16:26:03+00:00,2022,5,5,3,Thursday,18,16,spring,2022-2023_api_transition,editorial lrt safety needs stepping up,38,6,True,False,1,0,False,0.5614035087719298,0.18000000000000005,True,False,True,False,False,True,False,2022_Q2,c249fb765ba3eb04,0.4215,0.359,0.641,0.0,positive
ukd1og,Transit safety could be used as leverage to increase Edmonton police budget: CTLA,,1651929223.0,3,34,News,0.57,/r/Edmonton/comments/ukd1og/transit_safety_could_be_used_as_leverage_to/,https://globalnews.ca/news/8816688/transit-safety-edmonton-police-budget-lawyers/,False,False,False,False,False,Edmonton,Transit safety could be used as leverage to increase Edmonton police budget: CTLA ,2022-05-07 13:13:43+00:00,2022,5,7,5,Saturday,18,13,spring,2022-2023_api_transition,transit safety could be used as leverage to increase edmonton police budget ctla,80,13,True,False,2,0,False,8.5,0.43000000000000005,True,False,True,False,False,True,False,2022_Q2,add181ec3c316130,0.6249,0.317,0.683,0.0,positive
uz8jfs,Prescription safety glasses,Does anybody have good recommendations for places to get prescription safety glasses? Price isn't as important as quality. I recently got my class 1 and will be applying for certain jobs that require full PPE and will need to have safety glasses (preferably with transitional lenses). Any help is appreciated!,1653687610.0,5,33,Question,0.73,/r/Edmonton/comments/uz8jfs/prescription_safety_glasses/,https://www.reddit.com/r/Edmonton/comments/uz8jfs/prescription_safety_glasses/,True,False,False,False,False,Edmonton,Prescription safety glasses Does anybody have good recommendations for places to get prescription safety glasses? Price isn't as important as quality. I recently got my class 1 and will be applying for certain jobs that require full PPE and will need to have safety glasses (preferably with transitional lenses). Any help is appreciated!,2022-05-27 21:40:10+00:00,2022,5,27,4,Friday,21,21,spring,2022-2023_api_transition,prescription safety glasses does anybody have good recommendations for places to get prescription safety glasses? price isn t as important as quality. i recently got my class and will be applying for certain jobs that require full ppe and will need to have safety glasses preferably with transitional lenses . any help is appreciated!,334,54,True,False,1,0,False,5.5,0.27,True,False,True,False,False,True,False,2022_Q2,65c3cbb413fada9c,0.9612,0.318,0.682,0.0,positive
v0zwmg,Edmonton still has way too many dangerous intersections and pedestrian crossings. I hope that improvements can be fast tracked.,,1653916280.0,0,21,Commuting/Transit,0.48,/r/Edmonton/comments/v0zwmg/edmonton_still_has_way_too_many_dangerous/,https://youtu.be/0v7Me9AIt_8,False,False,False,False,False,Edmonton,Edmonton still has way too many dangerous intersections and pedestrian crossings. I hope that improvements can be fast tracked. ,2022-05-30 13:11:20+00:00,2022,5,30,0,Monday,22,13,spring,2022-2023_api_transition,edmonton still has way too many dangerous intersections and pedestrian crossings. i hope that improvements can be fast tracked.,127,19,True,False,1,0,False,21.0,0.52,True,False,True,False,False,True,False,2022_Q2,fb926cd2b4d44963,0.2732,0.214,0.658,0.128,positive
ujiemp,Car got stolen,"Car was in the shop, and the shop got broken into, and my “lucky” car got stolen. What are chances of getting it back?",1651823917.0,1,29,General,0.53,/r/Edmonton/comments/ujiemp/car_got_stolen/,https://www.reddit.com/r/Edmonton/comments/ujiemp/car_got_stolen/,True,False,False,False,False,Edmonton,"Car got stolen Car was in the shop, and the shop got broken into, and my “lucky” car got stolen. What are chances of getting it back?",2022-05-06 07:58:37+00:00,2022,5,6,4,Friday,18,7,spring,2022-2023_api_transition,car got stolen car was in the shop and the shop got broken into and my lucky car got stolen. what are chances of getting it back?,129,27,True,False,2,0,False,14.5,0.47,True,False,True,False,False,True,False,2022_Q2,0d74c5edfc3b3ca3,-0.7096,0.127,0.609,0.263,negative
ux8k28,Council takes heat over possible changes to Edmonton police funding,,1653450016.0,12,51,News,0.72,/r/Edmonton/comments/ux8k28/council_takes_heat_over_possible_changes_to/,https://edmontonjournal.com/news/local-news/council-takes-heat-over-possible-changes-to-edmonton-police-funding,False,False,False,False,False,Edmonton,Council takes heat over possible changes to Edmonton police funding ,2022-05-25 03:40:16+00:00,2022,5,25,2,Wednesday,21,3,spring,2022-2023_api_transition,council takes heat over possible changes to edmonton police funding,67,10,True,False,1,0,False,3.923076923076923,0.28,True,False,True,False,False,True,False,2022_Q2,9236973ebae50327,0.0,0.0,1.0,0.0,neutral
umbale,Do heat pumps work in Edmonton?,Moving to Edmonton in the next year and the potential utility bills are concerning. I have a heat pump in Victoria where I live now and it works great in this mild climate. Should I look into having one in my new home in Edmonton?,1652160658.0,4,36,Question,0.63,/r/Edmonton/comments/umbale/do_heat_pumps_work_in_edmonton/,https://www.reddit.com/r/Edmonton/comments/umbale/do_heat_pumps_work_in_edmonton/,True,False,False,False,False,Edmonton,Do heat pumps work in Edmonton? Moving to Edmonton in the next year and the potential utility bills are concerning. I have a heat pump in Victoria where I live now and it works great in this mild climate. Should I look into having one in my new home in Edmonton?,2022-05-10 05:30:58+00:00,2022,5,10,1,Tuesday,19,5,spring,2022-2023_api_transition,do heat pumps work in edmonton? moving to edmonton in the next year and the potential utility bills are concerning. i have a heat pump in victoria where i live now and it works great in this mild climate. should i look into having one in my new home in edmonton?,262,51,False,True,0,1,False,7.2,0.37,True,False,True,False,False,True,False,2022_Q2,1a0e79344d62727e,0.6662,0.082,0.918,0.0,positive
us1y4b,"Don't forget while school districts are slashing budgets, Scott Moe has all the money in the world for a Personal Pan Police Force.",,1652838433.0,125,82,Politics,0.79,/r/saskatchewan/comments/us1y4b/dont_forget_while_school_districts_are_slashing/,https://i.redd.it/texnwiiq35091.jpg,False,False,False,False,False,saskatchewan,"Don't forget while school districts are slashing budgets, Scott Moe has all the money in the world for a Personal Pan Police Force. ",2022-05-18 01:47:13+00:00,2022,5,18,2,Wednesday,20,1,spring,2022-2023_api_transition,don t forget while school districts are slashing budgets scott moe has all the money in the world for a personal pan police force.,130,24,True,False,1,0,False,0.6507936507936508,0.20999999999999996,True,False,True,False,False,True,False,2022_Q2,c156538982d2b00b,-0.4588,0.0,0.846,0.154,negative
ursyg7,Saskatoon Police Service report says Thin Blue Line patches not allowed on uniforms,,1652812170.0,130,43,None,0.92,/r/saskatchewan/comments/ursyg7/saskatoon_police_service_report_says_thin_blue/,https://www.cbc.ca/news/canada/saskatoon/saskatoon-police-service-report-says-thin-blue-line-patches-not-allowed-on-uniforms-1.6456039,False,False,False,False,False,saskatchewan,Saskatoon Police Service report says Thin Blue Line patches not allowed on uniforms ,2022-05-17 18:29:30+00:00,2022,5,17,1,Tuesday,20,18,spring,2022-2023_api_transition,saskatoon police service report says thin blue line patches not allowed on uniforms,83,13,True,False,1,0,False,0.3282442748091603,0.07999999999999996,True,False,True,False,False,True,False,2022_Q2,95a83184978d67b3,0.0,0.0,1.0,0.0,neutral
ul9ley,Posting this here as well because police told me that what normally happens with these trailer thefts is that they are brought to the hells angels in Sask who then bring it down to the US for sale. Please let me know if you find or see anything related to this truck and trailer so I can contact RCMP,,1652039324.0,87,40,None,0.95,/r/saskatchewan/comments/ul9ley/posting_this_here_as_well_because_police_told_me/,https://www.reddit.com/gallery/ukl2hy,False,False,False,False,False,saskatchewan,Posting this here as well because police told me that what normally happens with these trailer thefts is that they are brought to the hells angels in Sask who then bring it down to the US for sale. Please let me know if you find or see anything related to this truck and trailer so I can contact RCMP ,2022-05-08 19:48:44+00:00,2022,5,8,6,Sunday,18,19,spring,2022-2023_api_transition,posting this here as well because police told me that what normally happens with these trailer thefts is that they are brought to the hells angels in sask who then bring it down to the us for sale. please let me know if you find or see anything related to this truck and trailer so i can contact rcmp,300,59,True,False,3,0,False,0.45454545454545453,0.050000000000000044,True,False,True,False,False,True,False,2022_Q2,3582f954ec01ff7e,0.5267,0.072,0.928,0.0,positive
urt1ip,Gas theft up 76% in Sask. to start 2022: RCMP,,1652812402.0,65,39,None,0.93,/r/saskatchewan/comments/urt1ip/gas_theft_up_76_in_sask_to_start_2022_rcmp/,https://regina.ctvnews.ca/gas-theft-up-76-in-sask-to-start-2022-rcmp-1.5907166,False,False,False,False,False,saskatchewan,Gas theft up 76% in Sask. to start 2022: RCMP ,2022-05-17 18:33:22+00:00,2022,5,17,1,Tuesday,20,18,spring,2022-2023_api_transition,gas theft up in sask. to start rcmp,35,8,True,False,2,0,False,0.5909090909090909,0.06999999999999995,True,False,True,False,False,True,False,2022_Q2,0839dbc7cd97cf33,0.0,0.0,1.0,0.0,neutral
utid90,Anyone deal with a stolen motorcycle before?,"Looking at getting my motorcycle license. And just curious if it's like cars where if it gets stolen and not recovered, if sgi will total it, or if they'll just shrug and tell you to come back when they care.",1653010630.0,0,5,None,0.4,/r/saskatchewan/comments/utid90/anyone_deal_with_a_stolen_motorcycle_before/,https://www.reddit.com/r/saskatchewan/comments/utid90/anyone_deal_with_a_stolen_motorcycle_before/,True,False,False,False,False,saskatchewan,"Anyone deal with a stolen motorcycle before? Looking at getting my motorcycle license. And just curious if it's like cars where if it gets stolen and not recovered, if sgi will total it, or if they'll just shrug and tell you to come back when they care.",2022-05-20 01:37:10+00:00,2022,5,20,4,Friday,20,1,spring,2022-2023_api_transition,anyone deal with a stolen motorcycle before? looking at getting my motorcycle license. and just curious if it s like cars where if it gets stolen and not recovered if sgi will total it or if they ll just shrug and tell you to come back when they care.,251,49,True,False,2,0,False,5.0,0.6,True,False,True,False,False,True,False,2022_Q2,799df7efd6ca8823,0.1531,0.137,0.753,0.11,positive
ut2ac2,"Former Grenfell, Sask., teacher pleads guilty to sexually assaulting 15-year-old boy",,1652963173.0,40,29,None,0.94,/r/saskatchewan/comments/ut2ac2/former_grenfell_sask_teacher_pleads_guilty_to/,https://www.cbc.ca/news/canada/saskatchewan/grenfell-sask-teacher-guilty-sexual-assault-1.6458058,False,False,False,False,False,saskatchewan,"Former Grenfell, Sask., teacher pleads guilty to sexually assaulting 15-year-old boy ",2022-05-19 12:26:13+00:00,2022,5,19,3,Thursday,20,12,spring,2022-2023_api_transition,former grenfell sask. teacher pleads guilty to sexually assaulting year old boy,79,12,True,False,1,0,False,0.7073170731707317,0.06000000000000005,True,False,True,False,False,True,False,2022_Q2,c52f4df34252155f,-0.7269,0.0,0.621,0.379,negative
ursihk,"Inspired by a drive I took on a day with very similar weather to today. Highway 16, anyone recognize the spot? My marks are vague so I’ll be pleasantly surprised if anyone does!",,1652810969.0,178,19,None,0.98,/r/saskatchewan/comments/ursihk/inspired_by_a_drive_i_took_on_a_day_with_very/,https://i.redd.it/iyfu3ep1u2091.jpg,False,False,False,False,False,saskatchewan,"Inspired by a drive I took on a day with very similar weather to today. Highway 16, anyone recognize the spot? My marks are vague so I’ll be pleasantly surprised if anyone does! ",2022-05-17 18:09:29+00:00,2022,5,17,1,Tuesday,20,18,spring,2022-2023_api_transition,inspired by a drive i took on a day with very similar weather to today. highway anyone recognize the spot? my marks are vague so i ll be pleasantly surprised if anyone does!,173,33,False,True,0,1,False,0.10614525139664804,0.020000000000000018,True,False,True,False,False,True,False,2022_Q2,ea68469015658b57,0.7959,0.218,0.746,0.036,positive
unnd4y,Ep #48 - From a Cold Hearted Capitalist Perspective for youtube,,1652312761.0,0,0,Politics,0.29,/r/saskatchewan/comments/unnd4y/ep_48_from_a_cold_hearted_capitalist_perspective/,https://youtube.com/watch?v=BnrweY38z9s&feature=share,False,False,False,False,False,saskatchewan,Ep #48 - From a Cold Hearted Capitalist Perspective for youtube ,2022-05-11 23:46:01+00:00,2022,5,11,2,Wednesday,19,23,spring,2022-2023_api_transition,ep from a cold hearted capitalist perspective for youtube,57,9,False,True,0,1,False,0.0,0.71,True,False,True,False,False,True,False,2022_Q2,4ca7d6b3c5f6f14a,0.0,0.0,1.0,0.0,neutral
usgoj5,Spring snow expected in parts of Saskatchewan prior to May long weekend,,1652890895.0,18,4,None,0.86,/r/saskatchewan/comments/usgoj5/spring_snow_expected_in_parts_of_saskatchewan/,https://www.cbc.ca/news/canada/saskatchewan/snow-expected-thursday-in-southern-sask-1.6457660,False,False,False,False,False,saskatchewan,Spring snow expected in parts of Saskatchewan prior to May long weekend ,2022-05-18 16:21:35+00:00,2022,5,18,2,Wednesday,20,16,spring,2022-2023_api_transition,spring snow expected in parts of saskatchewan prior to may long weekend,71,12,False,True,0,2,False,0.21052631578947367,0.14,True,False,True,False,False,True,False,2022_Q2,c52f4df34252155f,0.0,0.0,1.0,0.0,neutral
uo3roo,‘Evolving threats’ to public safety at legislature warrant security boost: Province,,1652369519.0,27,16,Politics,0.97,/r/saskatchewan/comments/uo3roo/evolving_threats_to_public_safety_at_legislature/,https://globalnews.ca/news/8828563/evolving-threats-public-safety-legislature-security-boost-province/,False,False,False,False,False,saskatchewan,‘Evolving threats’ to public safety at legislature warrant security boost: Province ,2022-05-12 15:31:59+00:00,2022,5,12,3,Thursday,19,15,spring,2022-2023_api_transition,evolving threats to public safety at legislature warrant security boost province,80,11,True,False,2,0,False,0.5714285714285714,0.030000000000000027,True,False,True,False,False,True,False,2022_Q2,4950ca3cb42feed6,0.6249,0.446,0.395,0.158,positive
uqjrjt,Unpopular Opinion: It’s time to move on,"Well. I’ve been fortunate enough to leave the country for the first time in 2.5 years.  This post is coming from Ireland. 

First off. Amazing people. I cannot stress that enough. Phenomenal.  The country is grand. From Dublin to “the sticks” I’ve had the best food I’ve ever had and the best experience one can hope for in a life time. 

One word I haven’t heard once: “Covid”. 

I forgot it exists. Getting out of the Canadian fear bubble has been amazing. My mental health has improved and I’ve had the best experience. 

The second I got off the 8 hour flight from Canada, my world changed. People are worried about inflation, petrol/diesel prices, and how much a Guinness costs where we live. Not once was Covid mentioned. I hope this subreddit eventually goes back to that. 

This is a mental health safety check. Don’t let Covid run your life anymore. Here’s the downvoted but hear me out. I did all I could to help in the pandemic, it may not be over but you don’t need to live in fear. The world has moved on. It’s time we do the same.",1652662034.0,0,52,None,0.41,/r/saskatchewan/comments/uqjrjt/unpopular_opinion_its_time_to_move_on/,https://www.reddit.com/r/saskatchewan/comments/uqjrjt/unpopular_opinion_its_time_to_move_on/,True,False,False,False,False,saskatchewan,"Unpopular Opinion: It’s time to move on Well. I’ve been fortunate enough to leave the country for the first time in 2.5 years.  This post is coming from Ireland. 

First off. Amazing people. I cannot stress that enough. Phenomenal.  The country is grand. From Dublin to “the sticks” I’ve had the best food I’ve ever had and the best experience one can hope for in a life time. 

One word I haven’t heard once: “Covid”. 

I forgot it exists. Getting out of the Canadian fear bubble has been amazing. My mental health has improved and I’ve had the best experience. 

The second I got off the 8 hour flight from Canada, my world changed. People are worried about inflation, petrol/diesel prices, and how much a Guinness costs where we live. Not once was Covid mentioned. I hope this subreddit eventually goes back to that. 

This is a mental health safety check. Don’t let Covid run your life anymore. Here’s the downvoted but hear me out. I did all I could to help in the pandemic, it may not be over but you don’t need to live in fear. The world has moved on. It’s time we do the same.",2022-05-16 00:47:14+00:00,2022,5,16,0,Monday,20,0,spring,2022-2023_api_transition,unpopular opinion it s time to move on well. i ve been fortunate enough to leave the country for the first time in . years. this post is coming from ireland. first off. amazing people. i cannot stress that enough. phenomenal. the country is grand. from dublin to the sticks i ve had the best food i ve ever had and the best experience one can hope for in a life time. one word i haven t heard once covid . i forgot it exists. getting out of the canadian fear bubble has been amazing. my mental health has improved and i ve had the best experience. the second i got off the hour flight from canada my world changed. people are worried about inflation petrol diesel prices and how much a guinness costs where we live. not once was covid mentioned. i hope this subreddit eventually goes back to that. this is a mental health safety check. don t let covid run your life anymore. here s the downvoted but hear me out. i did all i could to help in the pandemic it may not be over but you don t need to live in fear. the world has moved on. it s time we do the same.,1059,210,True,False,1,0,False,52.0,0.5900000000000001,True,False,True,False,False,True,False,2022_Q2,f86ff0dfc5909de3,0.9522,0.134,0.827,0.039,positive
uyfbd4,OP cross posting. Truck stolen from Saskatoon,,1653593017.0,12,3,None,0.87,/r/saskatchewan/comments/uyfbd4/op_cross_posting_truck_stolen_from_saskatoon/,https://www.reddit.com/gallery/uyerai,False,False,False,False,False,saskatchewan,OP cross posting. Truck stolen from Saskatoon ,2022-05-26 19:23:37+00:00,2022,5,26,3,Thursday,21,19,spring,2022-2023_api_transition,op cross posting. truck stolen from saskatoon,45,7,True,False,2,0,False,0.23076923076923078,0.13,True,False,True,False,False,True,False,2022_Q2,dab67e110d12518d,-0.4939,0.0,0.652,0.348,negative
upk9uj,Is Manitoba's wild weather a sign of climate change?,,1652544100.0,31,26,Weather,0.79,/r/Manitoba/comments/upk9uj/is_manitobas_wild_weather_a_sign_of_climate_change/,https://www.cbc.ca/news/canada/manitoba/climate-change-manitoba-prairies-weather-1.6447990,False,False,False,False,False,manitoba,Is Manitoba's wild weather a sign of climate change? ,2022-05-14 16:01:40+00:00,2022,5,14,5,Saturday,19,16,spring,2022-2023_api_transition,is manitoba s wild weather a sign of climate change?,52,10,False,True,0,2,False,0.8125,0.20999999999999996,True,False,True,False,False,True,False,2022_Q2,95a83184978d67b3,0.0,0.0,1.0,0.0,neutral
uyyfry,"Morris business community raises concerns over Highway 75 closure - PembinaValleyOnline.com - Local news, Weather, Sports, Free Classifieds and Business Listings for the Pembina Valley, Manitoba",,1653658720.0,3,4,News,0.71,/r/Manitoba/comments/uyyfry/morris_business_community_raises_concerns_over/,https://pembinavalleyonline.com/articles/morris-business-community-raises-concerns-over-highway-75-closure,False,False,False,False,False,manitoba,"Morris business community raises concerns over Highway 75 closure - PembinaValleyOnline.com - Local news, Weather, Sports, Free Classifieds and Business Listings for the Pembina Valley, Manitoba ",2022-05-27 13:38:40+00:00,2022,5,27,4,Friday,21,13,spring,2022-2023_api_transition,morris business community raises concerns over highway closure pembinavalleyonline.com local news weather sports free classifieds and business listings for the pembina valley manitoba,183,23,False,True,0,1,False,1.0,0.29000000000000004,True,False,True,False,False,True,False,2022_Q2,2da8f44de74d7942,0.5106,0.13,0.87,0.0,positive
v1vy0j,"Manitoba Farmers Leave 2,000 Calves to Die in Inclement Weather",,1654019379.0,0,3,News,0.09,/r/Manitoba/comments/v1vy0j/manitoba_farmers_leave_2000_calves_to_die_in/,https://animaljustice.ca/blog/manitoba-calves-die-inclement-weather,False,False,False,False,False,manitoba,"Manitoba Farmers Leave 2,000 Calves to Die in Inclement Weather ",2022-05-31 17:49:39+00:00,2022,5,31,1,Tuesday,22,17,spring,2022-2023_api_transition,manitoba farmers leave calves to die in inclement weather,57,9,False,True,0,1,False,3.0,0.91,True,False,True,False,False,True,False,2022_Q2,23ff125f03262fd7,-0.6249,0.0,0.579,0.421,negative
uo0ttb,hopefully it will not be too much rain,,1652361324.0,76,28,Weather,0.96,/r/Manitoba/comments/uo0ttb/hopefully_it_will_not_be_too_much_rain/,https://v.redd.it/ewka5io1p1z81,False,False,False,False,False,manitoba,hopefully it will not be too much rain ,2022-05-12 13:15:24+00:00,2022,5,12,3,Thursday,19,13,spring,2022-2023_api_transition,hopefully it will not be too much rain,38,8,False,True,0,1,False,0.36363636363636365,0.040000000000000036,True,False,True,False,False,True,False,2022_Q2,2da8f44de74d7942,0.4019,0.278,0.722,0.0,positive
v1de4l,La Nina Spring,This spring has been nothing short of wild weather wise. La Nina is not messing around. How's everyone dealing with this spring season?,1653955441.0,6,21,Weather,0.75,/r/Manitoba/comments/v1de4l/la_nina_spring/,https://www.reddit.com/r/Manitoba/comments/v1de4l/la_nina_spring/,True,False,False,False,False,manitoba,La Nina Spring This spring has been nothing short of wild weather wise. La Nina is not messing around. How's everyone dealing with this spring season?,2022-05-31 00:04:01+00:00,2022,5,31,1,Tuesday,22,0,spring,2022-2023_api_transition,la nina spring this spring has been nothing short of wild weather wise. la nina is not messing around. how s everyone dealing with this spring season?,150,27,False,True,0,2,False,3.0,0.25,True,False,True,False,False,True,False,2022_Q2,9ad41686730d6773,0.4767,0.107,0.893,0.0,positive
