id,title,selftext,created_utc,score,num_comments,link_flair_text,upvote_ratio,permalink,url,is_self,over_18,spoiler,stickied,locked,subreddit,full_text,created_date,year,month,day,day_of_week,day_name,week_of_year,hour,season,platform_period,cleaned_text,text_length,word_count,contains_crime_keywords,contains_weather_keywords,crime_keyword_count,weather_keyword_count,crime_and_weather,engagement_rate,controversy_score,is_2022,is_2023,pre_api_announcement,post_api_announcement,during_blackout,pre_api_changes,post_api_changes,quarter,author_hash,sentiment_compound,sentiment_positive,sentiment_neutral,sentiment_negative,sentiment_category
14g8gel,Saskatoon Police Service Member Charged,,1687452698.0,54,122,Police Updates,0.89,/r/saskatoon/comments/14g8gel/saskatoon_police_service_member_charged/,https://saskatoonpolice.ca/news/2023367,False,False,False,False,False,Saskatoon,Saskatoon Police Service Member Charged ,2023-06-22 16:51:38+00:00,2023,6,22,3,Thursday,25,16,summer,2022-2023_api_transition,saskatoon police service member charged,39,5,True,False,1,0,False,2.2181818181818183,0.10999999999999999,False,True,False,True,False,True,False,2023_Q2,ecd91e168544abf3,-0.2023,0.0,0.69,0.31,negative
14ey6jx,Theft at the airport,Has anyone had anything stolen from their checked bag from the yxe airport recently? I flew in from Vancouver today and my suitcase was weirdly half unzipped (it has the double wrap around zipper to keep everything secure). Didn’t think much of it but now that I’m unpacking I’m missing 2 brand new sweaters that were packed on the very top. Is there anyone I can even contact about this/any next steps to take?,1687324232.0,11,14,Question,0.76,/r/saskatoon/comments/14ey6jx/theft_at_the_airport/,https://www.reddit.com/r/saskatoon/comments/14ey6jx/theft_at_the_airport/,True,False,False,False,False,Saskatoon,Theft at the airport Has anyone had anything stolen from their checked bag from the yxe airport recently? I flew in from Vancouver today and my suitcase was weirdly half unzipped (it has the double wrap around zipper to keep everything secure). Didn’t think much of it but now that I’m unpacking I’m missing 2 brand new sweaters that were packed on the very top. Is there anyone I can even contact about this/any next steps to take?,2023-06-21 05:10:32+00:00,2023,6,21,2,Wednesday,25,5,summer,2022-2023_api_transition,theft at the airport has anyone had anything stolen from their checked bag from the yxe airport recently? i flew in from vancouver today and my suitcase was weirdly half unzipped it has the double wrap around zipper to keep everything secure . didn t think much of it but now that i m unpacking i m missing brand new sweaters that were packed on the very top. is there anyone i can even contact about this any next steps to take?,429,82,True,False,3,0,False,1.1666666666666667,0.24,False,True,False,True,False,True,False,2023_Q2,873f0eb7535d8064,-0.3654,0.049,0.873,0.078,negative
13yisdc,question about poice,"My husband's buddy is trying to talk us into moving to Saskatoon but he says the crime in the city is through the room and people are breaking into his place during the day, stealing his tools off the sidewalk and then selling them on facebook but even with the film, the  whole thing the cops will do nothing.  On the other hand we hear about the long cold  walks home provided to  people by these same cops.......so  what is the sitch?",1685726516.0,0,12,Question,0.17,/r/saskatoon/comments/13yisdc/question_about_poice/,https://www.reddit.com/r/saskatoon/comments/13yisdc/question_about_poice/,True,False,False,False,False,Saskatoon,"question about poice My husband's buddy is trying to talk us into moving to Saskatoon but he says the crime in the city is through the room and people are breaking into his place during the day, stealing his tools off the sidewalk and then selling them on facebook but even with the film, the  whole thing the cops will do nothing.  On the other hand we hear about the long cold  walks home provided to  people by these same cops.......so  what is the sitch?",2023-06-02 17:21:56+00:00,2023,6,2,4,Friday,22,17,summer,2022-2023_api_transition,question about poice my husband s buddy is trying to talk us into moving to saskatoon but he says the crime in the city is through the room and people are breaking into his place during the day stealing his tools off the sidewalk and then selling them on facebook but even with the film the whole thing the cops will do nothing. on the other hand we hear about the long cold walks home provided to people by these same cops.......so what is the sitch?,451,86,True,True,2,1,True,12.0,0.83,False,True,False,True,False,True,False,2023_Q2,3253184f40ab9a6d,-0.7579,0.044,0.855,0.101,negative
14aatg0,Former principal of Christian Centre/Legacy Christian Academy charged x11 assault with a weapon,"https://saskatoonpolice.ca/news/2023357

""Charges have been laid in an investigation into historical assaults with faith-based affiliations.

In 2021 and 2022, several reports were made to police with allegations of assault occurring historically. The victims and accused were known to one another through their affiliation with the Saskatoon faith-based institution.

As a result of investigation by members of the Saskatoon Police Service Interpersonal Violence Section, a 65-year-old Prince Albert man has been charged with Assault with a Weapon (x11). He turned himself in to the SPS on June 15, 2023 and is expected to appear in Saskatoon Provincial Court today at 2:00 p.m.""",1686856971.0,237,103,Police Updates,0.95,/r/saskatoon/comments/14aatg0/former_principal_of_christian_centrelegacy/,https://www.reddit.com/r/saskatoon/comments/14aatg0/former_principal_of_christian_centrelegacy/,True,False,False,False,False,Saskatoon,"Former principal of Christian Centre/Legacy Christian Academy charged x11 assault with a weapon https://saskatoonpolice.ca/news/2023357

""Charges have been laid in an investigation into historical assaults with faith-based affiliations.

In 2021 and 2022, several reports were made to police with allegations of assault occurring historically. The victims and accused were known to one another through their affiliation with the Saskatoon faith-based institution.

As a result of investigation by members of the Saskatoon Police Service Interpersonal Violence Section, a 65-year-old Prince Albert man has been charged with Assault with a Weapon (x11). He turned himself in to the SPS on June 15, 2023 and is expected to appear in Saskatoon Provincial Court today at 2:00 p.m.""",2023-06-15 19:22:51+00:00,2023,6,15,3,Thursday,24,19,summer,2022-2023_api_transition,former principal of christian centre legacy christian academy charged x assault with a weapon charges have been laid in an investigation into historical assaults with faith based affiliations. in and several reports were made to police with allegations of assault occurring historically. the victims and accused were known to one another through their affiliation with the saskatoon faith based institution. as a result of investigation by members of the saskatoon police service interpersonal violence section a year old prince albert man has been charged with assault with a weapon x . he turned himself in to the sps on june and is expected to appear in saskatoon provincial court today at p.m.,697,112,True,False,4,0,False,0.4327731092436975,0.050000000000000044,False,True,False,True,False,True,False,2023_Q2,acc0484b20f09cca,-0.9776,0.041,0.714,0.245,negative
14ai70r,Saskatoon priest accused of sexually assaulting child headed to trial,,1686875161.0,68,25,News,0.91,/r/saskatoon/comments/14ai70r/saskatoon_priest_accused_of_sexually_assaulting/,https://saskatoon.ctvnews.ca/saskatoon-priest-accused-of-sexually-assaulting-child-headed-to-trial-1.6441531,False,False,False,False,False,Saskatoon,Saskatoon priest accused of sexually assaulting child headed to trial ,2023-06-16 00:26:01+00:00,2023,6,16,4,Friday,24,0,summer,2022-2023_api_transition,saskatoon priest accused of sexually assaulting child headed to trial,69,10,True,False,1,0,False,0.36231884057971014,0.08999999999999997,False,True,False,True,False,True,False,2023_Q2,42d30bf83eff6400,-0.6705,0.0,0.593,0.407,negative
14hsvmq,"Gas line upgrade, no hot water or gas","Hey all 

Sask energy was by to upgrade my gas meter. As part of that they need to relight your water heater and what not. The company they told me to call is closed until Monday. Does any one have any suggestions?",1687612657.0,5,10,Question,0.78,/r/saskatoon/comments/14hsvmq/gas_line_upgrade_no_hot_water_or_gas/,https://www.reddit.com/r/saskatoon/comments/14hsvmq/gas_line_upgrade_no_hot_water_or_gas/,True,False,False,False,False,Saskatoon,"Gas line upgrade, no hot water or gas Hey all 

Sask energy was by to upgrade my gas meter. As part of that they need to relight your water heater and what not. The company they told me to call is closed until Monday. Does any one have any suggestions?",2023-06-24 13:17:37+00:00,2023,6,24,5,Saturday,25,13,summer,2022-2023_api_transition,gas line upgrade no hot water or gas hey all sask energy was by to upgrade my gas meter. as part of that they need to relight your water heater and what not. the company they told me to call is closed until monday. does any one have any suggestions?,249,50,False,True,0,1,False,1.6666666666666667,0.21999999999999997,False,True,False,True,False,True,False,2023_Q2,4d6419edce8e5afb,-0.0258,0.04,0.918,0.042,neutral
14ng7ab,Storm left a little gift for homeowner.,,1688169447.0,88,23,Weather,0.99,/r/saskatoon/comments/14ng7ab/storm_left_a_little_gift_for_homeowner/,https://i.redd.it/trwre7vhu89b1.jpg,False,False,False,False,False,Saskatoon,Storm left a little gift for homeowner. ,2023-06-30 23:57:27+00:00,2023,6,30,4,Friday,26,23,summer,2022-2023_api_transition,storm left a little gift for homeowner.,39,7,False,True,0,1,False,0.25842696629213485,0.010000000000000009,False,True,False,True,False,True,False,2023_Q2,badacfceae0d1314,0.3832,0.303,0.697,0.0,positive
14lrkl3,Saskatoon council hears plea for better safety for cyclists,,1688002762.0,126,109,News,0.89,/r/saskatoon/comments/14lrkl3/saskatoon_council_hears_plea_for_better_safety/,https://thestarphoenix.com/news/local-news/saskatoon-council-hears-plea-for-better-safety-for-cyclists,False,False,False,False,False,Saskatoon,Saskatoon council hears plea for better safety for cyclists ,2023-06-29 01:39:22+00:00,2023,6,29,3,Thursday,26,1,summer,2022-2023_api_transition,saskatoon council hears plea for better safety for cyclists,59,9,True,False,1,0,False,0.8582677165354331,0.10999999999999999,False,True,False,True,False,True,False,2023_Q2,ea21b71ec4b98443,0.6908,0.449,0.551,0.0,positive
13zsas3,Does sask cover fertility preservation procedures due to cancer treatment?,"I will be undergoing stem cell transplant for lymphoma and it might make me infertile. I would like to freeze my eggs beforehand because I’m still very young and would love to have kids in the future. 

I was referred to aurora fertility clinic. Egg freezing costs 5k in total. There’s an organization that could help reimburse at least 1k, but 4k out of pocket is still a lot of money. 

Just wondering if anybody knows any other programs/organizations that would help me with the cost?",1685832078.0,12,5,Question,0.75,/r/saskatoon/comments/13zsas3/does_sask_cover_fertility_preservation_procedures/,https://www.reddit.com/r/saskatoon/comments/13zsas3/does_sask_cover_fertility_preservation_procedures/,True,False,False,False,False,Saskatoon,"Does sask cover fertility preservation procedures due to cancer treatment? I will be undergoing stem cell transplant for lymphoma and it might make me infertile. I would like to freeze my eggs beforehand because I’m still very young and would love to have kids in the future. 

I was referred to aurora fertility clinic. Egg freezing costs 5k in total. There’s an organization that could help reimburse at least 1k, but 4k out of pocket is still a lot of money. 

Just wondering if anybody knows any other programs/organizations that would help me with the cost?",2023-06-03 22:41:18+00:00,2023,6,3,5,Saturday,22,22,summer,2022-2023_api_transition,does sask cover fertility preservation procedures due to cancer treatment? i will be undergoing stem cell transplant for lymphoma and it might make me infertile. i would like to freeze my eggs beforehand because i m still very young and would love to have kids in the future. i was referred to aurora fertility clinic. egg freezing costs k in total. there s an organization that could help reimburse at least k but k out of pocket is still a lot of money. just wondering if anybody knows any other programs organizations that would help me with the cost?,554,99,False,True,0,2,False,0.38461538461538464,0.25,False,True,False,True,False,True,False,2023_Q2,db44a1b4fa275103,0.7438,0.105,0.859,0.036,positive
14dmgpc,Insanely high powerbills in my basement suite.,I'm staying in a 2 bedroom basement suite managed by real canadian property management. They just sent me the bill for this month it's $439.99 they say I have no choice but to pay it and the reason behind this is because the ac is running. I pay 2/3rds of the electricity because I have baseboard heating which I only use in the winter the ppl upstairs pay 1/3rd when they are running ac on their 3 level area with windows open all summer. Is there any way I can dispute this? I've already tried complaining several times to the company about this I just feel like I got punched in the gut. I am moving at the end of this month and I've never missed a single payment.,1687199287.0,83,162,Question,0.92,/r/saskatoon/comments/14dmgpc/insanely_high_powerbills_in_my_basement_suite/,https://www.reddit.com/r/saskatoon/comments/14dmgpc/insanely_high_powerbills_in_my_basement_suite/,True,False,False,False,False,Saskatoon,Insanely high powerbills in my basement suite. I'm staying in a 2 bedroom basement suite managed by real canadian property management. They just sent me the bill for this month it's $439.99 they say I have no choice but to pay it and the reason behind this is because the ac is running. I pay 2/3rds of the electricity because I have baseboard heating which I only use in the winter the ppl upstairs pay 1/3rd when they are running ac on their 3 level area with windows open all summer. Is there any way I can dispute this? I've already tried complaining several times to the company about this I just feel like I got punched in the gut. I am moving at the end of this month and I've never missed a single payment.,2023-06-19 18:28:07+00:00,2023,6,19,0,Monday,25,18,summer,2022-2023_api_transition,insanely high powerbills in my basement suite. i m staying in a bedroom basement suite managed by real canadian property management. they just sent me the bill for this month it s . they say i have no choice but to pay it and the reason behind this is because the ac is running. i pay rds of the electricity because i have baseboard heating which i only use in the winter the ppl upstairs pay rd when they are running ac on their level area with windows open all summer. is there any way i can dispute this? i ve already tried complaining several times to the company about this i just feel like i got punched in the gut. i am moving at the end of this month and i ve never missed a single payment.,698,138,False,True,0,2,False,1.9285714285714286,0.07999999999999996,False,True,False,True,False,True,False,2023_Q2,ccfe698f33fe6122,-0.5526,0.038,0.88,0.082,negative
143ygxp,Why did the Regina police buy a crime watching airplane to fly around the city?,,1686196338.0,31,72,Discussion,0.81,/r/regina/comments/143ygxp/why_did_the_regina_police_buy_a_crime_watching/,https://www.reddit.com/r/regina/comments/143ygxp/why_did_the_regina_police_buy_a_crime_watching/,True,False,False,False,False,Regina,Why did the Regina police buy a crime watching airplane to fly around the city? ,2023-06-08 03:52:18+00:00,2023,6,8,3,Thursday,23,3,summer,2022-2023_api_transition,why did the regina police buy a crime watching airplane to fly around the city?,79,15,True,False,2,0,False,2.25,0.18999999999999995,False,True,False,True,False,True,False,2023_Q2,cea0664671593153,-0.5423,0.0,0.8,0.2,negative
144abor,"There are a lot of crime stoppers websites in Canada, this is the one Regina police use",,1686233368.0,0,0,Community,0.17,/r/regina/comments/144abor/there_are_a_lot_of_crime_stoppers_websites_in/,https://www.canadiancrimestoppers.org/tips,False,False,False,False,False,Regina,"There are a lot of crime stoppers websites in Canada, this is the one Regina police use ",2023-06-08 14:09:28+00:00,2023,6,8,3,Thursday,23,14,summer,2022-2023_api_transition,there are a lot of crime stoppers websites in canada this is the one regina police use,86,17,True,False,2,0,False,0.0,0.83,False,True,False,True,False,True,False,2023_Q2,85e10db46d993c25,-0.5423,0.0,0.821,0.179,negative
14aezsj,Overheard an argument/discussion between two co-workers today...,"... and am curious to hear peoples thought on the pics that were brought up.

After reading about the incident at the library online, 'Bob' proceeded to loudly announce that Regina was the most dangerous, crime-ridden hellhole in all of Canada. 

'Jim' said that this was BS, and stated that if Bob didn't have the news or social media, he would think that Regina had hardly any crime at all, since Bob had never even actually seen or been a victim of any crime, and that this was true for the vast majority of Regina residents. Bob did have to concede that this was true in his case (outside of the time someone took the change from the console in his unlocked car), but that it didn't mean that the city wasn't - in general - a 'dangerous, crime-ridden hellhole'. 

Bob brought up our crime statistics, to which Jim replied that most of those crimes - particularly the serious ones - happen within certain areas and certain groups of people, but most people in Regina live their entire lives without being affected by them. Jim did concede that there as lot of crime that affected all neighbourhoods, but most of that was stuff like opportunistic theft or vandalism, nothing that warranted a dangerous reputation.

Tangentially, Jim then said that Bob spent too much time on Regina social media sites, and that was a bad thing to do because they were full of 'losers' who liked to shit on Regina to make themselves feel better about their own life situations, which would be awful no matter where they lived.

Bob took some offense to that, and things sorta devolved from there into subtle personal insults, but I thought it was an interesting conversation. 

I know I've seen a lot of people on here expressing Bob's viewpoint, but curious to know what people think about the Jim viewpoint. Is Regina really a dangerous place you feel unsafe in? Or do people make it out to be worse than it actually is for the average person?",1686866857.0,57,77,Discussion,0.92,/r/regina/comments/14aezsj/overheard_an_argumentdiscussion_between_two/,https://www.reddit.com/r/regina/comments/14aezsj/overheard_an_argumentdiscussion_between_two/,True,False,False,False,False,Regina,"Overheard an argument/discussion between two co-workers today... ... and am curious to hear peoples thought on the pics that were brought up.

After reading about the incident at the library online, 'Bob' proceeded to loudly announce that Regina was the most dangerous, crime-ridden hellhole in all of Canada. 

'Jim' said that this was BS, and stated that if Bob didn't have the news or social media, he would think that Regina had hardly any crime at all, since Bob had never even actually seen or been a victim of any crime, and that this was true for the vast majority of Regina residents. Bob did have to concede that this was true in his case (outside of the time someone took the change from the console in his unlocked car), but that it didn't mean that the city wasn't - in general - a 'dangerous, crime-ridden hellhole'. 

Bob brought up our crime statistics, to which Jim replied that most of those crimes - particularly the serious ones - happen within certain areas and certain groups of people, but most people in Regina live their entire lives without being affected by them. Jim did concede that there as lot of crime that affected all neighbourhoods, but most of that was stuff like opportunistic theft or vandalism, nothing that warranted a dangerous reputation.

Tangentially, Jim then said that Bob spent too much time on Regina social media sites, and that was a bad thing to do because they were full of 'losers' who liked to shit on Regina to make themselves feel better about their own life situations, which would be awful no matter where they lived.

Bob took some offense to that, and things sorta devolved from there into subtle personal insults, but I thought it was an interesting conversation. 

I know I've seen a lot of people on here expressing Bob's viewpoint, but curious to know what people think about the Jim viewpoint. Is Regina really a dangerous place you feel unsafe in? Or do people make it out to be worse than it actually is for the average person?",2023-06-15 22:07:37+00:00,2023,6,15,3,Thursday,24,22,summer,2022-2023_api_transition,overheard an argument discussion between two co workers today... ... and am curious to hear peoples thought on the pics that were brought up. after reading about the incident at the library online bob proceeded to loudly announce that regina was the most dangerous crime ridden hellhole in all of canada. jim said that this was bs and stated that if bob didn t have the news or social media he would think that regina had hardly any crime at all since bob had never even actually seen or been a victim of any crime and that this was true for the vast majority of regina residents. bob did have to concede that this was true in his case outside of the time someone took the change from the console in his unlocked car but that it didn t mean that the city wasn t in general a dangerous crime ridden hellhole . bob brought up our crime statistics to which jim replied that most of those crimes particularly the serious ones happen within certain areas and certain groups of people but most people in regina live their entire lives without being affected by them. jim did concede that there as lot of crime that affected all neighbourhoods but most of that was stuff like opportunistic theft or vandalism nothing that warranted a dangerous reputation. tangentially jim then said that bob spent too much time on regina social media sites and that was a bad thing to do because they were full of losers who liked to shit on regina to make themselves feel better about their own life situations which would be awful no matter where they lived. bob took some offense to that and things sorta devolved from there into subtle personal insults but i thought it was an interesting conversation. i know i ve seen a lot of people on here expressing bob s viewpoint but curious to know what people think about the jim viewpoint. is regina really a dangerous place you feel unsafe in? or do people make it out to be worse than it actually is for the average person?,1950,356,True,False,5,0,False,1.3275862068965518,0.07999999999999996,False,True,False,True,False,True,False,2023_Q2,5a9cc09f9f66f3d7,-0.993,0.07,0.756,0.175,negative
14mp5bz,A question for emergency workers,"With all the construction happening in the city, have you experienced major  issues getting to sites to render aid in emergencies?  Fires, accidents, sick people, crimes?",1688095941.0,0,9,Question,0.43,/r/regina/comments/14mp5bz/a_question_for_emergency_workers/,https://www.reddit.com/r/regina/comments/14mp5bz/a_question_for_emergency_workers/,True,False,False,False,False,Regina,"A question for emergency workers With all the construction happening in the city, have you experienced major  issues getting to sites to render aid in emergencies?  Fires, accidents, sick people, crimes?",2023-06-30 03:32:21+00:00,2023,6,30,4,Friday,26,3,summer,2022-2023_api_transition,a question for emergency workers with all the construction happening in the city have you experienced major issues getting to sites to render aid in emergencies? fires accidents sick people crimes?,197,31,True,False,1,0,False,9.0,0.5700000000000001,False,True,False,True,False,True,False,2023_Q2,ece9240510a46f26,-0.8205,0.0,0.766,0.234,negative
14mlyjg,The Regina police chief wants to force people with addictions into treatment — not everyone agrees | CBC News,,1688086620.0,58,112,News,0.9,/r/regina/comments/14mlyjg/the_regina_police_chief_wants_to_force_people/,https://www.cbc.ca/news/canada/saskatchewan/involuntary-treatment-saskatchewan-1.6892092,False,False,False,False,False,Regina,The Regina police chief wants to force people with addictions into treatment — not everyone agrees | CBC News ,2023-06-30 00:57:00+00:00,2023,6,30,4,Friday,26,0,summer,2022-2023_api_transition,the regina police chief wants to force people with addictions into treatment not everyone agrees cbc news,105,17,True,False,1,0,False,1.8983050847457628,0.09999999999999998,False,True,False,True,False,True,False,2023_Q2,768dd3bff210967d,-0.1511,0.0,0.91,0.09,negative
