id,title,selftext,created_utc,score,num_comments,link_flair_text,upvote_ratio,permalink,url,is_self,over_18,spoiler,stickied,locked,subreddit,full_text,created_date,year,month,day,day_of_week,day_name,week_of_year,hour,season,platform_period,cleaned_text,text_length,word_count,contains_crime_keywords,contains_weather_keywords,crime_keyword_count,weather_keyword_count,crime_and_weather,engagement_rate,controversy_score,is_2022,is_2023,pre_api_announcement,post_api_announcement,during_blackout,pre_api_changes,post_api_changes,quarter,author_hash,sentiment_compound,sentiment_positive,sentiment_neutral,sentiment_negative,sentiment_category
14dtyw7,"Snow-clearing plans could ‘trap’ Edmontonians with disabilities, advocate says",,1687216416.0,133,146,News,0.89,/r/Edmonton/comments/14dtyw7/snowclearing_plans_could_trap_edmontonians_with/,https://globalnews.ca/news/9779094/accessibility-snow-clearing-edmonton-budget-2023,False,False,False,False,False,Edmonton,"Snow-clearing plans could ‘trap’ Edmontonians with disabilities, advocate says ",2023-06-19 23:13:36+00:00,2023,6,19,0,Monday,25,23,summer,2022-2023_api_transition,snow clearing plans could trap edmontonians with disabilities advocate says,75,10,False,True,0,1,False,1.0895522388059702,0.10999999999999999,False,True,False,True,False,True,False,2023_Q2,c249fb765ba3eb04,-0.3182,0.0,0.796,0.204,negative
14b8o02,Edmonton snow-clearing to take longer this coming winter than last: report - Edmonton | Globalnews.ca,,1686951481.0,86,139,News,0.93,/r/Edmonton/comments/14b8o02/edmonton_snowclearing_to_take_longer_this_coming/,https://globalnews.ca/news/9774758/edmonton-snow-clearing-report-slower-service/,False,False,False,False,False,Edmonton,Edmonton snow-clearing to take longer this coming winter than last: report - Edmonton | Globalnews.ca ,2023-06-16 21:38:01+00:00,2023,6,16,4,Friday,24,21,summer,2022-2023_api_transition,edmonton snow clearing to take longer this coming winter than last report edmonton globalnews.ca,96,14,False,True,0,2,False,1.5977011494252873,0.06999999999999995,False,True,False,True,False,True,False,2023_Q2,c249fb765ba3eb04,0.0,0.0,1.0,0.0,neutral
141huq8,Edmonton just had its warmest May since records began. Mean temperature was 17.2°C.,,1685978270.0,77,33,General,0.91,/r/Edmonton/comments/141huq8/edmonton_just_had_its_warmest_may_since_records/,/r/EdmontonWxRecords/comments/141htkj/edmonton_just_had_its_warmest_may_since_records/,False,False,False,False,False,Edmonton,Edmonton just had its warmest May since records began. Mean temperature was 17.2°C. ,2023-06-05 15:17:50+00:00,2023,6,5,0,Monday,23,15,summer,2022-2023_api_transition,edmonton just had its warmest may since records began. mean temperature was . c.,80,14,False,True,0,2,False,0.4230769230769231,0.08999999999999997,False,True,False,True,False,True,False,2023_Q2,bdd9cecfabd99654,0.4019,0.172,0.828,0.0,positive
13x5uya,Lost Cat Northmount - Floof got out on Tuesday before the storm,,1685586684.0,31,1,Lost/Found Pets,0.88,/r/Edmonton/comments/13x5uya/lost_cat_northmount_floof_got_out_on_tuesday/,https://www.pawboost.com/p/9131558,False,False,False,False,False,Edmonton,Lost Cat Northmount - Floof got out on Tuesday before the storm ,2023-06-01 02:31:24+00:00,2023,6,1,3,Thursday,22,2,summer,2022-2023_api_transition,lost cat northmount floof got out on tuesday before the storm,61,11,False,True,0,1,False,0.03125,0.12,False,True,False,True,False,True,False,2023_Q2,447e083ccfd9324d,-0.3182,0.0,0.813,0.187,negative
14i0m2t,Edmonton safety,"recently, every time I’m on whyte or downtown, especially as a women I feel extremely unsafe around some of the people now. the amount of HARD drugs I see openly being used is quite alarming. one night when I was working I gave a cigarette to two homeless people and they pulled out a meth pipe on our patio. has anyone else noticed this, and does anyone know more about the type(s) of drugs or issues are happening within Edmonton right now?

edit: don’t know why this gained so many comments, i see there is a lot of strong opinions, ideas, beliefs, and factors behind this. but let’s all play nice in the comments :) I was simply asking if anyone knew the major drug that was going around. that is all, have a nice day.

second edit: I also gave them a cigarette bc they looked relatively normal, until I saw the meth pipe 😐",1687633008.0,172,281,Discussion,0.82,/r/Edmonton/comments/14i0m2t/edmonton_safety/,https://www.reddit.com/r/Edmonton/comments/14i0m2t/edmonton_safety/,True,False,False,False,False,Edmonton,"Edmonton safety recently, every time I’m on whyte or downtown, especially as a women I feel extremely unsafe around some of the people now. the amount of HARD drugs I see openly being used is quite alarming. one night when I was working I gave a cigarette to two homeless people and they pulled out a meth pipe on our patio. has anyone else noticed this, and does anyone know more about the type(s) of drugs or issues are happening within Edmonton right now?

edit: don’t know why this gained so many comments, i see there is a lot of strong opinions, ideas, beliefs, and factors behind this. but let’s all play nice in the comments :) I was simply asking if anyone knew the major drug that was going around. that is all, have a nice day.

second edit: I also gave them a cigarette bc they looked relatively normal, until I saw the meth pipe 😐",2023-06-24 18:56:48+00:00,2023,6,24,5,Saturday,25,18,summer,2022-2023_api_transition,edmonton safety recently every time i m on whyte or downtown especially as a women i feel extremely unsafe around some of the people now. the amount of hard drugs i see openly being used is quite alarming. one night when i was working i gave a cigarette to two homeless people and they pulled out a meth pipe on our patio. has anyone else noticed this and does anyone know more about the type s of drugs or issues are happening within edmonton right now? edit don t know why this gained so many comments i see there is a lot of strong opinions ideas beliefs and factors behind this. but let s all play nice in the comments i was simply asking if anyone knew the major drug that was going around. that is all have a nice day. second edit i also gave them a cigarette bc they looked relatively normal until i saw the meth pipe,824,160,True,False,1,0,False,1.6242774566473988,0.18000000000000005,False,True,False,True,False,True,False,2023_Q2,38bddecc8f433ffe,0.9319,0.097,0.888,0.015,positive
13ztlow,Dangerous Individual Reported near Edmonton Convention Centre wielding knifes,"I was enjoying the Africana Festival going on today.  And decided to check out the other attractions happening for the Downtown Spark Festival also happening this weekend.  Started walking my way in the direction to the Edmonton Convention Centre and was LUCKILY told by a mother & young daughter duo that ""I probably shouldn't go down that way"" because there's a man that was just on their bus wielding knifes.  Then another young man about junior high age was running in the opposite direction as well and stopped to tell me what his description was ""Old man slow so can't run and wielding knifes."". Told me him and his friends were just on the bus talking about their day, and this ruffian interrupted saying they're all just guests in this country and if they don't stop talking he'll stab everyone here.

I decided to stay in the library until I could take the soonest public transit home.

UPDATE: The Perpetrator was caught with a group of 6 Policemen watching over him with him on the ground.  Confirmed by 2 Policemen who were across the street that I asked.  A block away from the Africana Festival just past the downtown Library.

Here's the best picture I got of him
[Perpetrator ](https://ibb.co/NjRPZV2)",1685834984.0,172,85,General,0.92,/r/Edmonton/comments/13ztlow/dangerous_individual_reported_near_edmonton/,https://www.reddit.com/r/Edmonton/comments/13ztlow/dangerous_individual_reported_near_edmonton/,True,False,False,False,False,Edmonton,"Dangerous Individual Reported near Edmonton Convention Centre wielding knifes I was enjoying the Africana Festival going on today.  And decided to check out the other attractions happening for the Downtown Spark Festival also happening this weekend.  Started walking my way in the direction to the Edmonton Convention Centre and was LUCKILY told by a mother & young daughter duo that ""I probably shouldn't go down that way"" because there's a man that was just on their bus wielding knifes.  Then another young man about junior high age was running in the opposite direction as well and stopped to tell me what his description was ""Old man slow so can't run and wielding knifes."". Told me him and his friends were just on the bus talking about their day, and this ruffian interrupted saying they're all just guests in this country and if they don't stop talking he'll stab everyone here.

I decided to stay in the library until I could take the soonest public transit home.

UPDATE: The Perpetrator was caught with a group of 6 Policemen watching over him with him on the ground.  Confirmed by 2 Policemen who were across the street that I asked.  A block away from the Africana Festival just past the downtown Library.

Here's the best picture I got of him
[Perpetrator ](https://ibb.co/NjRPZV2)",2023-06-03 23:29:44+00:00,2023,6,3,5,Saturday,22,23,summer,2022-2023_api_transition,dangerous individual reported near edmonton convention centre wielding knifes i was enjoying the africana festival going on today. and decided to check out the other attractions happening for the downtown spark festival also happening this weekend. started walking my way in the direction to the edmonton convention centre and was luckily told by a mother young daughter duo that i probably shouldn t go down that way because there s a man that was just on their bus wielding knifes. then another young man about junior high age was running in the opposite direction as well and stopped to tell me what his description was old man slow so can t run and wielding knifes. . told me him and his friends were just on the bus talking about their day and this ruffian interrupted saying they re all just guests in this country and if they don t stop talking he ll stab everyone here. i decided to stay in the library until i could take the soonest public transit home. update the perpetrator was caught with a group of policemen watching over him with him on the ground. confirmed by ADDRESS that i asked. a block away from the africana festival just past the downtown library. here s the best picture i got of him perpetrator,1220,218,True,False,2,0,False,0.4913294797687861,0.07999999999999996,False,True,False,True,False,True,False,2023_Q2,dbf04961771d7f7f,0.836,0.12,0.791,0.089,positive
13zpvib,"I heard downtown was dangerous, but nothing could've prepared me.",,1685826954.0,573,17,Photo/Video,0.98,/r/Edmonton/comments/13zpvib/i_heard_downtown_was_dangerous_but_nothing/,https://i.redd.it/jsdp2bb2dv3b1.jpg,False,False,False,False,False,Edmonton,"I heard downtown was dangerous, but nothing could've prepared me. ",2023-06-03 21:15:54+00:00,2023,6,3,5,Saturday,22,21,summer,2022-2023_api_transition,i heard downtown was dangerous but nothing could ve prepared me.,64,11,True,False,1,0,False,0.029616724738675958,0.020000000000000018,False,True,False,True,False,True,False,2023_Q2,eac6abdf61a8a2d2,-0.4676,0.0,0.69,0.31,negative
14630kg,'Consequences can be dangerous': Trailer hitch alert from Edmonton police,,1686410671.0,37,7,News,0.91,/r/Edmonton/comments/14630kg/consequences_can_be_dangerous_trailer_hitch_alert/,https://edmontonjournal.com/news/local-news/consequences-can-be-dangerous-trailer-hitch-alert-from-edmonton-police,False,False,False,False,False,Edmonton,'Consequences can be dangerous': Trailer hitch alert from Edmonton police ,2023-06-10 15:24:31+00:00,2023,6,10,5,Saturday,23,15,summer,2022-2023_api_transition,consequences can be dangerous trailer hitch alert from edmonton police,70,10,True,False,2,0,False,0.18421052631578946,0.08999999999999997,False,True,False,True,False,True,False,2023_Q2,c249fb765ba3eb04,-0.2263,0.165,0.602,0.233,negative
14lq1g7,"Edmonton romance fraudster loses bid to toss guilty pleas, will be assessed for rare dangerous offender application",,1687998536.0,21,5,News,0.96,/r/Edmonton/comments/14lq1g7/edmonton_romance_fraudster_loses_bid_to_toss/,https://edmontonjournal.com/news/crime/jeffrey-kent-accused-romance-fraudster-loses-bid-to-withdraw-plea,False,False,False,False,False,Edmonton,"Edmonton romance fraudster loses bid to toss guilty pleas, will be assessed for rare dangerous offender application ",2023-06-29 00:28:56+00:00,2023,6,29,3,Thursday,26,0,summer,2022-2023_api_transition,edmonton romance fraudster loses bid to toss guilty pleas will be assessed for rare dangerous offender application,114,17,True,False,2,0,False,0.22727272727272727,0.040000000000000036,False,True,False,True,False,True,False,2023_Q2,c249fb765ba3eb04,-0.8625,0.125,0.382,0.493,negative
14b16ep,Where can Edmontonians list lost/stolen/found items?,"Where can the Edmonton community go to list lost/stolen/found items?  Is there a Facebook group dedicated to it?

The police don’t have the resources to act on small theft but the owner of a stolen item might like the closure of knowing what happened.

Are we able to add the recommendation on the Rules page of r/Edmonton?",1686932627.0,0,4,Question,0.5,/r/Edmonton/comments/14b16ep/where_can_edmontonians_list_loststolenfound_items/,https://www.reddit.com/r/Edmonton/comments/14b16ep/where_can_edmontonians_list_loststolenfound_items/,True,False,False,False,False,Edmonton,"Where can Edmontonians list lost/stolen/found items? Where can the Edmonton community go to list lost/stolen/found items?  Is there a Facebook group dedicated to it?

The police don’t have the resources to act on small theft but the owner of a stolen item might like the closure of knowing what happened.

Are we able to add the recommendation on the Rules page of r/Edmonton?",2023-06-16 16:23:47+00:00,2023,6,16,4,Friday,24,16,summer,2022-2023_api_transition,where can edmontonians list lost stolen found items? where can the edmonton community go to list lost stolen found items? is there a facebook group dedicated to it? the police don t have the resources to act on small theft but the owner of a stolen item might like the closure of knowing what happened. are we able to add the recommendation on the rules page of r edmonton?,373,69,True,False,4,0,False,4.0,0.5,False,True,False,True,False,True,False,2023_Q2,3bd1f35ccb6e2850,-0.7587,0.066,0.775,0.159,negative
14f5z87,61-year-old charged after allegedly filming teen in changing room: Saskatoon Police,,1687349343.0,77,51,None,0.95,/r/saskatchewan/comments/14f5z87/61yearold_charged_after_allegedly_filming_teen_in/,https://saskatoon.ctvnews.ca/61-year-old-charged-after-allegedly-filming-teen-in-changing-room-saskatoon-police-1.6449081,False,False,False,False,False,saskatchewan,61-year-old charged after allegedly filming teen in changing room: Saskatoon Police ,2023-06-21 12:09:03+00:00,2023,6,21,2,Wednesday,25,12,summer,2022-2023_api_transition,year old charged after allegedly filming teen in changing room saskatoon police,79,12,True,False,1,0,False,0.6538461538461539,0.050000000000000044,False,True,False,True,False,True,False,2023_Q2,c52f4df34252155f,-0.2023,0.0,0.859,0.141,negative
14k05bs,Regina police chief stands firm: Camp at city hall 'exploiting' homelessness,"Honestly, probably the best example of healthy exploitation, if he truly believes what he says.",1687830838.0,28,59,None,0.73,/r/saskatchewan/comments/14k05bs/regina_police_chief_stands_firm_camp_at_city_hall/,https://regina.ctvnews.ca/regina-police-chief-stands-firm-camp-at-city-hall-exploiting-homelessness-1.6456176,False,False,False,False,False,saskatchewan,"Regina police chief stands firm: Camp at city hall 'exploiting' homelessness Honestly, probably the best example of healthy exploitation, if he truly believes what he says.",2023-06-27 01:53:58+00:00,2023,6,27,1,Tuesday,26,1,summer,2022-2023_api_transition,regina police chief stands firm camp at city hall exploiting homelessness honestly probably the best example of healthy exploitation if he truly believes what he says.,167,26,True,False,1,0,False,2.0344827586206895,0.27,False,True,False,True,False,True,False,2023_Q2,b25256fdbb732f50,0.872,0.349,0.572,0.079,positive
13xq4dg,Basic auto insurance for theft,I'm struggling to find any clear answers to what seems to be a simple question - does the basic SGI auto insurance that comes with registration cover theft (of the vehicle) and vanadlism? On the website it seems to only cover collisions but I can't find any references to additional cover for theft either.,1685646012.0,4,7,None,0.83,/r/saskatchewan/comments/13xq4dg/basic_auto_insurance_for_theft/,https://www.reddit.com/r/saskatchewan/comments/13xq4dg/basic_auto_insurance_for_theft/,True,False,False,False,False,saskatchewan,Basic auto insurance for theft I'm struggling to find any clear answers to what seems to be a simple question - does the basic SGI auto insurance that comes with registration cover theft (of the vehicle) and vanadlism? On the website it seems to only cover collisions but I can't find any references to additional cover for theft either.,2023-06-01 19:00:12+00:00,2023,6,1,3,Thursday,22,19,summer,2022-2023_api_transition,basic auto insurance for theft i m struggling to find any clear answers to what seems to be a simple question does the basic sgi auto insurance that comes with registration cover theft of the vehicle and vanadlism? on the website it seems to only cover collisions but i can t find any references to additional cover for theft either.,333,60,True,False,1,0,False,1.4,0.17000000000000004,False,True,False,True,False,True,False,2023_Q2,1300a504826e4ca4,-0.1655,0.029,0.916,0.055,negative
14aetb0,Former principal of Saskatoon private Christian school faces 11 charges of assault with a weapon,,1686866443.0,131,18,None,0.96,/r/saskatchewan/comments/14aetb0/former_principal_of_saskatoon_private_christian/,https://www.cbc.ca/news/canada/saskatoon/legacy-christian-academy-principal-court-1.6877922,False,False,False,False,False,saskatchewan,Former principal of Saskatoon private Christian school faces 11 charges of assault with a weapon ,2023-06-15 22:00:43+00:00,2023,6,15,3,Thursday,24,22,summer,2022-2023_api_transition,former principal of saskatoon private christian school faces charges of assault with a weapon,93,14,True,False,1,0,False,0.13636363636363635,0.040000000000000036,False,True,False,True,False,True,False,2023_Q2,c52f4df34252155f,-0.7964,0.0,0.576,0.424,negative
14glsv2,Another Sask. private Christian school official charged with assault,,1687485603.0,126,17,None,0.96,/r/saskatchewan/comments/14glsv2/another_sask_private_christian_school_official/,https://www.cbc.ca/news/canada/saskatoon/another-private-christian-school-official-charged-assault-1.6885932,False,False,False,False,False,saskatchewan,Another Sask. private Christian school official charged with assault ,2023-06-23 02:00:03+00:00,2023,6,23,4,Friday,25,2,summer,2022-2023_api_transition,another sask. private christian school official charged with assault,68,9,True,False,1,0,False,0.13385826771653545,0.040000000000000036,False,True,False,True,False,True,False,2023_Q2,c52f4df34252155f,-0.6808,0.0,0.556,0.444,negative
14jvdcu,Moving from BC to Southern SK,"I've lived in costal BC my whole life, never known anything else, but a work opportunity has come up were my wife and I will be spending at least the next few years in Saskatchewan.

My main question is weather, and if you all think my 2017 Toyota Corolla is going to be sufficient as a daily drive? Specifically wondering about winters and the amount of snow I maybe working around.

I've driven in ""BC"" snow, but never anything more then 10-20cm, any more and everything shuts down.

Should I be considering trading in for something with more ground clearance or am I misinformed?

EDIT: Specifically moving to south west SK, near Shaunavon.",1687818363.0,29,107,None,0.78,/r/saskatchewan/comments/14jvdcu/moving_from_bc_to_southern_sk/,https://www.reddit.com/r/saskatchewan/comments/14jvdcu/moving_from_bc_to_southern_sk/,True,False,False,False,False,saskatchewan,"Moving from BC to Southern SK I've lived in costal BC my whole life, never known anything else, but a work opportunity has come up were my wife and I will be spending at least the next few years in Saskatchewan.

My main question is weather, and if you all think my 2017 Toyota Corolla is going to be sufficient as a daily drive? Specifically wondering about winters and the amount of snow I maybe working around.

I've driven in ""BC"" snow, but never anything more then 10-20cm, any more and everything shuts down.

Should I be considering trading in for something with more ground clearance or am I misinformed?

EDIT: Specifically moving to south west SK, near Shaunavon.",2023-06-26 22:26:03+00:00,2023,6,26,0,Monday,26,22,summer,2022-2023_api_transition,moving from bc to southern sk i ve lived in costal bc my whole life never known anything else but a work opportunity has come up were my wife and i will be spending at least the next few years in saskatchewan. my main question is weather and if you all think my ADDRESS ? specifically wondering about winters and the amount of snow i maybe working around. i ve driven in bc snow but never anything more then cm any more and everything shuts down. should i be considering trading in for something with more ground clearance or am i misinformed? edit specifically moving to south west sk near shaunavon.,601,111,False,True,0,3,False,3.566666666666667,0.21999999999999997,False,True,False,True,False,True,False,2023_Q2,80d54a230a78a2ca,0.168,0.035,0.936,0.029,positive
144sbv0,What's it like being a farmer in Saskatchewan,"In Ontario there is alot of farm land but nothing like Saskatchewan,  in Southern Ontario you are no more than 1 to 2 hours drive away from a big town basically anywhere there is farmland but from checking out Google maps in Saskatchewan there are these little towns but some of them seem really isolated and far away from the main city's.  So what's it like out there ?  How's day to day life, do you drive far to get something you want at store or you just order alot stuff online.   How's the weather seems like there alot of farmers in the far north like north Saskatoon?",1686276537.0,22,36,None,0.9,/r/saskatchewan/comments/144sbv0/whats_it_like_being_a_farmer_in_saskatchewan/,https://www.reddit.com/r/saskatchewan/comments/144sbv0/whats_it_like_being_a_farmer_in_saskatchewan/,True,False,False,False,False,saskatchewan,"What's it like being a farmer in Saskatchewan In Ontario there is alot of farm land but nothing like Saskatchewan,  in Southern Ontario you are no more than 1 to 2 hours drive away from a big town basically anywhere there is farmland but from checking out Google maps in Saskatchewan there are these little towns but some of them seem really isolated and far away from the main city's.  So what's it like out there ?  How's day to day life, do you drive far to get something you want at store or you just order alot stuff online.   How's the weather seems like there alot of farmers in the far north like north Saskatoon?",2023-06-09 02:08:57+00:00,2023,6,9,4,Friday,23,2,summer,2022-2023_api_transition,what s it like being a farmer in saskatchewan in ontario there is alot of farm land but nothing like saskatchewan in southern ontario you are no more than ADDRESS away from a big town basically anywhere there is farmland but from checking out google maps in saskatchewan there are these little towns but some of them seem really isolated and far away from the main city s. so what s it like out there ? how s day to day life do you drive far to get something you want at store or you just order alot stuff online. how s the weather seems like there alot of farmers in the far north like north saskatoon?,603,117,False,True,0,1,False,1.565217391304348,0.09999999999999998,False,True,False,True,False,True,False,2023_Q2,495a28b42e1745bd,0.5355,0.101,0.831,0.068,positive
