id,title,selftext,created_utc,score,num_comments,link_flair_text,upvote_ratio,permalink,url,is_self,over_18,spoiler,stickied,locked,subreddit,full_text,created_date,year,month,day,day_of_week,day_name,week_of_year,hour,season,platform_period,cleaned_text,text_length,word_count,contains_crime_keywords,contains_weather_keywords,crime_keyword_count,weather_keyword_count,crime_and_weather,engagement_rate,controversy_score,is_2022,is_2023,pre_api_announcement,post_api_announcement,during_blackout,pre_api_changes,post_api_changes,quarter,author_hash,sentiment_compound,sentiment_positive,sentiment_neutral,sentiment_negative,sentiment_category
ux6bun,Frost?,it is it safe to plant flowers and Veg garden?  Kind of scared to plant if there is still a risk of the killing frost?,1653442461.0,5,13,General,0.86,/r/Manitoba/comments/ux6bun/frost/,https://www.reddit.com/r/Manitoba/comments/ux6bun/frost/,True,False,False,False,False,manitoba,Frost? it is it safe to plant flowers and Veg garden?  Kind of scared to plant if there is still a risk of the killing frost?,2022-05-25 01:34:21+00:00,2022,5,25,2,Wednesday,21,1,spring,2022-2023_api_transition,frost? it is it safe to plant flowers and veg garden? kind of scared to plant if there is still a risk of the killing frost?,124,26,False,True,0,1,False,2.1666666666666665,0.14,True,False,True,False,False,True,False,2022_Q2,f5683e22edf385a1,-0.8091,0.083,0.626,0.291,negative
uvys58,Is it safe to swim in any of the rivers near the town of Birch River?,"Hello

I am 100% blind, but I don't mind a day out when it's hot to go swimming.

In a few weeks I'm going to be in the Birch River area with a couple people that are moving here from the Ukraine.  (I'm not from Ukraine myself but they are).

I mentioned going swimming at one of the rivers near Birch River, such as Steeprock or Bell, but the one girl from Ukraine, Bogdana is extremely skeptical, and even says it's not good for a blind guy to swim in the rivers without her hand on me, or even at all. 

Does anyone around the area agree with Bogdana that it isn't safe for a blind guy to swim in the rivers near the town of Birch River?

Are there any safe rivers to swim in in the area? 

I love the feeling of the current pushing against my back when I sit on a rock hence why I like going places with moderate currents, but not too strong. 

thanks.",1653307926.0,19,27,Question,0.93,/r/Manitoba/comments/uvys58/is_it_safe_to_swim_in_any_of_the_rivers_near_the/,https://www.reddit.com/r/Manitoba/comments/uvys58/is_it_safe_to_swim_in_any_of_the_rivers_near_the/,True,False,False,False,False,manitoba,"Is it safe to swim in any of the rivers near the town of Birch River? Hello

I am 100% blind, but I don't mind a day out when it's hot to go swimming.

In a few weeks I'm going to be in the Birch River area with a couple people that are moving here from the Ukraine.  (I'm not from Ukraine myself but they are).

I mentioned going swimming at one of the rivers near Birch River, such as Steeprock or Bell, but the one girl from Ukraine, Bogdana is extremely skeptical, and even says it's not good for a blind guy to swim in the rivers without her hand on me, or even at all. 

Does anyone around the area agree with Bogdana that it isn't safe for a blind guy to swim in the rivers near the town of Birch River?

Are there any safe rivers to swim in in the area? 

I love the feeling of the current pushing against my back when I sit on a rock hence why I like going places with moderate currents, but not too strong. 

thanks.",2022-05-23 12:12:06+00:00,2022,5,23,0,Monday,21,12,spring,2022-2023_api_transition,is it safe to swim in any of the rivers near the town of birch river? hello i am blind but i don t mind a day out when it s hot to go swimming. in a few weeks i m going to be in the birch river area with a couple people that are moving here from the ukraine. i m not from ukraine myself but they are . i mentioned going swimming at one of the rivers near birch river such as steeprock or bell but the one girl from ukraine bogdana is extremely skeptical and even says it s not good for a blind guy to swim in the rivers without her hand on me or even at all. does anyone around the area agree with bogdana that it isn t safe for a blind guy to swim in the rivers near the town of birch river? are there any safe rivers to swim in in the area? i love the feeling of the current pushing against my back when i sit on a rock hence why i like going places with moderate currents but not too strong. thanks.,902,192,False,True,0,2,False,1.35,0.06999999999999995,True,False,True,False,False,True,False,2022_Q2,311e788b31f92dfe,-0.3383,0.105,0.78,0.115,negative
v1vyf1,Thousands of Pigs Likely Suffocated from Poison Gas During Storm,,1654019408.0,0,6,News,0.29,/r/Manitoba/comments/v1vyf1/thousands_of_pigs_likely_suffocated_from_poison/,https://animaljustice.ca/blog/pigs-die-hylife,False,False,False,False,False,manitoba,Thousands of Pigs Likely Suffocated from Poison Gas During Storm ,2022-05-31 17:50:08+00:00,2022,5,31,1,Tuesday,22,17,spring,2022-2023_api_transition,thousands of pigs likely suffocated from poison gas during storm,64,10,False,True,0,1,False,6.0,0.71,True,False,True,False,False,True,False,2022_Q2,23ff125f03262fd7,-0.5423,0.0,0.72,0.28,negative
ux7klk,Ever played a game called Junebug?,"Hi, when I was young I remember playing this game with some other kids but I don't remember the rules. I remember having a blast, though, and I want to play with my kids. Posting here in case it's a regional thing.

As far as I remember, everyone gathers around someone who kicks the ball into the air and says someone's name. That person has to grab it while everyone else runs. The person yells stop when they catch the ball, everyone freezes in place, and then the person has to throw it and hit someone. Then repeat.

Anyone else remember?",1653446584.0,13,8,Question,1.0,/r/Manitoba/comments/ux7klk/ever_played_a_game_called_junebug/,https://www.reddit.com/r/Manitoba/comments/ux7klk/ever_played_a_game_called_junebug/,True,False,False,False,False,manitoba,"Ever played a game called Junebug? Hi, when I was young I remember playing this game with some other kids but I don't remember the rules. I remember having a blast, though, and I want to play with my kids. Posting here in case it's a regional thing.

As far as I remember, everyone gathers around someone who kicks the ball into the air and says someone's name. That person has to grab it while everyone else runs. The person yells stop when they catch the ball, everyone freezes in place, and then the person has to throw it and hit someone. Then repeat.

Anyone else remember?",2022-05-25 02:43:04+00:00,2022,5,25,2,Wednesday,21,2,spring,2022-2023_api_transition,ever played a game called junebug? hi when i was young i remember playing this game with some other kids but i don t remember the rules. i remember having a blast though and i want to play with my kids. posting here in case it s a regional thing. as far as i remember everyone gathers around someone who kicks the ball into the air and says someone s name. that person has to grab it while everyone else runs. the person yells stop when they catch the ball everyone freezes in place and then the person has to throw it and hit someone. then repeat. anyone else remember?,570,110,False,True,0,1,False,0.5714285714285714,0.0,True,False,True,False,False,True,False,2022_Q2,866b7744cec435de,0.4696,0.069,0.897,0.034,positive
v1vn62,Deadline arrives for Calgary Police Service members to remove 'thin blue line' patch,,1654018518.0,413,164,General,0.94,/r/alberta/comments/v1vn62/deadline_arrives_for_calgary_police_service/,https://calgary.ctvnews.ca/deadline-arrives-for-calgary-police-service-members-to-remove-thin-blue-line-patch-1.5925596,False,False,False,False,False,alberta,Deadline arrives for Calgary Police Service members to remove 'thin blue line' patch ,2022-05-31 17:35:18+00:00,2022,5,31,1,Tuesday,22,17,spring,2022-2023_api_transition,deadline arrives for calgary police service members to remove thin blue line patch,82,13,True,False,1,0,False,0.3961352657004831,0.06000000000000005,True,False,True,False,False,True,False,2022_Q2,bdc92df524a87461,0.0,0.0,1.0,0.0,neutral
uz3zj2,Which government agency to contact about wage theft?,"My son quit a job as a driver for an Edmonton company a month ago, his previous employer paid him for 11 hours instead of his full 80 hours that he had worked there for his final pay period. Texts to his boss started out with “I’ll look into it” but after that one reply he’s been ghosted. 
Which agency should he be talking to that will get ahold of his former boss and demand payment?",1653674455.0,24,9,Question,0.85,/r/alberta/comments/uz3zj2/which_government_agency_to_contact_about_wage/,https://www.reddit.com/r/alberta/comments/uz3zj2/which_government_agency_to_contact_about_wage/,True,False,False,False,False,alberta,"Which government agency to contact about wage theft? My son quit a job as a driver for an Edmonton company a month ago, his previous employer paid him for 11 hours instead of his full 80 hours that he had worked there for his final pay period. Texts to his boss started out with “I’ll look into it” but after that one reply he’s been ghosted. 
Which agency should he be talking to that will get ahold of his former boss and demand payment?",2022-05-27 18:00:55+00:00,2022,5,27,4,Friday,21,18,spring,2022-2023_api_transition,which government agency to contact about wage theft? my son quit a job as a driver for an edmonton company a month ago his previous employer paid him for hours instead of his full hours that he had worked there for his final pay period. texts to his boss started out with i ll look into it but after that one reply he s been ghosted. which agency should he be talking to that will get ahold of his former boss and demand payment?,429,84,True,False,1,0,False,0.36,0.15000000000000002,True,False,True,False,False,True,False,2022_Q2,53a6516aa6edf34d,-0.3204,0.0,0.961,0.039,negative
uu3m7w,Edmonton court hears accused murderer confess to RCMP in shooting deaths of Métis hunters,,1653068919.0,73,115,News,0.97,/r/alberta/comments/uu3m7w/edmonton_court_hears_accused_murderer_confess_to/,https://www.cbc.ca/news/canada/edmonton/edmonton-court-hears-accused-murderer-confess-to-rcmp-in-shooting-deaths-of-m%C3%A9tis-hunters-1.6460185,False,False,False,False,False,alberta,Edmonton court hears accused murderer confess to RCMP in shooting deaths of Métis hunters ,2022-05-20 17:48:39+00:00,2022,5,20,4,Friday,20,17,spring,2022-2023_api_transition,edmonton court hears accused murderer confess to rcmp in shooting deaths of m tis hunters,89,15,True,False,3,0,False,1.554054054054054,0.030000000000000027,True,False,True,False,False,True,False,2022_Q2,1f88a83ede157dab,-0.7783,0.0,0.657,0.343,negative
uocbeb,Former Leduc fire chief named in lawsuit as more Leduc employees make sexual assault allegations - Edmonton | Globalnews.ca,,1652392508.0,54,11,Alberta Politics,0.97,/r/alberta/comments/uocbeb/former_leduc_fire_chief_named_in_lawsuit_as_more/,https://globalnews.ca/news/8828622/leduc-fire-chief-named-lawsuit/,False,False,False,False,False,alberta,Former Leduc fire chief named in lawsuit as more Leduc employees make sexual assault allegations - Edmonton | Globalnews.ca ,2022-05-12 21:55:08+00:00,2022,5,12,3,Thursday,19,21,spring,2022-2023_api_transition,former leduc fire chief named in lawsuit as more leduc employees make sexual assault allegations edmonton globalnews.ca,119,17,True,False,1,0,False,0.2,0.030000000000000027,True,False,True,False,False,True,False,2022_Q2,3b283961953a3725,-0.7964,0.0,0.633,0.367,negative
ukjqnt,‘Significant’ number of firearms stolen in southern Alberta gun club break-in: RCMP,,1651949402.0,101,186,News,0.94,/r/alberta/comments/ukjqnt/significant_number_of_firearms_stolen_in_southern/,https://globalnews.ca/news/8817340/firearms-stolen-southern-alberta-gun-club/,False,False,False,False,False,alberta,‘Significant’ number of firearms stolen in southern Alberta gun club break-in: RCMP ,2022-05-07 18:50:02+00:00,2022,5,7,5,Saturday,18,18,spring,2022-2023_api_transition,significant number of firearms stolen in southern alberta gun club break in rcmp,80,13,True,False,4,0,False,1.8235294117647058,0.06000000000000005,True,False,True,False,False,True,False,2022_Q2,d5edc9b220904c37,-0.5423,0.175,0.508,0.316,negative
uwf3re,8 Straight Days out of service - Cold Lake,,1653354273.0,74,31,News,0.95,/r/alberta/comments/uwf3re/8_straight_days_out_of_service_cold_lake/,https://twitter.com/HSAAlbertaEMS/status/1528875074840846336?t=klWNmqmSIsSpD0FmnzZa0Q&s=19,False,False,False,False,False,alberta,8 Straight Days out of service - Cold Lake ,2022-05-24 01:04:33+00:00,2022,5,24,1,Tuesday,21,1,spring,2022-2023_api_transition,straight days out of service cold lake,38,7,False,True,0,1,False,0.41333333333333333,0.050000000000000044,True,False,True,False,False,True,False,2022_Q2,3b283961953a3725,0.2263,0.241,0.759,0.0,positive
ut5wgi,Jason Kenney finally delivers best summer ever,,1652974003.0,1027,83,Satire,0.96,/r/alberta/comments/ut5wgi/jason_kenney_finally_delivers_best_summer_ever/,https://www.thebeaverton.com/2022/05/jason-kenney-finally-delivers-best-summer-ever/,False,False,False,False,False,alberta,Jason Kenney finally delivers best summer ever ,2022-05-19 15:26:43+00:00,2022,5,19,3,Thursday,20,15,spring,2022-2023_api_transition,jason kenney finally delivers best summer ever,46,7,False,True,0,1,False,0.08073929961089495,0.040000000000000036,True,False,True,False,False,True,False,2022_Q2,c781cce746ee4b84,0.6369,0.412,0.588,0.0,positive
v0suei,Red Rock Canyon after a fresh Snow - Waterton National Park - Alberta,,1653887544.0,570,10,Local Photography,0.99,/r/alberta/comments/v0suei/red_rock_canyon_after_a_fresh_snow_waterton/,https://i.redd.it/h52du13arj291.jpg,False,False,False,False,False,alberta,Red Rock Canyon after a fresh Snow - Waterton National Park - Alberta ,2022-05-30 05:12:24+00:00,2022,5,30,0,Monday,22,5,spring,2022-2023_api_transition,red rock canyon after a fresh snow waterton national park alberta,65,11,False,True,0,1,False,0.017513134851138354,0.010000000000000009,True,False,True,False,False,True,False,2022_Q2,9c77eaa1cebd0cd3,0.3182,0.187,0.813,0.0,positive
um0054,First day in Alberta and it snowed ☺️❄️ I don’t get to see this at home.,,1652126843.0,99,11,Explore Alberta,0.92,/r/alberta/comments/um0054/first_day_in_alberta_and_it_snowed_i_dont_get_to/,https://www.reddit.com/gallery/um0054,False,False,False,False,False,alberta,First day in Alberta and it snowed ☺️❄️ I don’t get to see this at home. ,2022-05-09 20:07:23+00:00,2022,5,9,0,Monday,19,20,spring,2022-2023_api_transition,first day in alberta and it snowed i don t get to see this at home.,67,16,False,True,0,1,False,0.11,0.07999999999999996,True,False,True,False,False,True,False,2022_Q2,47b8d0f061ade64a,0.0,0.0,1.0,0.0,neutral
ulwhnh,Snow in Calgary makes it look like winter has hit the city all over again,,1652117344.0,7,5,News,0.61,/r/alberta/comments/ulwhnh/snow_in_calgary_makes_it_look_like_winter_has_hit/,https://dailyhive.com/vancouver/calgary-spring-snow-may,False,False,False,False,False,alberta,Snow in Calgary makes it look like winter has hit the city all over again ,2022-05-09 17:29:04+00:00,2022,5,9,0,Monday,19,17,spring,2022-2023_api_transition,snow in calgary makes it look like winter has hit the city all over again,73,15,False,True,0,2,False,0.625,0.39,True,False,True,False,False,True,False,2022_Q2,7853603950226e98,0.3612,0.152,0.848,0.0,positive
