id,title,selftext,created_utc,score,num_comments,link_flair_text,upvote_ratio,permalink,url,is_self,over_18,spoiler,stickied,locked,subreddit,full_text,created_date,year,month,day,day_of_week,day_name,week_of_year,hour,season,platform_period,cleaned_text,text_length,word_count,contains_crime_keywords,contains_weather_keywords,crime_keyword_count,weather_keyword_count,crime_and_weather,engagement_rate,controversy_score,is_2022,is_2023,pre_api_announcement,post_api_announcement,during_blackout,pre_api_changes,post_api_changes,quarter,author_hash,sentiment_compound,sentiment_positive,sentiment_neutral,sentiment_negative,sentiment_category
u461rm,What jobs are in demand in SK?,"I am 27f and I run a small drywall taping business in ON. I am considering moving to SK next year and am wondering what career I could pursue that would make me most of an asset to the economy and set me up for a good living. 

From what I understand, the trades are not as hot there as they are here, is that correct? Would I be able to make a decent living as a drywall taper? Is there enough of a residential reno market that I could be self employed again?

What other major industries need workers? I'm willing to acquire schooling or training, and willing to go into almost anything, but I would like to know I will have a job afterwards!

Thanks in advance.",1650022537.0,18,48,None,0.83,/r/saskatchewan/comments/u461rm/what_jobs_are_in_demand_in_sk/,https://www.reddit.com/r/saskatchewan/comments/u461rm/what_jobs_are_in_demand_in_sk/,True,False,False,False,False,saskatchewan,"What jobs are in demand in SK? I am 27f and I run a small drywall taping business in ON. I am considering moving to SK next year and am wondering what career I could pursue that would make me most of an asset to the economy and set me up for a good living. 

From what I understand, the trades are not as hot there as they are here, is that correct? Would I be able to make a decent living as a drywall taper? Is there enough of a residential reno market that I could be self employed again?

What other major industries need workers? I'm willing to acquire schooling or training, and willing to go into almost anything, but I would like to know I will have a job afterwards!

Thanks in advance.",2022-04-15 11:35:37+00:00,2022,4,15,4,Friday,15,11,spring,2022-2023_api_transition,what jobs are in demand in sk? i am f and i run a small drywall taping business in on. i am considering moving to sk next year and am wondering what career i could pursue that would make me most of an asset to the economy and set me up for a good living. from what i understand the trades are not as hot there as they are here is that correct? would i be able to make a decent living as a drywall taper? is there enough of a residential reno market that i could be self employed again? what other major industries need workers? i m willing to acquire schooling or training and willing to go into almost anything but i would like to know i will have a job afterwards! thanks in advance.,685,137,False,True,0,2,False,2.526315789473684,0.17000000000000004,True,False,True,False,False,True,False,2022_Q2,1269747f21c882ca,0.8986,0.084,0.908,0.009,positive
u5rsln,Environment Canada warns of more snow for southeast Saskatchewan,,1650216435.0,77,30,None,0.94,/r/saskatchewan/comments/u5rsln/environment_canada_warns_of_more_snow_for/,https://regina.ctvnews.ca/environment-canada-warns-of-more-snow-for-southeast-saskatchewan-1.5864140,False,False,False,False,False,saskatchewan,Environment Canada warns of more snow for southeast Saskatchewan ,2022-04-17 17:27:15+00:00,2022,4,17,6,Sunday,15,17,spring,2022-2023_api_transition,environment canada warns of more snow for southeast saskatchewan,64,9,False,True,0,1,False,0.38461538461538464,0.06000000000000005,True,False,True,False,False,True,False,2022_Q2,ea21b71ec4b98443,-0.1027,0.0,0.851,0.149,negative
u2do8e,"Here's what to expect from major blizzard set to hit Manitoba, Saskatchewan and Ontario",,1649810138.0,51,45,None,0.91,/r/saskatchewan/comments/u2do8e/heres_what_to_expect_from_major_blizzard_set_to/,https://www.cbc.ca/news/canada/major-spring-blizzard-prairies-ontario-1.6417002,False,False,False,False,False,saskatchewan,"Here's what to expect from major blizzard set to hit Manitoba, Saskatchewan and Ontario ",2022-04-13 00:35:38+00:00,2022,4,13,2,Wednesday,15,0,spring,2022-2023_api_transition,here s what to expect from major blizzard set to hit manitoba saskatchewan and ontario,86,15,False,True,0,1,False,0.8653846153846154,0.08999999999999997,True,False,True,False,False,True,False,2022_Q2,ea21b71ec4b98443,0.0,0.0,1.0,0.0,neutral
uazk1z,"Winter storm closes roads, knocks out power in southeast Sask.",,1650820867.0,49,14,None,0.94,/r/saskatchewan/comments/uazk1z/winter_storm_closes_roads_knocks_out_power_in/,https://www.cbc.ca/news/canada/saskatchewan/colorado-low-saskatchewan-winter-storm-1.6429372,False,False,False,False,False,saskatchewan,"Winter storm closes roads, knocks out power in southeast Sask. ",2022-04-24 17:21:07+00:00,2022,4,24,6,Sunday,16,17,spring,2022-2023_api_transition,winter storm closes roads knocks out power in southeast sask.,61,10,False,True,0,2,False,0.28,0.06000000000000005,True,False,True,False,False,True,False,2022_Q2,c9e292b67dda1abc,0.0,0.0,1.0,0.0,neutral
u3mj3b,Sask storm 2022 before and after (Moosomin area),,1649956772.0,36,12,Sask Photography,0.92,/r/saskatchewan/comments/u3mj3b/sask_storm_2022_before_and_after_moosomin_area/,https://www.reddit.com/gallery/u3mj3b,False,False,False,False,False,saskatchewan,Sask storm 2022 before and after (Moosomin area) ,2022-04-14 17:19:32+00:00,2022,4,14,3,Thursday,15,17,spring,2022-2023_api_transition,sask storm before and after moosomin area,41,7,False,True,0,1,False,0.32432432432432434,0.07999999999999996,True,False,True,False,False,True,False,2022_Q2,970b516ac483def0,0.0,0.0,1.0,0.0,neutral
tyk1ck,SLGA business partners should have figured out on their own that their data may have been stolen: minister,,1649357812.0,115,55,None,0.97,/r/saskatchewan/comments/tyk1ck/slga_business_partners_should_have_figured_out_on/,https://www.cbc.ca/news/canada/saskatchewan/minister-slga-business-partners-should-have-figured-out-data-may-been-stolen-1.6411620,False,False,False,False,False,saskatchewan,SLGA business partners should have figured out on their own that their data may have been stolen: minister ,2022-04-07 18:56:52+00:00,2022,4,7,3,Thursday,14,18,spring,2022-2023_api_transition,slga business partners should have figured out on their own that their data may have been stolen minister,105,18,True,False,2,0,False,0.47413793103448276,0.030000000000000027,True,False,True,False,False,True,False,2022_Q2,2aaa9a07c66b1b9d,-0.4939,0.0,0.842,0.158,negative
u3gpsg,"SLGA sends businesses 1st direct warning credit card data may have been stolen, almost 3 months after hack",,1649940296.0,66,14,None,0.96,/r/saskatchewan/comments/u3gpsg/slga_sends_businesses_1st_direct_warning_credit/,https://www.cbc.ca/news/canada/saskatchewan/slga-warns-business-partners-credit-card-data-may-have-been-stolen-1.6418954?cmp=rss,False,False,False,False,False,saskatchewan,"SLGA sends businesses 1st direct warning credit card data may have been stolen, almost 3 months after hack ",2022-04-14 12:44:56+00:00,2022,4,14,3,Thursday,15,12,spring,2022-2023_api_transition,slga sends businesses st direct warning credit card data may have been stolen almost months after hack,102,17,True,False,2,0,False,0.208955223880597,0.040000000000000036,True,False,True,False,False,True,False,2022_Q2,2028f49ed3cbe51b,-0.4588,0.117,0.631,0.252,negative
u3d46l,"My neighbour just shared me a footage of ""theft from vehicles"" inside a van an hour ago in Bridgewater, Winnipeg. (01:44 a.m - 14/APR/22) Police were notified and anyone who knows who this man is please inform the police on 204-986-6222. Thanks & keep your vehicles locked.",,1649927551.0,33,5,Pictures/Video,0.87,/r/Manitoba/comments/u3d46l/my_neighbour_just_shared_me_a_footage_of_theft/,https://v.redd.it/lqhbmxgydgt81,False,False,False,False,False,manitoba,"My neighbour just shared me a footage of ""theft from vehicles"" inside a van an hour ago in Bridgewater, Winnipeg. (01:44 a.m - 14/APR/22) Police were notified and anyone who knows who this man is please inform the police on 204-986-6222. Thanks & keep your vehicles locked. ",2022-04-14 09:12:31+00:00,2022,4,14,3,Thursday,15,9,spring,2022-2023_api_transition,my neighbour just shared me a footage of theft from vehicles inside a van an hour ago in bridgewater winnipeg. a.m apr police were notified and anyone who knows who this man is please inform the police on PHONE . thanks keep your vehicles locked.,246,45,True,False,2,0,False,0.14705882352941177,0.13,True,False,True,False,False,True,False,2022_Q2,0b612aeaad4a760b,0.765,0.153,0.847,0.0,positive
ttxclk,Solid chocolate bunny used as weapon in assault on Brandon store clerk,,1648836440.0,29,7,News,0.97,/r/Manitoba/comments/ttxclk/solid_chocolate_bunny_used_as_weapon_in_assault/,https://www.cbc.ca/news/canada/manitoba/brandon-police-assault-chocolate-bunny-1.6405124,False,False,False,False,False,manitoba,Solid chocolate bunny used as weapon in assault on Brandon store clerk ,2022-04-01 18:07:20+00:00,2022,4,1,4,Friday,13,18,spring,2022-2023_api_transition,solid chocolate bunny used as weapon in assault on brandon store clerk,70,12,True,False,1,0,False,0.23333333333333334,0.030000000000000027,True,False,True,False,False,True,False,2022_Q2,ae62e88aa88065af,-0.6597,0.096,0.542,0.361,negative
tu965g,Guard charged with sex assault on prisoner at Little Grand Rapids RCMP detachment - Winnipeg | Globalnews.ca,,1648869534.0,12,1,News,0.93,/r/Manitoba/comments/tu965g/guard_charged_with_sex_assault_on_prisoner_at/,https://globalnews.ca/news/8706923/guard-charged-sex-assault-prisoner-little-grand-rapids-rcmp-detachment/?fbclid=IwAR0HegYukxAUMOt-kpnLgMCUUjcqN7DRDH1GirmJ7dpcNBkyJTj66uR0X9o,False,False,False,False,False,manitoba,Guard charged with sex assault on prisoner at Little Grand Rapids RCMP detachment - Winnipeg | Globalnews.ca ,2022-04-02 03:18:54+00:00,2022,4,2,5,Saturday,13,3,spring,2022-2023_api_transition,guard charged with sex assault on prisoner at little grand rapids rcmp detachment winnipeg globalnews.ca,104,15,True,False,2,0,False,0.07692307692307693,0.06999999999999995,True,False,True,False,False,True,False,2022_Q2,668c74659272caa5,-0.7501,0.119,0.482,0.399,negative
u2b28x,First time the Brandon School Division has closed school due to weather since 1998,,1649802499.0,16,3,Weather,0.9,/r/Manitoba/comments/u2b28x/first_time_the_brandon_school_division_has_closed/,https://i.redd.it/k3izi4hcc6t81.jpg,False,False,False,False,False,manitoba,First time the Brandon School Division has closed school due to weather since 1998 ,2022-04-12 22:28:19+00:00,2022,4,12,1,Tuesday,15,22,spring,2022-2023_api_transition,first time the brandon school division has closed school due to weather since,77,13,False,True,0,1,False,0.17647058823529413,0.09999999999999998,True,False,True,False,False,True,False,2022_Q2,75e53658a6ee67d7,0.0,0.0,1.0,0.0,neutral
u2ubxj,"What is a good site for a weather record, not the forecast?",What I am looking for is a place where I can see how much snow or rain actually fell in a given area.,1649867500.0,8,3,Weather,1.0,/r/Manitoba/comments/u2ubxj/what_is_a_good_site_for_a_weather_record_not_the/,https://www.reddit.com/r/Manitoba/comments/u2ubxj/what_is_a_good_site_for_a_weather_record_not_the/,True,False,False,False,False,manitoba,"What is a good site for a weather record, not the forecast? What I am looking for is a place where I can see how much snow or rain actually fell in a given area.",2022-04-13 16:31:40+00:00,2022,4,13,2,Wednesday,15,16,spring,2022-2023_api_transition,what is a good site for a weather record not the forecast? what i am looking for is a place where i can see how much snow or rain actually fell in a given area.,160,35,False,True,0,3,False,0.3333333333333333,0.0,True,False,True,False,False,True,False,2022_Q2,9c59f7dad8b6da6b,0.4404,0.079,0.921,0.0,positive
u7xddo,Weather-Fi Chill Hop - Winnipeg Weather in the old shaw style,,1650463724.0,5,1,None,0.73,/r/Manitoba/comments/u7xddo/weatherfi_chill_hop_winnipeg_weather_in_the_old/,https://www.youtube.com/watch?v=V1ZBr7TWqvQ,False,False,False,False,False,manitoba,Weather-Fi Chill Hop - Winnipeg Weather in the old shaw style ,2022-04-20 14:08:44+00:00,2022,4,20,2,Wednesday,16,14,spring,2022-2023_api_transition,weather fi chill hop winnipeg weather in the old shaw style,59,11,False,True,0,1,False,0.16666666666666666,0.27,True,False,True,False,False,True,False,2022_Q2,e835e5f123453efd,0.0,0.0,1.0,0.0,neutral
u2n4lu,A more detailed and accurate weather predicton simulator,"[https://earth.nullschool.net/#current/wind/surface/level/overlay=precip\_3hr/orthographic=-95.98,50.06,2653](https://earth.nullschool.net/#current/wind/surface/level/overlay=precip_3hr/orthographic=-95.98,50.06,2653)

For those of you who want to just see the data and a more accurate prediction/simulation of the future of any aspect of the weather. Not dumbed down but much more powerful to those who know what dataset to look at for specific events. The link posted defaults to the 3hour Precipitation Accumulation which is most relevant to this storm.",1649845309.0,19,0,Weather,0.96,/r/Manitoba/comments/u2n4lu/a_more_detailed_and_accurate_weather_predicton/,https://www.reddit.com/r/Manitoba/comments/u2n4lu/a_more_detailed_and_accurate_weather_predicton/,True,False,False,False,False,manitoba,"A more detailed and accurate weather predicton simulator [https://earth.nullschool.net/#current/wind/surface/level/overlay=precip\_3hr/orthographic=-95.98,50.06,2653](https://earth.nullschool.net/#current/wind/surface/level/overlay=precip_3hr/orthographic=-95.98,50.06,2653)

For those of you who want to just see the data and a more accurate prediction/simulation of the future of any aspect of the weather. Not dumbed down but much more powerful to those who know what dataset to look at for specific events. The link posted defaults to the 3hour Precipitation Accumulation which is most relevant to this storm.",2022-04-13 10:21:49+00:00,2022,4,13,2,Wednesday,15,10,spring,2022-2023_api_transition,a more detailed and accurate weather predicton simulator for those of you who want to just see the data and a more accurate prediction simulation of the future of any aspect of the weather. not dumbed down but much more powerful to those who know what dataset to look at for specific events. the link posted defaults to the hour precipitation accumulation which is most relevant to this storm.,393,69,False,True,0,3,False,0.0,0.040000000000000036,True,False,True,False,False,True,False,2022_Q2,5f9551f1b889ee2b,0.7011,0.093,0.907,0.0,positive
twcejy,COVID Everywhere?,"Up until this point in the pandemic, I haven’t known anyone who has gotten sick with COVID. 

Now, there’s so many people close to me, all fully vaccinated, getting pretty sick from COVID. I’ve steered clear so far but it’s only a matter of time I’m sure. Of course, this is right at the time when the numbers are no longer being released and testing is being cut back as well. 

Seems odd, as the weather is getting nicer and people are spending more time outdoors. Anyone else know a lot of people with COVID right now?",1649104734.0,114,159,COVID-19,0.91,/r/Manitoba/comments/twcejy/covid_everywhere/,https://www.reddit.com/r/Manitoba/comments/twcejy/covid_everywhere/,True,False,False,False,False,manitoba,"COVID Everywhere? Up until this point in the pandemic, I haven’t known anyone who has gotten sick with COVID. 

Now, there’s so many people close to me, all fully vaccinated, getting pretty sick from COVID. I’ve steered clear so far but it’s only a matter of time I’m sure. Of course, this is right at the time when the numbers are no longer being released and testing is being cut back as well. 

Seems odd, as the weather is getting nicer and people are spending more time outdoors. Anyone else know a lot of people with COVID right now?",2022-04-04 20:38:54+00:00,2022,4,4,0,Monday,14,20,spring,2022-2023_api_transition,covid everywhere? up until this point in the pandemic i haven t known anyone who has gotten sick with covid. now there s so many people close to me all fully vaccinated getting pretty sick from covid. i ve steered clear so far but it s only a matter of time i m sure. of course this is right at the time when the numbers are no longer being released and testing is being cut back as well. seems odd as the weather is getting nicer and people are spending more time outdoors. anyone else know a lot of people with covid right now?,529,104,False,True,0,1,False,1.382608695652174,0.08999999999999997,True,False,True,False,False,True,False,2022_Q2,f9e932f377b800d7,0.3164,0.124,0.771,0.105,positive
u6ixw8,Climate change,The storm last week had me thinking if climate change is prolonging the winter season. What say you?,1650303949.0,24,92,Weather,0.7,/r/Manitoba/comments/u6ixw8/climate_change/,https://www.reddit.com/r/Manitoba/comments/u6ixw8/climate_change/,True,False,False,False,False,manitoba,Climate change The storm last week had me thinking if climate change is prolonging the winter season. What say you?,2022-04-18 17:45:49+00:00,2022,4,18,0,Monday,16,17,spring,2022-2023_api_transition,climate change the storm last week had me thinking if climate change is prolonging the winter season. what say you?,115,20,False,True,0,3,False,3.68,0.30000000000000004,True,False,True,False,False,True,False,2022_Q2,9ad41686730d6773,0.0,0.0,1.0,0.0,neutral
u2p8i2,Since when do we preemptively close schools and city buildings in anticipation of a storm?,If this doesn't turn out to be the apocalypse the school boards and city officials that made these decisions should be ashamed of themselves.,1649853039.0,0,62,General,0.2,/r/Manitoba/comments/u2p8i2/since_when_do_we_preemptively_close_schools_and/,https://www.reddit.com/r/Manitoba/comments/u2p8i2/since_when_do_we_preemptively_close_schools_and/,True,False,False,False,False,manitoba,Since when do we preemptively close schools and city buildings in anticipation of a storm? If this doesn't turn out to be the apocalypse the school boards and city officials that made these decisions should be ashamed of themselves.,2022-04-13 12:30:39+00:00,2022,4,13,2,Wednesday,15,12,spring,2022-2023_api_transition,since when do we preemptively close schools and city buildings in anticipation of a storm? if this doesn t turn out to be the apocalypse the school boards and city officials that made these decisions should be ashamed of themselves.,232,40,False,True,0,1,False,62.0,0.8,True,False,True,False,False,True,False,2022_Q2,29fb84801d74298b,-0.4019,0.033,0.894,0.073,negative
u2ck60,slight snow in southern MB so far. IT HAS BEGUN!!!!!,,1649806746.0,77,17,Weather,0.94,/r/Manitoba/comments/u2ck60/slight_snow_in_southern_mb_so_far_it_has_begun/,https://v.redd.it/hesy75qyo6t81,False,False,False,False,False,manitoba,slight snow in southern MB so far. IT HAS BEGUN!!!!! ,2022-04-12 23:39:06+00:00,2022,4,12,1,Tuesday,15,23,spring,2022-2023_api_transition,slight snow in southern mb so far. it has begun!!!!!,52,10,False,True,0,1,False,0.21794871794871795,0.06000000000000005,True,False,True,False,False,True,False,2022_Q2,2da8f44de74d7942,0.0,0.0,1.0,0.0,neutral
u1n6tt,30-80cm of snow expected in the coming days. Stay safe out there.,,1649726815.0,83,15,Weather,0.94,/r/Manitoba/comments/u1n6tt/3080cm_of_snow_expected_in_the_coming_days_stay/,https://i.redd.it/gepl14t730t81.png,False,False,False,False,False,manitoba,30-80cm of snow expected in the coming days. Stay safe out there. ,2022-04-12 01:26:55+00:00,2022,4,12,1,Tuesday,15,1,spring,2022-2023_api_transition,cm of snow expected in the coming days. stay safe out there.,60,12,False,True,0,1,False,0.17857142857142858,0.06000000000000005,True,False,True,False,False,True,False,2022_Q2,da36d3daf9e105a0,0.4404,0.209,0.791,0.0,positive
ucp4zb,April and the snow is still this deep!,,1651013879.0,93,10,Pictures/Video,0.95,/r/Manitoba/comments/ucp4zb/april_and_the_snow_is_still_this_deep/,https://www.reddit.com/gallery/ucp4zb,False,False,False,False,False,manitoba,April and the snow is still this deep! ,2022-04-26 22:57:59+00:00,2022,4,26,1,Tuesday,17,22,spring,2022-2023_api_transition,april and the snow is still this deep!,38,8,False,True,0,1,False,0.10638297872340426,0.050000000000000044,True,False,True,False,False,True,False,2022_Q2,05fa6f299ac1831a,0.0,0.0,1.0,0.0,neutral
u0pwoq,"So, so true. This represents every single Winnipeggers spirit when we heard we have a major snowstorm coming through on Tuesday, April 12, or Wednesday, April 13, and that we could get 20 to 40+ cm [16+inches] of snow.",,1649621519.0,59,12,Satire,0.94,/r/Manitoba/comments/u0pwoq/so_so_true_this_represents_every_single/,https://i.redd.it/fblk61qlyjt31.jpg,False,False,False,False,False,manitoba,"So, so true. This represents every single Winnipeggers spirit when we heard we have a major snowstorm coming through on Tuesday, April 12, or Wednesday, April 13, and that we could get 20 to 40+ cm [16+inches] of snow. ",2022-04-10 20:11:59+00:00,2022,4,10,6,Sunday,14,20,spring,2022-2023_api_transition,so so true. this represents every single winnipeggers spirit when we heard we have a major snowstorm coming through on tuesday april or wednesday april and that we could get to cm inches of snow.,195,35,False,True,0,2,False,0.2,0.06000000000000005,True,False,True,False,False,True,False,2022_Q2,805fe5ae2a1c9942,0.6214,0.133,0.867,0.0,positive
u3j83k,"Cleared the railing off last night, getting a bit of snow!",,1649947688.0,45,6,Weather,0.93,/r/Manitoba/comments/u3j83k/cleared_the_railing_off_last_night_getting_a_bit/,https://i.redd.it/2r5dxfa0cit81.jpg,False,False,False,False,False,manitoba,"Cleared the railing off last night, getting a bit of snow! ",2022-04-14 14:48:08+00:00,2022,4,14,3,Thursday,15,14,spring,2022-2023_api_transition,cleared the railing off last night getting a bit of snow!,57,11,False,True,0,1,False,0.13043478260869565,0.06999999999999995,True,False,True,False,False,True,False,2022_Q2,f4fb3ffa45cc3bfa,0.1759,0.145,0.855,0.0,positive
u28w4o,Great Movies for Blizzard Shut-Ins?,"I'll start. I love ""The Thing"" with Kurt Russell and ""The Day After Tomorrow"" with Jake Gyllenhaal.",1649796045.0,41,132,Question,0.9,/r/Manitoba/comments/u28w4o/great_movies_for_blizzard_shutins/,https://www.reddit.com/r/Manitoba/comments/u28w4o/great_movies_for_blizzard_shutins/,True,False,False,False,False,manitoba,"Great Movies for Blizzard Shut-Ins? I'll start. I love ""The Thing"" with Kurt Russell and ""The Day After Tomorrow"" with Jake Gyllenhaal.",2022-04-12 20:40:45+00:00,2022,4,12,1,Tuesday,15,20,spring,2022-2023_api_transition,great movies for blizzard shut ins? i ll start. i love the thing with kurt russell and the day after tomorrow with jake gyllenhaal.,131,24,False,True,0,1,False,3.142857142857143,0.09999999999999998,True,False,True,False,False,True,False,2022_Q2,c8518066fd2c089d,0.8519,0.274,0.726,0.0,positive
u0iziu,Flood risk,"With this storm coming, what's the chances we'll see a flood that eclipses the Flood of the Century?",1649601701.0,20,32,Weather,0.82,/r/Manitoba/comments/u0iziu/flood_risk/,https://www.reddit.com/r/Manitoba/comments/u0iziu/flood_risk/,True,False,False,False,False,manitoba,"Flood risk With this storm coming, what's the chances we'll see a flood that eclipses the Flood of the Century?",2022-04-10 14:41:41+00:00,2022,4,10,6,Sunday,14,14,spring,2022-2023_api_transition,flood risk with this storm coming what s the chances we ll see a flood that eclipses the flood of the century?,110,22,False,True,0,1,False,1.5238095238095237,0.18000000000000005,True,False,True,False,False,True,False,2022_Q2,9ad41686730d6773,-0.0772,0.075,0.837,0.088,negative
ubqaub,Is this our third or fourth winter this year? Sorry I've lost count.,,1650907138.0,86,17,Weather,0.96,/r/Manitoba/comments/ubqaub/is_this_our_third_or_fourth_winter_this_year/,https://i.redd.it/a45f58dpkpv81.jpg,False,False,False,False,False,manitoba,Is this our third or fourth winter this year? Sorry I've lost count. ,2022-04-25 17:18:58+00:00,2022,4,25,0,Monday,17,17,spring,2022-2023_api_transition,is this our third or fourth winter this year? sorry i ve lost count.,68,14,False,True,0,1,False,0.19540229885057472,0.040000000000000036,True,False,True,False,False,True,False,2022_Q2,ba87de88fee0d762,-0.3818,0.0,0.769,0.231,negative
u2xg7d,Quebec ice storm,"So does anyone know if our current conditions, temperature, snow, ice, wind, storm duration reflect the Quebec ice storm that shut down power in Quebec for weeks?",1649875893.0,3,1,Question,0.8,/r/Manitoba/comments/u2xg7d/quebec_ice_storm/,https://www.reddit.com/r/Manitoba/comments/u2xg7d/quebec_ice_storm/,True,False,False,False,False,manitoba,"Quebec ice storm So does anyone know if our current conditions, temperature, snow, ice, wind, storm duration reflect the Quebec ice storm that shut down power in Quebec for weeks?",2022-04-13 18:51:33+00:00,2022,4,13,2,Wednesday,15,18,spring,2022-2023_api_transition,quebec ice storm so does anyone know if our current conditions temperature snow ice wind storm duration reflect the quebec ice storm that shut down power in quebec for weeks?,174,30,False,True,0,4,False,0.25,0.19999999999999996,True,False,True,False,False,True,False,2022_Q2,fa49051338e213ec,0.0,0.0,1.0,0.0,neutral
