id,title,selftext,created_utc,score,num_comments,link_flair_text,upvote_ratio,permalink,url,is_self,over_18,spoiler,stickied,locked,subreddit,full_text,created_date,year,month,day,day_of_week,day_name,week_of_year,hour,season,platform_period,cleaned_text,text_length,word_count,contains_crime_keywords,contains_weather_keywords,crime_keyword_count,weather_keyword_count,crime_and_weather,engagement_rate,controversy_score,is_2022,is_2023,pre_api_announcement,post_api_announcement,during_blackout,pre_api_changes,post_api_changes,quarter,author_hash,sentiment_compound,sentiment_positive,sentiment_neutral,sentiment_negative,sentiment_category
17g12hc,With winter coming shortly does anyone know how much Mr.Lube is charging for a on rim tires swap out to winter tires?,,1698227197.0,0,32,Ask Winnipeg,0.21,/r/Winnipeg/comments/17g12hc/with_winter_coming_shortly_does_anyone_know_how/,https://www.reddit.com/r/Winnipeg/comments/17g12hc/with_winter_coming_shortly_does_anyone_know_how/,True,False,False,False,False,Winnipeg,With winter coming shortly does anyone know how much Mr.Lube is charging for a on rim tires swap out to winter tires? ,2023-10-25 09:46:37+00:00,2023,10,25,2,Wednesday,43,9,fall,2022-2023_api_transition,with winter coming shortly does anyone know how much mr.lube is charging for a on rim tires swap out to winter tires?,117,22,False,True,0,1,False,32.0,0.79,False,True,False,True,False,False,True,2023_Q4,21e7f7b8c994f881,0.0,0.0,1.0,0.0,neutral
17b7aen,Notice of Lien?,"I recieved a letter from River City Bailiffs telling me I owe over $500 to the Winnipeg Parking Authority. I haven't received anything regarding money owing untill this point. I'm confused why this is happening, and for such an outrageous cost. Could this be a scam? Has anyone else experienced something like this?",1697679341.0,11,18,Ask Winnipeg,0.71,/r/Winnipeg/comments/17b7aen/notice_of_lien/,https://www.reddit.com/r/Winnipeg/comments/17b7aen/notice_of_lien/,True,False,False,False,False,Winnipeg,"Notice of Lien? I recieved a letter from River City Bailiffs telling me I owe over $500 to the Winnipeg Parking Authority. I haven't received anything regarding money owing untill this point. I'm confused why this is happening, and for such an outrageous cost. Could this be a scam? Has anyone else experienced something like this?",2023-10-19 01:35:41+00:00,2023,10,19,3,Thursday,42,1,fall,2022-2023_api_transition,notice of lien? i recieved a letter from river city bailiffs telling me i owe over to the winnipeg parking authority. i haven t received anything regarding money owing untill this point. i m confused why this is happening and for such an outrageous cost. could this be a scam? has anyone else experienced something like this?,325,57,True,False,1,0,False,1.5,0.29000000000000004,False,True,False,True,False,False,True,2023_Q4,b8ebd6c4d5059abe,-0.7744,0.058,0.796,0.146,negative
17knc7h,What buildings in Downtown Winnipeg have on-site Security?,"I am curious just how many buildings in Downtown Winnipeg have on-site security present?  
The question was asked in our most recent Health and Safty meeting and I thought Reddit might know.

Thanks! ",1698765243.0,11,14,Ask Winnipeg,0.87,/r/Winnipeg/comments/17knc7h/what_buildings_in_downtown_winnipeg_have_onsite/,https://www.reddit.com/r/Winnipeg/comments/17knc7h/what_buildings_in_downtown_winnipeg_have_onsite/,True,False,False,False,False,Winnipeg,"What buildings in Downtown Winnipeg have on-site Security? I am curious just how many buildings in Downtown Winnipeg have on-site security present?  
The question was asked in our most recent Health and Safty meeting and I thought Reddit might know.

Thanks! ",2023-10-31 15:14:03+00:00,2023,10,31,1,Tuesday,44,15,fall,2022-2023_api_transition,what buildings in downtown winnipeg have on site security? i am curious just how many buildings in downtown winnipeg have on site security present? the question was asked in our most recent health and safty meeting and i thought reddit might know. thanks!,255,43,True,False,1,0,False,1.1666666666666667,0.13,False,True,False,True,False,False,True,2023_Q4,754f6d92c15bf68c,0.8642,0.215,0.785,0.0,positive
175eqnv,"School division suing teens, parents after break-in",,1697032914.0,90,63,News,0.86,/r/Winnipeg/comments/175eqnv/school_division_suing_teens_parents_after_breakin/,https://www.winnipegfreepress.com/breakingnews/2023/10/11/school-division-suing-teens-parents-after-break-in,False,False,False,False,False,Winnipeg,"School division suing teens, parents after break-in ",2023-10-11 14:01:54+00:00,2023,10,11,2,Wednesday,41,14,fall,2022-2023_api_transition,school division suing teens parents after break in,50,8,True,False,1,0,False,0.6923076923076923,0.14,False,True,False,True,False,False,True,2023_Q4,8079a3d5f143a1fa,-0.2732,0.0,0.769,0.231,negative
17ik2no,"Suspect to identify - second break happended in this morning-Magnus Ave, North End","Happened at 2:35 a.m. this morning, it's the same tall suspect who broke into the same shed and stole thousands dollar worth of belongings on Oct. 6, 2023. Police report already filed. Please help identify this suspect!  Any tips would be appreciated. Please contact my phone number 6138099025. Thank you! ",1698518345.0,112,51,Community,0.93,/r/Winnipeg/comments/17ik2no/suspect_to_identify_second_break_happended_in/,https://v.redd.it/ykof4423nzwb1,False,False,False,False,False,Winnipeg,"Suspect to identify - second break happended in this morning-Magnus Ave, North End Happened at 2:35 a.m. this morning, it's the same tall suspect who broke into the same shed and stole thousands dollar worth of belongings on Oct. 6, 2023. Police report already filed. Please help identify this suspect!  Any tips would be appreciated. Please contact my phone number 6138099025. Thank you! ",2023-10-28 18:39:05+00:00,2023,10,28,5,Saturday,43,18,fall,2022-2023_api_transition,suspect to identify second break happended in this morning magnus ave north end happened at a.m. this morning it s the same tall suspect who broke into the same shed and stole thousands dollar worth of belongings on oct. . police report already filed. please help identify this suspect! any tips would be appreciated. please contact my phone number PHONE . thank you!,367,63,True,False,2,0,False,0.45132743362831856,0.06999999999999995,False,True,False,True,False,False,True,2023_Q4,7ca1bfd7ac48cc25,0.7568,0.216,0.664,0.12,positive
173v014,How do you prevent car break-ins?,"Since moving to my place located off of Pembina in 2022, we have experienced at least 3 car break-ins and I'm looking for guidance on what preventative measures to take going forward. We had a break-in last night and the car door was locked; they managed to do something to the rubber at the top of the door to get in and the alarm didn't go off somehow. They stole a few insignificant, but semi-expensive items - we know that these should not be left in the vehicle, but my sister has two kids and I guess she was in a hurry to get them out of the car and into the house so she didn't think to go back and check for valuables.

I was thinking of installing a censor light on top of my shed - we have one in the back, but the fence blocks the censor, I guess. We also have a ring camera at the back, but again, the fence blocks its view.

Any advice is appreciated!",1696866128.0,32,46,Ask Winnipeg,0.85,/r/Winnipeg/comments/173v014/how_do_you_prevent_car_breakins/,https://www.reddit.com/r/Winnipeg/comments/173v014/how_do_you_prevent_car_breakins/,True,False,False,False,False,Winnipeg,"How do you prevent car break-ins? Since moving to my place located off of Pembina in 2022, we have experienced at least 3 car break-ins and I'm looking for guidance on what preventative measures to take going forward. We had a break-in last night and the car door was locked; they managed to do something to the rubber at the top of the door to get in and the alarm didn't go off somehow. They stole a few insignificant, but semi-expensive items - we know that these should not be left in the vehicle, but my sister has two kids and I guess she was in a hurry to get them out of the car and into the house so she didn't think to go back and check for valuables.

I was thinking of installing a censor light on top of my shed - we have one in the back, but the fence blocks the censor, I guess. We also have a ring camera at the back, but again, the fence blocks its view.

Any advice is appreciated!",2023-10-09 15:42:08+00:00,2023,10,9,0,Monday,41,15,fall,2022-2023_api_transition,how do you prevent car break ins? since moving to my place located off of pembina in we have experienced at least car break ins and i m looking for guidance on what preventative measures to take going forward. we had a break in last night and the car door was locked they managed to do something to the rubber at the top of the door to get in and the alarm didn t go off somehow. they stole a few insignificant but semi expensive items we know that these should not be left in the vehicle but my sister has two kids and i guess she was in a hurry to get them out of the car and into the house so she didn t think to go back and check for valuables. i was thinking of installing a censor light on top of my shed we have one in the back but the fence blocks the censor i guess. we also have a ring camera at the back but again the fence blocks its view. any advice is appreciated!,878,181,True,False,2,0,False,1.393939393939394,0.15000000000000002,False,True,False,True,False,False,True,2023_Q4,2ea3dd10447b4977,-0.484,0.066,0.852,0.082,negative
17il2xg,"Suspect to identify - first break in on Oct. 6, 2023 at Magnus Ave, North End ","Please help! Break in happened this morning at 2:35 a.m. on Magnus Ave, North End, Winnipeg, same tall suspect who broke into the same shed on Oct. 6 and stole thousands! Any tips would be appreciated, please call 6138099025",1698521276.0,65,28,Community,0.89,/r/Winnipeg/comments/17il2xg/suspect_to_identify_first_break_in_on_oct_6_2023/,https://v.redd.it/k2iq19rsvzwb1,False,False,False,False,False,Winnipeg,"Suspect to identify - first break in on Oct. 6, 2023 at Magnus Ave, North End  Please help! Break in happened this morning at 2:35 a.m. on Magnus Ave, North End, Winnipeg, same tall suspect who broke into the same shed on Oct. 6 and stole thousands! Any tips would be appreciated, please call 6138099025",2023-10-28 19:27:56+00:00,2023,10,28,5,Saturday,43,19,fall,2022-2023_api_transition,suspect to identify first break in on oct. ADDRESS north end please help! break in happened this morning at a.m. on magnus ave north end winnipeg same tall suspect who broke into the same shed on oct. ADDRESS ole thousands! any tips would be appreciated please call PHONE,271,48,True,False,2,0,False,0.42424242424242425,0.10999999999999999,False,True,False,True,False,False,True,2023_Q4,7ca1bfd7ac48cc25,0.6103,0.188,0.69,0.121,positive
17alfcp,"Car break-ins in Transcona, Wed. 18 Oct. 2023"," 

Morning, [r/wpg](https://www.reddit.com/r/wpg/). This morning at approximately 0200hrs I observed 2 individuals peering into cars and trying handles in the back lane between Newman ave. W. And Horton Ave. W. They then proceeded east down Newman towards Wabasha, breaking into vehicles where I lost them while on the phone with non-emergency.

If anyone had their car broken into, please feel free to reach out to me. I can't offer much besides corroboration unfortunately, but hopefully it's something.",1697616492.0,22,3,Community,0.85,/r/Winnipeg/comments/17alfcp/car_breakins_in_transcona_wed_18_oct_2023/,https://www.reddit.com/r/Winnipeg/comments/17alfcp/car_breakins_in_transcona_wed_18_oct_2023/,True,False,False,False,False,Winnipeg,"Car break-ins in Transcona, Wed. 18 Oct. 2023  

Morning, [r/wpg](https://www.reddit.com/r/wpg/). This morning at approximately 0200hrs I observed 2 individuals peering into cars and trying handles in the back lane between Newman ave. W. And Horton Ave. W. They then proceeded east down Newman towards Wabasha, breaking into vehicles where I lost them while on the phone with non-emergency.

If anyone had their car broken into, please feel free to reach out to me. I can't offer much besides corroboration unfortunately, but hopefully it's something.",2023-10-18 08:08:12+00:00,2023,10,18,2,Wednesday,42,8,fall,2022-2023_api_transition,car break ins in transcona wed. oct. morning r wpg this morning at approximately hrs i observed ADDRESS . w. and horton ave. w. they then proceeded east down newman towards wabasha breaking into vehicles where i lost them while on the phone with non emergency. if anyone had their car broken into please feel free to reach out to me. i can t offer much besides corroboration unfortunately but hopefully it s something.,418,74,True,False,1,0,False,0.13043478260869565,0.15000000000000002,False,True,False,True,False,False,True,2023_Q4,bc6ec2acc92ae3ef,0.296,0.103,0.809,0.088,positive
17jb4dw,All-Weather or Winter Tires?,"I’m debating weather to get all weather tires or winter tires. I’d save a lot if I were to opt for all-weather tires. I only drive within the city during winters. And how long do all weather tires usually last before needing to replace them? 

Thank you!!!",1698609371.0,11,53,Ask Winnipeg,0.69,/r/Winnipeg/comments/17jb4dw/allweather_or_winter_tires/,https://www.reddit.com/r/Winnipeg/comments/17jb4dw/allweather_or_winter_tires/,True,False,False,False,False,Winnipeg,"All-Weather or Winter Tires? I’m debating weather to get all weather tires or winter tires. I’d save a lot if I were to opt for all-weather tires. I only drive within the city during winters. And how long do all weather tires usually last before needing to replace them? 

Thank you!!!",2023-10-29 19:56:11+00:00,2023,10,29,6,Sunday,43,19,fall,2022-2023_api_transition,all weather or winter tires? i m debating weather to get all weather tires or winter tires. i d save a lot if i were to opt for all weather tires. i only drive within the city during winters. and how long do all weather tires usually last before needing to replace them? thank you!!!,283,55,False,True,0,2,False,4.416666666666667,0.31000000000000005,False,True,False,True,False,False,True,2023_Q4,e42b43c8f255543f,0.7867,0.116,0.884,0.0,positive
170xdhc,Best site for weather,What is the most reliable/accurate website or app for Winnipeg weather? I use Environment Canada but it is wrong a lot.,1696549687.0,13,19,Ask Winnipeg,0.84,/r/Winnipeg/comments/170xdhc/best_site_for_weather/,https://www.reddit.com/r/Winnipeg/comments/170xdhc/best_site_for_weather/,True,False,False,False,False,Winnipeg,Best site for weather What is the most reliable/accurate website or app for Winnipeg weather? I use Environment Canada but it is wrong a lot.,2023-10-05 23:48:07+00:00,2023,10,5,3,Thursday,40,23,fall,2022-2023_api_transition,best site for weather what is the most reliable accurate website or app for winnipeg weather? i use environment canada but it is wrong a lot.,141,26,False,True,0,1,False,1.3571428571428572,0.16000000000000003,False,True,False,True,False,False,True,2023_Q4,e06243efed3a3c71,-0.3716,0.085,0.78,0.135,negative
16xabzf,Anyone else have a wicked cold rn?,"For around a week there’s been a crazy bug cycling through my family. We’ve all tested negative for Covid multiple times, but I’ve never had a cold hit me like this!
A sore throat on par with the feeling of strep, ear pain from throat inflammation, feverish aches and chills without actually having a fever, and now a persistent chest cough that’s lingering.
Weirdly enough there was no sinus congestion or runny nose, I could breathe fine the entire time! I also went to a clinic to see if I had an ear infection or strep, and it was confirmed it was just a cold.
Just wanted to know if anyone else has this rn, because I’ve never experienced a cold that’s knocked me on my ass this hard before!",1696188544.0,122,104,Ask Winnipeg,0.9,/r/Winnipeg/comments/16xabzf/anyone_else_have_a_wicked_cold_rn/,https://www.reddit.com/r/Winnipeg/comments/16xabzf/anyone_else_have_a_wicked_cold_rn/,True,False,False,False,False,Winnipeg,"Anyone else have a wicked cold rn? For around a week there’s been a crazy bug cycling through my family. We’ve all tested negative for Covid multiple times, but I’ve never had a cold hit me like this!
A sore throat on par with the feeling of strep, ear pain from throat inflammation, feverish aches and chills without actually having a fever, and now a persistent chest cough that’s lingering.
Weirdly enough there was no sinus congestion or runny nose, I could breathe fine the entire time! I also went to a clinic to see if I had an ear infection or strep, and it was confirmed it was just a cold.
Just wanted to know if anyone else has this rn, because I’ve never experienced a cold that’s knocked me on my ass this hard before!",2023-10-01 19:29:04+00:00,2023,10,1,6,Sunday,39,19,fall,2022-2023_api_transition,anyone else have a wicked cold rn? for around a week there s been a crazy bug cycling through my family. we ve all tested negative for covid multiple times but i ve never had a cold hit me like this! a sore throat on par with the feeling of strep ear pain from throat inflammation feverish aches and chills without actually having a fever and now a persistent chest cough that s lingering. weirdly enough there was no sinus congestion or runny nose i could breathe fine the entire time! i also went to a clinic to see if i had an ear infection or strep and it was confirmed it was just a cold. just wanted to know if anyone else has this rn because i ve never experienced a cold that s knocked me on my ass this hard before!,724,143,False,True,0,1,False,0.8455284552845529,0.09999999999999998,False,True,False,True,False,False,True,2023_Q4,3b54eb41a93cf77c,-0.9639,0.044,0.786,0.171,negative
176oxxj,Seeking recommendation: Your best neck gaiters and finger-less gloves (or similar) for the cold,"I've been making do with for the last 4 years with a cheap short gaiter and a pair of mismatched gloves. Finally making some money so I thought I'd splurge into something better (but not too expensive). 

I quite prefer gaiters over scarves for the easy on/off. What's a good buy?

As for gloves, I do have a pair of raber garbage mitts (neat stuff, I like), but I'd like to have easy access to my fingers. Mitts, for all their help, are not my thing. Any recommendations for fingerless gloves, convertible mitts and/or similar?

Appreciate any recommendations!",1697166245.0,3,26,Ask Winnipeg,0.62,/r/Winnipeg/comments/176oxxj/seeking_recommendation_your_best_neck_gaiters_and/,https://www.reddit.com/r/Winnipeg/comments/176oxxj/seeking_recommendation_your_best_neck_gaiters_and/,True,False,False,False,False,Winnipeg,"Seeking recommendation: Your best neck gaiters and finger-less gloves (or similar) for the cold I've been making do with for the last 4 years with a cheap short gaiter and a pair of mismatched gloves. Finally making some money so I thought I'd splurge into something better (but not too expensive). 

I quite prefer gaiters over scarves for the easy on/off. What's a good buy?

As for gloves, I do have a pair of raber garbage mitts (neat stuff, I like), but I'd like to have easy access to my fingers. Mitts, for all their help, are not my thing. Any recommendations for fingerless gloves, convertible mitts and/or similar?

Appreciate any recommendations!",2023-10-13 03:04:05+00:00,2023,10,13,4,Friday,41,3,fall,2022-2023_api_transition,seeking recommendation your best neck gaiters and finger less gloves or similar for the cold i ve been making do with for the last years with a cheap short gaiter and a pair of mismatched gloves. finally making some money so i thought i d splurge into something better but not too expensive . i quite prefer gaiters over scarves for the easy on off. what s a good buy? as for gloves i do have a pair of raber garbage mitts neat stuff i like but i d like to have easy access to my fingers. mitts for all their help are not my thing. any recommendations for fingerless gloves convertible mitts and or similar? appreciate any recommendations!,639,119,False,True,0,1,False,6.5,0.38,False,True,False,True,False,False,True,2023_Q4,ed2d9b344406b108,0.9876,0.24,0.76,0.0,positive
17gbron,Best Hot Pot?,"Hi everyone, I recently moved back from Vancouver and my favourite restaurant there was hot pot (gokudo shabu shabu) I believe it’s Japanese? Anyways just wondering if there’s anything similar here or where the best hot pot is - something with vegan options preferably! TIA!",1698259122.0,13,29,Food,0.74,/r/Winnipeg/comments/17gbron/best_hot_pot/,https://www.reddit.com/r/Winnipeg/comments/17gbron/best_hot_pot/,True,False,False,False,False,Winnipeg,"Best Hot Pot? Hi everyone, I recently moved back from Vancouver and my favourite restaurant there was hot pot (gokudo shabu shabu) I believe it’s Japanese? Anyways just wondering if there’s anything similar here or where the best hot pot is - something with vegan options preferably! TIA!",2023-10-25 18:38:42+00:00,2023,10,25,2,Wednesday,43,18,fall,2022-2023_api_transition,best hot pot? hi everyone i recently moved back from vancouver and my favourite restaurant there was hot pot gokudo shabu shabu i believe it s japanese? anyways just wondering if there s anything similar here or where the best hot pot is something with vegan options preferably! tia!,283,49,False,True,0,1,False,2.0714285714285716,0.26,False,True,False,True,False,False,True,2023_Q4,36b03e249619f651,0.928,0.216,0.784,0.0,positive
16x2jmw,The LC hot buys are back!!,"Edit: they have updated the site to actual sale prices

It was a rough September without having hot buys. I was pretty excited to see that they were back this morning but then to my surprise everything on the hot buy list is just regular priced stuff. What's that all about?",1696170204.0,33,18,Satire/Humour,0.84,/r/Winnipeg/comments/16x2jmw/the_lc_hot_buys_are_back/,https://www.reddit.com/r/Winnipeg/comments/16x2jmw/the_lc_hot_buys_are_back/,True,False,False,False,False,Winnipeg,"The LC hot buys are back!! Edit: they have updated the site to actual sale prices

It was a rough September without having hot buys. I was pretty excited to see that they were back this morning but then to my surprise everything on the hot buy list is just regular priced stuff. What's that all about?",2023-10-01 14:23:24+00:00,2023,10,1,6,Sunday,39,14,fall,2022-2023_api_transition,the lc hot buys are back!! edit they have updated the site to actual sale prices it was a rough september without having hot buys. i was pretty excited to see that they were back this morning but then to my surprise everything on the hot buy list is just regular priced stuff. what s that all about?,299,58,False,True,0,1,False,0.5294117647058824,0.16000000000000003,False,True,False,True,False,False,True,2023_Q4,1e8f17c58f959496,0.6038,0.097,0.903,0.0,positive
173dkap,Any place open tomorrow with a hot tub?,"Not enough water for a nice hot bath and I have a killer migraine. Public Pools are closed but figured maybe a private place may have one so I can simmer the pain away. 

(No I won't use anyone's private jacuzzi. I'm not that desperate)",1696808606.0,1,15,Community,0.52,/r/Winnipeg/comments/173dkap/any_place_open_tomorrow_with_a_hot_tub/,https://www.reddit.com/r/Winnipeg/comments/173dkap/any_place_open_tomorrow_with_a_hot_tub/,True,False,False,False,False,Winnipeg,"Any place open tomorrow with a hot tub? Not enough water for a nice hot bath and I have a killer migraine. Public Pools are closed but figured maybe a private place may have one so I can simmer the pain away. 

(No I won't use anyone's private jacuzzi. I'm not that desperate)",2023-10-08 23:43:26+00:00,2023,10,8,6,Sunday,40,23,fall,2022-2023_api_transition,any place open tomorrow with a hot tub? not enough water for a nice hot bath and i have a killer migraine. public pools are closed but figured maybe a private place may have one so i can simmer the pain away. no i won t use anyone s private jacuzzi. i m not that desperate,272,56,False,True,0,2,False,7.5,0.48,False,True,False,True,False,False,True,2023_Q4,fa358dbb7021f6ef,-0.8899,0.064,0.733,0.204,negative
17h9cg2,Do any Winnipeg Rec Facility pools have a hot tub/jacuzzi?,"From what I can tell on the webpage, unless I am missing something, none of them do.

&#x200B;

EDIT: Specifically, ones run by the City.  Not ones that happen to be IN the city. :)",1698361477.0,4,13,Community,0.7,/r/Winnipeg/comments/17h9cg2/do_any_winnipeg_rec_facility_pools_have_a_hot/,https://www.reddit.com/r/Winnipeg/comments/17h9cg2/do_any_winnipeg_rec_facility_pools_have_a_hot/,True,False,False,False,False,Winnipeg,"Do any Winnipeg Rec Facility pools have a hot tub/jacuzzi? From what I can tell on the webpage, unless I am missing something, none of them do.

&#x200B;

EDIT: Specifically, ones run by the City.  Not ones that happen to be IN the city. :)",2023-10-26 23:04:37+00:00,2023,10,26,3,Thursday,43,23,fall,2022-2023_api_transition,do any winnipeg rec facility pools have a hot tub jacuzzi? from what i can tell on the webpage unless i am missing something none of them do. x b edit specifically ones run by the city. not ones that happen to be in the city.,225,46,False,True,0,1,False,2.6,0.30000000000000004,False,True,False,True,False,False,True,2023_Q4,fa358dbb7021f6ef,-0.296,0.0,0.953,0.047,negative
