id,title,selftext,created_utc,score,num_comments,link_flair_text,upvote_ratio,permalink,url,is_self,over_18,spoiler,stickied,locked,subreddit,full_text,created_date,year,month,day,day_of_week,day_name,week_of_year,hour,season,platform_period,cleaned_text,text_length,word_count,contains_crime_keywords,contains_weather_keywords,crime_keyword_count,weather_keyword_count,crime_and_weather,engagement_rate,controversy_score,is_2022,is_2023,pre_api_announcement,post_api_announcement,during_blackout,pre_api_changes,post_api_changes,quarter,author_hash,sentiment_compound,sentiment_positive,sentiment_neutral,sentiment_negative,sentiment_category
uq143b,PSA: Suspected Hate Crime -- Wheels on car,"It's come to my attention that there's some fuckers around loosening people's wheels in the city.

My sister's wheels were loosened, and I thought she was just a dummy. Out of curiosity, I have checked video footage of when she had her wheels changed. The wheels were torqued appropriately and since it's a VW, it had the caps on the lug bolts and they were missing when noticed. No accident occurred. The last wheel change was 2.5 months ago.

Anyway, another friend of mine today had her wheel fly off and land on another person's vehicle on gateway boulevard.

2 additional vehicles are sitting at 2 separate mechanic shops. I am friends with both the owners, and they're in there because of a wheel flew off and caused severe damage to the hub. Both the owners of the vehicles were also Asian.

This is a PSA that this IS going around. And this is my data that I am seeing. I urge you to check your wheels.

I am suspecting hate crime, because everyone has been Asian so far. Perhaps I have a sensitivity to Asian hate crimes and the plethora of racist remarks we get at our business on the daily. But I guess it doesn't matter if it's hate crime or not. Because this affects everyone on the road.

TLDR; check your wheels. someone is loosening lug bolts and lug nuts in town.

Edit: it's interesting to know that there are downvotes on this, and a lot of views already. Guess I needed to leave the Asian part out, huh? 

Edit 1: I’m a car guy, and own some very expensive torque wrenches and religiously checks my family’s stuff. 

The damages on the wheels is out of the ordinary. For all 5 nuts, and some 6 to be completely loose is improbable. 

Checking tq is good after a check changeover. This is not what you think it is.",1652600975.0,465,95,Commuting/Transit,0.84,/r/Edmonton/comments/uq143b/psa_suspected_hate_crime_wheels_on_car/,https://www.reddit.com/r/Edmonton/comments/uq143b/psa_suspected_hate_crime_wheels_on_car/,True,False,False,False,False,Edmonton,"PSA: Suspected Hate Crime -- Wheels on car It's come to my attention that there's some fuckers around loosening people's wheels in the city.

My sister's wheels were loosened, and I thought she was just a dummy. Out of curiosity, I have checked video footage of when she had her wheels changed. The wheels were torqued appropriately and since it's a VW, it had the caps on the lug bolts and they were missing when noticed. No accident occurred. The last wheel change was 2.5 months ago.

Anyway, another friend of mine today had her wheel fly off and land on another person's vehicle on gateway boulevard.

2 additional vehicles are sitting at 2 separate mechanic shops. I am friends with both the owners, and they're in there because of a wheel flew off and caused severe damage to the hub. Both the owners of the vehicles were also Asian.

This is a PSA that this IS going around. And this is my data that I am seeing. I urge you to check your wheels.

I am suspecting hate crime, because everyone has been Asian so far. Perhaps I have a sensitivity to Asian hate crimes and the plethora of racist remarks we get at our business on the daily. But I guess it doesn't matter if it's hate crime or not. Because this affects everyone on the road.

TLDR; check your wheels. someone is loosening lug bolts and lug nuts in town.

Edit: it's interesting to know that there are downvotes on this, and a lot of views already. Guess I needed to leave the Asian part out, huh? 

Edit 1: I’m a car guy, and own some very expensive torque wrenches and religiously checks my family’s stuff. 

The damages on the wheels is out of the ordinary. For all 5 nuts, and some 6 to be completely loose is improbable. 

Checking tq is good after a check changeover. This is not what you think it is.",2022-05-15 07:49:35+00:00,2022,5,15,6,Sunday,19,7,spring,2022-2023_api_transition,psa suspected hate crime wheels on car it s come to my attention that there s some fuckers around loosening people s wheels in the city. my sister s wheels were loosened and i thought she was just a dummy. out of curiosity i have checked video footage of when she had her wheels changed. the wheels were torqued appropriately and since it s a vw it had the caps on the lug bolts and they were missing when noticed. no accident occurred. the last wheel change was . months ago. anyway another friend of mine today had her wheel fly off and land on another person s vehicle on gateway boulevard. additional vehicles are sitting at separate mechanic shops. i am friends with both the owners and they re in there because of a wheel flew off and caused severe damage to the hub. both the owners of the vehicles were also asian. this is a psa that this is going around. and this is my data that i am seeing. i urge you to check your wheels. i am suspecting hate crime because everyone has been asian so far. perhaps i have a sensitivity to asian hate crimes and the plethora of racist remarks we get at our business on the daily. but i guess it doesn t matter if it s hate crime or not. because this affects everyone on the road. tldr check your wheels. someone is loosening lug bolts and lug nuts in town. edit it s interesting to know that there are downvotes on this and a lot of views already. guess i needed to leave the asian part out huh? edit i m a car guy and own some very expensive torque wrenches and religiously checks my family s stuff. the damages on the wheels is out of the ordinary. for all nuts and some to be completely loose is improbable. checking tq is good after a check changeover. this is not what you think it is.,1734,334,True,False,1,0,False,0.20386266094420602,0.16000000000000003,True,False,True,False,False,True,False,2022_Q2,9eaa86bc62077abc,-0.9842,0.039,0.829,0.132,negative
uwwxxl,"Citizens pack Edmonton council chambers to speak on Chinatown crime, safety and policing - Edmonton | Globalnews.ca",,1653415393.0,192,31,News,0.95,/r/Edmonton/comments/uwwxxl/citizens_pack_edmonton_council_chambers_to_speak/,https://globalnews.ca/news/8865439/edmonton-council-crime-chinatown-safety-policing/,False,False,False,False,False,Edmonton,"Citizens pack Edmonton council chambers to speak on Chinatown crime, safety and policing - Edmonton | Globalnews.ca ",2022-05-24 18:03:13+00:00,2022,5,24,1,Tuesday,21,18,spring,2022-2023_api_transition,citizens pack edmonton council chambers to speak on chinatown crime safety and policing edmonton globalnews.ca,110,15,True,False,2,0,False,0.16062176165803108,0.050000000000000044,True,False,True,False,False,True,False,2022_Q2,c249fb765ba3eb04,-0.1779,0.145,0.674,0.181,negative
uihu1y,A spike in hate-motivated crimes in Edmonton has police urging people to report all instances of hate,,1651701879.0,38,18,News,0.84,/r/Edmonton/comments/uihu1y/a_spike_in_hatemotivated_crimes_in_edmonton_has/,https://www.cbc.ca/news/canada/edmonton/hate-crimes-edmonton-increase-1.6441488,False,False,False,False,False,Edmonton,A spike in hate-motivated crimes in Edmonton has police urging people to report all instances of hate ,2022-05-04 22:04:39+00:00,2022,5,4,2,Wednesday,18,22,spring,2022-2023_api_transition,a spike in hate motivated crimes in edmonton has police urging people to report all instances of hate,101,18,True,False,2,0,False,0.46153846153846156,0.16000000000000003,True,False,True,False,False,True,False,2022_Q2,add181ec3c316130,-0.6597,0.118,0.591,0.291,negative
uth9ns,"Suspicious Chinatown deaths, violent crimes over 24 hours sees Edmonton police redirect more officers downtown",,1653006994.0,62,13,News,0.98,/r/Edmonton/comments/uth9ns/suspicious_chinatown_deaths_violent_crimes_over/,https://globalnews.ca/news/8849981/edmonton-police-service-central-edmonton-crime/,False,False,False,False,False,Edmonton,"Suspicious Chinatown deaths, violent crimes over 24 hours sees Edmonton police redirect more officers downtown ",2022-05-20 00:36:34+00:00,2022,5,20,4,Friday,20,0,spring,2022-2023_api_transition,suspicious chinatown deaths violent crimes over hours sees edmonton police redirect more officers downtown,106,14,True,False,2,0,False,0.20634920634920634,0.020000000000000018,True,False,True,False,False,True,False,2022_Q2,b1a2b867fc146846,-0.7506,0.0,0.652,0.348,negative
urora8,Phone Theft in Walker Area,"I just wanted to spread awareness of phone stealing going on in Summerside/Walker/Ellerslie area. 

I accidentally forgot my phone in my vehicle when I went into the Winners at Walker and it ended up getting stolen. 

The person who stole it knew what they were doing as they were able to get past my password, and used my Apple ID to make a purchase ($249). They also racked up thousands of dollars in outgoing calls. 

When I went to the Telus store they had mentioned I was the second person that day with the same story. 

I know it’s my fault for forgetting it in my vehicle but I just wanted to bring some awareness to the issue and hopefully help someone else to not make the same mistake I did!",1652800698.0,15,32,General,0.7,/r/Edmonton/comments/urora8/phone_theft_in_walker_area/,https://www.reddit.com/r/Edmonton/comments/urora8/phone_theft_in_walker_area/,True,False,False,False,False,Edmonton,"Phone Theft in Walker Area I just wanted to spread awareness of phone stealing going on in Summerside/Walker/Ellerslie area. 

I accidentally forgot my phone in my vehicle when I went into the Winners at Walker and it ended up getting stolen. 

The person who stole it knew what they were doing as they were able to get past my password, and used my Apple ID to make a purchase ($249). They also racked up thousands of dollars in outgoing calls. 

When I went to the Telus store they had mentioned I was the second person that day with the same story. 

I know it’s my fault for forgetting it in my vehicle but I just wanted to bring some awareness to the issue and hopefully help someone else to not make the same mistake I did!",2022-05-17 15:18:18+00:00,2022,5,17,1,Tuesday,20,15,spring,2022-2023_api_transition,phone theft in walker area i just wanted to spread awareness of phone stealing going on in summerside walker ellerslie area. i accidentally forgot my phone in my vehicle when i went into the winners at walker and it ended up getting stolen. the person who stole it knew what they were doing as they were able to get past my password and used my apple id to make a purchase . they also racked up thousands of dollars in outgoing calls. when i went to the telus store they had mentioned i was the second person that day with the same story. i know it s my fault for forgetting it in my vehicle but i just wanted to bring some awareness to the issue and hopefully help someone else to not make the same mistake i did!,714,139,True,True,3,1,True,2.0,0.30000000000000004,True,False,True,False,False,True,False,2022_Q2,ebabf627f2400b7c,0.2363,0.071,0.854,0.075,positive
uidcpp,"Edmonton transit attack should be a ""wake-up call,"" says woman assaulted on city bus.",,1651689429.0,146,68,Commuting/Transit,0.94,/r/Edmonton/comments/uidcpp/edmonton_transit_attack_should_be_a_wakeup_call/,https://www.cbc.ca/news/canada/edmonton/transit-safety-bus-assault-edmonton-1.6441144,False,False,False,False,False,Edmonton,"Edmonton transit attack should be a ""wake-up call,"" says woman assaulted on city bus. ",2022-05-04 18:37:09+00:00,2022,5,4,2,Wednesday,18,18,spring,2022-2023_api_transition,edmonton transit attack should be a wake up call says woman assaulted on city bus.,82,15,True,False,1,0,False,0.46258503401360546,0.06000000000000005,True,False,True,False,False,True,False,2022_Q2,25dce8d519b30fae,-0.7579,0.0,0.667,0.333,negative
unaycy,Man who sexually assaulted woman near southeast Edmonton park sought by police,,1652278836.0,105,64,News,0.98,/r/Edmonton/comments/unaycy/man_who_sexually_assaulted_woman_near_southeast/,https://edmonton.ctvnews.ca/man-who-sexually-assaulted-woman-near-southeast-edmonton-park-sought-by-police-1.5898011,False,False,False,False,False,Edmonton,Man who sexually assaulted woman near southeast Edmonton park sought by police ,2022-05-11 14:20:36+00:00,2022,5,11,2,Wednesday,19,14,spring,2022-2023_api_transition,man who sexually assaulted woman near southeast edmonton park sought by police,78,12,True,False,2,0,False,0.6037735849056604,0.020000000000000018,True,False,True,False,False,True,False,2022_Q2,c249fb765ba3eb04,-0.5267,0.0,0.764,0.236,negative
v1wg23,Edmonton police looking for robbery suspect after donation box taken from McDonald's,,1654020757.0,14,9,News,0.83,/r/Edmonton/comments/v1wg23/edmonton_police_looking_for_robbery_suspect_after/,https://edmontonjournal.com/news/local-news/edmonton-police-looking-for-robbery-suspect-after-donation-box-taken-from-mcdonalds,False,False,False,False,False,Edmonton,Edmonton police looking for robbery suspect after donation box taken from McDonald's ,2022-05-31 18:12:37+00:00,2022,5,31,1,Tuesday,22,18,spring,2022-2023_api_transition,edmonton police looking for robbery suspect after donation box taken from mcdonald s,84,13,True,False,2,0,False,0.6,0.17000000000000004,True,False,True,False,False,True,False,2022_Q2,c249fb765ba3eb04,-0.296,0.0,0.845,0.155,negative
utv7fo,Edmonton adds new patrols to LRT in bid to improve transit safety,,1653051816.0,329,117,News,0.97,/r/Edmonton/comments/utv7fo/edmonton_adds_new_patrols_to_lrt_in_bid_to/,https://www.cbc.ca/news/canada/edmonton/edmonton-transit-safety-1.6460336,False,False,False,False,False,Edmonton,Edmonton adds new patrols to LRT in bid to improve transit safety ,2022-05-20 13:03:36+00:00,2022,5,20,4,Friday,20,13,spring,2022-2023_api_transition,edmonton adds new patrols to lrt in bid to improve transit safety,65,12,True,False,1,0,False,0.35454545454545455,0.030000000000000027,True,False,True,False,False,True,False,2022_Q2,add181ec3c316130,0.6908,0.363,0.637,0.0,positive
uzedvo,All Weather Windows has sectioned off their parking lot for a nesting goose,,1653707064.0,1334,147,General,0.99,/r/Edmonton/comments/uzedvo/all_weather_windows_has_sectioned_off_their/,https://www.reddit.com/gallery/uzedvo,False,False,False,False,False,Edmonton,All Weather Windows has sectioned off their parking lot for a nesting goose ,2022-05-28 03:04:24+00:00,2022,5,28,5,Saturday,21,3,spring,2022-2023_api_transition,all weather windows has sectioned off their parking lot for a nesting goose,75,13,False,True,0,1,False,0.1101123595505618,0.010000000000000009,True,False,True,False,False,True,False,2022_Q2,1de467d44e6d0519,0.0,0.0,1.0,0.0,neutral
umktmy,Old Lawn Guy Thinks It's Too Cold To Be Outside But Wonders Why So Many Passport Questions?,"Why so many passport questions? Aside from an emergency, why are you all waiting so long//late to get your passport? If you're planning a trip - start by getting your passport process (stated) right away. Seems like you expect it on demand - it doesn't work that way. Procrastination is your fault.

PS. Get the ten year one, it's a bit more bucks ($$$) but worth it - if you travel a bit.

Damn it's cold out, I can't shake my fist at my lawn with a mitten. It doesn't listen.

&#x200B;

Edit. Sorry folks, I didn't realize there was such an intense backlog in the process. ",1652195123.0,18,39,General,0.61,/r/Edmonton/comments/umktmy/old_lawn_guy_thinks_its_too_cold_to_be_outside/,https://www.reddit.com/r/Edmonton/comments/umktmy/old_lawn_guy_thinks_its_too_cold_to_be_outside/,True,False,False,False,False,Edmonton,"Old Lawn Guy Thinks It's Too Cold To Be Outside But Wonders Why So Many Passport Questions? Why so many passport questions? Aside from an emergency, why are you all waiting so long//late to get your passport? If you're planning a trip - start by getting your passport process (stated) right away. Seems like you expect it on demand - it doesn't work that way. Procrastination is your fault.

PS. Get the ten year one, it's a bit more bucks ($$$) but worth it - if you travel a bit.

Damn it's cold out, I can't shake my fist at my lawn with a mitten. It doesn't listen.

&#x200B;

Edit. Sorry folks, I didn't realize there was such an intense backlog in the process. ",2022-05-10 15:05:23+00:00,2022,5,10,1,Tuesday,19,15,spring,2022-2023_api_transition,old lawn guy thinks it s too cold to be outside but wonders why so many passport questions? why so many passport questions? aside from an emergency why are you all waiting so long late to get your passport? if you re planning a trip start by getting your passport process stated right away. seems like you expect it on demand it doesn t work that way. procrastination is your fault. ps. get the ten year one it s a bit more bucks but worth it if you travel a bit. damn it s cold out i can t shake my fist at my lawn with a mitten. it doesn t listen. x b edit. sorry folks i didn t realize there was such an intense backlog in the process.,638,130,False,True,0,1,False,2.0526315789473686,0.39,True,False,True,False,False,True,False,2022_Q2,6320bac9e99d2cae,-0.8336,0.051,0.836,0.113,negative
umj0mv,Edmonton considers spending millions more on snow clearing,,1652190128.0,45,64,News,0.88,/r/Edmonton/comments/umj0mv/edmonton_considers_spending_millions_more_on_snow/,https://www.cbc.ca/news/canada/edmonton/edmonton-considers-spending-millions-more-on-snow-clearing-1.6447377,False,False,False,False,False,Edmonton,Edmonton considers spending millions more on snow clearing ,2022-05-10 13:42:08+00:00,2022,5,10,1,Tuesday,19,13,spring,2022-2023_api_transition,edmonton considers spending millions more on snow clearing,58,8,False,True,0,1,False,1.391304347826087,0.12,True,False,True,False,False,True,False,2022_Q2,c249fb765ba3eb04,0.0,0.0,1.0,0.0,neutral
uxznxd,Some lightning from tonight’s storm,,1653539925.0,52,3,Photo/Video,0.89,/r/Edmonton/comments/uxznxd/some_lightning_from_tonights_storm/,https://www.reddit.com/gallery/uxznxd,False,False,False,False,False,Edmonton,Some lightning from tonight’s storm ,2022-05-26 04:38:45+00:00,2022,5,26,3,Thursday,21,4,spring,2022-2023_api_transition,some lightning from tonight s storm,35,6,False,True,0,1,False,0.05660377358490566,0.10999999999999999,True,False,True,False,False,True,False,2022_Q2,b346c000c289ffd7,0.0,0.0,1.0,0.0,neutral
uy14kp,"Atop Huntington Hill during the thunder storm, in the hail.",,1653545895.0,39,3,Photo/Video,0.87,/r/Edmonton/comments/uy14kp/atop_huntington_hill_during_the_thunder_storm_in/,https://www.reddit.com/gallery/uy14kp,False,False,False,False,False,Edmonton,"Atop Huntington Hill during the thunder storm, in the hail. ",2022-05-26 06:18:15+00:00,2022,5,26,3,Thursday,21,6,spring,2022-2023_api_transition,atop huntington hill during the thunder storm in the hail.,58,10,False,True,0,1,False,0.075,0.13,True,False,True,False,False,True,False,2022_Q2,d9c2571dba1225c9,0.0772,0.126,0.874,0.0,positive
ujc6la,"Less photo radar cash may mean cuts to Edmonton police, traffic safety",,1651800133.0,97,131,News,0.87,/r/Edmonton/comments/ujc6la/less_photo_radar_cash_may_mean_cuts_to_edmonton/,https://edmontonjournal.com/news/local-news/shrinking-photo-radar-cash-could-mean-steep-cuts-to-edmontons-police-budget-traffic-safety-programs,False,False,False,False,False,Edmonton,"Less photo radar cash may mean cuts to Edmonton police, traffic safety ",2022-05-06 01:22:13+00:00,2022,5,6,4,Friday,18,1,spring,2022-2023_api_transition,less photo radar cash may mean cuts to edmonton police traffic safety,69,12,True,True,2,1,True,1.336734693877551,0.13,True,False,True,False,False,True,False,2022_Q2,c249fb765ba3eb04,0.1531,0.187,0.667,0.147,positive
urcks5,"Edmonton police up downtown patrols, council hears calls for safety",,1652755208.0,50,87,News,0.88,/r/Edmonton/comments/urcks5/edmonton_police_up_downtown_patrols_council_hears/,https://edmontonjournal.com/news/local-news/edmonton-police-downtown-patrols-city-council-safe,False,False,False,False,False,Edmonton,"Edmonton police up downtown patrols, council hears calls for safety ",2022-05-17 02:40:08+00:00,2022,5,17,1,Tuesday,20,2,spring,2022-2023_api_transition,edmonton police up downtown patrols council hears calls for safety,66,10,True,False,2,0,False,1.7058823529411764,0.12,True,False,True,False,False,True,False,2022_Q2,c249fb765ba3eb04,0.4215,0.237,0.763,0.0,positive
uyjlh0,Shandro invokes Police Act forces Edmonton to come up with safety plan,,1653605018.0,45,67,News,0.85,/r/Edmonton/comments/uyjlh0/shandro_invokes_police_act_forces_edmonton_to/,https://edmontonjournal.com/news/politics/shandro-evokes-police-act-forces-edmonton-to-come-up-with-public-safety-plan-within-two-weeks,False,False,False,False,False,Edmonton,Shandro invokes Police Act forces Edmonton to come up with safety plan ,2022-05-26 22:43:38+00:00,2022,5,26,3,Thursday,21,22,spring,2022-2023_api_transition,shandro invokes police act forces edmonton to come up with safety plan,70,12,True,False,2,0,False,1.4565217391304348,0.15000000000000002,True,False,True,False,False,True,False,2022_Q2,915c80b04b382f9a,0.4215,0.203,0.797,0.0,positive
uu9lrw,Cllr Aaron Paquette with 30 minutes free to answer your questions. This week one of the big topics was Community Safety and Well Being,"A nice side note: household water usage has been steadily decreasing in Edmonton as more efficient appliances and devices come into use.

Otherwise there was a lot of talk about safety - downtown and LRT stations, deployment choices, and the overall CSWB strategy.

After asking for action over a year ago, then approving an approach presented by City Administration and EPS in February, we are finally seeing action being taken starting this coming week.

I know that folks sometimes think your City Council ignores issues but the fact is this governance machine is slow moving, and that can be pretty frustrating for everyone.

Literally takes a minimum of 3 months to get a report back from a motion made in Council, and then months (or longer) to get the budget and plan for a particular item, and then more time to see it actually implemented (usually months).

Recent example: I asked for a cost breakdown of services for Snow and Ice Control 2 years ago. We just got it last month.",1653086276.0,51,64,Politics,0.79,/r/Edmonton/comments/uu9lrw/cllr_aaron_paquette_with_30_minutes_free_to/,https://www.reddit.com/r/Edmonton/comments/uu9lrw/cllr_aaron_paquette_with_30_minutes_free_to/,True,False,False,False,False,Edmonton,"Cllr Aaron Paquette with 30 minutes free to answer your questions. This week one of the big topics was Community Safety and Well Being A nice side note: household water usage has been steadily decreasing in Edmonton as more efficient appliances and devices come into use.

Otherwise there was a lot of talk about safety - downtown and LRT stations, deployment choices, and the overall CSWB strategy.

After asking for action over a year ago, then approving an approach presented by City Administration and EPS in February, we are finally seeing action being taken starting this coming week.

I know that folks sometimes think your City Council ignores issues but the fact is this governance machine is slow moving, and that can be pretty frustrating for everyone.

Literally takes a minimum of 3 months to get a report back from a motion made in Council, and then months (or longer) to get the budget and plan for a particular item, and then more time to see it actually implemented (usually months).

Recent example: I asked for a cost breakdown of services for Snow and Ice Control 2 years ago. We just got it last month.",2022-05-20 22:37:56+00:00,2022,5,20,4,Friday,20,22,spring,2022-2023_api_transition,cllr aaron paquette with minutes free to answer your questions. this week one of the big topics was community safety and well being a nice side note household water usage has been steadily decreasing in edmonton as more efficient appliances and devices come into use. otherwise there was a lot of talk about safety downtown and lrt stations deployment choices and the overall cswb strategy. after asking for action over a year ago then approving an approach presented by city administration and eps in february we are finally seeing action being taken starting this coming week. i know that folks sometimes think your city council ignores issues but the fact is this governance machine is slow moving and that can be pretty frustrating for everyone. literally takes a minimum of months to get a report back from a motion made in council and then months or longer to get the budget and plan for a particular item and then more time to see it actually implemented usually months . recent example i asked for a cost breakdown of services for snow and ice control years ago. we just got it last month.,1097,192,True,True,1,1,True,1.2307692307692308,0.20999999999999996,True,False,True,False,False,True,False,2022_Q2,0efb50cdb2597ce0,0.8098,0.077,0.896,0.026,positive
