id,title,selftext,created_utc,score,num_comments,link_flair_text,upvote_ratio,permalink,url,is_self,over_18,spoiler,stickied,locked,subreddit,full_text,created_date,year,month,day,day_of_week,day_name,week_of_year,hour,season,platform_period,cleaned_text,text_length,word_count,contains_crime_keywords,contains_weather_keywords,crime_keyword_count,weather_keyword_count,crime_and_weather,engagement_rate,controversy_score,is_2022,is_2023,pre_api_announcement,post_api_announcement,during_blackout,pre_api_changes,post_api_changes,quarter,author_hash,sentiment_compound,sentiment_positive,sentiment_neutral,sentiment_negative,sentiment_category
17ccjmo,Police warn public after used needles left on Saskatoon playgrounds | 650 CKOM,"Not sure if this has been posted yet, don't care. Everyone needs to see this.",1697811974.0,83,87,PSA,0.92,/r/saskatoon/comments/17ccjmo/police_warn_public_after_used_needles_left_on/,https://www.ckom.com/2023/10/19/police-warn-public-after-used-needles-left-on-saskatoon-playgrounds/,False,False,False,False,False,Saskatoon,"Police warn public after used needles left on Saskatoon playgrounds | 650 CKOM Not sure if this has been posted yet, don't care. Everyone needs to see this.",2023-10-20 14:26:14+00:00,2023,10,20,4,Friday,42,14,fall,2022-2023_api_transition,police warn public after used needles left on saskatoon playgrounds ckom not sure if this has been posted yet don t care. everyone needs to see this.,149,27,True,False,1,0,False,1.0357142857142858,0.07999999999999996,False,True,False,True,False,False,True,2023_Q4,287d512dd7ebff19,0.2115,0.105,0.785,0.11,positive
17jh6t7,Police car chase on 22nd Oct. 29th ‘23,So today while driving down 22nd around 3pm there was about 7-8 cop cars chasing a vehicle that was driving (crazily) into oncoming traffic in a vehicle that was falling apart. Grand theft auto style. He Hit a couple cars but still continued with his ‘escape’. Anyone have info about this ? The guy was probably intoxicated somewhat.,1698626444.0,30,12,Question,0.84,/r/saskatoon/comments/17jh6t7/police_car_chase_on_22nd_oct_29th_23/,https://www.reddit.com/r/saskatoon/comments/17jh6t7/police_car_chase_on_22nd_oct_29th_23/,True,False,False,False,False,Saskatoon,Police car chase on 22nd Oct. 29th ‘23 So today while driving down 22nd around 3pm there was about 7-8 cop cars chasing a vehicle that was driving (crazily) into oncoming traffic in a vehicle that was falling apart. Grand theft auto style. He Hit a couple cars but still continued with his ‘escape’. Anyone have info about this ? The guy was probably intoxicated somewhat.,2023-10-30 00:40:44+00:00,2023,10,30,0,Monday,44,0,fall,2022-2023_api_transition,police car chase on nd oct. th ADDRESS iving down nd around pm there was about ADDRESS iving crazily into oncoming traffic in a vehicle that was falling apart. grand theft auto style. he hit a couple cars but still continued with his escape . anyone have info about this ? the guy was probably intoxicated somewhat.,315,57,True,True,2,1,True,0.3870967741935484,0.16000000000000003,False,True,False,True,False,False,True,2023_Q4,55899095137a2df7,0.25,0.067,0.882,0.051,positive
178solp,Sask. sexual assault centres banned from classrooms under new gov't policy,,1697414089.0,133,53,News,0.89,/r/saskatoon/comments/178solp/sask_sexual_assault_centres_banned_from/,https://thestarphoenix.com/news/local-news/sask-sexual-assault-centres-banned-from-classrooms-under-new-govt-policy,False,False,False,False,False,Saskatoon,Sask. sexual assault centres banned from classrooms under new gov't policy ,2023-10-15 23:54:49+00:00,2023,10,15,6,Sunday,41,23,fall,2022-2023_api_transition,sask. sexual assault centres banned from classrooms under new gov t policy,74,12,True,False,1,0,False,0.39552238805970147,0.10999999999999999,False,True,False,True,False,False,True,2023_Q4,ea21b71ec4b98443,-0.7783,0.0,0.595,0.405,negative
17iv38v,Armed robbery - posting for a friend.,"On Monday Oct 23, at 830 my friends house on idywyld was robbed by 3 people. 2 males and a female, one of which was armed with a gun. 

They jimmied a window open then let the other two suspects into the house. They then robbed the place taking numerous items including a safe that was bolted into a wall. On Thursday police executed a search warrant and arrested two of the three suspects, Nautia crier and Jordan Watcheson. They attended provincial court on Friday and were held in custody until Monday Oct 30. 

Today, we see on this Reddit that someone found the stolen safe in their garbage in Caswell hill area. The police are hoping to recover the safe as evidence and we are reaching out to see if anyone else has any information on this robbery or the third person involved. Please contact Saskatoon city police and reference the file number  23-142871 or dm me directly. We are offering a big reward for any information leading to the arrest of the third person involved or the recovery of the stolen items.",1698553061.0,247,68,Events,0.96,/r/saskatoon/comments/17iv38v/armed_robbery_posting_for_a_friend/,https://www.reddit.com/gallery/17iv38v,False,False,False,False,False,Saskatoon,"Armed robbery - posting for a friend. On Monday Oct 23, at 830 my friends house on idywyld was robbed by 3 people. 2 males and a female, one of which was armed with a gun. 

They jimmied a window open then let the other two suspects into the house. They then robbed the place taking numerous items including a safe that was bolted into a wall. On Thursday police executed a search warrant and arrested two of the three suspects, Nautia crier and Jordan Watcheson. They attended provincial court on Friday and were held in custody until Monday Oct 30. 

Today, we see on this Reddit that someone found the stolen safe in their garbage in Caswell hill area. The police are hoping to recover the safe as evidence and we are reaching out to see if anyone else has any information on this robbery or the third person involved. Please contact Saskatoon city police and reference the file number  23-142871 or dm me directly. We are offering a big reward for any information leading to the arrest of the third person involved or the recovery of the stolen items.",2023-10-29 04:17:41+00:00,2023,10,29,6,Sunday,43,4,fall,2022-2023_api_transition,armed robbery posting for a friend. on monday oct at my friends house on idywyld was robbed by people. males and a female one of which was armed with a gun. they jimmied a window open then let the other two suspects into the house. they then robbed the place taking numerous items including a safe that was bolted into a wall. on thursday police executed a search warrant and arrested two of the three suspects nautia crier and jordan watcheson. they attended provincial court on friday and were held in custody until monday oct . today we see on this reddit that someone found the stolen safe in their garbage in caswell hill area. the police are hoping to recover the safe as evidence and we are reaching out to see if anyone else has any information on this robbery or the third person involved. please contact saskatoon city police and reference the file number or dm me directly. we are offering a big reward for any information leading to the arrest of the third person involved or the recovery of the stolen items.,1021,185,True,False,5,0,False,0.27419354838709675,0.040000000000000036,False,True,False,True,False,False,True,2023_Q4,e740a7c98a313f76,0.7783,0.126,0.785,0.089,positive
179puuk,Beach weather......,,1697516214.0,67,0,Photos of Saskatoon,0.97,/r/saskatoon/comments/179puuk/beach_weather/,https://i.redd.it/xela8ow6voub1.jpg,False,False,False,False,False,Saskatoon,Beach weather...... ,2023-10-17 04:16:54+00:00,2023,10,17,1,Tuesday,42,4,fall,2022-2023_api_transition,beach weather......,19,2,False,True,0,1,False,0.0,0.030000000000000027,False,True,False,True,False,False,True,2023_Q4,c78fe911b9795a6a,0.0,0.0,1.0,0.0,neutral
1703d4u,Weather,Exceptional skies today! Did anyone else get some interesting pictures of the clouds?,1696464976.0,16,0,Photos of Saskatoon,0.86,/r/saskatoon/comments/1703d4u/weather/,https://i.redd.it/r43waomc1asb1.jpg,False,False,False,False,False,Saskatoon,Weather Exceptional skies today! Did anyone else get some interesting pictures of the clouds?,2023-10-05 00:16:16+00:00,2023,10,5,3,Thursday,40,0,fall,2022-2023_api_transition,weather exceptional skies today! did anyone else get some interesting pictures of the clouds?,93,14,False,True,0,1,False,0.0,0.14,False,True,False,True,False,False,True,2023_Q4,666c5011a581048e,0.4574,0.187,0.813,0.0,positive
17epim2,"Its been a few years since the last post, Tesla drivers, how are your vehicles in the Sask winters?","I've been driving Tesla since 2019, but in BC, so we don't get as cold. Looking to relocate my business to Sask next year, and am wondering how other drivers vehicles handle in the -30 to -45 weather. 

The coldest I've driven our car is -30ish, which was fine. Obviously major range loss, but its fine for in town driving. 

&#x200B;

&#x200B;",1698080970.0,39,113,Question,0.8,/r/saskatoon/comments/17epim2/its_been_a_few_years_since_the_last_post_tesla/,https://www.reddit.com/r/saskatoon/comments/17epim2/its_been_a_few_years_since_the_last_post_tesla/,True,False,False,False,False,Saskatoon,"Its been a few years since the last post, Tesla drivers, how are your vehicles in the Sask winters? I've been driving Tesla since 2019, but in BC, so we don't get as cold. Looking to relocate my business to Sask next year, and am wondering how other drivers vehicles handle in the -30 to -45 weather. 

The coldest I've driven our car is -30ish, which was fine. Obviously major range loss, but its fine for in town driving. 

&#x200B;

&#x200B;",2023-10-23 17:09:30+00:00,2023,10,23,0,Monday,43,17,fall,2022-2023_api_transition,its been a few years since the last post tesla drivers how are your vehicles in the sask winters? i ve been driving tesla since but in bc so we don t get as cold. looking to relocate my business to sask next year and am wondering how other drivers vehicles handle in the to weather. the coldest i ve driven our car is ish which was fine. obviously major range loss but its fine for in town driving. x b x b,406,83,False,True,0,3,False,2.825,0.19999999999999996,False,True,False,True,False,False,True,2023_Q4,040451c3ed738ddc,0.0084,0.05,0.911,0.038,neutral
175w01l,Hotels with hot tubs in rooms?,Does anyone know of hotels in the city where a hot tub is in the room?,1697077705.0,2,30,Question,0.58,/r/saskatoon/comments/175w01l/hotels_with_hot_tubs_in_rooms/,https://www.reddit.com/r/saskatoon/comments/175w01l/hotels_with_hot_tubs_in_rooms/,True,False,False,False,False,Saskatoon,Hotels with hot tubs in rooms? Does anyone know of hotels in the city where a hot tub is in the room?,2023-10-12 02:28:25+00:00,2023,10,12,3,Thursday,41,2,fall,2022-2023_api_transition,hotels with hot tubs in rooms? does anyone know of hotels in the city where a hot tub is in the room?,101,22,False,True,0,1,False,10.0,0.42000000000000004,False,True,False,True,False,False,True,2023_Q4,2c0060ad41e7166b,0.0,0.0,1.0,0.0,neutral
170zk10,Hot tub,Thinking of buying a hot tub and was wondering where to buy and what your hot tub purchase experience was like? Thanks in advance for your comments.,1696555792.0,4,7,Question,0.84,/r/saskatoon/comments/170zk10/hot_tub/,https://www.reddit.com/r/saskatoon/comments/170zk10/hot_tub/,True,False,False,False,False,Saskatoon,Hot tub Thinking of buying a hot tub and was wondering where to buy and what your hot tub purchase experience was like? Thanks in advance for your comments.,2023-10-06 01:29:52+00:00,2023,10,6,4,Friday,40,1,fall,2022-2023_api_transition,hot tub thinking of buying a hot tub and was wondering where to buy and what your hot tub purchase experience was like? thanks in advance for your comments.,156,29,False,True,0,1,False,1.4,0.16000000000000003,False,True,False,True,False,False,True,2023_Q4,6586f19e0acde66f,0.6597,0.167,0.833,0.0,positive
177v5lf,Deadly Dan Hot Sauce Grill,"Pokey’s Pinball Cafe posted the Hot Sauce Grill menu is now being served there.
Does anyone know if they have expanded and are serving both the Shanty and Pokey’s or did they move? It’s been nice having somewhere decent on 51st.",1697306286.0,1,3,Question,0.56,/r/saskatoon/comments/177v5lf/deadly_dan_hot_sauce_grill/,https://www.reddit.com/r/saskatoon/comments/177v5lf/deadly_dan_hot_sauce_grill/,True,False,False,False,False,Saskatoon,"Deadly Dan Hot Sauce Grill Pokey’s Pinball Cafe posted the Hot Sauce Grill menu is now being served there.
Does anyone know if they have expanded and are serving both the Shanty and Pokey’s or did they move? It’s been nice having somewhere decent on 51st.",2023-10-14 17:58:06+00:00,2023,10,14,5,Saturday,41,17,fall,2022-2023_api_transition,deadly dan hot sauce grill pokey s pinball cafe posted the hot sauce grill menu is now being served there. does anyone know if they have expanded and are serving both the shanty and pokey s or did they move? it s been nice having somewhere decent on st.,253,49,False,True,0,1,False,1.5,0.43999999999999995,False,True,False,True,False,False,True,2023_Q4,8e7026f34cbe550d,0.4215,0.055,0.945,0.0,positive
17ex4h2,Red Hots Original - Do any stores currently sell this in Saskatoon?,,1698100212.0,0,1,Food & Restaurants,0.5,/r/saskatoon/comments/17ex4h2/red_hots_original_do_any_stores_currently_sell/,https://i.redd.it/iq7teddd31wb1.jpg,False,False,False,False,False,Saskatoon,Red Hots Original - Do any stores currently sell this in Saskatoon? ,2023-10-23 22:30:12+00:00,2023,10,23,0,Monday,43,22,fall,2022-2023_api_transition,red hots original do any stores currently sell this in saskatoon?,65,11,False,True,0,1,False,1.0,0.5,False,True,False,True,False,False,True,2023_Q4,26a863f9c94fde87,0.3182,0.187,0.813,0.0,positive
17emi2z,Arctic cool down and snow blanket Saskatchewan: up to 20cm in select areas,,1698073415.0,26,15,Weather,0.88,/r/saskatoon/comments/17emi2z/arctic_cool_down_and_snow_blanket_saskatchewan_up/,https://www.msn.com/en-ca/weather/other/arctic-cool-down-and-snow-blanket-saskatchewan-up-to-20cm-in-select-areas/vi-AA1iEx8420cm-in-select-areas,False,False,False,False,False,Saskatoon,Arctic cool down and snow blanket Saskatchewan: up to 20cm in select areas ,2023-10-23 15:03:35+00:00,2023,10,23,0,Monday,43,15,fall,2022-2023_api_transition,arctic cool down and snow blanket saskatchewan up to cm in select areas,71,13,False,True,0,1,False,0.5555555555555556,0.12,False,True,False,True,False,False,True,2023_Q4,ea21b71ec4b98443,0.3182,0.161,0.839,0.0,positive
17enhd1,"Cherishing the last warmth before the winter chill sets in! 🍂☀️ Take a Monday stroll at Kiwanis Memorial Park and soak in the positive vibes before the negative temperatures roll in later this week ❄️🚶‍♀️🚶‍♂️Have a great week, everyone!",,1698075841.0,23,1,Photos of Saskatoon,0.83,/r/saskatoon/comments/17enhd1/cherishing_the_last_warmth_before_the_winter/,https://i.redd.it/rwol41j93zvb1.png,False,False,False,False,False,Saskatoon,"Cherishing the last warmth before the winter chill sets in! 🍂☀️ Take a Monday stroll at Kiwanis Memorial Park and soak in the positive vibes before the negative temperatures roll in later this week ❄️🚶‍♀️🚶‍♂️Have a great week, everyone! ",2023-10-23 15:44:01+00:00,2023,10,23,0,Monday,43,15,fall,2022-2023_api_transition,cherishing the last warmth before the winter chill sets in! take a monday stroll at kiwanis memorial park and soak in the positive vibes before the negative temperatures roll in later this week have a great week everyone!,221,38,False,True,0,3,False,0.041666666666666664,0.17000000000000004,False,True,False,True,False,False,True,2023_Q4,d93d8081bbe9066b,0.8906,0.28,0.647,0.073,positive
17b470b,Saskatoon adds safety features at crosswalk where girl was fatally struck,,1697670506.0,60,32,News,0.97,/r/saskatoon/comments/17b470b/saskatoon_adds_safety_features_at_crosswalk_where/,https://saskatoon.ctvnews.ca/saskatoon-adds-safety-features-at-crosswalk-where-girl-was-fatally-struck-1.6607391,False,False,False,False,False,Saskatoon,Saskatoon adds safety features at crosswalk where girl was fatally struck ,2023-10-18 23:08:26+00:00,2023,10,18,2,Wednesday,42,23,fall,2022-2023_api_transition,saskatoon adds safety features at crosswalk where girl was fatally struck,73,11,True,False,1,0,False,0.5245901639344263,0.030000000000000027,False,True,False,True,False,False,True,2023_Q4,6135c7bd50504645,-0.5267,0.165,0.471,0.365,negative
170xqpb,West side street parking Safety,"My kid goes to school at Bedford, and ordinarily he gets dropped off, but next month I'm going want him to drive to school, and there's no student parking. We have two cars, one that blends in easily, and one that stands out as unique. Which one do you feel would be safer parking in that neighbourhood during the school day? Do you think there's a difference as far as which is more likely to get its windows smashed if there's nothing visible in its front seat ?

Edit for small grammatical errors",1696550665.0,0,13,Question,0.3,/r/saskatoon/comments/170xqpb/west_side_street_parking_safety/,https://www.reddit.com/r/saskatoon/comments/170xqpb/west_side_street_parking_safety/,True,False,False,False,False,Saskatoon,"West side street parking Safety My kid goes to school at Bedford, and ordinarily he gets dropped off, but next month I'm going want him to drive to school, and there's no student parking. We have two cars, one that blends in easily, and one that stands out as unique. Which one do you feel would be safer parking in that neighbourhood during the school day? Do you think there's a difference as far as which is more likely to get its windows smashed if there's nothing visible in its front seat ?

Edit for small grammatical errors",2023-10-06 00:04:25+00:00,2023,10,6,4,Friday,40,0,fall,2022-2023_api_transition,west side street parking safety my kid goes to school at bedford and ordinarily he gets dropped off but next month i m going want him to drive to school and there s no student parking. we have two cars one that blends in easily and one that stands out as unique. which one do you feel would be safer parking in that neighbourhood during the school day? do you think there s a difference as far as which is more likely to get its windows smashed if there s nothing visible in its front seat ? edit for small grammatical errors,525,102,True,False,1,0,False,13.0,0.7,False,True,False,True,False,False,True,2023_Q4,8da06e41618cb1b9,0.5588,0.093,0.854,0.052,positive
17c16pi,Last pleasant day before the freeze,Some sunset photos from today.,1697770851.0,35,1,Weather,0.88,/r/saskatoon/comments/17c16pi/last_pleasant_day_before_the_freeze/,https://www.reddit.com/gallery/17c16pi,False,False,False,False,False,Saskatoon,Last pleasant day before the freeze Some sunset photos from today.,2023-10-20 03:00:51+00:00,2023,10,20,4,Friday,42,3,fall,2022-2023_api_transition,last pleasant day before the freeze some sunset photos from today.,66,11,False,True,0,2,False,0.027777777777777776,0.12,False,True,False,True,False,False,True,2023_Q4,d49177004db57a9e,0.5423,0.333,0.667,0.0,positive
170xkz8,Basement suite heating costs,"Looking to move into a basement suite soon as that's all I can afford for myself, and most places have electric baseboard heaters where I pay electricity. About how much $ will this be during the wintertime?",1696550235.0,7,19,Question,0.82,/r/saskatoon/comments/170xkz8/basement_suite_heating_costs/,https://www.reddit.com/r/saskatoon/comments/170xkz8/basement_suite_heating_costs/,True,False,False,False,False,Saskatoon,"Basement suite heating costs Looking to move into a basement suite soon as that's all I can afford for myself, and most places have electric baseboard heaters where I pay electricity. About how much $ will this be during the wintertime?",2023-10-05 23:57:15+00:00,2023,10,5,3,Thursday,40,23,fall,2022-2023_api_transition,basement suite heating costs looking to move into a basement suite soon as that s all i can afford for myself and most places have electric baseboard heaters where i pay electricity. about how much will this be during the wintertime?,233,41,False,True,0,1,False,2.375,0.18000000000000005,False,True,False,True,False,False,True,2023_Q4,0113986d7fee483e,-0.1027,0.0,0.966,0.034,negative
179m216,baydo plaza heating,"Does anybody know when baydo plaza’s (in evergreen) heating will turn on?
I was told it will turn on mid september, but nothing yet. 
Is it dependent on when it snows orrrr? Just wondering because I be cold 😣",1697504557.0,0,7,Question,0.44,/r/saskatoon/comments/179m216/baydo_plaza_heating/,https://www.reddit.com/r/saskatoon/comments/179m216/baydo_plaza_heating/,True,False,False,False,False,Saskatoon,"baydo plaza heating Does anybody know when baydo plaza’s (in evergreen) heating will turn on?
I was told it will turn on mid september, but nothing yet. 
Is it dependent on when it snows orrrr? Just wondering because I be cold 😣",2023-10-17 01:02:37+00:00,2023,10,17,1,Tuesday,42,1,fall,2022-2023_api_transition,baydo plaza heating does anybody know when baydo plaza s in evergreen heating will turn on? i was told it will turn on mid september but nothing yet. is it dependent on when it snows orrrr? just wondering because i be cold,222,42,False,True,0,2,False,7.0,0.56,False,True,False,True,False,False,True,2023_Q4,ad104523b11287eb,0.0,0.0,1.0,0.0,neutral
175r409,Intruder injured after breaking into Regina police headquarters,,1697063856.0,36,22,News,0.9,/r/regina/comments/175r409/intruder_injured_after_breaking_into_regina/,https://www.cjme.com/2023/10/11/intruder-injured-after-breaking-into-regina-police-headquarters/,False,False,False,False,False,Regina,Intruder injured after breaking into Regina police headquarters ,2023-10-11 22:37:36+00:00,2023,10,11,2,Wednesday,41,22,fall,2022-2023_api_transition,intruder injured after breaking into regina police headquarters,63,8,True,False,1,0,False,0.5945945945945946,0.09999999999999998,False,True,False,True,False,False,True,2023_Q4,100a86b3a72e83f1,-0.4019,0.0,0.722,0.278,negative
1772grv,"Three teens charged after bear mace, knife assault at high school",,1697213898.0,76,50,News,0.97,/r/regina/comments/1772grv/three_teens_charged_after_bear_mace_knife_assault/,https://leaderpost.com/news/crime/three-teens-charged-after-bear-mace-knife-assault-at-high-school,False,False,False,False,False,Regina,"Three teens charged after bear mace, knife assault at high school ",2023-10-13 16:18:18+00:00,2023,10,13,4,Friday,41,16,fall,2022-2023_api_transition,three teens charged after bear mace knife assault at high school,64,11,True,False,1,0,False,0.6493506493506493,0.030000000000000027,False,True,False,True,False,False,True,2023_Q4,6ea42934d4f50484,-0.6808,0.0,0.616,0.384,negative
