id,title,selftext,created_utc,score,num_comments,link_flair_text,upvote_ratio,permalink,url,is_self,over_18,spoiler,stickied,locked,subreddit,full_text,created_date,year,month,day,day_of_week,day_name,week_of_year,hour,season,platform_period,cleaned_text,text_length,word_count,contains_crime_keywords,contains_weather_keywords,crime_keyword_count,weather_keyword_count,crime_and_weather,engagement_rate,controversy_score,is_2022,is_2023,pre_api_announcement,post_api_announcement,during_blackout,pre_api_changes,post_api_changes,quarter,author_hash,sentiment_compound,sentiment_positive,sentiment_neutral,sentiment_negative,sentiment_category
17ih1ng,This Special Weather Statement issued by Environment Canada for tonight,,1698509508.0,155,21,Fluff Post,0.88,/r/Edmonton/comments/17ih1ng/this_special_weather_statement_issued_by/,https://i.redd.it/v5fj1pilwywb1.png,False,False,False,False,False,Edmonton,This Special Weather Statement issued by Environment Canada for tonight ,2023-10-28 16:11:48+00:00,2023,10,28,5,Saturday,43,16,fall,2022-2023_api_transition,this special weather statement issued by environment canada for tonight,71,10,False,True,0,1,False,0.1346153846153846,0.12,False,True,False,True,False,False,True,2023_Q4,3a4a2151484dc5e2,0.4019,0.231,0.769,0.0,positive
17f1gb9,Which Weather App for Edmonton,"Hey everyone, which is your favorite weather app for Edmonton area?  Looking for hourly forecast and 7 day. Other features like radar maps are cool. Mostly I’m concerned about accuracy. 

My husband and I have different weather apps we prefer but both seem to have pros and cons, and usually don’t match either lol Looking for other suggestions.",1698112384.0,2,14,Question,0.57,/r/Edmonton/comments/17f1gb9/which_weather_app_for_edmonton/,https://www.reddit.com/r/Edmonton/comments/17f1gb9/which_weather_app_for_edmonton/,True,False,False,False,False,Edmonton,"Which Weather App for Edmonton Hey everyone, which is your favorite weather app for Edmonton area?  Looking for hourly forecast and 7 day. Other features like radar maps are cool. Mostly I’m concerned about accuracy. 

My husband and I have different weather apps we prefer but both seem to have pros and cons, and usually don’t match either lol Looking for other suggestions.",2023-10-24 01:53:04+00:00,2023,10,24,1,Tuesday,43,1,fall,2022-2023_api_transition,which weather app for edmonton hey everyone which is your favorite weather app for edmonton area? looking for hourly forecast and day. other features like radar maps are cool. mostly i m concerned about accuracy. my husband and i have different weather apps we prefer but both seem to have pros and cons and usually don t match either lol looking for other suggestions.,369,64,False,True,0,1,False,4.666666666666667,0.43000000000000005,False,True,False,True,False,False,True,2023_Q4,71bb892422161a68,0.7964,0.132,0.868,0.0,positive
17f0xbc,Edmonton bus jackknifed in snow ,The 110X New Flyer XD60 Trying to leave Eaux claires ,1698110839.0,71,28,Commuting/Transit,0.97,/r/Edmonton/comments/17f0xbc/edmonton_bus_jackknifed_in_snow/,https://v.redd.it/7ply93hcz1wb1,False,False,False,False,False,Edmonton,Edmonton bus jackknifed in snow  The 110X New Flyer XD60 Trying to leave Eaux claires ,2023-10-24 01:27:19+00:00,2023,10,24,1,Tuesday,43,1,fall,2022-2023_api_transition,edmonton bus jackknifed in snow the x new flyer xd trying to leave eaux claires,79,15,False,True,0,1,False,0.3888888888888889,0.030000000000000027,False,True,False,True,False,False,True,2023_Q4,58b378b2ba89ce0c,0.5574,0.211,0.722,0.067,positive
17emam2,First snow of the season...,"Which means everyone who waits until the last minute will be at the counter at the tire shop...

""What do you mean, I have to leave my car for 3 days?"" 

Or

""How are you booked for winter tires for 3 weeks?"" 

""You don't understand,  it's snowing and I need my winter tires"" 

It always amazed me that people who live in a city that gets snow at the same time(ish) every year, seem to forget that it's coming. 
Then they are shocked that many other people are doing the exact same thing, at the exact same time. 

Just an observation standing in line......to book a tire changeover appointment.",1698072897.0,21,36,General,0.67,/r/Edmonton/comments/17emam2/first_snow_of_the_season/,https://www.reddit.com/r/Edmonton/comments/17emam2/first_snow_of_the_season/,True,False,False,False,False,Edmonton,"First snow of the season... Which means everyone who waits until the last minute will be at the counter at the tire shop...

""What do you mean, I have to leave my car for 3 days?"" 

Or

""How are you booked for winter tires for 3 weeks?"" 

""You don't understand,  it's snowing and I need my winter tires"" 

It always amazed me that people who live in a city that gets snow at the same time(ish) every year, seem to forget that it's coming. 
Then they are shocked that many other people are doing the exact same thing, at the exact same time. 

Just an observation standing in line......to book a tire changeover appointment.",2023-10-23 14:54:57+00:00,2023,10,23,0,Monday,43,14,fall,2022-2023_api_transition,first snow of the season... which means everyone who waits until the last minute will be at the counter at the tire shop... what do you mean i have to leave my car for days? or how are you booked for winter tires for weeks? you don t understand it s snowing and i need my winter tires it always amazed me that people who live in a city that gets snow at the same time ish every year seem to forget that it s coming. then they are shocked that many other people are doing the exact same thing at the exact same time. just an observation standing in line......to book a tire changeover appointment.,596,116,False,True,0,2,False,1.6363636363636365,0.32999999999999996,False,True,False,True,False,False,True,2023_Q4,b373184aa5450ae8,-0.1431,0.026,0.926,0.048,negative
17gx8vk,"Safety improving on Edmonton transit, new numbers suggest | CBC News",,1698328941.0,50,10,General,0.86,/r/Edmonton/comments/17gx8vk/safety_improving_on_edmonton_transit_new_numbers/,https://www.cbc.ca/news/canada/edmonton/edmonton-transit-safety-drug-use-1.7008246,False,False,False,False,False,Edmonton,"Safety improving on Edmonton transit, new numbers suggest | CBC News ",2023-10-26 14:02:21+00:00,2023,10,26,3,Thursday,43,14,fall,2022-2023_api_transition,safety improving on edmonton transit new numbers suggest cbc news,65,10,True,False,1,0,False,0.19607843137254902,0.14,False,True,False,True,False,False,True,2023_Q4,5bd53d7c35034eaa,0.6808,0.412,0.588,0.0,positive
173bnu7,Edmonton Best place for Rent (Price & Safety),"Hey, everyone! 

I analyzed rent prices and crime rates in all neighbourhoods in Edmonton to provide valuable insights for individuals looking to rent a property. The project focuses on two key factors: rent prices and safety, offering a comprehensive overview of the rental market and crime zones in Edmonton. You can find the best place for rent for your personal criteria's as well ([Click Here To View Map](https://public.tableau.com/app/profile/andrii.hryn/viz/WhereshouldIrentRentpriceCrimezonesEdmonton/Dashboard2))

&#x200B;

>P.S I also add top 20 neighbourhoods for rent based on Price/Crime Ratio

&#x200B;

https://i.redd.it/5g8e8fnbz1tb1.gif

https://preview.redd.it/dtiugi4mz1tb1.png?width=168&format=png&auto=webp&s=e6ce92841cb1e08b29de975964aee892c4e7f26f

**Now, I need your help! I'm looking for your feedback. Please feel free to criticize this.**",1696803465.0,30,13,General,0.89,/r/Edmonton/comments/173bnu7/edmonton_best_place_for_rent_price_safety/,https://www.reddit.com/r/Edmonton/comments/173bnu7/edmonton_best_place_for_rent_price_safety/,True,False,False,False,False,Edmonton,"Edmonton Best place for Rent (Price & Safety) Hey, everyone! 

I analyzed rent prices and crime rates in all neighbourhoods in Edmonton to provide valuable insights for individuals looking to rent a property. The project focuses on two key factors: rent prices and safety, offering a comprehensive overview of the rental market and crime zones in Edmonton. You can find the best place for rent for your personal criteria's as well ([Click Here To View Map](https://public.tableau.com/app/profile/andrii.hryn/viz/WhereshouldIrentRentpriceCrimezonesEdmonton/Dashboard2))

&#x200B;

>P.S I also add top 20 neighbourhoods for rent based on Price/Crime Ratio

&#x200B;

https://i.redd.it/5g8e8fnbz1tb1.gif

https://preview.redd.it/dtiugi4mz1tb1.png?width=168&format=png&auto=webp&s=e6ce92841cb1e08b29de975964aee892c4e7f26f

**Now, I need your help! I'm looking for your feedback. Please feel free to criticize this.**",2023-10-08 22:17:45+00:00,2023,10,8,6,Sunday,40,22,fall,2022-2023_api_transition,edmonton best place for rent price safety hey everyone! i analyzed rent prices and crime rates in all neighbourhoods in edmonton to provide valuable insights for individuals looking to rent a property. the project focuses on two key factors rent prices and safety offering a comprehensive overview of the rental market and crime zones in edmonton. you can find the best place for rent for your personal criteria s as well click here to view map x b p.s i also add top neighbourhoods for rent based on price crime ratio x b now i need your help! i m looking for your feedback. please feel free to criticize this.,611,110,True,False,2,0,False,0.41935483870967744,0.10999999999999999,False,True,False,True,False,False,True,2023_Q4,14114955492a71f8,0.95,0.228,0.679,0.094,positive
16yai0s,Drives in Edmonton lately,"Has anybody else been experiencing the most insane/ wild drivers on the road? I am having almost multiple accidents a day seeing some insane/ dangerous driving.

Running red lights, being cut off, seeing pedestrians being almost ran down, drivers doing 20 under the speed limit, blasting construction zones, and drivers swerving into me doing a lane change.

My partner said he feels the same way I do. At this rate first snow fall is gonna be Armageddon, it usually is but it will be wild if this is the norm.",1696285426.0,457,297,Discussion,0.94,/r/Edmonton/comments/16yai0s/drives_in_edmonton_lately/,https://www.reddit.com/r/Edmonton/comments/16yai0s/drives_in_edmonton_lately/,True,False,False,False,False,Edmonton,"Drives in Edmonton lately Has anybody else been experiencing the most insane/ wild drivers on the road? I am having almost multiple accidents a day seeing some insane/ dangerous driving.

Running red lights, being cut off, seeing pedestrians being almost ran down, drivers doing 20 under the speed limit, blasting construction zones, and drivers swerving into me doing a lane change.

My partner said he feels the same way I do. At this rate first snow fall is gonna be Armageddon, it usually is but it will be wild if this is the norm.",2023-10-02 22:23:46+00:00,2023,10,2,0,Monday,40,22,fall,2022-2023_api_transition,drives in edmonton lately has anybody else been experiencing the most insane wild drivers on the road? i am having almost multiple accidents a day seeing some insane dangerous driving. running red lights being cut off seeing pedestrians being almost ran down drivers doing under the speed limit blasting construction zones and drivers swerving into me doing a lane change. my partner said he feels the same way i do. at this rate first snow fall is gonna be armageddon it usually is but it will be wild if this is the norm.,523,93,True,True,1,2,True,0.648471615720524,0.06000000000000005,False,True,False,True,False,False,True,2023_Q4,adec2210f3cb92e7,-0.7147,0.0,0.908,0.092,negative
17gbdaz,Edmonton man arrested in didsbury on Firearms charges in stolen vehicle,https://www.discoverairdrie.com/articles/edmonton-man-arrested-in-disbury-on-firearms-charges-in-stolen-vehicle,1698258070.0,35,16,News,0.97,/r/Edmonton/comments/17gbdaz/edmonton_man_arrested_in_didsbury_on_firearms/,https://www.reddit.com/r/Edmonton/comments/17gbdaz/edmonton_man_arrested_in_didsbury_on_firearms/,True,False,False,False,False,Edmonton,Edmonton man arrested in didsbury on Firearms charges in stolen vehicle https://www.discoverairdrie.com/articles/edmonton-man-arrested-in-disbury-on-firearms-charges-in-stolen-vehicle,2023-10-25 18:21:10+00:00,2023,10,25,2,Wednesday,43,18,fall,2022-2023_api_transition,edmonton man arrested in didsbury on firearms charges in stolen vehicle,71,11,True,False,3,0,False,0.4444444444444444,0.030000000000000027,False,True,False,True,False,False,True,2023_Q4,56c550c23e34ddfe,-0.8126,0.0,0.488,0.512,negative
17i1tze,Stolen wallet,"Stupid me left my car unlocked and now my wallet is missing along with all my spare change. Thankfully they left my expensive prescription sunglasses. Anyways, my credit card has some random small transaction that I’ll dispute with them. Does anyone have experience with fraud on their debit card? Apparently they spent $5 at a vending machine. Thanks in advance and lock your doors.

Edit to add: any other advice? My licence is gone so I’ll keep an eye on my credit report. 

Edit number two: police report filed, it was so so easy. Credit and debit cards canceled. Will talk to the bank tomorrow.",1698453121.0,12,16,Question,0.8,/r/Edmonton/comments/17i1tze/stolen_wallet/,https://www.reddit.com/r/Edmonton/comments/17i1tze/stolen_wallet/,True,False,False,False,False,Edmonton,"Stolen wallet Stupid me left my car unlocked and now my wallet is missing along with all my spare change. Thankfully they left my expensive prescription sunglasses. Anyways, my credit card has some random small transaction that I’ll dispute with them. Does anyone have experience with fraud on their debit card? Apparently they spent $5 at a vending machine. Thanks in advance and lock your doors.

Edit to add: any other advice? My licence is gone so I’ll keep an eye on my credit report. 

Edit number two: police report filed, it was so so easy. Credit and debit cards canceled. Will talk to the bank tomorrow.",2023-10-28 00:32:01+00:00,2023,10,28,5,Saturday,43,0,fall,2022-2023_api_transition,stolen wallet stupid me left my car unlocked and now my wallet is missing along with all my spare change. thankfully they left my expensive prescription sunglasses. anyways my credit card has some random small transaction that i ll dispute with them. does anyone have experience with fraud on their debit card? apparently they spent at a vending machine. thanks in advance and lock your doors. edit to add any other advice? my licence is gone so i ll keep an eye on my credit report. edit number two police report filed it was so so easy. credit and debit cards canceled. will talk to the bank tomorrow.,603,108,True,False,4,0,False,1.2307692307692308,0.19999999999999996,False,True,False,True,False,False,True,2023_Q4,36ba3dfb0a145b56,0.541,0.151,0.732,0.117,positive
17d537p,Keep your cats INSIDE!,"TW: >!dead animal!<

Now I love petting outdoor cats, I’ll pspsps all day long at them. but for every one that i see i can’t help but think of the owner that doesn’t seem to care for their pet’s safety.

Which makes it all the more tragic when I was driving 199 street this morning and saw a poor thing that must have gotten hit by a car in the night. I feel sick and I can’t get the image out of my head. I pity and hate whatever owner let this happen, so let it be a warning.

Outdoor cats get sick, they get in fights, they freeze, and they get hit by cars. Keep them inside.

p.s. it was a brown and black striped cat, if you know anyone in the hamptons area with one. if the owner sees this, i truly am sorry.",1697902081.0,303,257,Discussion,0.87,/r/Edmonton/comments/17d537p/keep_your_cats_inside/,https://www.reddit.com/r/Edmonton/comments/17d537p/keep_your_cats_inside/,True,False,False,False,False,Edmonton,"Keep your cats INSIDE! TW: >!dead animal!<

Now I love petting outdoor cats, I’ll pspsps all day long at them. but for every one that i see i can’t help but think of the owner that doesn’t seem to care for their pet’s safety.

Which makes it all the more tragic when I was driving 199 street this morning and saw a poor thing that must have gotten hit by a car in the night. I feel sick and I can’t get the image out of my head. I pity and hate whatever owner let this happen, so let it be a warning.

Outdoor cats get sick, they get in fights, they freeze, and they get hit by cars. Keep them inside.

p.s. it was a brown and black striped cat, if you know anyone in the hamptons area with one. if the owner sees this, i truly am sorry.",2023-10-21 15:28:01+00:00,2023,10,21,5,Saturday,42,15,fall,2022-2023_api_transition,keep your cats inside! tw !dead animal! now i love petting outdoor cats i ll pspsps all day long at them. but for every one that i see i can t help but think of the owner that doesn t seem to care for their pet s safety. which makes it all the more tragic when i was driving street this morning and saw a poor thing that must have gotten hit by a car in the night. i feel sick and i can t get the image out of my head. i pity and hate whatever owner let this happen so let it be a warning. outdoor cats get sick they get in fights they freeze and they get hit by cars. keep them inside. p.s. it was a brown and black striped cat if you know anyone in the hamptons area with one. if the owner sees this i truly am sorry.,719,154,True,True,1,1,True,0.8453947368421053,0.13,False,True,False,True,False,False,True,2023_Q4,19c5ce2ef1c2a493,-0.9621,0.099,0.71,0.19,negative
17hrcbr,"For our new Edmonton citizens,","If you come from Ontario or BC, do yourself a favour and grab a humidifier for your bedside table. Eczema lotion ( goldbond is reasonably priced) after a shower can help lock in moisture as well. 

Ladies, if you wonder why you wake up and your skin looks like crap, I cannot stress this enough that humidifiers seriously help.

Alberta is dry as hell already and with the furnace going it makes it even more dry. We don't have a new build so there's no humidity option for our furnace, as an FYI. 

My plant shelf sensor dropped from 56% to 32% when the furnace is going. Yeesh. 

Enjoy the winter, and grab some yaktraks or other related spiked footwear, the ice sucks. Edmonton generally goes through freeze/thaw cycles in the later winter and sidewalks can become icy very fast.",1698423831.0,275,100,Discussion,0.91,/r/Edmonton/comments/17hrcbr/for_our_new_edmonton_citizens/,https://www.reddit.com/r/Edmonton/comments/17hrcbr/for_our_new_edmonton_citizens/,True,False,False,False,False,Edmonton,"For our new Edmonton citizens, If you come from Ontario or BC, do yourself a favour and grab a humidifier for your bedside table. Eczema lotion ( goldbond is reasonably priced) after a shower can help lock in moisture as well. 

Ladies, if you wonder why you wake up and your skin looks like crap, I cannot stress this enough that humidifiers seriously help.

Alberta is dry as hell already and with the furnace going it makes it even more dry. We don't have a new build so there's no humidity option for our furnace, as an FYI. 

My plant shelf sensor dropped from 56% to 32% when the furnace is going. Yeesh. 

Enjoy the winter, and grab some yaktraks or other related spiked footwear, the ice sucks. Edmonton generally goes through freeze/thaw cycles in the later winter and sidewalks can become icy very fast.",2023-10-27 16:23:51+00:00,2023,10,27,4,Friday,43,16,fall,2022-2023_api_transition,for our new edmonton citizens if you come from ontario or bc do yourself a favour and grab a humidifier for your bedside table. eczema lotion goldbond is reasonably priced after a shower can help lock in moisture as well. ladies if you wonder why you wake up and your skin looks like crap i cannot stress this enough that humidifiers seriously help. alberta is dry as hell already and with the furnace going it makes it even more dry. we don t have a new build so there s no humidity option for our furnace as an fyi. my plant shelf sensor dropped from to when the furnace is going. yeesh. enjoy the winter and grab some yaktraks or other related spiked footwear the ice sucks. edmonton generally goes through freeze thaw cycles in the later winter and sidewalks can become icy very fast.,788,145,False,True,0,3,False,0.36231884057971014,0.08999999999999997,False,True,False,True,False,False,True,2023_Q4,4f4b05a57df982bf,0.6776,0.129,0.788,0.083,positive
176j0ad,Anybody hear anything else about this? https://www.sasktoday.ca/crime-cops-court/waskesiu-rcmp-issue-dangerous-person-alert-7676637,,1697148498.0,2,0,None,0.57,/r/saskatchewan/comments/176j0ad/anybody_hear_anything_else_about_this/,https://www.reddit.com/r/saskatchewan/comments/176j0ad/anybody_hear_anything_else_about_this/,True,False,False,False,False,saskatchewan,Anybody hear anything else about this? https://www.sasktoday.ca/crime-cops-court/waskesiu-rcmp-issue-dangerous-person-alert-7676637 ,2023-10-12 22:08:18+00:00,2023,10,12,3,Thursday,41,22,fall,2022-2023_api_transition,anybody hear anything else about this?,38,6,True,False,4,0,False,0.0,0.43000000000000005,False,True,False,True,False,False,True,2023_Q4,26a3e64e85c4d180,0.0,0.0,1.0,0.0,neutral
