id,title,selftext,created_utc,score,num_comments,link_flair_text,upvote_ratio,permalink,url,is_self,over_18,spoiler,stickied,locked,subreddit,full_text,created_date,year,month,day,day_of_week,day_name,week_of_year,hour,season,platform_period,cleaned_text,text_length,word_count,contains_crime_keywords,contains_weather_keywords,crime_keyword_count,weather_keyword_count,crime_and_weather,engagement_rate,controversy_score,is_2022,is_2023,pre_api_announcement,post_api_announcement,during_blackout,pre_api_changes,post_api_changes,quarter,author_hash,sentiment_compound,sentiment_positive,sentiment_neutral,sentiment_negative,sentiment_category
17sodf7,What makes S'toon a better place to live than Winnipeg? Scenery? The people? Nightlife? Traffic? Better jobs? Bunny hugs? Less crime?,,1699682910.0,7,39,Question,0.61,/r/saskatoon/comments/17sodf7/what_makes_stoon_a_better_place_to_live_than/,https://www.reddit.com/r/saskatoon/comments/17sodf7/what_makes_stoon_a_better_place_to_live_than/,True,False,False,False,False,Saskatoon,What makes S'toon a better place to live than Winnipeg? Scenery? The people? Nightlife? Traffic? Better jobs? Bunny hugs? Less crime? ,2023-11-11 06:08:30+00:00,2023,11,11,5,Saturday,45,6,fall,2022-2023_api_transition,what makes s toon a better place to live than winnipeg? scenery? the people? nightlife? traffic? better jobs? bunny hugs? less crime?,133,22,True,False,1,0,False,4.875,0.39,False,True,False,True,False,False,True,2023_Q4,540d838535bd44dc,0.7752,0.32,0.578,0.103,positive
17lhom5,Is this the most crime region of Saskatoon “1100 block of 22nd Street West”?,,1698860460.0,5,11,Question,0.65,/r/saskatoon/comments/17lhom5/is_this_the_most_crime_region_of_saskatoon_1100/,https://www.reddit.com/r/saskatoon/comments/17lhom5/is_this_the_most_crime_region_of_saskatoon_1100/,True,False,False,False,False,Saskatoon,Is this the most crime region of Saskatoon “1100 block of 22nd Street West”? ,2023-11-01 17:41:00+00:00,2023,11,1,2,Wednesday,44,17,fall,2022-2023_api_transition,is this the most crime region of saskatoon ADDRESS west ?,57,11,True,False,1,0,False,1.8333333333333333,0.35,False,True,False,True,False,False,True,2023_Q4,23fe29df23f3a2d5,-0.5849,0.0,0.725,0.275,negative
17n62g5,"'Not tasting one day of real jail': Criminal defence lawyer calls Dawn Walker sentence 'very, very light'",,1699048194.0,118,114,News,0.91,/r/saskatoon/comments/17n62g5/not_tasting_one_day_of_real_jail_criminal_defence/,https://saskatoon.ctvnews.ca/not-tasting-one-day-of-real-jail-criminal-defence-lawyer-calls-dawn-walker-sentence-very-very-light-1.6630494,False,False,False,False,False,Saskatoon,"'Not tasting one day of real jail': Criminal defence lawyer calls Dawn Walker sentence 'very, very light' ",2023-11-03 21:49:54+00:00,2023,11,3,4,Friday,44,21,fall,2022-2023_api_transition,not tasting one day of real jail criminal defence lawyer calls dawn walker sentence very very light,99,17,True,False,1,0,False,0.957983193277311,0.08999999999999997,False,True,False,True,False,False,True,2023_Q4,c2cc70eff694799d,-0.4019,0.134,0.697,0.169,negative
17lp5gb,Ambulance Theft / Injured Paramedic - 1100 Block 22nd Street West,,1698880297.0,42,33,Police Updates,0.92,/r/saskatoon/comments/17lp5gb/ambulance_theft_injured_paramedic_1100_block_22nd/,https://saskatoonpolice.ca/news/2023671,False,False,False,False,False,Saskatoon,Ambulance Theft / Injured Paramedic - 1100 Block 22nd Street West ,2023-11-01 23:11:37+00:00,2023,11,1,2,Wednesday,44,23,fall,2022-2023_api_transition,ambulance theft injured paramedic ADDRESS west,46,6,True,False,1,0,False,0.7674418604651163,0.07999999999999996,False,True,False,True,False,False,True,2023_Q4,ea21b71ec4b98443,-0.4019,0.0,0.649,0.351,negative
17mbz6f,Ex-Legacy Christian Academy director pleads not guilty to assaults,,1698954496.0,25,2,News,0.86,/r/saskatoon/comments/17mbz6f/exlegacy_christian_academy_director_pleads_not/,https://thestarphoenix.com/news/crime/former-legacy-christian-academy-director-pleads-not-guilty-to-historical-assaults#main-content,False,False,False,False,False,Saskatoon,Ex-Legacy Christian Academy director pleads not guilty to assaults ,2023-11-02 19:48:16+00:00,2023,11,2,3,Thursday,44,19,fall,2022-2023_api_transition,ex legacy christian academy director pleads not guilty to assaults,66,10,True,False,1,0,False,0.07692307692307693,0.14,False,True,False,True,False,False,True,2023_Q4,02ccf62e38f4347c,0.6348,0.393,0.607,0.0,positive
1840o92,Why all the cops in WIllowGrove?,"Every intersection around University heights from mccormond to centennial had police vehicles with lights going… must have been about a dozen..

Was it a Moose or a bad guy?",1700966860.0,0,17,Question,0.5,/r/saskatoon/comments/1840o92/why_all_the_cops_in_willowgrove/,https://www.reddit.com/r/saskatoon/comments/1840o92/why_all_the_cops_in_willowgrove/,True,False,False,False,False,Saskatoon,"Why all the cops in WIllowGrove? Every intersection around University heights from mccormond to centennial had police vehicles with lights going… must have been about a dozen..

Was it a Moose or a bad guy?",2023-11-26 02:47:40+00:00,2023,11,26,6,Sunday,47,2,fall,2022-2023_api_transition,why all the cops in willowgrove? every intersection around university heights from mccormond to centennial had police vehicles with lights going must have been about a dozen.. was it a moose or a bad guy?,204,35,True,False,2,0,False,17.0,0.5,False,True,False,True,False,False,True,2023_Q4,32c75197fc014fe2,-0.594,0.0,0.898,0.102,negative
18577wh,"May 20 1993 - Weather Boy Jeff Rogstad live reporting from the Cheers Brew Pub, the night of the Cheers finale",,1701103278.0,53,24,Saskatoon History,0.92,/r/saskatoon/comments/18577wh/may_20_1993_weather_boy_jeff_rogstad_live/,https://youtu.be/EsuKlVryfyQ,False,False,False,False,False,Saskatoon,"May 20 1993 - Weather Boy Jeff Rogstad live reporting from the Cheers Brew Pub, the night of the Cheers finale ",2023-11-27 16:41:18+00:00,2023,11,27,0,Monday,48,16,fall,2022-2023_api_transition,may weather boy jeff rogstad live reporting from the cheers brew pub the night of the cheers finale,99,18,False,True,0,1,False,0.4444444444444444,0.07999999999999996,False,True,False,True,False,False,True,2023_Q4,86c7aec7c519abbd,0.7351,0.279,0.721,0.0,positive
183r7dj,Baby its cold outside,"Come check out the festival of trees at the western development museum, open until 9!",1700939955.0,74,12,Events,0.94,/r/saskatoon/comments/183r7dj/baby_its_cold_outside/,https://www.reddit.com/gallery/183r7dj,False,False,False,False,False,Saskatoon,"Baby its cold outside Come check out the festival of trees at the western development museum, open until 9!",2023-11-25 19:19:15+00:00,2023,11,25,5,Saturday,47,19,fall,2022-2023_api_transition,baby its cold outside come check out the festival of trees at the western development museum open until !,105,19,False,True,0,1,False,0.16,0.06000000000000005,False,True,False,True,False,False,True,2023_Q4,bb632c3db635848c,0.5411,0.162,0.838,0.0,positive
17li5en,Saskatoon's Housing Market's Hot Streak Continues Through October,,1698861694.0,17,38,News,0.77,/r/saskatoon/comments/17li5en/saskatoons_housing_markets_hot_streak_continues/,https://jbuc61.wordpress.com/2023/11/01/post-285-october-2023-in-review/,False,False,False,False,False,Saskatoon,Saskatoon's Housing Market's Hot Streak Continues Through October ,2023-11-01 18:01:34+00:00,2023,11,1,2,Wednesday,44,18,fall,2022-2023_api_transition,saskatoon s housing market s hot streak continues through october,65,10,False,True,0,1,False,2.111111111111111,0.22999999999999998,False,True,False,True,False,False,True,2023_Q4,d81d029b365bc8dc,0.0,0.0,1.0,0.0,neutral
1863mki,Where can I find some AMAZING hot chocolate?,"My gf loves hit chocolate and I want to buy her some Christmas since she's running out of it. I don't want something I can pick up at Walmart or Tim's, wondering if there is a certain bakery or somewhere else that's sells hot chocolate that I can look at?",1701197844.0,1,21,Question,0.55,/r/saskatoon/comments/1863mki/where_can_i_find_some_amazing_hot_chocolate/,https://www.reddit.com/r/saskatoon/comments/1863mki/where_can_i_find_some_amazing_hot_chocolate/,True,False,False,False,False,Saskatoon,"Where can I find some AMAZING hot chocolate? My gf loves hit chocolate and I want to buy her some Christmas since she's running out of it. I don't want something I can pick up at Walmart or Tim's, wondering if there is a certain bakery or somewhere else that's sells hot chocolate that I can look at?",2023-11-28 18:57:24+00:00,2023,11,28,1,Tuesday,48,18,fall,2022-2023_api_transition,where can i find some amazing hot chocolate? my gf loves hit chocolate and i want to buy her some christmas since she s running out of it. i don t want something i can pick up at walmart or tim s wondering if there is a certain bakery or somewhere else that s sells hot chocolate that i can look at?,299,62,False,True,0,1,False,10.5,0.44999999999999996,False,True,False,True,False,False,True,2023_Q4,7bc2d26a113da9f4,0.89,0.181,0.819,0.0,positive
17s6wdt,Hot Topic in Midtown,if anyone is in midtown today could you tell me what squishmallows and five nights at freddys stuff they have?,1699631489.0,0,10,Question,0.24,/r/saskatoon/comments/17s6wdt/hot_topic_in_midtown/,https://www.reddit.com/r/saskatoon/comments/17s6wdt/hot_topic_in_midtown/,True,False,False,False,False,Saskatoon,Hot Topic in Midtown if anyone is in midtown today could you tell me what squishmallows and five nights at freddys stuff they have?,2023-11-10 15:51:29+00:00,2023,11,10,4,Friday,45,15,fall,2022-2023_api_transition,hot topic in midtown if anyone is in midtown today could you tell me what squishmallows and five nights at freddys stuff they have?,131,24,False,True,0,1,False,10.0,0.76,False,True,False,True,False,False,True,2023_Q4,5fede9de8e38f459,0.0,0.0,1.0,0.0,neutral
185p1rh,I am curious as to why there is no snow at this time of the year?,,1701151093.0,0,46,Weather,0.5,/r/saskatoon/comments/185p1rh/i_am_curious_as_to_why_there_is_no_snow_at_this/,https://www.reddit.com/r/saskatoon/comments/185p1rh/i_am_curious_as_to_why_there_is_no_snow_at_this/,True,False,False,False,False,Saskatoon,I am curious as to why there is no snow at this time of the year? ,2023-11-28 05:58:13+00:00,2023,11,28,1,Tuesday,48,5,fall,2022-2023_api_transition,i am curious as to why there is no snow at this time of the year?,65,16,False,True,0,1,False,46.0,0.5,False,True,False,True,False,False,True,2023_Q4,4d1841e48257c6cd,0.0258,0.124,0.757,0.119,neutral
1865jre,"The temperature on my deck right now is 10 above - it's kind of crazy, but I'll take it",,1701202619.0,61,15,Photos of Saskatoon,0.92,/r/saskatoon/comments/1865jre/the_temperature_on_my_deck_right_now_is_10_above/,https://i.redd.it/t52pmjunc53c1.png,False,False,False,False,False,Saskatoon,"The temperature on my deck right now is 10 above - it's kind of crazy, but I'll take it ",2023-11-28 20:16:59+00:00,2023,11,28,1,Tuesday,48,20,fall,2022-2023_api_transition,the temperature on my deck right now is above it s kind of crazy but i ll take it,81,19,False,True,0,1,False,0.24193548387096775,0.07999999999999996,False,True,False,True,False,False,True,2023_Q4,9b99b5ed4f268898,-0.2135,0.0,0.907,0.093,negative
187wsez,Throwback Thursday: Saskatchewan Storm 1991-92 (full game vs. Calgary),"[https://funwhileitlasted.net/2015/05/04/1990-1992-saskatchewan-storm/](https://funwhileitlasted.net/2015/05/04/1990-1992-saskatchewan-storm/)

The Storm's games at Sask Place were kind of fun! 

/Oh, and the video of the game has all the commercials included!

/any memories of the team for those on r/saskatoon ?",1701387398.0,9,1,Saskatoon History,1.0,/r/saskatoon/comments/187wsez/throwback_thursday_saskatchewan_storm_199192_full/,https://www.reddit.com/r/saskatoon/comments/187wsez/throwback_thursday_saskatchewan_storm_199192_full/,True,False,False,False,False,Saskatoon,"Throwback Thursday: Saskatchewan Storm 1991-92 (full game vs. Calgary) [https://funwhileitlasted.net/2015/05/04/1990-1992-saskatchewan-storm/](https://funwhileitlasted.net/2015/05/04/1990-1992-saskatchewan-storm/)

The Storm's games at Sask Place were kind of fun! 

/Oh, and the video of the game has all the commercials included!

/any memories of the team for those on r/saskatoon ?",2023-11-30 23:36:38+00:00,2023,11,30,3,Thursday,48,23,fall,2022-2023_api_transition,throwback thursday saskatchewan storm full game vs. calgary the storm s games at sask place were kind of fun! oh and the video of the game has all the commercials included! any memories of the team for those on r saskatoon ?,224,42,False,True,0,1,False,0.1,0.0,False,True,False,True,False,False,True,2023_Q4,0922eeea59d2e48d,0.556,0.081,0.919,0.0,positive
17w4pxp,Dangerous Criss Crossing: Circle Drive merging onto College Drive to turn left on Central Ave or exiting the turning lanes towards Central back onto College Dr.,The city really needs to make the traffic area safer. Slow down when the snow comes please.,1700084717.0,21,17,Traffic/Road Conditions,0.76,/r/saskatoon/comments/17w4pxp/dangerous_criss_crossing_circle_drive_merging/,https://www.reddit.com/r/saskatoon/comments/17w4pxp/dangerous_criss_crossing_circle_drive_merging/,True,False,False,False,False,Saskatoon,Dangerous Criss Crossing: Circle Drive merging onto College Drive to turn left on Central Ave or exiting the turning lanes towards Central back onto College Dr. The city really needs to make the traffic area safer. Slow down when the snow comes please.,2023-11-15 21:45:17+00:00,2023,11,15,2,Wednesday,46,21,fall,2022-2023_api_transition,dangerous criss crossing circle drive merging onto college drive to turn left on central ave or exiting the turning lanes towards central back onto college dr. the city really needs to make the traffic area safer. slow down when the snow comes please.,251,43,True,True,1,1,True,0.7727272727272727,0.24,False,True,False,True,False,False,True,2023_Q4,fab474ad52936627,0.25,0.106,0.83,0.064,positive
17w4pvy,Dangerous Criss Crossing: Circle Drive merging onto College Drive to turn left on Central Ave or exiting the turning lanes towards Central back onto College Dr.,The city really needs to make the traffic area safer. Slow down when the snow comes please.,1700084713.0,0,11,Traffic/Road Conditions,0.39,/r/saskatoon/comments/17w4pvy/dangerous_criss_crossing_circle_drive_merging/,https://www.reddit.com/r/saskatoon/comments/17w4pvy/dangerous_criss_crossing_circle_drive_merging/,True,False,False,False,False,Saskatoon,Dangerous Criss Crossing: Circle Drive merging onto College Drive to turn left on Central Ave or exiting the turning lanes towards Central back onto College Dr. The city really needs to make the traffic area safer. Slow down when the snow comes please.,2023-11-15 21:45:13+00:00,2023,11,15,2,Wednesday,46,21,fall,2022-2023_api_transition,dangerous criss crossing circle drive merging onto college drive to turn left on central ave or exiting the turning lanes towards central back onto college dr. the city really needs to make the traffic area safer. slow down when the snow comes please.,251,43,True,True,1,1,True,11.0,0.61,False,True,False,True,False,False,True,2023_Q4,fab474ad52936627,0.25,0.106,0.83,0.064,positive
181plpx,New shelter got approved by City councillors for the full 18 months,"City councillors held a meeting today about this new shelter on Idylwyld which resulted to the approval of it. 
There were tears! There were questions with no answers! There was also fear that another “Fairhaven” would be made.

I really don’t understand why we choose this spot. It’s right by the busiest street in the city. People will j walk and cause incidents. People with complex needs are basically everyone who is struggling with suicidal ideation, alcoholics, drug addiction, gangster, etc. so that tiny center won’t be able to hold that for long. 

The wellness shelter in FH is basically a big church with a huge park beside, but here it’s just residents and businesses and a street with busy traffic! Where would people go after being discharged??

I’m aware of nobody wanting to have the shelter in their communities but I was hoping to have at least some neighborhood consultation happening but obvious the provincial gov did nothing! This is not about NIMBY but this is just a way to express opinions as a citizen.

As someone who is working in this Social service field, I know and care about people out there, but this plan with little to no details is bringing me more fear than confidence that this center will help people “sober” after 24 hours! It’s the whole journey of treatment to get someone who “dangers to themselves “ can stay clean! How are we expecting everyone to put up with this? There will be tents set up right outside from people waiting to get help in line! What worst is that we have back alleys here in Mayfair and that would basically be where people stay while waiting to be registered or picked up by police…

Just some thoughts",1700703155.0,30,80,Politics,0.65,/r/saskatoon/comments/181plpx/new_shelter_got_approved_by_city_councillors_for/,https://www.reddit.com/r/saskatoon/comments/181plpx/new_shelter_got_approved_by_city_councillors_for/,True,False,False,False,False,Saskatoon,"New shelter got approved by City councillors for the full 18 months City councillors held a meeting today about this new shelter on Idylwyld which resulted to the approval of it. 
There were tears! There were questions with no answers! There was also fear that another “Fairhaven” would be made.

I really don’t understand why we choose this spot. It’s right by the busiest street in the city. People will j walk and cause incidents. People with complex needs are basically everyone who is struggling with suicidal ideation, alcoholics, drug addiction, gangster, etc. so that tiny center won’t be able to hold that for long. 

The wellness shelter in FH is basically a big church with a huge park beside, but here it’s just residents and businesses and a street with busy traffic! Where would people go after being discharged??

I’m aware of nobody wanting to have the shelter in their communities but I was hoping to have at least some neighborhood consultation happening but obvious the provincial gov did nothing! This is not about NIMBY but this is just a way to express opinions as a citizen.

As someone who is working in this Social service field, I know and care about people out there, but this plan with little to no details is bringing me more fear than confidence that this center will help people “sober” after 24 hours! It’s the whole journey of treatment to get someone who “dangers to themselves “ can stay clean! How are we expecting everyone to put up with this? There will be tents set up right outside from people waiting to get help in line! What worst is that we have back alleys here in Mayfair and that would basically be where people stay while waiting to be registered or picked up by police…

Just some thoughts",2023-11-23 01:32:35+00:00,2023,11,23,3,Thursday,47,1,fall,2022-2023_api_transition,new shelter got approved by city councillors for the full months city councillors held a meeting today about this new shelter on idylwyld which resulted to the approval of it. there were tears! there were questions with no answers! there was also fear that another fairhaven would be made. i really don t understand why we choose this spot. it s right by the busiest street in the city. people will j walk and cause incidents. people with complex needs are basically everyone who is struggling with suicidal ideation alcoholics drug addiction gangster etc. so that tiny center won t be able to hold that for long. the wellness shelter in fh is basically a big church with a huge park beside but here it s just residents and businesses and a street with busy traffic! where would people go after being discharged?? i m aware of nobody wanting to have the shelter in their communities but i was hoping to have at least some neighborhood consultation happening but obvious the provincial gov did nothing! this is not about nimby but this is just a way to express opinions as a citizen. as someone who is working in this social service field i know and care about people out there but this plan with little to no details is bringing me more fear than confidence that this center will help people sober after hours! it s the whole journey of treatment to get someone who dangers to themselves can stay clean! how are we expecting everyone to put up with this? there will be tents set up right outside from people waiting to get help in line! what worst is that we have back alleys here in mayfair and that would basically be where people stay while waiting to be registered or picked up by police just some thoughts,1710,309,True,False,2,0,False,2.5806451612903225,0.35,False,True,False,True,False,False,True,2023_Q4,e0372db8eabfb047,0.8784,0.105,0.818,0.076,positive
17rp0in,Arrest - High-Speed Evade Police / Stolen Vehicles,,1699569189.0,43,24,Police Updates,0.95,/r/saskatoon/comments/17rp0in/arrest_highspeed_evade_police_stolen_vehicles/,https://saskatoonpolice.ca/news/2023687,False,False,False,False,False,Saskatoon,Arrest - High-Speed Evade Police / Stolen Vehicles ,2023-11-09 22:33:09+00:00,2023,11,9,3,Thursday,45,22,fall,2022-2023_api_transition,arrest high speed evade police stolen vehicles,46,7,True,False,4,0,False,0.5454545454545454,0.050000000000000044,False,True,False,True,False,False,True,2023_Q4,ea21b71ec4b98443,-0.6808,0.0,0.472,0.528,negative
17mygzh,Snowbird - house maitenance,"Looking after a relative’s house who just left for a couple of months. I regularly go to their house and leave random lights on from time to time. My question is specifically about their water. Should I shut off their water main and water heater? I guess my concern is if water does not flow regularly into the house, it might cause the pipes coming in from outside to freeze when it gets colder, or will it not? Am I just better off running the water whenever I am there?",1699027549.0,16,30,Question,0.9,/r/saskatoon/comments/17mygzh/snowbird_house_maitenance/,https://www.reddit.com/r/saskatoon/comments/17mygzh/snowbird_house_maitenance/,True,False,False,False,False,Saskatoon,"Snowbird - house maitenance Looking after a relative’s house who just left for a couple of months. I regularly go to their house and leave random lights on from time to time. My question is specifically about their water. Should I shut off their water main and water heater? I guess my concern is if water does not flow regularly into the house, it might cause the pipes coming in from outside to freeze when it gets colder, or will it not? Am I just better off running the water whenever I am there?",2023-11-03 16:05:49+00:00,2023,11,3,4,Friday,44,16,fall,2022-2023_api_transition,snowbird house maitenance looking after a relative s house who just left for a couple of months. i regularly go to their house and leave random lights on from time to time. my question is specifically about their water. should i shut off their water main and water heater? i guess my concern is if water does not flow regularly into the house it might cause the pipes coming in from outside to freeze when it gets colder or will it not? am i just better off running the water whenever i am there?,496,94,False,True,0,3,False,1.7647058823529411,0.09999999999999998,False,True,False,True,False,False,True,2023_Q4,a60605676bdb6405,0.533,0.048,0.94,0.012,positive
183kz8d,Saskatoon tenants brace for second winter without main heating system,,1700922740.0,26,18,News,0.85,/r/saskatoon/comments/183kz8d/saskatoon_tenants_brace_for_second_winter_without/,https://saskatoon.ctvnews.ca/saskatoon-tenants-brace-for-second-winter-without-main-heating-system-1.6659817,False,False,False,False,False,Saskatoon,Saskatoon tenants brace for second winter without main heating system ,2023-11-25 14:32:20+00:00,2023,11,25,5,Saturday,47,14,fall,2022-2023_api_transition,saskatoon tenants brace for second winter without main heating system,69,10,False,True,0,1,False,0.6666666666666666,0.15000000000000002,False,True,False,True,False,False,True,2023_Q4,e9efbfa272768d2b,0.0,0.0,1.0,0.0,neutral
