id,title,selftext,created_utc,score,num_comments,link_flair_text,upvote_ratio,permalink,url,is_self,over_18,spoiler,stickied,locked,subreddit,full_text,created_date,year,month,day,day_of_week,day_name,week_of_year,hour,season,platform_period,cleaned_text,text_length,word_count,contains_crime_keywords,contains_weather_keywords,crime_keyword_count,weather_keyword_count,crime_and_weather,engagement_rate,controversy_score,is_2014,is_2015,is_2016,is_2017,is_2018,is_2019,reddit_growth_period,half_year,quarter,author_hash,sentiment_compound,sentiment_positive,sentiment_neutral,sentiment_negative,sentiment_category
643rup,"Sixteen year old shot by assailant for not giving into attempted robbery. (They were NOT known to each other, random crime).",,1491605952.0,5,8,None,0.62,/r/saskatoon/comments/643rup/sixteen_year_old_shot_by_assailant_for_not_giving/,http://saskatoonpolice.ca/news/2017305,False,False,False,False,False,Saskatoon,"Sixteen year old shot by assailant for not giving into attempted robbery. (They were NOT known to each other, random crime). ",2017-04-07 22:59:12+00:00,2017,4,7,4,Friday,14,22,spring,2014-2019_pre_pandemic_era,sixteen year old shot by assailant for not giving into attempted robbery. they were not known to each other random crime .,122,22,True,True,2,1,True,1.3333333333333333,0.38,False,False,False,True,False,False,mid_growth,2017_H1,2017_Q2,dbd536f67e2b4f7c,-0.6742,0.0,0.783,0.217,negative
64sc6z,Saskatoon weather outlook: major storm set to hit Easter weekend - Saskatoon,,1491932126.0,0,2,None,0.5,/r/saskatoon/comments/64sc6z/saskatoon_weather_outlook_major_storm_set_to_hit/,http://globalnews.ca/news/3368845/saskatoon-weather-outlook-major-storm-set-to-hit-easter-weekend/,False,False,False,False,False,Saskatoon,Saskatoon weather outlook: major storm set to hit Easter weekend - Saskatoon ,2017-04-11 17:35:26+00:00,2017,4,11,1,Tuesday,15,17,spring,2014-2019_pre_pandemic_era,saskatoon weather outlook major storm set to hit easter weekend saskatoon,73,11,False,True,0,2,False,2.0,0.5,False,False,False,True,False,False,mid_growth,2017_H1,2017_Q2,f163dc0a97fe1c50,0.0,0.0,1.0,0.0,neutral
683sj4,Weekly/biweekly Summer Dnd Game,"Hey folks, I'm coming back from University for the summer and am looking at starting up or getting involved with a 5th edition dnd game for the next 4 months.  If you have a game that I could join, or are interested in playing once a week or every 2 weeks, please let me know.

I'm an early 20s guy who is studying history at Carleton University.  I've been playing Dnd for the last 10 years, starting with 3.5 and now up to 5th.  I have a homebrew world that is a mix of skyrim and Westeros.  I really like intricate plots and quest arcs, and lots of social challenges and combat.  If you're interested in playing, or have a game going that could do with an extra player, let me know!",1493397699.0,7,2,Question,0.82,/r/regina/comments/683sj4/weeklybiweekly_summer_dnd_game/,https://www.reddit.com/r/regina/comments/683sj4/weeklybiweekly_summer_dnd_game/,True,False,False,False,False,Regina,"Weekly/biweekly Summer Dnd Game Hey folks, I'm coming back from University for the summer and am looking at starting up or getting involved with a 5th edition dnd game for the next 4 months.  If you have a game that I could join, or are interested in playing once a week or every 2 weeks, please let me know.

I'm an early 20s guy who is studying history at Carleton University.  I've been playing Dnd for the last 10 years, starting with 3.5 and now up to 5th.  I have a homebrew world that is a mix of skyrim and Westeros.  I really like intricate plots and quest arcs, and lots of social challenges and combat.  If you're interested in playing, or have a game going that could do with an extra player, let me know!",2017-04-28 16:41:39+00:00,2017,4,28,4,Friday,17,16,spring,2014-2019_pre_pandemic_era,weekly biweekly summer dnd game hey folks i m coming back from university for the summer and am looking at starting up or getting involved with a th edition dnd game for the next months. if you have a game that i could join or are interested in playing once a week or every weeks please let me know. i m an early s guy who is studying history at carleton university. i ve been playing dnd for the last years starting with . and now up to th. i have a homebrew world that is a mix of skyrim and westeros. i really like intricate plots and quest arcs and lots of social challenges and combat. if you re interested in playing or have a game going that could do with an extra player let me know!,691,138,False,True,0,1,False,0.25,0.18000000000000005,False,False,False,True,False,False,mid_growth,2017_H1,2017_Q2,1873c4a5d069d484,0.9345,0.143,0.841,0.016,positive
63luc5,Looking back at the Winnipeg blizzard that led to the Flood of the Century,,1491402413.0,31,17,History,0.87,/r/Winnipeg/comments/63luc5/looking_back_at_the_winnipeg_blizzard_that_led_to/,http://globalnews.ca/news/3356580/looking-back-at-the-blizzard-that-led-to-the-flood-of-the-century/?sf68127848=1,False,False,False,False,False,Winnipeg,Looking back at the Winnipeg blizzard that led to the Flood of the Century ,2017-04-05 14:26:53+00:00,2017,4,5,2,Wednesday,14,14,spring,2014-2019_pre_pandemic_era,looking back at the winnipeg blizzard that led to the flood of the century,74,14,False,True,0,1,False,0.53125,0.13,False,False,False,True,False,False,mid_growth,2017_H1,2017_Q2,d446206da5beccbf,0.0,0.0,1.0,0.0,neutral
67upvy,Any obvious reason why the crime rate is so high in SK?,I'm in the process of getting residentship under provincial nominee program. Must stay in SK. Afraid of the crime statistics. Any obvious and simple explanation of this outlier?,1493288411.0,11,20,None,0.92,/r/saskatchewan/comments/67upvy/any_obvious_reason_why_the_crime_rate_is_so_high/,https://www.reddit.com/r/saskatchewan/comments/67upvy/any_obvious_reason_why_the_crime_rate_is_so_high/,True,False,False,False,False,saskatchewan,Any obvious reason why the crime rate is so high in SK? I'm in the process of getting residentship under provincial nominee program. Must stay in SK. Afraid of the crime statistics. Any obvious and simple explanation of this outlier?,2017-04-27 10:20:11+00:00,2017,4,27,3,Thursday,17,10,spring,2014-2019_pre_pandemic_era,any obvious reason why the crime rate is so high in sk? i m in the process of getting residentship under provincial nominee program. must stay in sk. afraid of the crime statistics. any obvious and simple explanation of this outlier?,233,41,True,False,1,0,False,1.6666666666666667,0.07999999999999996,False,False,False,True,False,False,mid_growth,2017_H1,2017_Q2,112071204251c9e2,-0.8105,0.0,0.841,0.159,negative
