id,title,selftext,created_utc,score,num_comments,link_flair_text,upvote_ratio,permalink,url,is_self,over_18,spoiler,stickied,locked,subreddit,full_text,created_date,year,month,day,day_of_week,day_name,week_of_year,hour,season,platform_period,cleaned_text,text_length,word_count,contains_crime_keywords,contains_weather_keywords,crime_keyword_count,weather_keyword_count,crime_and_weather,engagement_rate,controversy_score,is_2014,is_2015,is_2016,is_2017,is_2018,is_2019,reddit_growth_period,half_year,quarter,author_hash,sentiment_compound,sentiment_positive,sentiment_neutral,sentiment_negative,sentiment_category
4d8fiz,Anyone else remember the Saskatchewan Storm? Here's an old clip I found on youtube.,,1459725122.0,5,2,None,0.78,/r/saskatoon/comments/4d8fiz/anyone_else_remember_the_saskatchewan_storm_heres/,https://www.youtube.com/watch?v=4XNWPEGGvRQ,False,False,False,False,False,Saskatoon,Anyone else remember the Saskatchewan Storm? Here's an old clip I found on youtube. ,2016-04-03 23:12:02+00:00,2016,4,3,6,Sunday,13,23,spring,2014-2019_pre_pandemic_era,anyone else remember the saskatchewan storm? here s an old clip i found on youtube.,83,15,False,True,0,1,False,0.3333333333333333,0.21999999999999997,False,False,True,False,False,False,early_growth,2016_H1,2016_Q2,42d30bf83eff6400,0.0,0.0,1.0,0.0,neutral
4dmp1m,What is everyone doing for leisure activities this spring/summer?,"Don't see anything paticularly striking in the leisure guide. My girlfriend and I did a ball room dance class over the winter,one night a week. And we really enjoyed the activity. Anyone know of anything like that for the spring or summer? We were thinking maybe volleyball  but not committed to anything yet. ",1459962495.0,9,45,None,0.91,/r/saskatoon/comments/4dmp1m/what_is_everyone_doing_for_leisure_activities/,https://www.reddit.com/r/saskatoon/comments/4dmp1m/what_is_everyone_doing_for_leisure_activities/,True,False,False,False,False,Saskatoon,"What is everyone doing for leisure activities this spring/summer? Don't see anything paticularly striking in the leisure guide. My girlfriend and I did a ball room dance class over the winter,one night a week. And we really enjoyed the activity. Anyone know of anything like that for the spring or summer? We were thinking maybe volleyball  but not committed to anything yet. ",2016-04-06 17:08:15+00:00,2016,4,6,2,Wednesday,14,17,spring,2014-2019_pre_pandemic_era,what is everyone doing for leisure activities this spring summer? don t see anything paticularly striking in the leisure guide. my girlfriend and i did a ball room dance class over the winter one night a week. and we really enjoyed the activity. anyone know of anything like that for the spring or summer? we were thinking maybe volleyball but not committed to anything yet.,374,65,False,True,0,3,False,4.5,0.08999999999999997,False,False,True,False,False,False,early_growth,2016_H1,2016_Q2,8e8147887f61a0e8,0.2927,0.064,0.903,0.032,positive
4grpn4,Regina crime stats increasing by leaps,,1461806585.0,11,7,None,1.0,/r/regina/comments/4grpn4/regina_crime_stats_increasing_by_leaps/,http://www.cbc.ca/news/canada/saskatchewan/crime-statistics-regina-police-1.3556021,False,False,False,False,False,Regina,Regina crime stats increasing by leaps ,2016-04-28 01:23:05+00:00,2016,4,28,3,Thursday,17,1,spring,2014-2019_pre_pandemic_era,regina crime stats increasing by leaps,38,6,True,False,1,0,False,0.5833333333333334,0.0,False,False,True,False,False,False,early_growth,2016_H1,2016_Q2,770d4473a391051c,-0.5423,0.0,0.588,0.412,negative
4h0ojt,Man seriously injured in Broad St. nightclub assault,,1461953211.0,6,8,None,1.0,/r/regina/comments/4h0ojt/man_seriously_injured_in_broad_st_nightclub/,http://globalnews.ca/news/2670392/man-seriously-injured-in-broad-st-nightclub-assault/,False,False,False,False,False,Regina,Man seriously injured in Broad St. nightclub assault ,2016-04-29 18:06:51+00:00,2016,4,29,4,Friday,17,18,spring,2014-2019_pre_pandemic_era,man seriously injured in broad st. nightclub assault,52,8,True,False,1,0,False,1.1428571428571428,0.0,False,False,True,False,False,False,early_growth,2016_H1,2016_Q2,2722069b05a2697c,-0.802,0.0,0.379,0.621,negative
4h179m,YAS basketball coach also former child molester,"Just got my YAS basketball brochure in the mail.

Coach Denis Hall plead guilty in 1981 of two accounts of intercourse with girls aged 14-16 and two accounts of indecent assault of females. This was while he was employed as a teacher and the girls were members of the basketball team he coached. I don't know if he's still directly coaching but it looks like he's still involved with YAS as of 2015 according to their facebook page.

I'll just leave this here. Sorry about the ads. http://caselaw.canada.globe24h.com/0/0/saskatchewan/court-of-appeal-for-saskatchewan/2009/10/29/hall-v-regina-school-division-no-4-of-saskatchewan-2009-skca-118.shtml",1461959696.0,19,4,None,0.89,/r/regina/comments/4h179m/yas_basketball_coach_also_former_child_molester/,https://www.reddit.com/r/regina/comments/4h179m/yas_basketball_coach_also_former_child_molester/,True,False,False,False,False,Regina,"YAS basketball coach also former child molester Just got my YAS basketball brochure in the mail.

Coach Denis Hall plead guilty in 1981 of two accounts of intercourse with girls aged 14-16 and two accounts of indecent assault of females. This was while he was employed as a teacher and the girls were members of the basketball team he coached. I don't know if he's still directly coaching but it looks like he's still involved with YAS as of 2015 according to their facebook page.

I'll just leave this here. Sorry about the ads. http://caselaw.canada.globe24h.com/0/0/saskatchewan/court-of-appeal-for-saskatchewan/2009/10/29/hall-v-regina-school-division-no-4-of-saskatchewan-2009-skca-118.shtml",2016-04-29 19:54:56+00:00,2016,4,29,4,Friday,17,19,spring,2014-2019_pre_pandemic_era,yas basketball coach also former child molester just got my yas basketball brochure in the mail. coach denis hall plead guilty in of two accounts of intercourse with girls aged and two accounts of indecent assault of females. this was while he was employed as a teacher and the girls were members of the basketball team he coached. i don t know if he s still directly coaching but it looks like he s still involved with yas as of according to their facebook page. i ll just leave this here. sorry about the ads.,511,95,True,False,1,0,False,0.2,0.10999999999999999,False,False,True,False,False,False,early_growth,2016_H1,2016_Q2,f65e9cf7a4adef51,-0.4497,0.032,0.877,0.091,negative
4cy104,Here’s What Canadian Winter Looks Like Through The Eyes Of A Syrian Refugee (Who Settled in Regina),,1459543791.0,53,10,None,0.94,/r/regina/comments/4cy104/heres_what_canadian_winter_looks_like_through_the/,http://www.buzzfeed.com/hanyalmoulia/heres-what-canadian-winter-looks-like-through-the-eyes-of-a?utm_term=.du2JknBRo#.qn99PBK3q,False,False,False,False,False,Regina,Here’s What Canadian Winter Looks Like Through The Eyes Of A Syrian Refugee (Who Settled in Regina) ,2016-04-01 20:49:51+00:00,2016,4,1,4,Friday,13,20,spring,2014-2019_pre_pandemic_era,here s what canadian winter looks like through the eyes of a syrian refugee who settled in regina,97,18,False,True,0,1,False,0.18518518518518517,0.06000000000000005,False,False,True,False,False,False,early_growth,2016_H1,2016_Q2,0839dbc7cd97cf33,0.3612,0.128,0.872,0.0,positive
4ge5hg,City won't release flood predictions. Neighbourhood maps show impact of once-in-a-century storm event,,1461602376.0,11,11,None,0.87,/r/Edmonton/comments/4ge5hg/city_wont_release_flood_predictions_neighbourhood/,http://edmontonjournal.com/news/local-news/city-of-edmonton-says-no-to-releasing-neighbourhood-flood-predictions,False,False,False,False,False,Edmonton,City won't release flood predictions. Neighbourhood maps show impact of once-in-a-century storm event ,2016-04-25 16:39:36+00:00,2016,4,25,0,Monday,17,16,spring,2014-2019_pre_pandemic_era,city won t release flood predictions. neighbourhood maps show impact of once in a century storm event,101,17,False,True,0,1,False,0.9166666666666666,0.13,False,False,True,False,False,False,early_growth,2016_H1,2016_Q2,0bdc3b55fe40c3e5,0.5719,0.188,0.812,0.0,positive
4dg5wx,Brandon University (BU) tries to silence sexual assault victims,,1459859012.0,7,20,None,0.67,/r/Manitoba/comments/4dg5wx/brandon_university_bu_tries_to_silence_sexual/,http://imgur.com/ai7OH12,False,False,False,False,False,manitoba,Brandon University (BU) tries to silence sexual assault victims ,2016-04-05 12:23:32+00:00,2016,4,5,1,Tuesday,14,12,spring,2014-2019_pre_pandemic_era,brandon university bu tries to silence sexual assault victims,61,9,True,False,2,0,False,2.5,0.32999999999999996,False,False,True,False,False,False,early_growth,2016_H1,2016_Q2,7fcfe97a51a5a4df,-0.7269,0.0,0.534,0.466,negative
