id,title,selftext,created_utc,score,num_comments,link_flair_text,upvote_ratio,permalink,url,is_self,over_18,spoiler,stickied,locked,subreddit,full_text,created_date,year,month,day,day_of_week,day_name,week_of_year,hour,season,platform_period,cleaned_text,text_length,word_count,contains_crime_keywords,contains_weather_keywords,crime_keyword_count,weather_keyword_count,crime_and_weather,engagement_rate,controversy_score,is_2014,is_2015,is_2016,is_2017,is_2018,is_2019,reddit_growth_period,half_year,quarter,author_hash,sentiment_compound,sentiment_positive,sentiment_neutral,sentiment_negative,sentiment_category
6aolcw,Saskatoon Crime Stoppers,,1494554812.0,41,4,None,0.89,/r/saskatoon/comments/6aolcw/saskatoon_crime_stoppers/,http://imgur.com/a/QoccW,False,False,False,False,False,Saskatoon,Saskatoon Crime Stoppers ,2017-05-12 02:06:52+00:00,2017,5,12,4,Friday,19,2,spring,2014-2019_pre_pandemic_era,saskatoon crime stoppers,24,3,True,False,1,0,False,0.09523809523809523,0.10999999999999999,False,False,False,True,False,False,mid_growth,2017_H1,2017_Q2,2eb4f17a8d5f63c9,-0.5423,0.0,0.364,0.636,negative
6bj8c2,Crime: Man stabbed while sitting in car outside restaurant,,1494958753.0,12,2,None,0.87,/r/saskatoon/comments/6bj8c2/crime_man_stabbed_while_sitting_in_car_outside/,http://thestarphoenix.com/news/crime/man-stabbed-while-sitting-in-car-outside-restaurant,False,False,False,False,False,Saskatoon,Crime: Man stabbed while sitting in car outside restaurant ,2017-05-16 18:19:13+00:00,2017,5,16,1,Tuesday,20,18,spring,2014-2019_pre_pandemic_era,crime man stabbed while sitting in car outside restaurant,57,9,True,False,1,0,False,0.15384615384615385,0.13,False,False,False,True,False,False,mid_growth,2017_H1,2017_Q2,dbd536f67e2b4f7c,-0.7506,0.0,0.522,0.478,negative
6dn72b,Assault With A Weapon Near Broadway Bridge,,1495884180.0,20,6,None,0.86,/r/saskatoon/comments/6dn72b/assault_with_a_weapon_near_broadway_bridge/,http://saskatoonpolice.ca/news/2017430,False,False,False,False,False,Saskatoon,Assault With A Weapon Near Broadway Bridge ,2017-05-27 11:23:00+00:00,2017,5,27,5,Saturday,21,11,spring,2014-2019_pre_pandemic_era,assault with a weapon near broadway bridge,42,7,True,False,1,0,False,0.2857142857142857,0.14,False,False,False,True,False,False,mid_growth,2017_H1,2017_Q2,2eb4f17a8d5f63c9,-0.7184,0.0,0.455,0.545,negative
6bpwuh,Unlawful Confinement/Aggravated Assault - Avenue G And 17th Street,,1495039719.0,3,4,None,0.64,/r/saskatoon/comments/6bpwuh/unlawful_confinementaggravated_assault_avenue_g/,http://saskatoonpolice.ca/news/2017403,False,False,False,False,False,Saskatoon,Unlawful Confinement/Aggravated Assault - Avenue G And 17th Street ,2017-05-17 16:48:39+00:00,2017,5,17,2,Wednesday,20,16,spring,2014-2019_pre_pandemic_era,unlawful confinement aggravated assault avenue g and th street,62,9,True,False,1,0,False,1.0,0.36,False,False,False,True,False,False,mid_growth,2017_H1,2017_Q2,dbd536f67e2b4f7c,-0.7717,0.0,0.511,0.489,negative
6bik0i,Where can i find some good cold brew coffee?,,1494952499.0,11,5,Question,0.91,/r/regina/comments/6bik0i/where_can_i_find_some_good_cold_brew_coffee/,https://www.reddit.com/r/regina/comments/6bik0i/where_can_i_find_some_good_cold_brew_coffee/,True,False,False,False,False,Regina,Where can i find some good cold brew coffee? ,2017-05-16 16:34:59+00:00,2017,5,16,1,Tuesday,20,16,spring,2014-2019_pre_pandemic_era,where can i find some good cold brew coffee?,44,9,False,True,0,1,False,0.4166666666666667,0.08999999999999997,False,False,False,True,False,False,mid_growth,2017_H1,2017_Q2,66e8e6edc6f7d3e6,0.4404,0.266,0.734,0.0,positive
69ezde,Skeeters making backyard unusable in summer,"We have a very shady backyard, and in summer it's essentially unusable due to the amount of mosquitos we get back there. It's a very lovely yard and I want my kids to be able to enjoy it in the summer. Someone has suggested getting the yard sprayed and I was wondering if anyone could comment on the efficacy of that or offer any other suggestions.",1493994313.0,13,14,Question,0.99,/r/regina/comments/69ezde/skeeters_making_backyard_unusable_in_summer/,https://www.reddit.com/r/regina/comments/69ezde/skeeters_making_backyard_unusable_in_summer/,True,False,False,False,False,Regina,"Skeeters making backyard unusable in summer We have a very shady backyard, and in summer it's essentially unusable due to the amount of mosquitos we get back there. It's a very lovely yard and I want my kids to be able to enjoy it in the summer. Someone has suggested getting the yard sprayed and I was wondering if anyone could comment on the efficacy of that or offer any other suggestions.",2017-05-05 14:25:13+00:00,2017,5,5,4,Friday,18,14,spring,2014-2019_pre_pandemic_era,skeeters making backyard unusable in summer we have a very shady backyard and in summer it s essentially unusable due to the amount of mosquitos we get back there. it s a very lovely yard and i want my kids to be able to enjoy it in the summer. someone has suggested getting the yard sprayed and i was wondering if anyone could comment on the efficacy of that or offer any other suggestions.,391,74,False,True,0,1,False,1.0,0.010000000000000009,False,False,False,True,False,False,mid_growth,2017_H1,2017_Q2,3e36ec99638210c6,0.8221,0.108,0.892,0.0,positive
6a1y9u,Spanish pro soccer team to play this summer at new Mosaic Stadium,,1494288120.0,26,12,News,0.85,/r/regina/comments/6a1y9u/spanish_pro_soccer_team_to_play_this_summer_at/,http://leaderpost.com/news/local-news/spanish-soccer-team-to-play-this-summer-at-new-mosaic-stadium,False,False,False,False,False,Regina,Spanish pro soccer team to play this summer at new Mosaic Stadium ,2017-05-09 00:02:00+00:00,2017,5,9,1,Tuesday,19,0,spring,2014-2019_pre_pandemic_era,spanish pro soccer team to play this summer at new mosaic stadium,65,12,False,True,0,1,False,0.4444444444444444,0.15000000000000002,False,False,False,True,False,False,mid_growth,2017_H1,2017_Q2,a3e6be592bc5d43b,0.34,0.179,0.821,0.0,positive
6d3pt4,Regina Summer camp opportunity: 2017 MSI Computer Camps,"This year marks the 26th annual MSI Computer Camps. The MSI Computer Camps are a set of camps hosted each year on the University of Regina campus and are dedicated to teaching children and youth about computers, Photoshop, website development, video editing, programming, and more. There are also guest speakers from the industry, including a game developer. At the camp, emerging technologies are also shown to campers such as remote-controlled drones. The camp also features many activities such as swimming, bowling, a pizza lunch, and a barbecue in the park. 

This year the camp runs for two weeks. Week one is July 3 to July 7, and week two is July 10 to July 14. The camp is geared for kids age 12-17 and is available to any children regardless of their knowledge or familiarity with what we teach at the camp. Campers are also allowed to register for both weeks. While the content taught each week is the same, second week campers will be given advanced lessons and guidance to challenge them to improve upon their projects from the first week. 

Registrations are coming in fast and there is only a few spots left in each week. If you or someone you know would be interested in registering, head on over to www.compcamps.com for more information and to register. ",1495647722.0,24,4,Events,0.86,/r/regina/comments/6d3pt4/regina_summer_camp_opportunity_2017_msi_computer/,https://www.reddit.com/r/regina/comments/6d3pt4/regina_summer_camp_opportunity_2017_msi_computer/,True,False,False,False,False,Regina,"Regina Summer camp opportunity: 2017 MSI Computer Camps This year marks the 26th annual MSI Computer Camps. The MSI Computer Camps are a set of camps hosted each year on the University of Regina campus and are dedicated to teaching children and youth about computers, Photoshop, website development, video editing, programming, and more. There are also guest speakers from the industry, including a game developer. At the camp, emerging technologies are also shown to campers such as remote-controlled drones. The camp also features many activities such as swimming, bowling, a pizza lunch, and a barbecue in the park. 

This year the camp runs for two weeks. Week one is July 3 to July 7, and week two is July 10 to July 14. The camp is geared for kids age 12-17 and is available to any children regardless of their knowledge or familiarity with what we teach at the camp. Campers are also allowed to register for both weeks. While the content taught each week is the same, second week campers will be given advanced lessons and guidance to challenge them to improve upon their projects from the first week. 

Registrations are coming in fast and there is only a few spots left in each week. If you or someone you know would be interested in registering, head on over to www.compcamps.com for more information and to register. ",2017-05-24 17:42:02+00:00,2017,5,24,2,Wednesday,21,17,spring,2014-2019_pre_pandemic_era,regina summer camp opportunity msi computer camps this year marks the th annual msi computer camps. the msi computer camps are a set of camps hosted each year on the university of regina campus and are dedicated to teaching children and youth about computers photoshop website development video editing programming and more. there are also guest speakers from the industry including a game developer. at the camp emerging technologies are also shown to campers such as remote controlled drones. the camp also features many activities such as swimming bowling a pizza lunch and a barbecue in the park. this year the camp runs for two weeks. week one is july to july and week two is july to july . the camp is geared for kids age and is available to any children regardless of their knowledge or familiarity with what we teach at the camp. campers are also allowed to register for both weeks. while the content taught each week is the same second week campers will be given advanced lessons and guidance to challenge them to improve upon their projects from the first week. registrations are coming in fast and there is only a few spots left in each week. if you or someone you know would be interested in registering head on over to for more information and to register.,1269,223,False,True,0,2,False,0.16,0.14,False,False,False,True,False,False,mid_growth,2017_H1,2017_Q2,0377164a39a1695c,0.9136,0.063,0.937,0.0,positive
6apgdj,"r/winnipeg, I am a cycling noob - is it rude to ride my bike on side walks instead of a bike path or the road? I am looking to ride my bike to the grocery store, the mall, the gym, etc for the summer.","I don't want to ride on the road - I would prefer bike paths, but often there is only the side walks available.  What do I do?",1494566533.0,20,470,Ask Winnipeg,0.75,/r/Winnipeg/comments/6apgdj/rwinnipeg_i_am_a_cycling_noob_is_it_rude_to_ride/,https://www.reddit.com/r/Winnipeg/comments/6apgdj/rwinnipeg_i_am_a_cycling_noob_is_it_rude_to_ride/,True,False,False,False,False,Winnipeg,"r/winnipeg, I am a cycling noob - is it rude to ride my bike on side walks instead of a bike path or the road? I am looking to ride my bike to the grocery store, the mall, the gym, etc for the summer. I don't want to ride on the road - I would prefer bike paths, but often there is only the side walks available.  What do I do?",2017-05-12 05:22:13+00:00,2017,5,12,4,Friday,19,5,spring,2014-2019_pre_pandemic_era,r winnipeg i am a cycling noob is it rude to ride my bike on side walks instead of a bike path or the road? i am looking to ride my bike to the grocery store the mall the gym etc for the summer. i don t want to ride on the road i would prefer bike paths but often there is only the side walks available. what do i do?,317,71,False,True,0,1,False,22.38095238095238,0.25,False,False,False,True,False,False,mid_growth,2017_H1,2017_Q2,a7a9be831e9d4496,-0.3204,0.016,0.937,0.048,negative
6d7gzn,"Mainstreet Equity apartment: My bedroom in my apartment flooded (Twice), what are my options?","Hey Everyone. I'm looking for some advice here. I live in a Mainstreet Equity apartment and I've heard some horror stories about dealing with issues with them. 3-4 weeks ago, my bedroom in my apartment flooded (I live on the basement floor) from the huge amount of snow that we had for a night or two before it all melted. Just tonight, during the giant storm, I come back from work to see that its happened again.

What I think is happening is that the water that is piling up outside my window is seeping through the walls and down underneath my floor boards, as my floor boards feel like they are floating and whenever i step on them, water is coming out of the cracks. There is visible damage to them as well from the water, they look lifted and bloated.

I have documented with pictures and video both times it happened and called my apartment manager and Mainstreet Equity emergency line as well as texted, So i have records of it. The first time it happened, the Apartment manager sent a maintenance worker over who looked at it, after that I didn't hear back from them and they screened my calls and texts. This time, I called and she told me that ""The maintenance worker said everything was okay and nothing needed to be done to it"" and then she said we would talk tomorrow about it because there is nothing they could do today, so i called the main call center and told two different people about it who told me to call back tomorrow as well.

Before I go into this tomorrow, i really want to know what my options are. They did nothing about it the first time and I'm not expecting much this time around, but i want to do whatever i can to have the issue fixed in whatever way possible, whether they pay for me to move, move me to another unit or fix it up. Does anyone have any ideas of what to expect going through this and what i could ask for? Any resources I could use or anyone i could talk to for help? 

TL;DR: Apartment bedroom flooded, I need to know my options when dealing with the company on what i can expect and what i am legally obligated/what i can ask for when dealing with the situation.

Thank you!",1495687131.0,7,18,None,0.74,/r/Edmonton/comments/6d7gzn/mainstreet_equity_apartment_my_bedroom_in_my/,https://www.reddit.com/r/Edmonton/comments/6d7gzn/mainstreet_equity_apartment_my_bedroom_in_my/,True,False,False,False,False,Edmonton,"Mainstreet Equity apartment: My bedroom in my apartment flooded (Twice), what are my options? Hey Everyone. I'm looking for some advice here. I live in a Mainstreet Equity apartment and I've heard some horror stories about dealing with issues with them. 3-4 weeks ago, my bedroom in my apartment flooded (I live on the basement floor) from the huge amount of snow that we had for a night or two before it all melted. Just tonight, during the giant storm, I come back from work to see that its happened again.

What I think is happening is that the water that is piling up outside my window is seeping through the walls and down underneath my floor boards, as my floor boards feel like they are floating and whenever i step on them, water is coming out of the cracks. There is visible damage to them as well from the water, they look lifted and bloated.

I have documented with pictures and video both times it happened and called my apartment manager and Mainstreet Equity emergency line as well as texted, So i have records of it. The first time it happened, the Apartment manager sent a maintenance worker over who looked at it, after that I didn't hear back from them and they screened my calls and texts. This time, I called and she told me that ""The maintenance worker said everything was okay and nothing needed to be done to it"" and then she said we would talk tomorrow about it because there is nothing they could do today, so i called the main call center and told two different people about it who told me to call back tomorrow as well.

Before I go into this tomorrow, i really want to know what my options are. They did nothing about it the first time and I'm not expecting much this time around, but i want to do whatever i can to have the issue fixed in whatever way possible, whether they pay for me to move, move me to another unit or fix it up. Does anyone have any ideas of what to expect going through this and what i could ask for? Any resources I could use or anyone i could talk to for help? 

TL;DR: Apartment bedroom flooded, I need to know my options when dealing with the company on what i can expect and what i am legally obligated/what i can ask for when dealing with the situation.

Thank you!",2017-05-25 04:38:51+00:00,2017,5,25,3,Thursday,21,4,spring,2014-2019_pre_pandemic_era,mainstreet equity apartment my bedroom in my apartment flooded twice what are my options? hey everyone. i m looking for some advice here. i live in a mainstreet equity apartment and i ve heard some horror stories about dealing with issues with them. weeks ago my bedroom in my apartment flooded i live on the basement floor from the huge amount of snow that we had for a night or two before it all melted. just tonight during the giant storm i come back from work to see that its happened again. what i think is happening is that the water that is piling up outside my window is seeping through the walls and down underneath my floor boards as my floor boards feel like they are floating and whenever i step on them water is coming out of the cracks. there is visible damage to them as well from the water they look lifted and bloated. i have documented with pictures and video both times it happened and called my apartment manager and mainstreet equity emergency line as well as texted so i have records of it. the first time it happened the apartment manager sent a maintenance worker over who looked at it after that i didn t hear back from them and they screened my calls and texts. this time i called and she told me that the maintenance worker said everything was okay and nothing needed to be done to it and then she said we would talk tomorrow about it because there is nothing they could do today so i called the main call center and told two different people about it who told me to call back tomorrow as well. before i go into this tomorrow i really want to know what my options are. they did nothing about it the first time and i m not expecting much this time around but i want to do whatever i can to have the issue fixed in whatever way possible whether they pay for me to move move me to another unit or fix it up. does anyone have any ideas of what to expect going through this and what i could ask for? any resources i could use or anyone i could talk to for help? tl dr apartment bedroom flooded i need to know my options when dealing with the company on what i can expect and what i am legally obligated what i can ask for when dealing with the situation. thank you!,2187,421,False,True,0,2,False,2.25,0.26,False,False,False,True,False,False,mid_growth,2017_H1,2017_Q2,5fb08989c621d2e8,0.8634,0.049,0.933,0.018,positive
6e5h6v,"Regina LGBT organization wants patio smoking ban exemption, citing safety","chase expansion sparkle bright chunky seemly rinse hat license sharp

 *This post was mass deleted and anonymized with [Redact](https://redact.dev/home)*",1496122906.0,12,13,None,1.0,/r/saskatchewan/comments/6e5h6v/regina_lgbt_organization_wants_patio_smoking_ban/,http://www.cbc.ca/1.4135615,False,False,False,False,False,saskatchewan,"Regina LGBT organization wants patio smoking ban exemption, citing safety chase expansion sparkle bright chunky seemly rinse hat license sharp

 *This post was mass deleted and anonymized with [Redact](https://redact.dev/home)*",2017-05-30 05:41:46+00:00,2017,5,30,1,Tuesday,22,5,spring,2014-2019_pre_pandemic_era,regina lgbt organization wants patio smoking ban exemption citing safety chase expansion sparkle bright chunky seemly rinse hat license sharp this post was mass deleted and anonymized with redact,195,29,True,False,1,0,False,1.0,0.0,False,False,False,True,False,False,mid_growth,2017_H1,2017_Q2,ec1f27e3c7c9c92f,0.5994,0.229,0.674,0.097,positive
6cvxco,"Saskatchewan tops other Canadian provinces on ""Food Performance"": Canada's provincial food report card compares 63 food metrics in 5 areas: industry prosperity, healthy food & diets, food safety, household food security, & environmental sustainability.",,1495558555.0,6,0,None,0.67,/r/saskatchewan/comments/6cvxco/saskatchewan_tops_other_canadian_provinces_on/,http://www.conferenceboard.ca/press/newsrelease/17-05-18/saskatchewan_head_of_the_class_among_provinces_on_food_performance.aspx,False,False,False,False,False,saskatchewan,"Saskatchewan tops other Canadian provinces on ""Food Performance"": Canada's provincial food report card compares 63 food metrics in 5 areas: industry prosperity, healthy food & diets, food safety, household food security, & environmental sustainability. ",2017-05-23 16:55:55+00:00,2017,5,23,1,Tuesday,21,16,spring,2014-2019_pre_pandemic_era,saskatchewan tops other canadian provinces on food performance canada s provincial food report card compares food metrics in areas industry prosperity healthy food diets food safety household food security environmental sustainability.,235,31,True,False,2,0,False,0.0,0.32999999999999996,False,False,False,True,False,False,mid_growth,2017_H1,2017_Q2,9adcc789ef114762,0.8807,0.293,0.707,0.0,positive
6d44ql,Regina summer camp opportunity: 2017 MSI Computer Camps,"This year marks the 26th annual MSI Computer Camps. The MSI Computer Camps are a set of camps hosted each year on the University of Regina campus and are dedicated to teaching children and youth about computers, Photoshop, website development, video editing, programming, and more. There are also guest speakers from the industry, including a game developer. At the camp, emerging technologies are also shown to campers such as remote-controlled drones. The camp also features many activities such as swimming, bowling, a pizza lunch, and a barbecue in the park. 

This year the camp runs for two weeks. Week one is July 3 to July 7, and week two is July 10 to July 14. The camp is geared for kids age 12-17 and is available to any children regardless of their knowledge or familiarity with what we teach at the camp. Campers are also allowed to register for both weeks. While the content taught each week is the same, second week campers will be given advanced lessons and guidance to challenge them to improve upon their projects from the first week. 

Registrations are coming in fast and there is only a few spots left in each week. If you or someone you know would be interested in registering, head on over to www.compcamps.com for more information and to register. ",1495651550.0,13,4,None,0.75,/r/saskatchewan/comments/6d44ql/regina_summer_camp_opportunity_2017_msi_computer/,https://www.reddit.com/r/saskatchewan/comments/6d44ql/regina_summer_camp_opportunity_2017_msi_computer/,True,False,False,False,False,saskatchewan,"Regina summer camp opportunity: 2017 MSI Computer Camps This year marks the 26th annual MSI Computer Camps. The MSI Computer Camps are a set of camps hosted each year on the University of Regina campus and are dedicated to teaching children and youth about computers, Photoshop, website development, video editing, programming, and more. There are also guest speakers from the industry, including a game developer. At the camp, emerging technologies are also shown to campers such as remote-controlled drones. The camp also features many activities such as swimming, bowling, a pizza lunch, and a barbecue in the park. 

This year the camp runs for two weeks. Week one is July 3 to July 7, and week two is July 10 to July 14. The camp is geared for kids age 12-17 and is available to any children regardless of their knowledge or familiarity with what we teach at the camp. Campers are also allowed to register for both weeks. While the content taught each week is the same, second week campers will be given advanced lessons and guidance to challenge them to improve upon their projects from the first week. 

Registrations are coming in fast and there is only a few spots left in each week. If you or someone you know would be interested in registering, head on over to www.compcamps.com for more information and to register. ",2017-05-24 18:45:50+00:00,2017,5,24,2,Wednesday,21,18,spring,2014-2019_pre_pandemic_era,regina summer camp opportunity msi computer camps this year marks the th annual msi computer camps. the msi computer camps are a set of camps hosted each year on the university of regina campus and are dedicated to teaching children and youth about computers photoshop website development video editing programming and more. there are also guest speakers from the industry including a game developer. at the camp emerging technologies are also shown to campers such as remote controlled drones. the camp also features many activities such as swimming bowling a pizza lunch and a barbecue in the park. this year the camp runs for two weeks. week one is july to july and week two is july to july . the camp is geared for kids age and is available to any children regardless of their knowledge or familiarity with what we teach at the camp. campers are also allowed to register for both weeks. while the content taught each week is the same second week campers will be given advanced lessons and guidance to challenge them to improve upon their projects from the first week. registrations are coming in fast and there is only a few spots left in each week. if you or someone you know would be interested in registering head on over to for more information and to register.,1269,223,False,True,0,2,False,0.2857142857142857,0.25,False,False,False,True,False,False,mid_growth,2017_H1,2017_Q2,0377164a39a1695c,0.9136,0.063,0.937,0.0,positive
