id,title,selftext,created_utc,score,num_comments,link_flair_text,upvote_ratio,permalink,url,is_self,over_18,spoiler,stickied,locked,subreddit,full_text,created_date,year,month,day,day_of_week,day_name,week_of_year,hour,season,platform_period,cleaned_text,text_length,word_count,contains_crime_keywords,contains_weather_keywords,crime_keyword_count,weather_keyword_count,crime_and_weather,engagement_rate,controversy_score,is_2014,is_2015,is_2016,is_2017,is_2018,is_2019,reddit_growth_period,half_year,quarter,author_hash,sentiment_compound,sentiment_positive,sentiment_neutral,sentiment_negative,sentiment_category
7n0727,Crime rate during frigid weather,Is it lower or the same in saskatoon?,1514616887.0,9,16,None,0.74,/r/saskatoon/comments/7n0727/crime_rate_during_frigid_weather/,https://www.reddit.com/r/saskatoon/comments/7n0727/crime_rate_during_frigid_weather/,True,False,False,False,False,Saskatoon,Crime rate during frigid weather Is it lower or the same in saskatoon?,2017-12-30 06:54:47+00:00,2017,12,30,5,Saturday,52,6,winter,2014-2019_pre_pandemic_era,crime rate during frigid weather is it lower or the same in saskatoon?,70,13,True,True,1,1,True,1.6,0.26,False,False,False,True,False,False,mid_growth,2017_H2,2017_Q4,0f092505dcae4c58,-0.6908,0.0,0.659,0.341,negative
7lalhr,CTV reporter assaulted during stand-up outside of The Lighthouse,,1513874381.0,103,66,None,0.94,/r/saskatoon/comments/7lalhr/ctv_reporter_assaulted_during_standup_outside_of/,https://twitter.com/angelinaiCTV/status/943630842034765825?s=09,False,False,False,False,False,Saskatoon,CTV reporter assaulted during stand-up outside of The Lighthouse ,2017-12-21 16:39:41+00:00,2017,12,21,3,Thursday,51,16,winter,2014-2019_pre_pandemic_era,ctv reporter assaulted during stand up outside of the lighthouse,64,10,True,False,1,0,False,0.6346153846153846,0.06000000000000005,False,False,False,True,False,False,mid_growth,2017_H2,2017_Q4,9ce5362c43ed82a8,-0.5267,0.0,0.726,0.274,negative
7mpyez,Saskatoon Police Constable charged with common assault,,1514500007.0,19,19,None,0.88,/r/saskatoon/comments/7mpyez/saskatoon_police_constable_charged_with_common/,http://saskatoonpolice.ca/news/20171055,False,False,False,False,False,Saskatoon,Saskatoon Police Constable charged with common assault ,2017-12-28 22:26:47+00:00,2017,12,28,3,Thursday,52,22,winter,2014-2019_pre_pandemic_era,saskatoon police constable charged with common assault,54,7,True,False,2,0,False,0.95,0.12,False,False,False,True,False,False,mid_growth,2017_H2,2017_Q4,a0a73f3d01b74e1d,-0.6808,0.0,0.472,0.528,negative
7gy09u,"Woman assaulted, confined in Saskatoon basement; police arrest five people",,1512161798.0,18,6,None,0.85,/r/saskatoon/comments/7gy09u/woman_assaulted_confined_in_saskatoon_basement/,http://thestarphoenix.com/news/crime/woman-assaulted-confined-in-saskatoon-basement-police-arrest-five-people,False,False,False,False,False,Saskatoon,"Woman assaulted, confined in Saskatoon basement; police arrest five people ",2017-12-01 20:56:38+00:00,2017,12,1,4,Friday,48,20,winter,2014-2019_pre_pandemic_era,woman assaulted confined in saskatoon basement police arrest five people,72,10,True,False,3,0,False,0.3157894736842105,0.15000000000000002,False,False,False,True,False,False,mid_growth,2017_H2,2017_Q4,32c6527b511e7caf,-0.7003,0.0,0.58,0.42,negative
7je8g2,"3 pedestrian collisions in 3 days on 22nd St., but no plan for quick road safety fixes",,1513115073.0,8,20,None,0.69,/r/saskatoon/comments/7je8g2/3_pedestrian_collisions_in_3_days_on_22nd_st_but/,http://www.cbc.ca/beta/news/canada/saskatoon/pedestrian-vehicle-car-collision-22nd-street-city-hall-1.4441414,False,False,False,False,False,Saskatoon,"3 pedestrian collisions in 3 days on 22nd St., but no plan for quick road safety fixes ",2017-12-12 21:44:33+00:00,2017,12,12,1,Tuesday,50,21,winter,2014-2019_pre_pandemic_era,ADDRESS . but no plan for quick road safety fixes,49,10,True,False,1,0,False,2.2222222222222223,0.31000000000000005,False,False,False,True,False,False,mid_growth,2017_H2,2017_Q4,692495b2474a04b5,0.2263,0.255,0.552,0.193,positive
7m8odo,"Extreme cold weather alert in effect in Toronto on Boxing Day: -12, -23 with the windchill! How will they survive?",,1514305929.0,69,37,None,0.86,/r/saskatoon/comments/7m8odo/extreme_cold_weather_alert_in_effect_in_toronto/,http://www.cbc.ca/1.4464628,False,False,False,False,False,Saskatoon,"Extreme cold weather alert in effect in Toronto on Boxing Day: -12, -23 with the windchill! How will they survive? ",2017-12-26 16:32:09+00:00,2017,12,26,1,Tuesday,52,16,winter,2014-2019_pre_pandemic_era,extreme cold weather alert in effect in toronto on boxing day with the windchill! how will they survive?,104,18,False,True,0,4,False,0.5285714285714286,0.14,False,False,False,True,False,False,mid_growth,2017_H2,2017_Q4,5562eb0ce7041441,0.4129,0.139,0.861,0.0,positive
7lvf39,"Saskatoon cabbie punched in face, left out in the cold after carjacking",,1514126233.0,19,13,None,0.86,/r/saskatoon/comments/7lvf39/saskatoon_cabbie_punched_in_face_left_out_in_the/,http://www.cbc.ca/news/canada/saskatchewan/saskatoon-cabbie-out-cold-carjacking-1.4464170,False,False,False,False,False,Saskatoon,"Saskatoon cabbie punched in face, left out in the cold after carjacking ",2017-12-24 14:37:13+00:00,2017,12,24,6,Sunday,51,14,winter,2014-2019_pre_pandemic_era,saskatoon cabbie punched in face left out in the cold after carjacking,70,12,True,True,1,1,True,0.65,0.14,False,False,False,True,False,False,mid_growth,2017_H2,2017_Q4,a6ddf3fe63da3378,0.0,0.0,1.0,0.0,neutral
7mpzac,“Saskatoon is colder than both the north and south poles”,,1514500238.0,43,19,None,0.89,/r/saskatoon/comments/7mpzac/saskatoon_is_colder_than_both_the_north_and_south/,http://thestarphoenix.com/news/canada/mars-and-the-north-pole-are-warmer-than-winnipeg-a-guide-to-how-damned-cold-it-is/wcm/12062254-d871-4531-8f01-647985ee3003,False,False,False,False,False,Saskatoon,“Saskatoon is colder than both the north and south poles” ,2017-12-28 22:30:38+00:00,2017,12,28,3,Thursday,52,22,winter,2014-2019_pre_pandemic_era,saskatoon is colder than both the north and south poles,55,10,False,True,0,1,False,0.4318181818181818,0.10999999999999999,False,False,False,True,False,False,mid_growth,2017_H2,2017_Q4,5a4aebdaeffdc48f,0.0,0.0,1.0,0.0,neutral
7lc70n,Moving to regina in January Got some questions for you all,"I'm moving from Saskatoon and currently looking for a place near Victoria or Central Park. I'd like to walk to work in order to avoid paying for parking. My concern, since I'll be walking lots, is safety. 

How safe is the downtown area?

Is parking typically included with rent for downtown apartments?

What are the good pubs, bars, and clubs?

Thanks! 

Edit: I should mention the only walking I'll be doing is to and from work, I'll be working 8-4:30.

Edit2: Wow thanks everyone for all your tips. Looks like I shouldn’t have problems where I plan to live (near scarth and 12th), especially as a guy. I’m gonna start calling places and booking appointments. Btw r/Regina is a lot less negative than r/Saskatoon...refreshing! ",1513888182.0,6,38,None,0.75,/r/regina/comments/7lc70n/moving_to_regina_in_january_got_some_questions/,https://www.reddit.com/r/regina/comments/7lc70n/moving_to_regina_in_january_got_some_questions/,True,False,False,False,False,Regina,"Moving to regina in January Got some questions for you all I'm moving from Saskatoon and currently looking for a place near Victoria or Central Park. I'd like to walk to work in order to avoid paying for parking. My concern, since I'll be walking lots, is safety. 

How safe is the downtown area?

Is parking typically included with rent for downtown apartments?

What are the good pubs, bars, and clubs?

Thanks! 

Edit: I should mention the only walking I'll be doing is to and from work, I'll be working 8-4:30.

Edit2: Wow thanks everyone for all your tips. Looks like I shouldn’t have problems where I plan to live (near scarth and 12th), especially as a guy. I’m gonna start calling places and booking appointments. Btw r/Regina is a lot less negative than r/Saskatoon...refreshing! ",2017-12-21 20:29:42+00:00,2017,12,21,3,Thursday,51,20,winter,2014-2019_pre_pandemic_era,moving to regina in january got some questions for you all i m moving from saskatoon and currently looking for a place near victoria or central park. i d like to walk to work in order to avoid paying for parking. my concern since i ll be walking lots is safety. how safe is the downtown area? is parking typically included with rent for downtown apartments? what are the good pubs bars and clubs? thanks! edit i should mention the only walking i ll be doing is to and from work i ll be working . edit wow thanks everyone for all your tips. looks like i shouldn t have problems where i plan to live near scarth and th especially as a guy. i m gonna start calling places and booking appointments. btw r regina is a lot less negative than r saskatoon...refreshing!,761,144,True,False,1,0,False,5.428571428571429,0.25,False,False,False,True,False,False,mid_growth,2017_H2,2017_Q4,cdc47ca3b9a6e5e8,0.9434,0.147,0.803,0.05,positive
7laxa9,"Owner of popular restaurant crashes car through bank door, tries to rob bank vault with a weapon, leaves the scene and assaults 2 officers . Gets 18 month suspended sentence aka not a single day in jail.",,1513877204.0,19,14,Discussion,0.85,/r/regina/comments/7laxa9/owner_of_popular_restaurant_crashes_car_through/,https://www.facebook.com/cbcsask/posts/10154948309211782,False,False,False,False,False,Regina,"Owner of popular restaurant crashes car through bank door, tries to rob bank vault with a weapon, leaves the scene and assaults 2 officers . Gets 18 month suspended sentence aka not a single day in jail. ",2017-12-21 17:26:44+00:00,2017,12,21,3,Thursday,51,17,winter,2014-2019_pre_pandemic_era,owner of popular restaurant crashes car through bank door tries to rob bank vault with a weapon leaves the scene and assaults officers . gets month suspended sentence aka not a single day in jail.,196,35,True,False,1,0,False,0.7,0.15000000000000002,False,False,False,True,False,False,mid_growth,2017_H2,2017_Q4,79b1ccb700ad8714,-0.8519,0.09,0.637,0.273,negative
7lat7k,Today’s Weather report.,,1513876226.0,20,9,None,0.8,/r/regina/comments/7lat7k/todays_weather_report/,https://i.redd.it/wq9vby1r5b501.jpg,False,False,False,False,False,Regina,Today’s Weather report. ,2017-12-21 17:10:26+00:00,2017,12,21,3,Thursday,51,17,winter,2014-2019_pre_pandemic_era,today s weather report.,23,4,False,True,0,1,False,0.42857142857142855,0.19999999999999996,False,False,False,True,False,False,mid_growth,2017_H2,2017_Q4,df1d7115d02e663c,0.0,0.0,1.0,0.0,neutral
7n1qnd,It's -36 outside. -41 with windchilld. Why do you live here?,"Work sent me here, but this small city has grown on me.  Has all the amenities of a big city, but can get anywhere in 10-15 minutes.  Why do you put up with this ridiculous weather and call Regina home?",1514643366.0,34,64,Discussion,0.95,/r/regina/comments/7n1qnd/its_36_outside_41_with_windchilld_why_do_you_live/,https://www.reddit.com/r/regina/comments/7n1qnd/its_36_outside_41_with_windchilld_why_do_you_live/,True,False,False,False,False,Regina,"It's -36 outside. -41 with windchilld. Why do you live here? Work sent me here, but this small city has grown on me.  Has all the amenities of a big city, but can get anywhere in 10-15 minutes.  Why do you put up with this ridiculous weather and call Regina home?",2017-12-30 14:16:06+00:00,2017,12,30,5,Saturday,52,14,winter,2014-2019_pre_pandemic_era,it s outside. with windchilld. why do you live here? work sent me here but this small city has grown on me. has all the amenities of a big city but can get anywhere in minutes. why do you put up with this ridiculous weather and call regina home?,245,49,False,True,0,2,False,1.8285714285714285,0.050000000000000044,False,False,False,True,False,False,mid_growth,2017_H2,2017_Q4,1c56d5792dced34b,-0.6337,0.0,0.92,0.08,negative
7mr8p4,Anywhere indoors to take a puppy for exercise in the winter??,"This is a long shot, but, does anyone know of anywhere indoors that I could take my puppy for exercise in the winter? 

With how cold it's been the last few days, my pup is getting really riled up from lack of exercise. ",1514512931.0,12,13,Question,0.89,/r/regina/comments/7mr8p4/anywhere_indoors_to_take_a_puppy_for_exercise_in/,https://www.reddit.com/r/regina/comments/7mr8p4/anywhere_indoors_to_take_a_puppy_for_exercise_in/,True,False,False,False,False,Regina,"Anywhere indoors to take a puppy for exercise in the winter?? This is a long shot, but, does anyone know of anywhere indoors that I could take my puppy for exercise in the winter? 

With how cold it's been the last few days, my pup is getting really riled up from lack of exercise. ",2017-12-29 02:02:11+00:00,2017,12,29,4,Friday,52,2,winter,2014-2019_pre_pandemic_era,anywhere indoors to take a puppy for exercise in the winter?? this is a long shot but does anyone know of anywhere indoors that i could take my puppy for exercise in the winter? with how cold it s been the last few days my pup is getting really riled up from lack of exercise.,276,55,False,True,0,3,False,1.0,0.10999999999999999,False,False,False,True,False,False,mid_growth,2017_H2,2017_Q4,47c0b638ce6d628d,-0.5408,0.0,0.939,0.061,negative
7gxmzv,Off-duty officer stabbed while trying to thwart car theft outside police headquarters,,1512158671.0,29,60,News,0.87,/r/Winnipeg/comments/7gxmzv/offduty_officer_stabbed_while_trying_to_thwart/,http://winnipeg.ctvnews.ca/mobile/off-duty-officer-stabbed-while-trying-to-thwart-car-theft-outside-police-headquarters-1.3703394,False,False,False,False,False,Winnipeg,Off-duty officer stabbed while trying to thwart car theft outside police headquarters ,2017-12-01 20:04:31+00:00,2017,12,1,4,Friday,48,20,winter,2014-2019_pre_pandemic_era,off duty officer stabbed while trying to thwart car theft outside police headquarters,85,13,True,False,2,0,False,2.0,0.13,False,False,False,True,False,False,mid_growth,2017_H2,2017_Q4,3395eec96c1647d4,-0.4404,0.0,0.805,0.195,negative
7hr9nu,'I was scared': Indigenous senior warning others after she jumped from Winnipeg taxi for safety,,1512495305.0,9,93,News,0.68,/r/Winnipeg/comments/7hr9nu/i_was_scared_indigenous_senior_warning_others/,http://www.cbc.ca/news/canada/manitoba/77-year-old-woman-jumped-from-cab-winnipeg-1.4432508,False,False,False,False,False,Winnipeg,'I was scared': Indigenous senior warning others after she jumped from Winnipeg taxi for safety ,2017-12-05 17:35:05+00:00,2017,12,5,1,Tuesday,49,17,winter,2014-2019_pre_pandemic_era,i was scared indigenous senior warning others after she jumped from winnipeg taxi for safety,92,15,True,False,1,0,False,9.3,0.31999999999999995,False,False,False,True,False,False,mid_growth,2017_H2,2017_Q4,5a9a8a9f87d73937,-0.3612,0.139,0.597,0.264,negative
7hxtva,Ban on home-grown pot: prudent safety measure or nonsensical tax grab?,,1512564892.0,57,64,News,0.9,/r/Winnipeg/comments/7hxtva/ban_on_homegrown_pot_prudent_safety_measure_or/,http://www.cbc.ca/beta/news/canada/manitoba/manitoba-cannabis-legalization-legislation-reaction-1.4434770,False,False,False,False,False,Winnipeg,Ban on home-grown pot: prudent safety measure or nonsensical tax grab? ,2017-12-06 12:54:52+00:00,2017,12,6,2,Wednesday,49,12,winter,2014-2019_pre_pandemic_era,ban on home grown pot prudent safety measure or nonsensical tax grab?,69,12,True,False,1,0,False,1.103448275862069,0.09999999999999998,False,False,False,True,False,False,mid_growth,2017_H2,2017_Q4,5dbd80d8634173a2,-0.2023,0.171,0.61,0.22,negative
7l1izt,"Cheap electricity, cold weather provide 'huge marketing opportunity' for Manitoba to attract bitcoin 'miners'",,1513778235.0,19,72,News,0.71,/r/Winnipeg/comments/7l1izt/cheap_electricity_cold_weather_provide_huge/,http://www.cbc.ca/beta/news/canada/manitoba/manitoba-bitcoin-1.4457486,False,False,False,False,False,Winnipeg,"Cheap electricity, cold weather provide 'huge marketing opportunity' for Manitoba to attract bitcoin 'miners' ",2017-12-20 13:57:15+00:00,2017,12,20,2,Wednesday,51,13,winter,2014-2019_pre_pandemic_era,cheap electricity cold weather provide huge marketing opportunity for manitoba to attract bitcoin miners,104,14,False,True,0,2,False,3.6,0.29000000000000004,False,False,False,True,False,False,mid_growth,2017_H2,2017_Q4,5dbd80d8634173a2,0.765,0.409,0.591,0.0,positive
7n451e,"Cold Snap is continuing- please make sure to keep your animals warm, and if you can, bring any strays inside or to a rescue.","I'm not the first person who's pointed out that it's super cold, but I haven't seen anything posted here about strays/ abandoned animals in the city.

 Please, please, please, please, if you or someone you know has an animal but isn't in the position to care for it, please bring it to a rescue or someone who can help. There are dozens of rescues across the city, no questions asked. There really isn't anything more important than keeping them safe at this time. 

I work at a shelter and the sheer number of dying/severely injured animals that have come in lately is absolutely heartbreaking, especially because it could have been prevented. If you have any questions, obviously post them here or feel free to PM me and I'll answer as best I can. It's cold for everyone but it seems to me like there isn't as much education or information out there for animal welfare. 

[Dog shelters and rescues in Manitoba](http://www.winnipeghumanesociety.ca/pet-owners/surrendering-your-pet/manitoba-dog-rescuesshelters/)

[Cat/Critter shelters and rescues in Manitoba](http://www.winnipeghumanesociety.ca/pet-owners/surrendering-your-pet/manitoba-cat-and-critter-sheltersrescues/)

**Edit**
If you suspect a pet is being neglected (i.e being mistreated, left outside in bad conditions beyond a reasonable time with no shelter, not being fed, being abused,etc) [please contact the **Animal Care Line in Manitoba at 204-945-8000**](http://www.gov.mb.ca/agriculture/animals/animal-welfare/animal-care-and-handling.html), OR contact the [Winnipeg Humane Society Emergency line at 204-982-2020](https://www.winnipeghumanesociety.ca/animal-issues/animal-protection/)
",1514668645.0,80,48,Community,0.91,/r/Winnipeg/comments/7n451e/cold_snap_is_continuing_please_make_sure_to_keep/,https://www.reddit.com/r/Winnipeg/comments/7n451e/cold_snap_is_continuing_please_make_sure_to_keep/,True,False,False,False,False,Winnipeg,"Cold Snap is continuing- please make sure to keep your animals warm, and if you can, bring any strays inside or to a rescue. I'm not the first person who's pointed out that it's super cold, but I haven't seen anything posted here about strays/ abandoned animals in the city.

 Please, please, please, please, if you or someone you know has an animal but isn't in the position to care for it, please bring it to a rescue or someone who can help. There are dozens of rescues across the city, no questions asked. There really isn't anything more important than keeping them safe at this time. 

I work at a shelter and the sheer number of dying/severely injured animals that have come in lately is absolutely heartbreaking, especially because it could have been prevented. If you have any questions, obviously post them here or feel free to PM me and I'll answer as best I can. It's cold for everyone but it seems to me like there isn't as much education or information out there for animal welfare. 

[Dog shelters and rescues in Manitoba](http://www.winnipeghumanesociety.ca/pet-owners/surrendering-your-pet/manitoba-dog-rescuesshelters/)

[Cat/Critter shelters and rescues in Manitoba](http://www.winnipeghumanesociety.ca/pet-owners/surrendering-your-pet/manitoba-cat-and-critter-sheltersrescues/)

**Edit**
If you suspect a pet is being neglected (i.e being mistreated, left outside in bad conditions beyond a reasonable time with no shelter, not being fed, being abused,etc) [please contact the **Animal Care Line in Manitoba at 204-945-8000**](http://www.gov.mb.ca/agriculture/animals/animal-welfare/animal-care-and-handling.html), OR contact the [Winnipeg Humane Society Emergency line at 204-982-2020](https://www.winnipeghumanesociety.ca/animal-issues/animal-protection/)
",2017-12-30 21:17:25+00:00,2017,12,30,5,Saturday,52,21,winter,2014-2019_pre_pandemic_era,cold snap is continuing please make sure to keep your animals warm and if you can bring any strays inside or to a rescue. i m not the first person who s pointed out that it s super cold but i haven t seen anything posted here about strays abandoned animals in the city. please please please please if you or someone you know has an animal but isn t in the position to care for it please bring it to a rescue or someone who can help. there are dozens of rescues across the city no questions asked. there really isn t anything more important than keeping them safe at this time. i work at a shelter and the sheer number of dying severely injured animals that have come in lately is absolutely heartbreaking especially because it could have been prevented. if you have any questions obviously post them here or feel free to pm me and i ll answer as best i can. it s cold for everyone but it seems to me like there isn t as much education or information out there for animal welfare. dog shelters and rescues in manitoba cat critter shelters and rescues in manitoba edit if you suspect a pet is being neglected i.e being mistreated left outside in bad conditions beyond a reasonable time with no shelter not being fed being abused etc please contact the animal care line in manitoba at PHONE or contact the winnipeg humane society emergency line at PHONE,1350,252,False,True,0,2,False,0.5925925925925926,0.08999999999999997,False,False,False,True,False,False,mid_growth,2017_H2,2017_Q4,30a884b09705c7d9,0.9808,0.226,0.649,0.125,positive
7jjg7v,No more waiting in the cold: Rural Manitoba school division to start using school bus-tracking app - Manitoba,,1513174076.0,65,41,News,0.98,/r/Winnipeg/comments/7jjg7v/no_more_waiting_in_the_cold_rural_manitoba_school/,http://www.cbc.ca/news/canada/manitoba/no-more-waiting-in-the-cold-rural-manitoba-school-division-to-start-using-school-bus-tracking-app-1.4445269,False,False,False,False,False,Winnipeg,No more waiting in the cold: Rural Manitoba school division to start using school bus-tracking app - Manitoba ,2017-12-13 14:07:56+00:00,2017,12,13,2,Wednesday,50,14,winter,2014-2019_pre_pandemic_era,no more waiting in the cold rural manitoba school division to start using school bus tracking app manitoba,106,18,False,True,0,1,False,0.6212121212121212,0.020000000000000018,False,False,False,True,False,False,mid_growth,2017_H2,2017_Q4,ea595420b7772db5,-0.296,0.0,0.885,0.115,negative
