id,title,selftext,created_utc,score,num_comments,link_flair_text,upvote_ratio,permalink,url,is_self,over_18,spoiler,stickied,locked,subreddit,full_text,created_date,year,month,day,day_of_week,day_name,week_of_year,hour,season,platform_period,cleaned_text,text_length,word_count,contains_crime_keywords,contains_weather_keywords,crime_keyword_count,weather_keyword_count,crime_and_weather,engagement_rate,controversy_score,is_2014,is_2015,is_2016,is_2017,is_2018,is_2019,reddit_growth_period,half_year,quarter,author_hash,sentiment_compound,sentiment_positive,sentiment_neutral,sentiment_negative,sentiment_category
36jed2,"Saskatoonians,what is your summer hobby?","looking to join a team and meet new people....list all your hobbies, I'm open to anything, Go!",1432068166.0,12,51,None,0.88,/r/saskatoon/comments/36jed2/saskatoonianswhat_is_your_summer_hobby/,https://www.reddit.com/r/saskatoon/comments/36jed2/saskatoonianswhat_is_your_summer_hobby/,True,False,False,False,False,Saskatoon,"Saskatoonians,what is your summer hobby? looking to join a team and meet new people....list all your hobbies, I'm open to anything, Go!",2015-05-19 20:42:46+00:00,2015,5,19,1,Tuesday,21,20,spring,2014-2019_pre_pandemic_era,saskatoonians what is your summer hobby? looking to join a team and meet new people....list all your hobbies i m open to anything go!,133,24,False,True,0,1,False,3.923076923076923,0.12,False,True,False,False,False,False,early_growth,2015_H1,2015_Q2,e1351a95cb1fb000,0.3595,0.098,0.902,0.0,positive
34sm6w,Is anyone visiting Grasslands National Park this summer?,"A friend and I will be hanging out in Regina for 3 days this June. On one of those days we are interested in going on a day trip outside of the city but we don't have a car. Grasslands National Park would be a highlight for a day trip but it's about 3 hours away and there is no public transportation there.

If anyone else from Regina is going to the park for a day trip there we'll be happy to come along (of course we'll cover money for gas). We are two college aged males who want to see more of this province",1430716942.0,6,1,None,1.0,/r/regina/comments/34sm6w/is_anyone_visiting_grasslands_national_park_this/,https://www.reddit.com/r/regina/comments/34sm6w/is_anyone_visiting_grasslands_national_park_this/,True,False,False,False,False,Regina,"Is anyone visiting Grasslands National Park this summer? A friend and I will be hanging out in Regina for 3 days this June. On one of those days we are interested in going on a day trip outside of the city but we don't have a car. Grasslands National Park would be a highlight for a day trip but it's about 3 hours away and there is no public transportation there.

If anyone else from Regina is going to the park for a day trip there we'll be happy to come along (of course we'll cover money for gas). We are two college aged males who want to see more of this province",2015-05-04 05:22:22+00:00,2015,5,4,0,Monday,19,5,spring,2014-2019_pre_pandemic_era,is anyone visiting grasslands national park this summer? a friend and i will be hanging out in regina for days this june. on one of those days we are interested in going on a day trip outside of the city but we don t have a car. grasslands national park would be a highlight for a day trip but it s about hours away and there is no public transportation there. if anyone else from regina is going to the park for a day trip there we ll be happy to come along of course we ll cover money for gas . we are two college aged males who want to see more of this province,564,116,False,True,0,1,False,0.14285714285714285,0.0,False,True,False,False,False,False,early_growth,2015_H1,2015_Q2,91fae5aad005147b,0.8674,0.107,0.871,0.022,positive
36w1n3,Talk to me about summer camp.,"When I was young, I did Trossachs and Blackstrap summer camp.  Now that my daughter is that age, I want to send her to one as well, but those ones were kind of church-y for my liking.   

Tell me about what camps you went to. Why were they awesome? ",1432311851.0,1,10,None,1.0,/r/saskatchewan/comments/36w1n3/talk_to_me_about_summer_camp/,https://www.reddit.com/r/saskatchewan/comments/36w1n3/talk_to_me_about_summer_camp/,True,False,False,False,False,saskatchewan,"Talk to me about summer camp. When I was young, I did Trossachs and Blackstrap summer camp.  Now that my daughter is that age, I want to send her to one as well, but those ones were kind of church-y for my liking.   

Tell me about what camps you went to. Why were they awesome? ",2015-05-22 16:24:11+00:00,2015,5,22,4,Friday,21,16,spring,2014-2019_pre_pandemic_era,talk to me about summer camp. when i was young i did trossachs and blackstrap summer camp. now that my daughter is that age i want to send her to one as well but those ones were kind of church y for my liking. tell me about what camps you went to. why were they awesome?,270,56,False,True,0,1,False,5.0,0.0,False,True,False,False,False,False,early_growth,2015_H1,2015_Q2,98b948bb485d377b,0.8979,0.186,0.814,0.0,positive
34wxoe,Anyone planning a trip to Grasslands National Park this summer?,"A friend and I will be hanging out in Regina for 3 days this June. On one of those days we are interested in going on a day trip outside of the city but we don't have a car. Grasslands National Park would be a highlight for a day trip but it's about 3 hours away and there is no public transportation there.
If anyone else from Regina is going to the park for a day trip there we'll be happy to come along (of course we'll cover money for gas). We are two college aged males who want to see more of this province",1430806756.0,7,4,None,1.0,/r/saskatchewan/comments/34wxoe/anyone_planning_a_trip_to_grasslands_national/,https://www.reddit.com/r/saskatchewan/comments/34wxoe/anyone_planning_a_trip_to_grasslands_national/,True,False,False,False,False,saskatchewan,"Anyone planning a trip to Grasslands National Park this summer? A friend and I will be hanging out in Regina for 3 days this June. On one of those days we are interested in going on a day trip outside of the city but we don't have a car. Grasslands National Park would be a highlight for a day trip but it's about 3 hours away and there is no public transportation there.
If anyone else from Regina is going to the park for a day trip there we'll be happy to come along (of course we'll cover money for gas). We are two college aged males who want to see more of this province",2015-05-05 06:19:16+00:00,2015,5,5,1,Tuesday,19,6,spring,2014-2019_pre_pandemic_era,anyone planning a trip to grasslands national park this summer? a friend and i will be hanging out in regina for days this june. on one of those days we are interested in going on a day trip outside of the city but we don t have a car. grasslands national park would be a highlight for a day trip but it s about hours away and there is no public transportation there. if anyone else from regina is going to the park for a day trip there we ll be happy to come along of course we ll cover money for gas . we are two college aged males who want to see more of this province,571,118,False,True,0,1,False,0.5,0.0,False,True,False,False,False,False,early_growth,2015_H1,2015_Q2,91fae5aad005147b,0.8674,0.106,0.873,0.022,positive
