id,title,selftext,created_utc,score,num_comments,link_flair_text,upvote_ratio,permalink,url,is_self,over_18,spoiler,stickied,locked,subreddit,full_text,created_date,year,month,day,day_of_week,day_name,week_of_year,hour,season,platform_period,cleaned_text,text_length,word_count,contains_crime_keywords,contains_weather_keywords,crime_keyword_count,weather_keyword_count,crime_and_weather,engagement_rate,controversy_score,is_2014,is_2015,is_2016,is_2017,is_2018,is_2019,reddit_growth_period,half_year,quarter,author_hash,sentiment_compound,sentiment_positive,sentiment_neutral,sentiment_negative,sentiment_category
39k01r,That storm,I mean I guess we're overdue but damn.,1434092571.0,13,33,None,0.89,/r/saskatoon/comments/39k01r/that_storm/,https://www.reddit.com/r/saskatoon/comments/39k01r/that_storm/,True,False,False,False,False,Saskatoon,That storm I mean I guess we're overdue but damn.,2015-06-12 07:02:51+00:00,2015,6,12,4,Friday,24,7,summer,2014-2019_pre_pandemic_era,that storm i mean i guess we re overdue but damn.,49,11,False,True,0,1,False,2.357142857142857,0.10999999999999999,False,True,False,False,False,False,early_growth,2015_H1,2015_Q2,e79c4b7fe46b73e6,-0.5499,0.0,0.738,0.262,negative
39yqjm,OTV Currently Offering a Summer Service Special.,"Hey everyone, we are currently offering a Summer service special! Running from June 15–19 at OTV Technologies on 810 Albert Street. Get a PC tuneup + diagnostic for $25. Limited time only! (Reg $75) - http://otvtech.ca",1434404725.0,0,2,None,0.5,/r/regina/comments/39yqjm/otv_currently_offering_a_summer_service_special/,https://www.reddit.com/r/regina/comments/39yqjm/otv_currently_offering_a_summer_service_special/,True,False,False,False,False,Regina,"OTV Currently Offering a Summer Service Special. Hey everyone, we are currently offering a Summer service special! Running from June 15–19 at OTV Technologies on 810 Albert Street. Get a PC tuneup + diagnostic for $25. Limited time only! (Reg $75) - http://otvtech.ca",2015-06-15 21:45:25+00:00,2015,6,15,0,Monday,25,21,summer,2014-2019_pre_pandemic_era,otv currently offering a summer service special. hey everyone we are currently offering a summer service special! running from june ADDRESS . get a pc tuneup diagnostic for . limited time only! reg,197,33,False,True,0,1,False,2.0,0.5,False,True,False,False,False,False,early_growth,2015_H1,2015_Q2,e8f76127af638c9d,0.6229,0.158,0.792,0.05,positive
3bk2cw,Dry weather fuelling Saskatchewan wildfires; air quality statement issued,,1435613359.0,2,0,None,1.0,/r/saskatchewan/comments/3bk2cw/dry_weather_fuelling_saskatchewan_wildfires_air/,http://www.globalnews.ca/news/2081237/dry-weather-fuelling-sask-wildfires-air-quality-statement-issued/,False,False,False,False,False,saskatchewan,Dry weather fuelling Saskatchewan wildfires; air quality statement issued ,2015-06-29 21:29:19+00:00,2015,6,29,0,Monday,27,21,summer,2014-2019_pre_pandemic_era,dry weather fuelling saskatchewan wildfires air quality statement issued,72,9,False,True,0,2,False,0.0,0.0,False,True,False,False,False,False,early_growth,2015_H1,2015_Q2,0e9a5bf9165dae69,0.0,0.0,1.0,0.0,neutral
3b1c0b,Northern Lights from Monday's Geomagnetic Storm,,1435205924.0,8,0,None,1.0,/r/saskatchewan/comments/3b1c0b/northern_lights_from_mondays_geomagnetic_storm/,https://streamable.com/mi8v,False,False,False,False,False,saskatchewan,Northern Lights from Monday's Geomagnetic Storm ,2015-06-25 04:18:44+00:00,2015,6,25,3,Thursday,26,4,summer,2014-2019_pre_pandemic_era,northern lights from monday s geomagnetic storm,47,7,False,True,0,1,False,0.0,0.0,False,True,False,False,False,False,early_growth,2015_H1,2015_Q2,d45503b8107bafb0,0.0,0.0,1.0,0.0,neutral
384rhe,"Humidity, temperature and light winds have lead the Alberta Emergency Management Agency to lift the province-wide fire ban, although there are still some regional bans in place.",,1433193138.0,14,2,None,0.66,/r/alberta/comments/384rhe/humidity_temperature_and_light_winds_have_lead/,http://criticalinfrastructurealliance.com/alberta-wildfires-are-taking-a-positive-turn/,False,False,False,False,False,alberta,"Humidity, temperature and light winds have lead the Alberta Emergency Management Agency to lift the province-wide fire ban, although there are still some regional bans in place. ",2015-06-01 21:12:18+00:00,2015,6,1,0,Monday,23,21,summer,2014-2019_pre_pandemic_era,humidity temperature and light winds have lead the alberta emergency management agency to lift the province wide fire ban although there are still some regional bans in place.,175,28,False,True,0,2,False,0.13333333333333333,0.33999999999999997,False,True,False,False,False,False,early_growth,2015_H1,2015_Q2,b8db1289f7b4ee3f,-0.8225,0.0,0.744,0.256,negative
