id,title,selftext,created_utc,score,num_comments,link_flair_text,upvote_ratio,permalink,url,is_self,over_18,spoiler,stickied,locked,subreddit,full_text,created_date,year,month,day,day_of_week,day_name,week_of_year,hour,season,platform_period,cleaned_text,text_length,word_count,contains_crime_keywords,contains_weather_keywords,crime_keyword_count,weather_keyword_count,crime_and_weather,engagement_rate,controversy_score,is_2014,is_2015,is_2016,is_2017,is_2018,is_2019,reddit_growth_period,half_year,quarter,author_hash,sentiment_compound,sentiment_positive,sentiment_neutral,sentiment_negative,sentiment_category
40yjid,Saskatoon police have opened a new lab to help *predict* crime,,1452792088.0,4,11,None,0.7,/r/saskatoon/comments/40yjid/saskatoon_police_have_opened_a_new_lab_to_help/,http://thestarphoenix.com/news/crime/saskatoon-police-have-opened-a-new-lab-to-help-predict-crime-trends,False,False,False,False,False,Saskatoon,Saskatoon police have opened a new lab to help *predict* crime ,2016-01-14 17:21:28+00:00,2016,1,14,3,Thursday,2,17,winter,2014-2019_pre_pandemic_era,saskatoon police have opened a new lab to help predict crime,60,11,True,False,2,0,False,2.2,0.30000000000000004,False,False,True,False,False,False,early_growth,2016_H1,2016_Q1,af888f0c517051e6,-0.2023,0.178,0.592,0.23,negative
41jr8g,Broadway resident assaulted and stabbed during home invasion at 5:45am Saturday morning. (SPS Link),,1453135864.0,9,16,None,0.77,/r/saskatoon/comments/41jr8g/broadway_resident_assaulted_and_stabbed_during/,http://police.saskatoon.sk.ca/news/201631,False,False,False,False,False,Saskatoon,Broadway resident assaulted and stabbed during home invasion at 5:45am Saturday morning. (SPS Link) ,2016-01-18 16:51:04+00:00,2016,1,18,0,Monday,3,16,winter,2014-2019_pre_pandemic_era,broadway resident assaulted and stabbed during home invasion at am saturday morning. sps link,93,14,True,False,1,0,False,1.6,0.22999999999999998,False,False,True,False,False,False,early_growth,2016_H1,2016_Q1,4d73743d2dd0218c,-0.743,0.0,0.656,0.344,negative
41h8g7,Toronto: extreme cold advis....HAHAHAHAHA,,1453090232.0,83,30,None,0.94,/r/saskatoon/comments/41h8g7/toronto_extreme_cold_advishahahahaha/,http://imgur.com/3giRsQM,False,False,False,False,False,Saskatoon,Toronto: extreme cold advis....HAHAHAHAHA ,2016-01-18 04:10:32+00:00,2016,1,18,0,Monday,3,4,winter,2014-2019_pre_pandemic_era,toronto extreme cold advis....hahahahaha,40,4,False,True,0,2,False,0.35714285714285715,0.06000000000000005,False,False,True,False,False,False,early_growth,2016_H1,2016_Q1,8db18a00e76c1965,0.0,0.0,1.0,0.0,neutral
43k9vt,USask hiring for SHAD summer enrichment program.,"The University of Saskatchewan hosts a one month summer enrichment program called SHAD for high school students from across Canada. We're currently looking to hire Program Assistants from the program. 

You can find out more about the position here: [http://shad.usask.ca/employment.php](http://shad.usask.ca/employment.php). Compensation starts at $3500 + room & board. 

In the past, the position has been filled primarily by teachers and university students, but we welcome folks from all walks of life! However, you must be 18 to apply.

Thanks!

Julia Chernushevich",1454265958.0,4,2,None,0.75,/r/regina/comments/43k9vt/usask_hiring_for_shad_summer_enrichment_program/,https://www.reddit.com/r/regina/comments/43k9vt/usask_hiring_for_shad_summer_enrichment_program/,True,False,False,False,False,Regina,"USask hiring for SHAD summer enrichment program. The University of Saskatchewan hosts a one month summer enrichment program called SHAD for high school students from across Canada. We're currently looking to hire Program Assistants from the program. 

You can find out more about the position here: [http://shad.usask.ca/employment.php](http://shad.usask.ca/employment.php). Compensation starts at $3500 + room & board. 

In the past, the position has been filled primarily by teachers and university students, but we welcome folks from all walks of life! However, you must be 18 to apply.

Thanks!

Julia Chernushevich",2016-01-31 18:45:58+00:00,2016,1,31,6,Sunday,4,18,winter,2014-2019_pre_pandemic_era,usask hiring for shad summer enrichment program. the university of saskatchewan hosts a one month summer enrichment program called shad for high school students from across canada. we re currently looking to hire program assistants from the program. you can find out more about the position here compensation starts at room board. in the past the position has been filled primarily by teachers and university students but we welcome folks from all walks of life! however you must be to apply. thanks! julia chernushevich,520,84,False,True,0,1,False,0.4,0.25,False,False,True,False,False,False,early_growth,2016_H1,2016_Q1,5559b0fee42b2a7c,0.8568,0.093,0.907,0.0,positive
3zfr35,Crime in the community: when 'designer' social housing goes wrong,,1451929372.0,39,93,None,0.92,/r/Winnipeg/comments/3zfr35/crime_in_the_community_when_designer_social/,http://www.theguardian.com/cities/2016/jan/04/crime-community-designer-social-housing-winnipeg,False,False,False,False,False,Winnipeg,Crime in the community: when 'designer' social housing goes wrong ,2016-01-04 17:42:52+00:00,2016,1,4,0,Monday,1,17,winter,2014-2019_pre_pandemic_era,crime in the community when designer social housing goes wrong,62,10,True,False,1,0,False,2.325,0.07999999999999996,False,False,True,False,False,False,early_growth,2016_H1,2016_Q1,5a9a8a9f87d73937,-0.765,0.0,0.548,0.452,negative
42620e,Former mayoral candidate charged with theft from a vehicle at EIA on Christmas Eve,,1453477353.0,25,21,None,0.93,/r/Edmonton/comments/42620e/former_mayoral_candidate_charged_with_theft_from/,http://www.edmontonsun.com/2016/01/05/former-edmonton-mayoral-candidate-facing-charges,False,False,False,False,False,Edmonton,Former mayoral candidate charged with theft from a vehicle at EIA on Christmas Eve ,2016-01-22 15:42:33+00:00,2016,1,22,4,Friday,3,15,winter,2014-2019_pre_pandemic_era,former mayoral candidate charged with theft from a vehicle at eia on christmas eve,82,14,True,False,1,0,False,0.8076923076923077,0.06999999999999995,False,False,True,False,False,False,early_growth,2016_H1,2016_Q1,41f60bdc8984b169,-0.2023,0.0,0.878,0.122,negative
3zvywl,Are you supposed to clear the snow off the hood of your car?,"Hello, /r/edmonton. My boyfriend and I are having a disagreement. He absolutely refuses to wipe the snow off the hood of his car (or any other part of the vehicle, for that matter) before he goes driving. 

I googled ""leaving snow on your car"" and read him all the links that came up with reasons why you really absolutely should clear it, but he just keeps repeating that it doesn't matter. I also tried pointing out to him that no other cars had a full layer of snow on the hood and roof, but that also did not sway him.

And to clarify - he wants to leave the snow on the car, INDEFINITELY. Leave it there to harden and turn into ice and just leave that layer of ice on the car. The only time he would EVER clear it is if we had a blizzard and it piled so high that it blocked a significant part of the window, then he'd give it a half-ass wipe I'm sure. He does not intend to fully clear off the car at any point, let alone regularly.

This is his first winter driving (though he is 24) and I think that the relatively small amount of snowfall has allowed him to continue thinking this way. Maybe opinions from other Edmonton drivers will show him that he's being a dumbass. Thanks!!

TL;DR: Dude won't clear snow off his hood, roof, or anywhere else on his car. Thinks it doesn't matter. Tell him he's stupid

UPDATE: for those of you who wanted to know his reaction - he initially refused to look at the thread because he doesn't care. When he eventually did look at it, he skimmed over the posts and the comments and was laughing to himself. When I asked why it was funny... Wanna guess what he said?
""Because it doesn't matter""

AAAAAAHHHHHHH",1452181144.0,73,103,None,0.92,/r/Edmonton/comments/3zvywl/are_you_supposed_to_clear_the_snow_off_the_hood/,https://www.reddit.com/r/Edmonton/comments/3zvywl/are_you_supposed_to_clear_the_snow_off_the_hood/,True,False,False,False,False,Edmonton,"Are you supposed to clear the snow off the hood of your car? Hello, /r/edmonton. My boyfriend and I are having a disagreement. He absolutely refuses to wipe the snow off the hood of his car (or any other part of the vehicle, for that matter) before he goes driving. 

I googled ""leaving snow on your car"" and read him all the links that came up with reasons why you really absolutely should clear it, but he just keeps repeating that it doesn't matter. I also tried pointing out to him that no other cars had a full layer of snow on the hood and roof, but that also did not sway him.

And to clarify - he wants to leave the snow on the car, INDEFINITELY. Leave it there to harden and turn into ice and just leave that layer of ice on the car. The only time he would EVER clear it is if we had a blizzard and it piled so high that it blocked a significant part of the window, then he'd give it a half-ass wipe I'm sure. He does not intend to fully clear off the car at any point, let alone regularly.

This is his first winter driving (though he is 24) and I think that the relatively small amount of snowfall has allowed him to continue thinking this way. Maybe opinions from other Edmonton drivers will show him that he's being a dumbass. Thanks!!

TL;DR: Dude won't clear snow off his hood, roof, or anywhere else on his car. Thinks it doesn't matter. Tell him he's stupid

UPDATE: for those of you who wanted to know his reaction - he initially refused to look at the thread because he doesn't care. When he eventually did look at it, he skimmed over the posts and the comments and was laughing to himself. When I asked why it was funny... Wanna guess what he said?
""Because it doesn't matter""

AAAAAAHHHHHHH",2016-01-07 15:39:04+00:00,2016,1,7,3,Thursday,1,15,winter,2014-2019_pre_pandemic_era,are you supposed to clear the snow off the hood of your car? hello r edmonton. my boyfriend and i are having a disagreement. he absolutely refuses to wipe the snow off the hood of his car or any other part of the vehicle for that matter before he goes driving. i googled leaving snow on your car and read him all the links that came up with reasons why you really absolutely should clear it but he just keeps repeating that it doesn t matter. i also tried pointing out to him that no other cars had a full layer of snow on the hood and roof but that also did not sway him. and to clarify he wants to leave the snow on the car indefinitely. leave it there to harden and turn into ice and just leave that layer of ice on the car. the only time he would ever clear it is if we had a blizzard and it piled so high that it blocked a significant part of the window then he d give it a half ass wipe i m sure. he does not intend to fully clear off the car at any point let alone regularly. this is his first winter driving though he is and i think that the relatively small amount of snowfall has allowed him to continue thinking this way. maybe opinions from other edmonton drivers will show him that he s being a dumbass. thanks!! tl dr dude won t clear snow off his hood roof or anywhere else on his car. thinks it doesn t matter. tell him he s stupid update for those of you who wanted to know his reaction he initially refused to look at the thread because he doesn t care. when he eventually did look at it he skimmed over the posts and the comments and was laughing to himself. when i asked why it was funny... wanna guess what he said? because it doesn t matter aaaaaahhhhhhh,1676,335,False,True,0,4,False,1.3918918918918919,0.07999999999999996,False,False,True,False,False,False,early_growth,2016_H1,2016_Q1,bb7032001f67d34f,0.9326,0.119,0.801,0.08,positive
427xqs,"Out-of-town girlfriend's birthday tomorrow, please help!","Hey there /r/Edmonton! Im from Baltimore, my girlfriend is a flight attendant for a private airline and she got sent out on a flight before the blizzard hit here. The bad news is that her 24th birthday is tomorrow and we had to scrap our plans. However, the good news is she's headed into Edmonton tonight and will be spending her birthday in your city!

Her fellow flight attendants unfortunately don't really want to go out, so I thought I'd ask you all if anybody could help me in helping my girlfriend have a fantastic birthday out in Edmonton. She's a good extrovert who likes drinking, so I'm sure there's something! If any of you had plans she might be able to join in on (she had some interest in the Oilers game, anybody going to that maybe?) or other fun ideas for an out-of-towner, it would be greatly appreciated.

Edit: she's definitely interested in the Oilers game - anybody going to it who she could go with?",1453501317.0,13,14,None,0.81,/r/Edmonton/comments/427xqs/outoftown_girlfriends_birthday_tomorrow_please/,https://www.reddit.com/r/Edmonton/comments/427xqs/outoftown_girlfriends_birthday_tomorrow_please/,True,False,False,False,False,Edmonton,"Out-of-town girlfriend's birthday tomorrow, please help! Hey there /r/Edmonton! Im from Baltimore, my girlfriend is a flight attendant for a private airline and she got sent out on a flight before the blizzard hit here. The bad news is that her 24th birthday is tomorrow and we had to scrap our plans. However, the good news is she's headed into Edmonton tonight and will be spending her birthday in your city!

Her fellow flight attendants unfortunately don't really want to go out, so I thought I'd ask you all if anybody could help me in helping my girlfriend have a fantastic birthday out in Edmonton. She's a good extrovert who likes drinking, so I'm sure there's something! If any of you had plans she might be able to join in on (she had some interest in the Oilers game, anybody going to that maybe?) or other fun ideas for an out-of-towner, it would be greatly appreciated.

Edit: she's definitely interested in the Oilers game - anybody going to it who she could go with?",2016-01-22 22:21:57+00:00,2016,1,22,4,Friday,3,22,winter,2014-2019_pre_pandemic_era,out of town girlfriend s birthday tomorrow please help! hey there r edmonton! im from baltimore my girlfriend is a flight attendant for a private airline and she got sent out on a flight before the blizzard hit here. the bad news is that her th birthday is tomorrow and we had to scrap our plans. however the good news is she s headed into edmonton tonight and will be spending her birthday in your city! her fellow flight attendants unfortunately don t really want to go out so i thought i d ask you all if anybody could help me in helping my girlfriend have a fantastic birthday out in edmonton. she s a good extrovert who likes drinking so i m sure there s something! if any of you had plans she might be able to join in on she had some interest in the oilers game anybody going to that maybe? or other fun ideas for an out of towner it would be greatly appreciated. edit she s definitely interested in the oilers game anybody going to it who she could go with?,964,186,False,True,0,1,False,1.0,0.18999999999999995,False,False,True,False,False,False,early_growth,2016_H1,2016_Q1,bcdd0f11a3028d12,0.9886,0.207,0.767,0.027,positive
40v6so,Dashcam that can survive a Saskatchewan winter?,I want to get a dash cam for my car but know all too well what -30 to -40 weather can do to electronics. Does anybody know of a good one that won't die in a year?,1452733307.0,12,9,None,0.88,/r/saskatchewan/comments/40v6so/dashcam_that_can_survive_a_saskatchewan_winter/,https://www.reddit.com/r/saskatchewan/comments/40v6so/dashcam_that_can_survive_a_saskatchewan_winter/,True,False,False,False,False,saskatchewan,Dashcam that can survive a Saskatchewan winter? I want to get a dash cam for my car but know all too well what -30 to -40 weather can do to electronics. Does anybody know of a good one that won't die in a year?,2016-01-14 01:01:47+00:00,2016,1,14,3,Thursday,2,1,winter,2014-2019_pre_pandemic_era,dashcam that can survive a saskatchewan winter? i want to get a dash cam for my car but know all too well what to weather can do to electronics. does anybody know of a good one that won t die in a year?,202,43,False,True,0,2,False,0.6923076923076923,0.12,False,False,True,False,False,False,early_growth,2016_H1,2016_Q1,368c2847ba41a04a,0.7724,0.232,0.674,0.095,positive
41ul0m,"Mom, 4-year-old survive cold night after car crash in southwest Manitoba",,1453300507.0,9,8,None,0.92,/r/Manitoba/comments/41ul0m/mom_4yearold_survive_cold_night_after_car_crash/,http://www.cbc.ca/news/canada/manitoba/mom-child-car-crash-manitoba-1.3411593,False,False,False,False,False,manitoba,"Mom, 4-year-old survive cold night after car crash in southwest Manitoba ",2016-01-20 14:35:07+00:00,2016,1,20,2,Wednesday,3,14,winter,2014-2019_pre_pandemic_era,mom year old survive cold night after car crash in southwest manitoba,69,12,False,True,0,1,False,0.8,0.07999999999999996,False,False,True,False,False,False,early_growth,2016_H1,2016_Q1,b92dba282920b987,-0.4019,0.0,0.803,0.197,negative
40n8fh,Looking for a(nother) reason to love winter? Explore our cross-country skiing guide,,1452618019.0,6,2,None,0.88,/r/Manitoba/comments/40n8fh/looking_for_another_reason_to_love_winter_explore/,http://spectatortribune.com/cross-country-skiing-manitoba/,False,False,False,False,False,manitoba,Looking for a(nother) reason to love winter? Explore our cross-country skiing guide ,2016-01-12 17:00:19+00:00,2016,1,12,1,Tuesday,2,17,winter,2014-2019_pre_pandemic_era,looking for a nother reason to love winter? explore our cross country skiing guide,82,14,False,True,0,1,False,0.2857142857142857,0.12,False,False,True,False,False,False,early_growth,2016_H1,2016_Q1,87c87a97a4884af1,0.6369,0.244,0.756,0.0,positive
410k6z,TIL there is a tab on the map that is on www.alberta511 that shows the current location of all snow plows.,,1452818069.0,72,7,None,0.97,/r/alberta/comments/410k6z/til_there_is_a_tab_on_the_map_that_is_on/,http://vts.511.alberta.ca/vts/,False,False,False,False,False,alberta,TIL there is a tab on the map that is on www.alberta511 that shows the current location of all snow plows. ,2016-01-15 00:34:29+00:00,2016,1,15,4,Friday,2,0,winter,2014-2019_pre_pandemic_era,til there is a tab on the map that is on that shows the current location of all snow plows.,91,20,False,True,0,1,False,0.0958904109589041,0.030000000000000027,False,False,True,False,False,False,early_growth,2016_H1,2016_Q1,19d4d88b3ed28ad6,0.0,0.0,1.0,0.0,neutral
