id,title,selftext,created_utc,score,num_comments,link_flair_text,upvote_ratio,permalink,url,is_self,over_18,spoiler,stickied,locked,subreddit,full_text,created_date,year,month,day,day_of_week,day_name,week_of_year,hour,season,platform_period,cleaned_text,text_length,word_count,contains_crime_keywords,contains_weather_keywords,crime_keyword_count,weather_keyword_count,crime_and_weather,engagement_rate,controversy_score,is_2014,is_2015,is_2016,is_2017,is_2018,is_2019,reddit_growth_period,half_year,quarter,author_hash,sentiment_compound,sentiment_positive,sentiment_neutral,sentiment_negative,sentiment_category
7q02qt,Grand Theft Auto: Saskatchewan,,1515794295.0,6,5,None,0.71,/r/saskatoon/comments/7q02qt/grand_theft_auto_saskatchewan/,http://wpmedia.o.canada.com/2013/10/gtas.jpg?w=680&h=510,False,False,False,False,False,Saskatoon,Grand Theft Auto: Saskatchewan ,2018-01-12 21:58:15+00:00,2018,1,12,4,Friday,2,21,winter,2014-2019_pre_pandemic_era,grand theft auto saskatchewan,29,4,True,False,1,0,False,0.7142857142857143,0.29000000000000004,False,False,False,False,True,False,mature_growth,2018_H1,2018_Q1,692495b2474a04b5,0.4588,0.5,0.5,0.0,positive
7pb4hj,Anybody else in Saskatoon in a new house having windows leaking in this recent warm weather?,"Our place is two years old, and two windows are leaking similar to this (brown water leaking from the top of the window).  The same happened last year.  The builder said it was fixed, but there is still an issue.  I'm looking for any thoughts/ suggestions.",1515539091.0,8,21,None,0.79,/r/saskatoon/comments/7pb4hj/anybody_else_in_saskatoon_in_a_new_house_having/,https://www.reddit.com/r/saskatoon/comments/7pb4hj/anybody_else_in_saskatoon_in_a_new_house_having/,True,False,False,False,False,Saskatoon,"Anybody else in Saskatoon in a new house having windows leaking in this recent warm weather? Our place is two years old, and two windows are leaking similar to this (brown water leaking from the top of the window).  The same happened last year.  The builder said it was fixed, but there is still an issue.  I'm looking for any thoughts/ suggestions.",2018-01-09 23:04:51+00:00,2018,1,9,1,Tuesday,2,23,winter,2014-2019_pre_pandemic_era,anybody else in saskatoon in a new house having windows leaking in this recent warm weather? our place is two years old and two windows are leaking similar to this brown water leaking from the top of the window . the same happened last year. the builder said it was fixed but there is still an issue. i m looking for any thoughts suggestions.,342,64,False,True,0,2,False,2.3333333333333335,0.20999999999999996,False,False,False,False,True,False,mature_growth,2018_H1,2018_Q1,5358f641c089e53f,0.2144,0.044,0.956,0.0,positive
7pwb3l,Does Saskatoon ever declare it too cold to go to work?,"I’m not going to work today, fuck that ",1515760644.0,17,48,None,0.74,/r/saskatoon/comments/7pwb3l/does_saskatoon_ever_declare_it_too_cold_to_go_to/,https://www.reddit.com/r/saskatoon/comments/7pwb3l/does_saskatoon_ever_declare_it_too_cold_to_go_to/,True,False,False,False,False,Saskatoon,"Does Saskatoon ever declare it too cold to go to work? I’m not going to work today, fuck that ",2018-01-12 12:37:24+00:00,2018,1,12,4,Friday,2,12,winter,2014-2019_pre_pandemic_era,does saskatoon ever declare it too cold to go to work? i m not going to work today fuck that,92,20,False,True,0,1,False,2.6666666666666665,0.26,False,False,False,False,True,False,mature_growth,2018_H1,2018_Q1,9d2f88ab930564b7,-0.5423,0.0,0.844,0.156,negative
7pt20t,Extreme Cold Warning in effect for Saskatoon & Area,,1515720266.0,10,7,None,0.86,/r/saskatoon/comments/7pt20t/extreme_cold_warning_in_effect_for_saskatoon_area/,https://weather.gc.ca/warnings/report_e.html?sk18#2150209581993036534201801100501ww1373cwwg,False,False,False,False,False,Saskatoon,Extreme Cold Warning in effect for Saskatoon & Area ,2018-01-12 01:24:26+00:00,2018,1,12,4,Friday,2,1,winter,2014-2019_pre_pandemic_era,extreme cold warning in effect for saskatoon area,49,8,False,True,0,2,False,0.6363636363636364,0.14,False,False,False,False,True,False,mature_growth,2018_H1,2018_Q1,5c22495a39561def,-0.3976,0.0,0.723,0.277,negative
7p34ju,San Jose Sharks players slam 'cold and dark' Winnipeg as worst NHL city to play in,,1515457354.0,59,42,Winnipeg Jets,0.75,/r/Winnipeg/comments/7p34ju/san_jose_sharks_players_slam_cold_and_dark/,http://www.cbc.ca/news/canada/manitoba/winnipeg-criticize-san-jose-sharks-1.4477439,False,False,False,False,False,Winnipeg,San Jose Sharks players slam 'cold and dark' Winnipeg as worst NHL city to play in ,2018-01-09 00:22:34+00:00,2018,1,9,1,Tuesday,2,0,winter,2014-2019_pre_pandemic_era,san jose sharks players slam cold and dark winnipeg as worst nhl city to play in,80,16,False,True,0,1,False,0.7,0.25,False,False,False,False,True,False,mature_growth,2018_H1,2018_Q1,2208ac86fdeefa07,-0.6486,0.109,0.588,0.303,negative
7u571a,Dramatic takedown of truck theft suspect caught on video in west Edmonton,,1517353576.0,13,18,None,0.69,/r/Edmonton/comments/7u571a/dramatic_takedown_of_truck_theft_suspect_caught/,https://globalnews.ca/news/3996225/edmonton-truck-theft-video/,False,False,False,False,False,Edmonton,Dramatic takedown of truck theft suspect caught on video in west Edmonton ,2018-01-30 23:06:16+00:00,2018,1,30,1,Tuesday,5,23,winter,2014-2019_pre_pandemic_era,dramatic takedown of truck theft suspect caught on video in west edmonton,73,12,True,False,1,0,False,1.2857142857142858,0.31000000000000005,False,False,False,False,True,False,mature_growth,2018_H1,2018_Q1,b1a2b867fc146846,-0.296,0.0,0.833,0.167,negative
7q0xfu,A reminder: It's never too cold to feel morally superior.,,1515802145.0,84,132,None,0.76,/r/Edmonton/comments/7q0xfu/a_reminder_its_never_too_cold_to_feel_morally/,https://imgur.com/ungAOec,False,False,False,False,False,Edmonton,A reminder: It's never too cold to feel morally superior. ,2018-01-13 00:09:05+00:00,2018,1,13,5,Saturday,2,0,winter,2014-2019_pre_pandemic_era,a reminder it s never too cold to feel morally superior.,56,11,False,True,0,1,False,1.5529411764705883,0.24,False,False,False,False,True,False,mature_growth,2018_H1,2018_Q1,fb74814e7b22c460,0.5423,0.259,0.741,0.0,positive
7njl9w,Cab driver drops off young Beaumont man on rural road in extreme temperatures,,1514861135.0,168,107,None,0.96,/r/Edmonton/comments/7njl9w/cab_driver_drops_off_young_beaumont_man_on_rural/,https://edmonton.ctvnews.ca/cab-driver-drops-off-young-beaumont-man-on-rural-road-in-extreme-temperatures-1.3741763,False,False,False,False,False,Edmonton,Cab driver drops off young Beaumont man on rural road in extreme temperatures ,2018-01-02 02:45:35+00:00,2018,1,2,1,Tuesday,1,2,winter,2014-2019_pre_pandemic_era,cab driver drops off young beaumont man on rural road in extreme temperatures,77,13,False,True,0,1,False,0.6331360946745562,0.040000000000000036,False,False,False,False,True,False,mature_growth,2018_H1,2018_Q1,f1d1b7d885c55e9b,0.0,0.0,1.0,0.0,neutral
7tcukh,What Are Your Real Stories About Crime in Rural Saskatchewan?,I have been reading and hearing a lot of “I heard that...My friend’s uncle said that...” and so on. I’m trying to get a picture of what the situation is like in areas of rural Saskatchewan that say they are in crisis mode. What are things like for you? ,1517061733.0,27,37,None,0.89,/r/saskatchewan/comments/7tcukh/what_are_your_real_stories_about_crime_in_rural/,https://www.reddit.com/r/saskatchewan/comments/7tcukh/what_are_your_real_stories_about_crime_in_rural/,True,False,False,False,False,saskatchewan,What Are Your Real Stories About Crime in Rural Saskatchewan? I have been reading and hearing a lot of “I heard that...My friend’s uncle said that...” and so on. I’m trying to get a picture of what the situation is like in areas of rural Saskatchewan that say they are in crisis mode. What are things like for you? ,2018-01-27 14:02:13+00:00,2018,1,27,5,Saturday,4,14,winter,2014-2019_pre_pandemic_era,what are your real stories about crime in rural saskatchewan? i have been reading and hearing a lot of i heard that...my friend s uncle said that... and so on. i m trying to get a picture of what the situation is like in areas of rural saskatchewan that say they are in crisis mode. what are things like for you?,312,61,True,False,1,0,False,1.3214285714285714,0.10999999999999999,False,False,False,False,True,False,mature_growth,2018_H1,2018_Q1,a5c6c9b04e2a94e2,-0.1926,0.119,0.776,0.105,negative
7q02mq,Grand Theft Auto: Saskatchewan,,1515794266.0,6,1,None,0.8,/r/saskatchewan/comments/7q02mq/grand_theft_auto_saskatchewan/,http://wpmedia.o.canada.com/2013/10/gtas.jpg?w=680&h=510,False,False,False,False,False,saskatchewan,Grand Theft Auto: Saskatchewan ,2018-01-12 21:57:46+00:00,2018,1,12,4,Friday,2,21,winter,2014-2019_pre_pandemic_era,grand theft auto saskatchewan,29,4,True,False,1,0,False,0.14285714285714285,0.19999999999999996,False,False,False,False,True,False,mature_growth,2018_H1,2018_Q1,692495b2474a04b5,0.4588,0.5,0.5,0.0,positive
7ucohd,Boushie trial day 2,"Interesting...

http://www.ckom.com/2018/01/31/just-wanted-to-scare-them-stanley-son-on-boushie-shooting/?platform=hootsuite


“It just went off,” Sheldon remembered Gerald saying, adding his dad looked like he would be sick.

Sheldon said Gerald then said: “I just wanted to scare them … I bumped (him) and it just went off.”",1517428310.0,25,157,None,0.97,/r/saskatchewan/comments/7ucohd/boushie_trial_day_2/,https://www.reddit.com/r/saskatchewan/comments/7ucohd/boushie_trial_day_2/,True,False,False,False,False,saskatchewan,"Boushie trial day 2 Interesting...

http://www.ckom.com/2018/01/31/just-wanted-to-scare-them-stanley-son-on-boushie-shooting/?platform=hootsuite


“It just went off,” Sheldon remembered Gerald saying, adding his dad looked like he would be sick.

Sheldon said Gerald then said: “I just wanted to scare them … I bumped (him) and it just went off.”",2018-01-31 19:51:50+00:00,2018,1,31,2,Wednesday,5,19,winter,2014-2019_pre_pandemic_era,boushie trial day interesting... it just went off sheldon remembered gerald saying adding his dad looked like he would be sick. sheldon said gerald then said i just wanted to scare them i bumped him and it just went off.,220,40,True,False,1,0,False,6.038461538461538,0.030000000000000027,False,False,False,False,True,False,mature_growth,2018_H1,2018_Q1,dc7e696d1f751ee4,-0.3182,0.109,0.755,0.136,negative
7pzrp7,"Both weather radars in Sask. down for upgrades, repairs",,1515791718.0,17,5,None,0.96,/r/saskatchewan/comments/7pzrp7/both_weather_radars_in_sask_down_for_upgrades/,http://www.ckom.com/syn/648/215816/both-weather-radars-in-sask-down-for-upgrades-repairs/,False,False,False,False,False,saskatchewan,"Both weather radars in Sask. down for upgrades, repairs ",2018-01-12 21:15:18+00:00,2018,1,12,4,Friday,2,21,winter,2014-2019_pre_pandemic_era,both weather radars in sask. down for upgrades repairs,54,9,False,True,0,1,False,0.2777777777777778,0.040000000000000036,False,False,False,False,True,False,mature_growth,2018_H1,2018_Q1,a0a73f3d01b74e1d,0.0,0.0,1.0,0.0,neutral
7q5qv6,Lack of snow worries Sask. farmers ahead of 2018 season,,1515864167.0,20,2,None,0.93,/r/saskatchewan/comments/7q5qv6/lack_of_snow_worries_sask_farmers_ahead_of_2018/,http://www.cjme.com/syn/653/217340/lack-of-snow-worries-sask-farmers-ahead-of-2018-season/,False,False,False,False,False,saskatchewan,Lack of snow worries Sask. farmers ahead of 2018 season ,2018-01-13 17:22:47+00:00,2018,1,13,5,Saturday,2,17,winter,2014-2019_pre_pandemic_era,lack of snow worries sask. farmers ahead of season,50,9,False,True,0,1,False,0.09523809523809523,0.06999999999999995,False,False,False,False,True,False,mature_growth,2018_H1,2018_Q1,692495b2474a04b5,-0.6249,0.0,0.579,0.421,negative
7qomn8,Looking for a unique outing this summer?,,1516064667.0,16,1,None,0.91,/r/saskatchewan/comments/7qomn8/looking_for_a_unique_outing_this_summer/,http://wheatlandexpress.ca/,False,False,False,False,False,saskatchewan,Looking for a unique outing this summer? ,2018-01-16 01:04:27+00:00,2018,1,16,1,Tuesday,3,1,winter,2014-2019_pre_pandemic_era,looking for a unique outing this summer?,40,7,False,True,0,1,False,0.058823529411764705,0.08999999999999997,False,False,False,False,True,False,mature_growth,2018_H1,2018_Q1,35def66fc29ad3c0,0.0,0.0,1.0,0.0,neutral
7tetkz,Saskatoon bishop urges Catholic groups to express concerns about summer jobs reproductive rights clause - Saskatoon,,1517080250.0,2,1,None,0.56,/r/saskatchewan/comments/7tetkz/saskatoon_bishop_urges_catholic_groups_to_express/,http://www.cbc.ca/news/canada/saskatoon/summer-jobs-abortion-clause-saskatoon-catholic-bishop-1.4506525,False,False,False,False,False,saskatchewan,Saskatoon bishop urges Catholic groups to express concerns about summer jobs reproductive rights clause - Saskatoon ,2018-01-27 19:10:50+00:00,2018,1,27,5,Saturday,4,19,winter,2014-2019_pre_pandemic_era,saskatoon bishop urges catholic groups to express concerns about summer jobs reproductive rights clause saskatoon,113,15,False,True,0,1,False,0.3333333333333333,0.43999999999999995,False,False,False,False,True,False,mature_growth,2018_H1,2018_Q1,692495b2474a04b5,0.0,0.0,1.0,0.0,neutral
7nhoal,"9 Reasons to Visit Oakville, MB This Winter - Archival Historical Photos",,1514841272.0,7,1,None,0.82,/r/Manitoba/comments/7nhoal/9_reasons_to_visit_oakville_mb_this_winter/,http://thehoopandholler.com/9-reasons-of-visit-oakville-this-winter/,False,False,False,False,False,manitoba,"9 Reasons to Visit Oakville, MB This Winter - Archival Historical Photos ",2018-01-01 21:14:32+00:00,2018,1,1,0,Monday,1,21,winter,2014-2019_pre_pandemic_era,reasons to visit oakville mb this winter archival historical photos,67,10,False,True,0,2,False,0.125,0.18000000000000005,False,False,False,False,True,False,mature_growth,2018_H1,2018_Q1,ea595420b7772db5,0.0,0.0,1.0,0.0,neutral
