id,title,selftext,created_utc,score,num_comments,link_flair_text,upvote_ratio,permalink,url,is_self,over_18,spoiler,stickied,locked,subreddit,full_text,created_date,year,month,day,day_of_week,day_name,week_of_year,hour,season,platform_period,cleaned_text,text_length,word_count,contains_crime_keywords,contains_weather_keywords,crime_keyword_count,weather_keyword_count,crime_and_weather,engagement_rate,controversy_score,is_2014,is_2015,is_2016,is_2017,is_2018,is_2019,reddit_growth_period,half_year,quarter,author_hash,sentiment_compound,sentiment_positive,sentiment_neutral,sentiment_negative,sentiment_category
7ma67y,Extreme cold dead car... Battery? Starter? Alternator?,"So my 2014 sorento which has been happy outside of its usual  uninsulated garage for the past 3 weeks started to die the last couple of nights of -40 weather. The 1st night it died, i was able to boost and start it fine. Then decided to plug in the block heater on a 2 hr morning timer. Next colder night, i couldn't even boost it to life. Wasn't turning over. I had to run a battery conditioner on a deep cycle charge @ 2amps for many hours along with plugging in the block heater. Finally got it started and put it in the garage again. Scared to leave it outside. 

Now both times, when trying to turn it over, the battery lights up all the guages and interior lights strong, just wouldn't turn over the engine strong. The 2nd time it happened, the engine would not even make a noise to turn over BUT the interior lights and gauges all lit up really bright. So is my battery or starter bad? How can i test? I don't want to run out and buy a new battery or starter if i don't need to.  

Any advice would be greatly appreciated.",1514320791.0,27,44,Ask Winnipeg,0.89,/r/Winnipeg/comments/7ma67y/extreme_cold_dead_car_battery_starter_alternator/,https://www.reddit.com/r/Winnipeg/comments/7ma67y/extreme_cold_dead_car_battery_starter_alternator/,True,False,False,False,False,Winnipeg,"Extreme cold dead car... Battery? Starter? Alternator? So my 2014 sorento which has been happy outside of its usual  uninsulated garage for the past 3 weeks started to die the last couple of nights of -40 weather. The 1st night it died, i was able to boost and start it fine. Then decided to plug in the block heater on a 2 hr morning timer. Next colder night, i couldn't even boost it to life. Wasn't turning over. I had to run a battery conditioner on a deep cycle charge @ 2amps for many hours along with plugging in the block heater. Finally got it started and put it in the garage again. Scared to leave it outside. 

Now both times, when trying to turn it over, the battery lights up all the guages and interior lights strong, just wouldn't turn over the engine strong. The 2nd time it happened, the engine would not even make a noise to turn over BUT the interior lights and gauges all lit up really bright. So is my battery or starter bad? How can i test? I don't want to run out and buy a new battery or starter if i don't need to.  

Any advice would be greatly appreciated.",2017-12-26 20:39:51+00:00,2017,12,26,1,Tuesday,52,20,winter,2014-2019_pre_pandemic_era,extreme cold dead car... battery? starter? alternator? so my ADDRESS arted to die the last couple of nights of weather. the st night it died i was able to boost and start it fine. then decided to plug in the block heater on a hr morning timer. next colder night i couldn t even boost it to life. wasn t turning over. i had to run a battery conditioner on a deep cycle charge amps for many hours along with plugging in the block heater. finally got it started and put it in the garage again. scared to leave it outside. now both times when trying to turn it over the battery lights up all the guages and interior lights strong just wouldn t turn over the engine strong. the nd time it happened the engine would not even make a noise to turn over but the interior lights and gauges all lit up really bright. so is my battery or starter bad? how can i test? i don t want to run out and buy a new battery or starter if i don t need to. any advice would be greatly appreciated.,972,193,False,True,0,3,False,1.5714285714285714,0.10999999999999999,False,False,False,True,False,False,mid_growth,2017_H2,2017_Q4,00d22d35d1ab0a69,0.4117,0.097,0.815,0.089,positive
7lkz64,Christmas parcel thefts caught on camera in south Edmonton,,1513983833.0,61,32,None,0.98,/r/Edmonton/comments/7lkz64/christmas_parcel_thefts_caught_on_camera_in_south/,https://globalnews.ca/news/3932022/christmas-parcel-thefts-caught-on-camera-in-south-edmonton/?utm_source=GlobalEdmonton&utm_medium=Facebook,False,False,False,False,False,Edmonton,Christmas parcel thefts caught on camera in south Edmonton ,2017-12-22 23:03:53+00:00,2017,12,22,4,Friday,51,23,winter,2014-2019_pre_pandemic_era,christmas parcel thefts caught on camera in south edmonton,58,9,True,False,1,0,False,0.5161290322580645,0.020000000000000018,False,False,False,True,False,False,mid_growth,2017_H2,2017_Q4,add181ec3c316130,0.0,0.0,1.0,0.0,neutral
7h7qey,Laptop theft at local store in Southgate Mall caught on camera,,1512275703.0,67,15,None,0.89,/r/Edmonton/comments/7h7qey/laptop_theft_at_local_store_in_southgate_mall/,http://edmonton.ctvnews.ca/video?clipId=1276294,False,False,False,False,False,Edmonton,Laptop theft at local store in Southgate Mall caught on camera ,2017-12-03 04:35:03+00:00,2017,12,3,6,Sunday,48,4,winter,2014-2019_pre_pandemic_era,laptop theft at local store in southgate mall caught on camera,62,11,True,False,1,0,False,0.22058823529411764,0.10999999999999999,False,False,False,True,False,False,mid_growth,2017_H2,2017_Q4,add181ec3c316130,0.0,0.0,1.0,0.0,neutral
7jedz5,"Is anyone else getting weirded out by the weather? I've been here 30 years, and I don't know if it's my imagination or selective memory, but it feels like winters are getting noticeably warmer.","Yes, I understand we're getting a chinook, so this isn't entirely typical, but the past decade seems like we've had warmer Christmases than average.",1513116395.0,203,131,None,0.94,/r/Edmonton/comments/7jedz5/is_anyone_else_getting_weirded_out_by_the_weather/,https://www.reddit.com/r/Edmonton/comments/7jedz5/is_anyone_else_getting_weirded_out_by_the_weather/,True,False,False,False,False,Edmonton,"Is anyone else getting weirded out by the weather? I've been here 30 years, and I don't know if it's my imagination or selective memory, but it feels like winters are getting noticeably warmer. Yes, I understand we're getting a chinook, so this isn't entirely typical, but the past decade seems like we've had warmer Christmases than average.",2017-12-12 22:06:35+00:00,2017,12,12,1,Tuesday,50,22,winter,2014-2019_pre_pandemic_era,is anyone else getting weirded out by the weather? i ve been here years and i don t know if it s my imagination or selective memory but it feels like winters are getting noticeably warmer. yes i understand we re getting a chinook so this isn t entirely typical but the past decade seems like we ve had warmer christmases than average.,334,63,False,True,0,4,False,0.6421568627450981,0.06000000000000005,False,False,False,True,False,False,mid_growth,2017_H2,2017_Q4,7d7c114745643749,0.9398,0.212,0.788,0.0,positive
7n95jf,City of Edmonton cancels outdoor NYE activities at the Legislature due to extreme cold temperatures,,1514735592.0,116,40,None,0.97,/r/Edmonton/comments/7n95jf/city_of_edmonton_cancels_outdoor_nye_activities/,https://www.facebook.com/cityofedmonton/posts/10155985152014371,False,False,False,False,False,Edmonton,City of Edmonton cancels outdoor NYE activities at the Legislature due to extreme cold temperatures ,2017-12-31 15:53:12+00:00,2017,12,31,6,Sunday,52,15,winter,2014-2019_pre_pandemic_era,city of edmonton cancels outdoor nye activities at the legislature due to extreme cold temperatures,99,15,False,True,0,3,False,0.3418803418803419,0.030000000000000027,False,False,False,True,False,False,mid_growth,2017_H2,2017_Q4,02d17624dc2ffdf2,-0.2263,0.0,0.881,0.119,negative
7hw4lf,I'll see your Purolator claims of nonexistent winter storms and raise you Intelcom Express,,1512540085.0,100,64,None,0.99,/r/Edmonton/comments/7hw4lf/ill_see_your_purolator_claims_of_nonexistent/,https://i.imgur.com/hufXLWw.jpg,False,False,False,False,False,Edmonton,I'll see your Purolator claims of nonexistent winter storms and raise you Intelcom Express ,2017-12-06 06:01:25+00:00,2017,12,6,2,Wednesday,49,6,winter,2014-2019_pre_pandemic_era,i ll see your purolator claims of nonexistent winter storms and raise you intelcom express,90,15,False,True,0,2,False,0.6336633663366337,0.010000000000000009,False,False,False,True,False,False,mid_growth,2017_H2,2017_Q4,c47059ca879784df,0.0,0.0,1.0,0.0,neutral
7k8sin,Wondering where winter is?,,1513450820.0,1002,42,None,0.95,/r/Edmonton/comments/7k8sin/wondering_where_winter_is/,https://i.redd.it/985v240t0c401.jpg,False,False,False,False,False,Edmonton,Wondering where winter is? ,2017-12-16 19:00:20+00:00,2017,12,16,5,Saturday,50,19,winter,2014-2019_pre_pandemic_era,wondering where winter is?,26,4,False,True,0,1,False,0.04187437686939183,0.050000000000000044,False,False,False,True,False,False,mid_growth,2017_H2,2017_Q4,5baa97786ff8cad3,0.0,0.0,1.0,0.0,neutral
7lb1kd,"Owner of popular Regina restaurant crashes car through bank door, attempts to rob vault carrying a weapon, leaves the scene then assaults 2 officers. Gets an 18 month suspended sentence aka not a single day in jail.",,1513878228.0,25,16,News,0.9,/r/saskatchewan/comments/7lb1kd/owner_of_popular_regina_restaurant_crashes_car/,https://www.facebook.com/cbcsask/posts/10154948309211782,False,False,False,False,False,saskatchewan,"Owner of popular Regina restaurant crashes car through bank door, attempts to rob vault carrying a weapon, leaves the scene then assaults 2 officers. Gets an 18 month suspended sentence aka not a single day in jail. ",2017-12-21 17:43:48+00:00,2017,12,21,3,Thursday,51,17,winter,2014-2019_pre_pandemic_era,owner of popular regina restaurant crashes car through bank door attempts to rob vault carrying a weapon leaves the scene then assaults officers. gets an month suspended sentence aka not a single day in jail.,208,35,True,False,1,0,False,0.6153846153846154,0.09999999999999998,False,False,False,True,False,False,mid_growth,2017_H2,2017_Q4,79b1ccb700ad8714,-0.8519,0.09,0.637,0.273,negative
7mpwpi,“Saskatoon is colder than both the north and south poles”,,1514499586.0,23,13,None,0.96,/r/saskatchewan/comments/7mpwpi/saskatoon_is_colder_than_both_the_north_and_south/,http://thestarphoenix.com/news/canada/mars-and-the-north-pole-are-warmer-than-winnipeg-a-guide-to-how-damned-cold-it-is/wcm/12062254-d871-4531-8f01-647985ee3003,False,False,False,False,False,saskatchewan,“Saskatoon is colder than both the north and south poles” ,2017-12-28 22:19:46+00:00,2017,12,28,3,Thursday,52,22,winter,2014-2019_pre_pandemic_era,saskatoon is colder than both the north and south poles,55,10,False,True,0,1,False,0.5416666666666666,0.040000000000000036,False,False,False,True,False,False,mid_growth,2017_H2,2017_Q4,5a4aebdaeffdc48f,0.0,0.0,1.0,0.0,neutral
7jj83x,Good news! The 6 horses stolen from a central Alberta ranch have been found safe,,1513172276.0,126,5,None,0.97,/r/alberta/comments/7jj83x/good_news_the_6_horses_stolen_from_a_central/,https://globalnews.ca/news/3913928/6-stolen-horses-found-central-alberta/,False,False,False,False,False,alberta,Good news! The 6 horses stolen from a central Alberta ranch have been found safe ,2017-12-13 13:37:56+00:00,2017,12,13,2,Wednesday,50,13,winter,2014-2019_pre_pandemic_era,good news! the ADDRESS olen from a central alberta ranch have been found safe,77,14,True,False,2,0,False,0.03937007874015748,0.030000000000000027,False,False,False,True,False,False,mid_growth,2017_H2,2017_Q4,b1a2b867fc146846,0.7263,0.337,0.663,0.0,positive
7lb3bz,Calgary teacher accused of sexually assaulting teens faces 49 charges after more girls come forward,,1513878671.0,58,32,None,0.94,/r/alberta/comments/7lb3bz/calgary_teacher_accused_of_sexually_assaulting/,http://www.cbc.ca/news/canada/calgary/sexual-assault-luring-online-sarile-christian-victim-girls-charges-calgary-1.4460172,False,False,False,False,False,alberta,Calgary teacher accused of sexually assaulting teens faces 49 charges after more girls come forward ,2017-12-21 17:51:11+00:00,2017,12,21,3,Thursday,51,17,winter,2014-2019_pre_pandemic_era,calgary teacher accused of sexually assaulting teens faces charges after more girls come forward,96,14,True,False,1,0,False,0.5423728813559322,0.06000000000000005,False,False,False,True,False,False,mid_growth,2017_H2,2017_Q4,bc2fafac4bc2b860,-0.765,0.0,0.591,0.409,negative
7h8i99,Question regarding Traffic Safety Act Section 167(1)(c),"Tonight I was pulled over for speeding and received a ticket for “Failure to produce valid insurance”. I couldn’t find the insurance for a minute or two but did produce it in a semi-timely manner. The pink card was expired but I currently have existing insurance. The cop made it sound like I was getting a ticket for not taking it out in time. Is there a way I can get out of $233 on top of the speeding fine? 

[Here’s a link to the Traffic Safety Act, Section 167 is on page 175](http://www.qp.alberta.ca/documents/Acts/t06.pdf)",1512287362.0,6,67,None,0.69,/r/alberta/comments/7h8i99/question_regarding_traffic_safety_act_section/,https://www.reddit.com/r/alberta/comments/7h8i99/question_regarding_traffic_safety_act_section/,True,False,False,False,False,alberta,"Question regarding Traffic Safety Act Section 167(1)(c) Tonight I was pulled over for speeding and received a ticket for “Failure to produce valid insurance”. I couldn’t find the insurance for a minute or two but did produce it in a semi-timely manner. The pink card was expired but I currently have existing insurance. The cop made it sound like I was getting a ticket for not taking it out in time. Is there a way I can get out of $233 on top of the speeding fine? 

[Here’s a link to the Traffic Safety Act, Section 167 is on page 175](http://www.qp.alberta.ca/documents/Acts/t06.pdf)",2017-12-03 07:49:22+00:00,2017,12,3,6,Sunday,48,7,winter,2014-2019_pre_pandemic_era,question regarding traffic safety act section c tonight i was pulled over for speeding and received a ticket for failure to produce valid insurance . i couldn t find the insurance for a minute or two but did produce it in a semi timely manner. the pink card was expired but i currently have existing insurance. the cop made it sound like i was getting a ticket for not taking it out in time. is there a way i can get out of on top of the speeding fine? here s a link to the traffic safety act section is on page,511,102,True,False,1,0,False,9.571428571428571,0.31000000000000005,False,False,False,True,False,False,mid_growth,2017_H2,2017_Q4,2aa1ae6e5c71487e,0.8779,0.119,0.862,0.019,positive
7mmv1d,The end is in sight for this awful cold weather!,"It will be for that and hopefully other reasons, a *Happy New Year!* for all of us.",1514471108.0,16,22,None,0.79,/r/alberta/comments/7mmv1d/the_end_is_in_sight_for_this_awful_cold_weather/,https://www.reddit.com/r/alberta/comments/7mmv1d/the_end_is_in_sight_for_this_awful_cold_weather/,True,False,False,False,False,alberta,"The end is in sight for this awful cold weather! It will be for that and hopefully other reasons, a *Happy New Year!* for all of us.",2017-12-28 14:25:08+00:00,2017,12,28,3,Thursday,52,14,winter,2014-2019_pre_pandemic_era,the end is in sight for this awful cold weather! it will be for that and hopefully other reasons a happy new year! for all of us.,129,27,False,True,0,2,False,1.2941176470588236,0.20999999999999996,False,False,False,True,False,False,mid_growth,2017_H2,2017_Q4,ebefe6c88a381519,0.5399,0.203,0.696,0.101,positive
