id,title,selftext,created_utc,score,num_comments,link_flair_text,upvote_ratio,permalink,url,is_self,over_18,spoiler,stickied,locked,subreddit,full_text,created_date,year,month,day,day_of_week,day_name,week_of_year,hour,season,platform_period,cleaned_text,text_length,word_count,contains_crime_keywords,contains_weather_keywords,crime_keyword_count,weather_keyword_count,crime_and_weather,engagement_rate,controversy_score,is_2014,is_2015,is_2016,is_2017,is_2018,is_2019,reddit_growth_period,half_year,quarter,author_hash,sentiment_compound,sentiment_positive,sentiment_neutral,sentiment_negative,sentiment_category
2wvhcf,After reading a post on front page I need some advice (my boss is stealing from me),"I work for a local electrical contractor that has been in saskatoon for decades, not a fly by night operation.
Since I have been working here,(over 10 yrs now)my boss had been stealing from me, and not just me, every employee that works here.
Everyone here works a significant amount of O.T. and we are all paid straight time, no matter how many hours we work instead of time and a half after 40/hrs/week.
This has been going on so long at my company no one even thinks about it anymore, the only time it gets brought up is when we hire different journeyman electricians for our busy summer months, and they tell all of us how we are all getting burned by our boss, but every long term electrician here is to scared to say anything.
I know of one former employee at our company that put up a fight and told my boss that after YEARS of this shit he was going to goto the labour board and report him.
He was told outright by my boss, if he did so he would be fired and would never be hired by another electrical contractor in the province, because all the big contractors know each other and he would be labeled as a troublemaker.
Every week we work OT, and its booked in like it should be but then it's adjusted on our pay stubs as time and a half.
I.E. Work 15 hrs ot and your stub says 10 hrs of time and a half, when by law it should be the full 15.
So we are in fact being paid out base rate no matter how many hrs we work.
What can I do about this, without losing my job?
",1424702827.0,30,53,None,0.91,/r/saskatoon/comments/2wvhcf/after_reading_a_post_on_front_page_i_need_some/,https://www.reddit.com/r/saskatoon/comments/2wvhcf/after_reading_a_post_on_front_page_i_need_some/,True,False,False,False,False,Saskatoon,"After reading a post on front page I need some advice (my boss is stealing from me) I work for a local electrical contractor that has been in saskatoon for decades, not a fly by night operation.
Since I have been working here,(over 10 yrs now)my boss had been stealing from me, and not just me, every employee that works here.
Everyone here works a significant amount of O.T. and we are all paid straight time, no matter how many hours we work instead of time and a half after 40/hrs/week.
This has been going on so long at my company no one even thinks about it anymore, the only time it gets brought up is when we hire different journeyman electricians for our busy summer months, and they tell all of us how we are all getting burned by our boss, but every long term electrician here is to scared to say anything.
I know of one former employee at our company that put up a fight and told my boss that after YEARS of this shit he was going to goto the labour board and report him.
He was told outright by my boss, if he did so he would be fired and would never be hired by another electrical contractor in the province, because all the big contractors know each other and he would be labeled as a troublemaker.
Every week we work OT, and its booked in like it should be but then it's adjusted on our pay stubs as time and a half.
I.E. Work 15 hrs ot and your stub says 10 hrs of time and a half, when by law it should be the full 15.
So we are in fact being paid out base rate no matter how many hrs we work.
What can I do about this, without losing my job?
",2015-02-23 14:47:07+00:00,2015,2,23,0,Monday,9,14,winter,2014-2019_pre_pandemic_era,after reading a post on front page i need some advice my boss is stealing from me i work for a local electrical contractor that has been in saskatoon for decades not a fly by night operation. since i have been working here over yrs now my boss had been stealing from me and not just me every employee that works here. everyone here works a significant amount of o.t. and we are all paid straight time no matter how many hours we work instead of time and a half after hrs week. this has been going on so long at my company no one even thinks about it anymore the only time it gets brought up is when we hire different journeyman electricians for our busy summer months and they tell all of us how we are all getting burned by our boss but every long term electrician here is to scared to say anything. i know of one former employee at our company that put up a fight and told my boss that after years of this shit he was going to goto the labour board and report him. he was told outright by my boss if he did so he would be fired and would never be hired by another electrical contractor in the province because all the big contractors know each other and he would be labeled as a troublemaker. every week we work ot and its booked in like it should be but then it s adjusted on our pay stubs as time and a half. i.e. work ADDRESS ub says hrs of time and a half when by law it should be the full . so we are in fact being paid out base rate no matter how many hrs we work. what can i do about this without losing my job?,1520,308,False,True,0,1,False,1.7096774193548387,0.08999999999999997,False,True,False,False,False,False,early_growth,2015_H1,2015_Q1,ed76d73b756ce56d,-0.9726,0.027,0.877,0.096,negative
2v3v3g,taylor street driving test routes-SGI saskatoon,Hey guys! So I took my downtown road test and failed (le sigh) The blizzard coupled with an insanely picky driving instructor made for an unimpressive grade. I have rescheduled for the Taylor location in a few weeks and wondered if any of you guys knew some approximate routes I can practice on. Any help is welcome! (tricks and tips included!),1423330692.0,4,24,None,0.64,/r/saskatoon/comments/2v3v3g/taylor_street_driving_test_routessgi_saskatoon/,https://www.reddit.com/r/saskatoon/comments/2v3v3g/taylor_street_driving_test_routessgi_saskatoon/,True,False,False,False,False,Saskatoon,taylor street driving test routes-SGI saskatoon Hey guys! So I took my downtown road test and failed (le sigh) The blizzard coupled with an insanely picky driving instructor made for an unimpressive grade. I have rescheduled for the Taylor location in a few weeks and wondered if any of you guys knew some approximate routes I can practice on. Any help is welcome! (tricks and tips included!),2015-02-07 17:38:12+00:00,2015,2,7,5,Saturday,6,17,winter,2014-2019_pre_pandemic_era,taylor street driving test routes sgi saskatoon hey guys! so i took my downtown road test and failed le sigh the blizzard coupled with an insanely picky driving instructor made for an unimpressive grade. i have rescheduled for the taylor location in a few weeks and wondered if any of you guys knew some approximate routes i can practice on. any help is welcome! tricks and tips included!,388,68,False,True,0,1,False,4.8,0.36,False,True,False,False,False,False,early_growth,2015_H1,2015_Q1,b35bac429db6cc27,-0.3129,0.088,0.806,0.105,negative
2uli5g,Installing K&N Cold air intake,"I have a 2008 Honda Accord V6 and I am looking to get a K&N Cold Air intake installed in it. Now, I am not too car-savvy and I can't install it myself. I saw videos on youtube and doesn't look very challenging, but I would rather pay someone who knows what they are doing to get it installed. Anybody out there who does it or knows a shop where I can get it done?",1422934181.0,1,7,None,0.55,/r/regina/comments/2uli5g/installing_kn_cold_air_intake/,https://www.reddit.com/r/regina/comments/2uli5g/installing_kn_cold_air_intake/,True,False,False,False,False,Regina,"Installing K&N Cold air intake I have a 2008 Honda Accord V6 and I am looking to get a K&N Cold Air intake installed in it. Now, I am not too car-savvy and I can't install it myself. I saw videos on youtube and doesn't look very challenging, but I would rather pay someone who knows what they are doing to get it installed. Anybody out there who does it or knows a shop where I can get it done?",2015-02-03 03:29:41+00:00,2015,2,3,1,Tuesday,6,3,winter,2014-2019_pre_pandemic_era,installing k n cold air intake i have a honda accord v and i am looking to get a k n cold air intake installed in it. now i am not too car savvy and i can t install it myself. i saw videos on youtube and doesn t look very challenging but i would rather pay someone who knows what they are doing to get it installed. anybody out there who does it or knows a shop where i can get it done?,386,84,False,True,0,1,False,3.5,0.44999999999999996,False,True,False,False,False,False,early_growth,2015_H1,2015_Q1,314e8193cdd8900e,-0.0396,0.017,0.964,0.019,neutral
2vzt0p,Sun Dogs after yesterday's storm,,1424027081.0,41,5,None,1.0,/r/saskatchewan/comments/2vzt0p/sun_dogs_after_yesterdays_storm/,http://i.imgur.com/649Gkwy.jpg,False,False,False,False,False,saskatchewan,Sun Dogs after yesterday's storm ,2015-02-15 19:04:41+00:00,2015,2,15,6,Sunday,7,19,winter,2014-2019_pre_pandemic_era,sun dogs after yesterday s storm,32,6,False,True,0,1,False,0.11904761904761904,0.0,False,True,False,False,False,False,early_growth,2015_H1,2015_Q1,031dc4f377a92482,0.0,0.0,1.0,0.0,neutral
2w88cv,"Castle Mountain Resort closes for winter due to warm weather, lack of snow.",,1424203337.0,25,4,None,0.89,/r/alberta/comments/2w88cv/castle_mountain_resort_closes_for_winter_due_to/,http://globalnews.ca/news/1832857/castle-mountain-resort-closes-for-winter-due-to-warm-weather-lack-of-snow/,False,False,False,False,False,alberta,"Castle Mountain Resort closes for winter due to warm weather, lack of snow. ",2015-02-17 20:02:17+00:00,2015,2,17,1,Tuesday,8,20,winter,2014-2019_pre_pandemic_era,castle mountain resort closes for winter due to warm weather lack of snow.,74,13,False,True,0,4,False,0.15384615384615385,0.10999999999999999,False,True,False,False,False,False,early_growth,2015_H1,2015_Q1,4af3c8fb26c3c123,-0.1027,0.125,0.724,0.151,negative
