id,title,selftext,created_utc,score,num_comments,link_flair_text,upvote_ratio,permalink,url,is_self,over_18,spoiler,stickied,locked,subreddit,full_text,created_date,year,month,day,day_of_week,day_name,week_of_year,hour,season,platform_period,cleaned_text,text_length,word_count,contains_crime_keywords,contains_weather_keywords,crime_keyword_count,weather_keyword_count,crime_and_weather,engagement_rate,controversy_score,is_2014,is_2015,is_2016,is_2017,is_2018,is_2019,reddit_growth_period,half_year,quarter,author_hash,sentiment_compound,sentiment_positive,sentiment_neutral,sentiment_negative,sentiment_category
6atult,Asylum seeker charged with assault says he's not violent - Manitoba,,1494621510.0,1,4,None,0.52,/r/Manitoba/comments/6atult/asylum_seeker_charged_with_assault_says_hes_not/,http://www.cbc.ca/news/canada/manitoba/asylum-seeker-assault-charge-1.4107289,False,False,False,False,False,manitoba,Asylum seeker charged with assault says he's not violent - Manitoba ,2017-05-12 20:38:30+00:00,2017,5,12,4,Friday,19,20,spring,2014-2019_pre_pandemic_era,asylum seeker charged with assault says he s not violent manitoba,65,11,True,False,1,0,False,2.0,0.48,False,False,False,True,False,False,mid_growth,2017_H1,2017_Q2,69ea2da799038718,-0.3515,0.188,0.478,0.334,negative
6drt3f,When will Southern Manitoba finally get warm weather,"I'm talking like 27 - 32 degrees Celsius. Last year on May 5 temperatures hit 34 degrees, but this May it did not even go past 25 degrees Celsius here in Brandon. I'm hoping for warmer temperatures between June and early November.",1495942472.0,0,9,None,0.23,/r/Manitoba/comments/6drt3f/when_will_southern_manitoba_finally_get_warm/,https://www.reddit.com/r/Manitoba/comments/6drt3f/when_will_southern_manitoba_finally_get_warm/,True,False,False,False,False,manitoba,"When will Southern Manitoba finally get warm weather I'm talking like 27 - 32 degrees Celsius. Last year on May 5 temperatures hit 34 degrees, but this May it did not even go past 25 degrees Celsius here in Brandon. I'm hoping for warmer temperatures between June and early November.",2017-05-28 03:34:32+00:00,2017,5,28,6,Sunday,21,3,spring,2014-2019_pre_pandemic_era,when will southern manitoba finally get warm weather i m talking like degrees celsius. last year on may temperatures hit degrees but this may it did not even go past degrees celsius here in brandon. i m hoping for warmer temperatures between june and early november.,266,46,False,True,0,4,False,9.0,0.77,False,False,False,True,False,False,mid_growth,2017_H1,2017_Q2,4fa241cc211bfba9,0.8271,0.188,0.812,0.0,positive
6am50x,"Alberta government to review Photo Radar program and ensure it's being used for safety, not as a cash cow",,1494528535.0,139,169,None,0.97,/r/alberta/comments/6am50x/alberta_government_to_review_photo_radar_program/,http://glbn.ca/F7M1wA,False,False,False,False,False,alberta,"Alberta government to review Photo Radar program and ensure it's being used for safety, not as a cash cow ",2017-05-11 18:48:55+00:00,2017,5,11,3,Thursday,19,18,spring,2014-2019_pre_pandemic_era,alberta government to review photo radar program and ensure it s being used for safety not as a cash cow,104,20,True,True,1,1,True,1.207142857142857,0.030000000000000027,False,False,False,True,False,False,mid_growth,2017_H1,2017_Q2,3a719ad1537421d1,0.6597,0.231,0.769,0.0,positive
6cqv06,‘Abrupt change in the weather’ looming for Alberta: Environment Canada,,1495495096.0,62,23,None,0.93,/r/alberta/comments/6cqv06/abrupt_change_in_the_weather_looming_for_alberta/,http://globalnews.ca/news/3469603/abrupt-change-in-the-weather-looming-for-alberta-environment-canada/?utm_source=GlobalEdmonton&utm_medium=Facebook,False,False,False,False,False,alberta,‘Abrupt change in the weather’ looming for Alberta: Environment Canada ,2017-05-22 23:18:16+00:00,2017,5,22,0,Monday,21,23,spring,2014-2019_pre_pandemic_era,abrupt change in the weather looming for alberta environment canada,67,10,False,True,0,1,False,0.36507936507936506,0.06999999999999995,False,False,False,True,False,False,mid_growth,2017_H1,2017_Q2,749dd5b8795c86e0,-0.128,0.0,0.857,0.143,negative
6c115f,"Business, Non-Profit, and Institutional Energy Savings program details released","https://www.efficiencyalberta.ca/business-non-profit-and-institutional/

**tl;dr:** Some improvements to what they posted before, but the rebates are only useful if you happened to be doing this exact work anyway and sometimes not even then.

For example, their rebates for LED bulbs now cover 60W-equivalent (they previously said they would not).  But the rebates are only $1.50 per bulb.  So unless you can combine rebates with the residential program, and I'm reasonably certain they won't let you do that, you'd do better just going to a big box store and buying bulbs off the shelf.

Four foot LED tubes UL Type B are now covered (they were excluded before).  Rebate is $5/tube.  The problem is the fixture must be recertified to receive the rebate.  Recertification costs $17 per fixture in volume.  My electrical inspector says recertification is not necessary, so in this case its only purpose is so you can apply for the rebate.  So I could retrofit a 2-tube fixture for $9+$9=$18, or use the program $9+$9+$17-$5-$5=$25.  It costs MORE to use the rebate program.  If anyone knows how to get fixtures recertified for cheap, let me know.  All they do is check the temperature and slap a label on saying it's been modified.  I have no idea why it's so expensive.

2x4 troffer retrofit kits carry a rebate of $45.  (Retrofit kits cost around $200, so the rebate covers a little under 25%.)  For $45 I could install two Type B tubes, have the fixture recertified, and produce the same number of lumens as a retrofit kit...AND have money left over.  But forget that; why would we want to make the rebates attractive?

Downlight fixtures carry a $9 or $10 rebate under the Business program but $15 under Residential.

I wasn't really interested in the rest because it doesn't apply to my facility, but all the rebates are posted on their website if you want to read them.

I wish the rebates were based on a reduction in energy consumption instead of specific types of products.  It makes no sense that two products that produce the same light and are equally efficient but are priced differently carry different rebates.",1495162115.0,6,3,None,0.72,/r/alberta/comments/6c115f/business_nonprofit_and_institutional_energy/,https://www.reddit.com/r/alberta/comments/6c115f/business_nonprofit_and_institutional_energy/,True,False,False,False,False,alberta,"Business, Non-Profit, and Institutional Energy Savings program details released https://www.efficiencyalberta.ca/business-non-profit-and-institutional/

**tl;dr:** Some improvements to what they posted before, but the rebates are only useful if you happened to be doing this exact work anyway and sometimes not even then.

For example, their rebates for LED bulbs now cover 60W-equivalent (they previously said they would not).  But the rebates are only $1.50 per bulb.  So unless you can combine rebates with the residential program, and I'm reasonably certain they won't let you do that, you'd do better just going to a big box store and buying bulbs off the shelf.

Four foot LED tubes UL Type B are now covered (they were excluded before).  Rebate is $5/tube.  The problem is the fixture must be recertified to receive the rebate.  Recertification costs $17 per fixture in volume.  My electrical inspector says recertification is not necessary, so in this case its only purpose is so you can apply for the rebate.  So I could retrofit a 2-tube fixture for $9+$9=$18, or use the program $9+$9+$17-$5-$5=$25.  It costs MORE to use the rebate program.  If anyone knows how to get fixtures recertified for cheap, let me know.  All they do is check the temperature and slap a label on saying it's been modified.  I have no idea why it's so expensive.

2x4 troffer retrofit kits carry a rebate of $45.  (Retrofit kits cost around $200, so the rebate covers a little under 25%.)  For $45 I could install two Type B tubes, have the fixture recertified, and produce the same number of lumens as a retrofit kit...AND have money left over.  But forget that; why would we want to make the rebates attractive?

Downlight fixtures carry a $9 or $10 rebate under the Business program but $15 under Residential.

I wasn't really interested in the rest because it doesn't apply to my facility, but all the rebates are posted on their website if you want to read them.

I wish the rebates were based on a reduction in energy consumption instead of specific types of products.  It makes no sense that two products that produce the same light and are equally efficient but are priced differently carry different rebates.",2017-05-19 02:48:35+00:00,2017,5,19,4,Friday,20,2,spring,2014-2019_pre_pandemic_era,business non profit and institutional energy savings program details released tl dr some improvements to what they posted before but the rebates are only useful if you happened to be doing this exact work anyway and sometimes not even then. for example their rebates for led bulbs now cover w equivalent they previously said they would not . but the rebates are only . per bulb. so unless you can combine rebates with the residential program and i m reasonably certain they won t let you do that you d do better just going to a big box store and buying bulbs off the shelf. four foot led tubes ul type b are now covered they were excluded before . rebate is tube. the problem is the fixture must be recertified to receive the rebate. recertification costs per fixture in volume. my electrical inspector says recertification is not necessary so in this case its only purpose is so you can apply for the rebate. so i could retrofit a tube fixture for or use the program . it costs more to use the rebate program. if anyone knows how to get fixtures recertified for cheap let me know. all they do is check the temperature and slap a label on saying it s been modified. i have no idea why it s so expensive. x troffer retrofit kits carry a rebate of . retrofit kits cost around so the rebate covers a little under . for i could install two type b tubes have the fixture recertified and produce the same number of lumens as a retrofit kit...and have money left over. but forget that why would we want to make the rebates attractive? downlight fixtures carry a or rebate under the business program but under residential. i wasn t really interested in the rest because it doesn t apply to my facility but all the rebates are posted on their website if you want to read them. i wish the rebates were based on a reduction in energy consumption instead of specific types of products. it makes no sense that two products that produce the same light and are equally efficient but are priced differently carry different rebates.,2015,369,False,True,0,1,False,0.42857142857142855,0.28,False,False,False,True,False,False,mid_growth,2017_H1,2017_Q2,89be882b7f545e28,0.9797,0.109,0.855,0.036,positive
6b572j,Blizzard of embers sparked fires that burned Fort McMurray homes last year,,1494784221.0,9,6,None,0.74,/r/alberta/comments/6b572j/blizzard_of_embers_sparked_fires_that_burned_fort/,http://www.ctvnews.ca/canada/blizzard-of-embers-sparked-fires-that-burned-fort-mcmurray-homes-last-year-1.3413024,False,False,False,False,False,alberta,Blizzard of embers sparked fires that burned Fort McMurray homes last year ,2017-05-14 17:50:21+00:00,2017,5,14,6,Sunday,19,17,spring,2014-2019_pre_pandemic_era,blizzard of embers sparked fires that burned fort mcmurray homes last year,74,12,False,True,0,1,False,0.6,0.26,False,False,False,True,False,False,mid_growth,2017_H1,2017_Q2,4d13bcb24698041e,0.0,0.0,1.0,0.0,neutral
