id,title,selftext,created_utc,score,num_comments,link_flair_text,upvote_ratio,permalink,url,is_self,over_18,spoiler,stickied,locked,subreddit,full_text,created_date,year,month,day,day_of_week,day_name,week_of_year,hour,season,platform_period,cleaned_text,text_length,word_count,contains_crime_keywords,contains_weather_keywords,crime_keyword_count,weather_keyword_count,crime_and_weather,engagement_rate,controversy_score,is_2014,is_2015,is_2016,is_2017,is_2018,is_2019,reddit_growth_period,half_year,quarter,author_hash,sentiment_compound,sentiment_positive,sentiment_neutral,sentiment_negative,sentiment_category
86tixq,Complainant at centre of Sask. NDP assault allegation investigated for electoral database breach - Rylee Schuhmacher says she did nothing wrong,,1521903491.0,9,16,None,0.76,/r/saskatoon/comments/86tixq/complainant_at_centre_of_sask_ndp_assault/,http://www.cbc.ca/beta/news/canada/saskatchewan/saskatchewan-ndp-database-1.4588854,False,False,False,False,False,Saskatoon,Complainant at centre of Sask. NDP assault allegation investigated for electoral database breach - Rylee Schuhmacher says she did nothing wrong ,2018-03-24 14:58:11+00:00,2018,3,24,5,Saturday,12,14,spring,2014-2019_pre_pandemic_era,complainant at centre of sask. ndp assault allegation investigated for electoral database breach rylee schuhmacher says she did nothing wrong,141,20,True,False,1,0,False,1.6,0.24,False,False,False,False,True,False,mature_growth,2018_H1,2018_Q1,3c4a113e5d027a83,-0.449,0.102,0.679,0.22,negative
87jw54,'Outrageous disregard for safety'; Saskatoon parents launch lawsuit over autistic 5-year-old's drowning death,,1522168764.0,1,40,None,0.52,/r/saskatoon/comments/87jw54/outrageous_disregard_for_safety_saskatoon_parents/,http://www.cbc.ca/news/canada/saskatoon/lawsuit-saskatoon-autistic-child-drowning-1.4595045,False,False,False,False,False,Saskatoon,'Outrageous disregard for safety'; Saskatoon parents launch lawsuit over autistic 5-year-old's drowning death ,2018-03-27 16:39:24+00:00,2018,3,27,1,Tuesday,13,16,spring,2014-2019_pre_pandemic_era,outrageous disregard for safety saskatoon parents launch lawsuit over autistic year old s drowning death,104,15,True,False,1,0,False,20.0,0.48,False,False,False,False,True,False,mature_growth,2018_H1,2018_Q1,7b21cd0e65829dac,-0.7964,0.118,0.422,0.46,negative
824en0,Lousy Smarch Weather.,,1520236960.0,87,7,None,0.96,/r/saskatoon/comments/824en0/lousy_smarch_weather/,https://i.redd.it/tju40tbfjwj01.jpg,False,False,False,False,False,Saskatoon,Lousy Smarch Weather. ,2018-03-05 08:02:40+00:00,2018,3,5,0,Monday,10,8,spring,2014-2019_pre_pandemic_era,lousy smarch weather.,21,3,False,True,0,1,False,0.07954545454545454,0.040000000000000036,False,False,False,False,True,False,mature_growth,2018_H1,2018_Q1,e6eec755af340f20,-0.5423,0.0,0.364,0.636,negative
84ahc4,What Dundonald Storm Water Pond was promised to be kept like and was maintained like for many years!,,1520999967.0,0,15,None,0.5,/r/saskatoon/comments/84ahc4/what_dundonald_storm_water_pond_was_promised_to/,https://i.redd.it/twamjnp3knl01.jpg,False,False,False,False,False,Saskatoon,What Dundonald Storm Water Pond was promised to be kept like and was maintained like for many years! ,2018-03-14 03:59:27+00:00,2018,3,14,2,Wednesday,11,3,spring,2014-2019_pre_pandemic_era,what dundonald storm water pond was promised to be kept like and was maintained like for many years!,100,18,False,True,0,1,False,15.0,0.5,False,False,False,False,True,False,mature_growth,2018_H1,2018_Q1,238032db66232d6e,0.7777,0.342,0.658,0.0,positive
829c2k,Snow routes declared...,,1520283861.0,19,11,News,0.95,/r/regina/comments/829c2k/snow_routes_declared/,https://twitter.com/CityofRegina/status/970766022176313344,False,False,False,False,False,Regina,Snow routes declared... ,2018-03-05 21:04:21+00:00,2018,3,5,0,Monday,10,21,spring,2014-2019_pre_pandemic_era,snow routes declared...,23,3,False,True,0,1,False,0.55,0.050000000000000044,False,False,False,False,True,False,mature_growth,2018_H1,2018_Q1,8133a8f2120f7850,0.0,0.0,1.0,0.0,neutral
82iuwy,City cancelling parking tickets (except for snow route tickets),,1520372538.0,19,4,News,0.92,/r/regina/comments/82iuwy/city_cancelling_parking_tickets_except_for_snow/,https://facebook.com/story.php?story_fbid=10155322294607286&id=139114992285,False,False,False,False,False,Regina,City cancelling parking tickets (except for snow route tickets) ,2018-03-06 21:42:18+00:00,2018,3,6,1,Tuesday,10,21,spring,2014-2019_pre_pandemic_era,city cancelling parking tickets except for snow route tickets,61,9,False,True,0,1,False,0.2,0.07999999999999996,False,False,False,False,True,False,mature_growth,2018_H1,2018_Q1,504fb182b8a98b1d,-0.2023,0.0,0.816,0.184,negative
86p36q,X post from parent worried about their son in the storm.,,1521847236.0,14,0,None,0.94,/r/regina/comments/86p36q/x_post_from_parent_worried_about_their_son_in_the/,https://www.reddit.com/r/saskatchewan/comments/86op4m/anyone_see_a_white_truck_off_hwy_1_between/,False,False,False,False,False,Regina,X post from parent worried about their son in the storm. ,2018-03-23 23:20:36+00:00,2018,3,23,4,Friday,12,23,spring,2014-2019_pre_pandemic_era,x post from parent worried about their son in the storm.,56,11,False,True,0,1,False,0.0,0.06000000000000005,False,False,False,False,True,False,mature_growth,2018_H1,2018_Q1,5b8685724000f9aa,-0.296,0.0,0.82,0.18,negative
82h0sn,Open Letter to those that hate Parking Enforcement,"Lay off them. They are doing a job that supplies them a living wage, benefit and probably a pension plan.  

I saw a FB post going around calling them out for ticketing people during the snow storm. They are just doing there jobs. If they don’t ticket people then they run the risk of losing their jobs. If you received a ticket please contact the Commissioner on the back of your ticket and explain to them that you were stuck and couldn’t move your vehicle. The Commissioners will most likely throw your ticket out. 

They are doing a thankless job and I have seen first hand the verbal abuse they take. You would not like it if I walking into your place of work and started calling you a “worthless piece of shit” and berate you infront of your coworkers. 

Please be civil with them 

Signed a citizen of Regina 

Edit:
I never wanted to argue the merit of tickets. I just wanted to people to stop yelling and belittling the Parking Enforcement for doing their job. 

If you have a problem with the parking rules then talk to your City Councillor.  I am tired of defending any city parking ordinance 

Edit 2:
The Mayor just cancelled all tickets from Monday Morning to Wednesday morning ",1520358805.0,23,58,None,0.64,/r/regina/comments/82h0sn/open_letter_to_those_that_hate_parking_enforcement/,https://www.reddit.com/r/regina/comments/82h0sn/open_letter_to_those_that_hate_parking_enforcement/,True,False,False,False,False,Regina,"Open Letter to those that hate Parking Enforcement Lay off them. They are doing a job that supplies them a living wage, benefit and probably a pension plan.  

I saw a FB post going around calling them out for ticketing people during the snow storm. They are just doing there jobs. If they don’t ticket people then they run the risk of losing their jobs. If you received a ticket please contact the Commissioner on the back of your ticket and explain to them that you were stuck and couldn’t move your vehicle. The Commissioners will most likely throw your ticket out. 

They are doing a thankless job and I have seen first hand the verbal abuse they take. You would not like it if I walking into your place of work and started calling you a “worthless piece of shit” and berate you infront of your coworkers. 

Please be civil with them 

Signed a citizen of Regina 

Edit:
I never wanted to argue the merit of tickets. I just wanted to people to stop yelling and belittling the Parking Enforcement for doing their job. 

If you have a problem with the parking rules then talk to your City Councillor.  I am tired of defending any city parking ordinance 

Edit 2:
The Mayor just cancelled all tickets from Monday Morning to Wednesday morning ",2018-03-06 17:53:25+00:00,2018,3,6,1,Tuesday,10,17,spring,2014-2019_pre_pandemic_era,open letter to those that hate parking enforcement lay off them. they are doing a job that supplies them a living wage benefit and probably a pension plan. i saw a fb post going around calling them out for ticketing people during the snow storm. they are just doing there jobs. if they don t ticket people then they run the risk of losing their jobs. if you received a ticket please contact the commissioner on the back of your ticket and explain to them that you were stuck and couldn t move your vehicle. the commissioners will most likely throw your ticket out. they are doing a thankless job and i have seen first hand the verbal abuse they take. you would not like it if i walking into your place of work and started calling you a worthless piece of shit and berate you infront of your coworkers. please be civil with them signed a citizen of regina edit i never wanted to argue the merit of tickets. i just wanted to people to stop yelling and belittling the parking enforcement for doing their job. if you have a problem with the parking rules then talk to your city councillor. i am tired of defending any city parking ordinance edit the mayor just cancelled all tickets from monday morning to wednesday morning,1219,224,False,True,0,2,False,2.4166666666666665,0.36,False,False,False,False,True,False,mature_growth,2018_H1,2018_Q1,96405fdf5f790b41,-0.9466,0.061,0.809,0.13,negative
81i506,Frankie has spoken...storm coming Monday,,1520024251.0,111,31,News,0.92,/r/Winnipeg/comments/81i506/frankie_has_spokenstorm_coming_monday/,https://twitter.com/frankiemacd/status/969669391301439490,False,False,False,False,False,Winnipeg,Frankie has spoken...storm coming Monday ,2018-03-02 20:57:31+00:00,2018,3,2,4,Friday,9,20,spring,2014-2019_pre_pandemic_era,frankie has spoken...storm coming monday,40,5,False,True,0,1,False,0.2767857142857143,0.07999999999999996,False,False,False,False,True,False,mature_growth,2018_H1,2018_Q1,d6dc0caf2d6910cf,0.0,0.0,1.0,0.0,neutral
83joy9,Hi! I'm from Winnipeg and I make stuff out of glass because I can't make friends. Recently joined Reddit and thought I'd share this photo from the summer,,1520732381.0,391,99,Pictures/Video,0.94,/r/Winnipeg/comments/83joy9/hi_im_from_winnipeg_and_i_make_stuff_out_of_glass/,http://imgur.com/uBpK6QS,False,False,False,False,False,Winnipeg,Hi! I'm from Winnipeg and I make stuff out of glass because I can't make friends. Recently joined Reddit and thought I'd share this photo from the summer ,2018-03-11 01:39:41+00:00,2018,3,11,6,Sunday,10,1,spring,2014-2019_pre_pandemic_era,hi! i m from winnipeg and i make stuff out of glass because i can t make friends. recently joined reddit and thought i d share this photo from the summer,153,31,False,True,0,2,False,0.25255102040816324,0.06000000000000005,False,False,False,False,True,False,mature_growth,2018_H1,2018_Q1,bd2d0aa602341e70,0.68,0.162,0.838,0.0,positive
864519,"Edmonton police lay 460 charges against 32 youths, 2 adults in massive roving teenage crime ring",,1521654554.0,310,276,None,0.98,/r/Edmonton/comments/864519/edmonton_police_lay_460_charges_against_32_youths/,https://globalnews.ca/news/4096862/edmonton-teenage-theft-ring/,False,False,False,False,False,Edmonton,"Edmonton police lay 460 charges against 32 youths, 2 adults in massive roving teenage crime ring ",2018-03-21 17:49:14+00:00,2018,3,21,2,Wednesday,12,17,spring,2014-2019_pre_pandemic_era,edmonton police lay charges against youths adults in massive roving teenage crime ring,86,13,True,False,2,0,False,0.887459807073955,0.020000000000000018,False,False,False,False,True,False,mature_growth,2018_H1,2018_Q1,b1a2b867fc146846,-0.6808,0.0,0.663,0.337,negative
87tmzv,"Man in life-threatening condition after overnight crime spree involving home invasion, robbery, kidnapping, shooting",,1522256987.0,52,58,None,0.98,/r/Edmonton/comments/87tmzv/man_in_lifethreatening_condition_after_overnight/,https://globalnews.ca/news/4110789/northeast-edmonton-police-manning-drive/,False,False,False,False,False,Edmonton,"Man in life-threatening condition after overnight crime spree involving home invasion, robbery, kidnapping, shooting ",2018-03-28 17:09:47+00:00,2018,3,28,2,Wednesday,13,17,spring,2014-2019_pre_pandemic_era,man in life threatening condition after overnight crime spree involving home invasion robbery kidnapping shooting,113,15,True,False,3,0,False,1.0943396226415094,0.020000000000000018,False,False,False,False,True,False,mature_growth,2018_H1,2018_Q1,b1a2b867fc146846,-0.7845,0.0,0.653,0.347,negative
81jws7,Where is this Snow Storm?,25cm snow storm warning was reported for today. Where is the snow?,1520033828.0,24,42,None,0.92,/r/Edmonton/comments/81jws7/where_is_this_snow_storm/,https://www.reddit.com/r/Edmonton/comments/81jws7/where_is_this_snow_storm/,True,False,False,False,False,Edmonton,Where is this Snow Storm? 25cm snow storm warning was reported for today. Where is the snow?,2018-03-02 23:37:08+00:00,2018,3,2,4,Friday,9,23,spring,2014-2019_pre_pandemic_era,where is this snow storm? cm snow storm warning was reported for today. where is the snow?,90,17,False,True,0,2,False,1.68,0.07999999999999996,False,False,False,False,True,False,mature_growth,2018_H1,2018_Q1,07ddcf123d74bd47,-0.4137,0.0,0.853,0.147,negative
87a384,The New LRT - Arriving This Summer,,1522079006.0,361,61,None,0.97,/r/Edmonton/comments/87a384/the_new_lrt_arriving_this_summer/,https://pbs.twimg.com/media/DZOZWKeVMAATYA8.jpg,False,False,False,False,False,Edmonton,The New LRT - Arriving This Summer ,2018-03-26 15:43:26+00:00,2018,3,26,0,Monday,13,15,spring,2014-2019_pre_pandemic_era,the new lrt arriving this summer,32,6,False,True,0,1,False,0.1685082872928177,0.030000000000000027,False,False,False,False,True,False,mature_growth,2018_H1,2018_Q1,9d5e906794259f20,0.0,0.0,1.0,0.0,neutral
86i5eb,The Sheaf - USSU President To Refuse Transition After Candidate Accused of Sexual Assault,,1521780896.0,21,15,None,0.87,/r/saskatchewan/comments/86i5eb/the_sheaf_ussu_president_to_refuse_transition/,http://thesheaf.com/2018/03/22/ussu-president-deon-to-refuse-transition-after-incoming-candidate-accused-of-sexual-assault/,False,False,False,False,False,saskatchewan,The Sheaf - USSU President To Refuse Transition After Candidate Accused of Sexual Assault ,2018-03-23 04:54:56+00:00,2018,3,23,4,Friday,12,4,spring,2014-2019_pre_pandemic_era,the sheaf ussu president to refuse transition after candidate accused of sexual assault,87,13,True,False,1,0,False,0.6818181818181818,0.13,False,False,False,False,True,False,mature_growth,2018_H1,2018_Q1,44c64cbaaeed0ddc,-0.802,0.0,0.549,0.451,negative
86p65z,I hear you've been getting a bit of weather out today.,,1521848009.0,24,4,None,0.92,/r/saskatchewan/comments/86p65z/i_hear_youve_been_getting_a_bit_of_weather_out/,https://i.redd.it/cmotx1sxlln01.jpg,False,False,False,False,False,saskatchewan,I hear you've been getting a bit of weather out today. ,2018-03-23 23:33:29+00:00,2018,3,23,4,Friday,12,23,spring,2014-2019_pre_pandemic_era,i hear you ve been getting a bit of weather out today.,54,12,False,True,0,1,False,0.16,0.07999999999999996,False,False,False,False,True,False,mature_growth,2018_H1,2018_Q1,07cd4c533b38cd25,0.0,0.0,1.0,0.0,neutral
82dyx8,Any good snow photos?,"simplistic follow placid gold nutty numerous treatment unwritten books reply

 *This post was mass deleted and anonymized with [Redact](https://redact.dev/home)*",1520330736.0,4,3,None,0.63,/r/saskatchewan/comments/82dyx8/any_good_snow_photos/,https://www.reddit.com/r/saskatchewan/comments/82dyx8/any_good_snow_photos/,True,False,False,False,False,saskatchewan,"Any good snow photos? simplistic follow placid gold nutty numerous treatment unwritten books reply

 *This post was mass deleted and anonymized with [Redact](https://redact.dev/home)*",2018-03-06 10:05:36+00:00,2018,3,6,1,Tuesday,10,10,spring,2014-2019_pre_pandemic_era,any good snow photos? simplistic follow placid gold nutty numerous treatment unwritten books reply this post was mass deleted and anonymized with redact,152,23,False,True,0,2,False,0.6,0.37,False,False,False,False,True,False,mature_growth,2018_H1,2018_Q1,ec1f27e3c7c9c92f,0.4404,0.116,0.884,0.0,positive
85btrv,Another winter blast striking southwestern Saskatchewan this weekend | 620 CKRM The Source,,1521386317.0,1,0,None,0.57,/r/saskatchewan/comments/85btrv/another_winter_blast_striking_southwestern/,http://www.620ckrm.com/2018/03/17/another-winter-blast-striking-saskatchewan-this-weekend/,False,False,False,False,False,saskatchewan,Another winter blast striking southwestern Saskatchewan this weekend | 620 CKRM The Source ,2018-03-18 15:18:37+00:00,2018,3,18,6,Sunday,11,15,spring,2014-2019_pre_pandemic_era,another winter blast striking southwestern saskatchewan this weekend ckrm the source,84,11,False,True,0,1,False,0.0,0.43000000000000005,False,False,False,False,True,False,mature_growth,2018_H1,2018_Q1,1d2a86b4150a6a10,0.0,0.0,1.0,0.0,neutral
839t0i,"Alberta announces $10M, 39 RCMP officer positions, to fight rural crime",,1520626985.0,114,52,None,0.97,/r/alberta/comments/839t0i/alberta_announces_10m_39_rcmp_officer_positions/,https://globalnews.ca/news/4073295/alberta-funding-politics-rural-crime-rcmp/,False,False,False,False,False,alberta,"Alberta announces $10M, 39 RCMP officer positions, to fight rural crime ",2018-03-09 20:23:05+00:00,2018,3,9,4,Friday,10,20,spring,2014-2019_pre_pandemic_era,alberta announces m rcmp officer positions to fight rural crime,63,10,True,False,2,0,False,0.45217391304347826,0.030000000000000027,False,False,False,False,True,False,mature_growth,2018_H1,2018_Q1,7853603950226e98,-0.7269,0.0,0.567,0.433,negative
881lvt,"Red Deer weathers 'perfect storm' of recession, crime and addiction to find its way forward",,1522333028.0,72,49,Opioid Crisis,0.97,/r/alberta/comments/881lvt/red_deer_weathers_perfect_storm_of_recession/,http://www.cbc.ca/news/canada/calgary/red-deer-perfect-storm-recession-crime-addiction-1.4598301,False,False,False,False,False,alberta,"Red Deer weathers 'perfect storm' of recession, crime and addiction to find its way forward ",2018-03-29 14:17:08+00:00,2018,3,29,3,Thursday,13,14,spring,2014-2019_pre_pandemic_era,red deer weathers perfect storm of recession crime and addiction to find its way forward,88,15,True,True,1,2,True,0.6712328767123288,0.030000000000000027,False,False,False,False,True,False,mature_growth,2018_H1,2018_Q1,fe05c2a01ea42097,-0.3818,0.168,0.545,0.286,negative
879vn5,"""A wakeup call"": Edmonton police charge more than 30 teens in series of crimes",,1522077369.0,83,43,None,0.96,/r/alberta/comments/879vn5/a_wakeup_call_edmonton_police_charge_more_than_30/,http://www.metronews.ca/news/edmonton/2018/03/21/a-wakeup-call-edmonton-police-charge-more-than-30-teens-in-series-of-crimes.html,False,False,False,False,False,alberta,"""A wakeup call"": Edmonton police charge more than 30 teens in series of crimes ",2018-03-26 15:16:09+00:00,2018,3,26,0,Monday,13,15,spring,2014-2019_pre_pandemic_era,a wakeup call edmonton police charge more than teens in series of crimes,72,13,True,False,2,0,False,0.5119047619047619,0.040000000000000036,False,False,False,False,True,False,mature_growth,2018_H1,2018_Q1,82675c1f6c59c6ef,0.0,0.0,1.0,0.0,neutral
88iti4,Right-wing ‘traditionalists’ use video of white people rioting to warn about a ‘black crime wave’,,1522505063.0,40,17,None,0.65,/r/alberta/comments/88iti4/rightwing_traditionalists_use_video_of_white/,https://www.rawstory.com/2018/03/right-wing-traditionalists-use-video-white-people-rioting-warn-black-crime-wave/,False,False,False,False,False,alberta,Right-wing ‘traditionalists’ use video of white people rioting to warn about a ‘black crime wave’ ,2018-03-31 14:04:23+00:00,2018,3,31,5,Saturday,13,14,spring,2014-2019_pre_pandemic_era,right wing traditionalists use video of white people rioting to warn about a black crime wave,93,16,True,False,1,0,False,0.4146341463414634,0.35,False,False,False,False,True,False,mature_growth,2018_H1,2018_Q1,f216e5b12aa6e674,-0.5994,0.0,0.741,0.259,negative
866mab,"Edmonton police announce hundreds of charges laid against 32 teens, 2 men for thefts and attacks over past year",,1521672216.0,81,18,None,0.98,/r/alberta/comments/866mab/edmonton_police_announce_hundreds_of_charges_laid/,https://globalnews.ca/news/4096862/edmonton-teenage-theft-ring/,False,False,False,False,False,alberta,"Edmonton police announce hundreds of charges laid against 32 teens, 2 men for thefts and attacks over past year ",2018-03-21 22:43:36+00:00,2018,3,21,2,Wednesday,12,22,spring,2014-2019_pre_pandemic_era,edmonton police announce hundreds of charges laid against teens men for thefts and attacks over past year,105,17,True,False,2,0,False,0.21951219512195122,0.020000000000000018,False,False,False,False,True,False,mature_growth,2018_H1,2018_Q1,0618895b4bf7020d,-0.6124,0.0,0.75,0.25,negative
82kdkc,"Alberta leads the country in auto thefts, police say",,1520385458.0,18,20,None,0.86,/r/alberta/comments/82kdkc/alberta_leads_the_country_in_auto_thefts_police/,http://edmontonjournal.com/news/local-news/alberta-the-worst-province-for-auto-thefts-say-police-launching-anti-theft-campaign,False,False,False,False,False,alberta,"Alberta leads the country in auto thefts, police say ",2018-03-07 01:17:38+00:00,2018,3,7,2,Wednesday,10,1,spring,2014-2019_pre_pandemic_era,alberta leads the country in auto thefts police say,51,9,True,False,2,0,False,1.0526315789473684,0.14,False,False,False,False,True,False,mature_growth,2018_H1,2018_Q1,c2c34c94ea44c9ed,0.0,0.0,1.0,0.0,neutral
82n9vc,Number of vehicle thefts in Alberta ‘staggering’: Alberta Motor Association,,1520417909.0,40,9,None,0.97,/r/alberta/comments/82n9vc/number_of_vehicle_thefts_in_alberta_staggering/,https://globalnews.ca/news/4065962/alberta-vehicle-thefts/,False,False,False,False,False,alberta,Number of vehicle thefts in Alberta ‘staggering’: Alberta Motor Association ,2018-03-07 10:18:29+00:00,2018,3,7,2,Wednesday,10,10,spring,2014-2019_pre_pandemic_era,number of vehicle thefts in alberta staggering alberta motor association,72,10,True,False,1,0,False,0.21951219512195122,0.030000000000000027,False,False,False,False,True,False,mature_growth,2018_H1,2018_Q1,a5edee89130a8461,0.0772,0.126,0.874,0.0,positive
87dmql,"Wetaskiwin RCMP Arrest Four in Break and Enter, Robbery, Mischief and Theft.",,1522105884.0,1,5,None,0.57,/r/alberta/comments/87dmql/wetaskiwin_rcmp_arrest_four_in_break_and_enter/,http://www.canadapolicereport.ca/2018/03/26/wetaskiwin-rcmp-arrest-four-in-break-and-enter-robbery-mischief-and-theft/,False,False,False,False,False,alberta,"Wetaskiwin RCMP Arrest Four in Break and Enter, Robbery, Mischief and Theft. ",2018-03-26 23:11:24+00:00,2018,3,26,0,Monday,13,23,spring,2014-2019_pre_pandemic_era,wetaskiwin rcmp arrest four in break and enter robbery mischief and theft.,74,12,True,False,5,0,False,2.5,0.43000000000000005,False,False,False,False,True,False,mature_growth,2018_H1,2018_Q1,449b23568e8e30e0,-0.5994,0.0,0.671,0.329,negative
