id,title,selftext,created_utc,score,num_comments,link_flair_text,upvote_ratio,permalink,url,is_self,over_18,spoiler,stickied,locked,subreddit,full_text,created_date,year,month,day,day_of_week,day_name,week_of_year,hour,season,platform_period,cleaned_text,text_length,word_count,contains_crime_keywords,contains_weather_keywords,contains_pandemic_keywords,crime_keyword_count,weather_keyword_count,pandemic_keyword_count,crime_and_weather_and_pandemic,engagement_rate,controversy_score,is_2020,is_2021,pre_pandemic_declared,post_pandemic_declared,vaccine_rollout,major_variant_wave,quarter,author_hash,sentiment_compound,sentiment_positive,sentiment_neutral,sentiment_negative,sentiment_category
l5hfnt,"[Survey] The Impact of Social Media on COVID-19 Vaccine Perception, Attitude, and Behavior (18+ Canadians)","Social media has allowed for the fast exchange of information, both to the benefit and detriment of society.

In this study, we would like to explore how social media impacts perception, attitude, and behavior regarding the vaccine. This survey is meant for those currently residing in Canada or who have spent time during the COVID-19 pandemic in Canada.

The survey should not take more than 5 minutes to complete and will be used in the writing of an academic paper.

This survey is completely anonymous, opinion-based, and should only be filled out voluntarily.

If you would like to be contacted after your survey, to get a copy of the article if published, for example, you may leave your email

Thank you for your participation.

A bit about the project:

I am a part of a COVID-19 vaccine efficacy research group. I got curious regarding the role of social media in influencing people’s perceptions, attitudes, and behaviors regarding the COVID-19 vaccine. By no means is this survey intended to sway your opinion one way or another. I am hoping to reach enough people and collect enough data to publish an article.

[https://forms.gle/3SQjpFZp9rbkGeE66](https://forms.gle/3SQjpFZp9rbkGeE66)",1611678306.0,5,2,None,0.86,/r/Manitoba/comments/l5hfnt/survey_the_impact_of_social_media_on_covid19/,https://www.reddit.com/r/Manitoba/comments/l5hfnt/survey_the_impact_of_social_media_on_covid19/,True,False,False,False,False,manitoba,"[Survey] The Impact of Social Media on COVID-19 Vaccine Perception, Attitude, and Behavior (18+ Canadians) Social media has allowed for the fast exchange of information, both to the benefit and detriment of society.

In this study, we would like to explore how social media impacts perception, attitude, and behavior regarding the vaccine. This survey is meant for those currently residing in Canada or who have spent time during the COVID-19 pandemic in Canada.

The survey should not take more than 5 minutes to complete and will be used in the writing of an academic paper.

This survey is completely anonymous, opinion-based, and should only be filled out voluntarily.

If you would like to be contacted after your survey, to get a copy of the article if published, for example, you may leave your email

Thank you for your participation.

A bit about the project:

I am a part of a COVID-19 vaccine efficacy research group. I got curious regarding the role of social media in influencing people’s perceptions, attitudes, and behaviors regarding the COVID-19 vaccine. By no means is this survey intended to sway your opinion one way or another. I am hoping to reach enough people and collect enough data to publish an article.

[https://forms.gle/3SQjpFZp9rbkGeE66](https://forms.gle/3SQjpFZp9rbkGeE66)",2021-01-26 16:25:06+00:00,2021,1,26,1,Tuesday,4,16,winter,2020-2021_pandemic_era,survey the impact of social media on covid vaccine perception attitude and behavior canadians social media has allowed for the fast exchange of information both to the benefit and detriment of society. in this study we would like to explore how social media impacts perception attitude and behavior regarding the vaccine. this survey is meant for those currently residing in canada or who have spent time during the covid pandemic in canada. the survey should not take more than minutes to complete and will be used in the writing of an academic paper. this survey is completely anonymous opinion based and should only be filled out voluntarily. if you would like to be contacted after your survey to get a copy of the article if published for example you may leave your email thank you for your participation. a bit about the project i am a part of a covid vaccine efficacy research group. i got curious regarding the role of social media in influencing people s perceptions attitudes and behaviors regarding the covid vaccine. by no means is this survey intended to sway your opinion one way or another. i am hoping to reach enough people and collect enough data to publish an article.,1187,205,False,False,True,0,0,3,False,0.3333333333333333,0.14,False,True,False,True,True,False,2021_Q1,8682fb5251c9e609,0.9062,0.077,0.907,0.016,positive
ktsvrt,'A light at the end of the tunnel': COVID-19 vaccine arriving in Manitoba First Nations communities | CBC News,,1610206268.0,13,0,None,0.79,/r/Manitoba/comments/ktsvrt/a_light_at_the_end_of_the_tunnel_covid19_vaccine/,https://www.cbc.ca/news/canada/manitoba/manitoba-first-nations-covid-19-vaccine-1.5865595?fbclid=IwAR0fdOzLkz6odo7YJncOs-YLRIa196etmwJ4iMIQrBMhGtV69DvEoqyVwmU,False,False,False,False,False,manitoba,'A light at the end of the tunnel': COVID-19 vaccine arriving in Manitoba First Nations communities | CBC News ,2021-01-09 15:31:08+00:00,2021,1,9,5,Saturday,1,15,winter,2020-2021_pandemic_era,a light at the end of the tunnel covid vaccine arriving in manitoba first nations communities cbc news,102,18,False,False,True,0,0,2,False,0.0,0.20999999999999996,False,True,False,True,True,False,2021_Q1,eb2ff7fc04226b9c,0.0,0.0,1.0,0.0,neutral
l6att2,Manitoba vaccine briefing,,1611771289.0,1,0,None,0.6,/r/Manitoba/comments/l6att2/manitoba_vaccine_briefing/,https://drive.google.com/file/d/1KzoWWvrIJpH7rCRMNxmlt0Bu0LGJQl1X/view,False,False,False,False,False,manitoba,Manitoba vaccine briefing ,2021-01-27 18:14:49+00:00,2021,1,27,2,Wednesday,4,18,winter,2020-2021_pandemic_era,manitoba vaccine briefing,25,3,False,False,True,0,0,1,False,0.0,0.4,False,True,False,True,True,False,2021_Q1,77ec1749f4c038d3,0.0,0.0,1.0,0.0,neutral
l4bidg,"Lockdowns don’t kill small businesses, coronavirus does.",,1611534093.0,217,68,Covid-19 Coronavirus,0.84,/r/alberta/comments/l4bidg/lockdowns_dont_kill_small_businesses_coronavirus/,https://www.sciencedirect.com/science/article/pii/S0047272720301754,False,False,False,False,False,alberta,"Lockdowns don’t kill small businesses, coronavirus does. ",2021-01-25 00:21:33+00:00,2021,1,25,0,Monday,4,0,winter,2020-2021_pandemic_era,lockdowns don t kill small businesses coronavirus does.,55,8,False,False,True,0,0,3,False,0.3119266055045872,0.16000000000000003,False,True,False,True,True,False,2021_Q1,b05774a96057d1a6,-0.6908,0.0,0.598,0.402,negative
l2qekq,Lockdown burnout,"Does anyone else get the sense that people are pretty much ""done"" with the current restrictions and aren't following them as closely as they were a month ago?  I'm talking longer visits at the front door with relatives, perhaps just stepping inside just for a bit, that sort of thing?

&#x200B;

I just get the sense that people can only do a strict lockdown for so long, and then we need a chance to return to something similar to normal for a bit.  Right now it feels how it felt in early May last year.  People were just done with it.",1611330647.0,14,114,Covid-19 Coronavirus,0.68,/r/alberta/comments/l2qekq/lockdown_burnout/,https://www.reddit.com/r/alberta/comments/l2qekq/lockdown_burnout/,True,False,False,False,False,alberta,"Lockdown burnout Does anyone else get the sense that people are pretty much ""done"" with the current restrictions and aren't following them as closely as they were a month ago?  I'm talking longer visits at the front door with relatives, perhaps just stepping inside just for a bit, that sort of thing?

&#x200B;

I just get the sense that people can only do a strict lockdown for so long, and then we need a chance to return to something similar to normal for a bit.  Right now it feels how it felt in early May last year.  People were just done with it.",2021-01-22 15:50:47+00:00,2021,1,22,4,Friday,3,15,winter,2020-2021_pandemic_era,lockdown burnout does anyone else get the sense that people are pretty much done with the current restrictions and aren t following them as closely as they were a month ago? i m talking longer visits at the front door with relatives perhaps just stepping inside just for a bit that sort of thing? x b i just get the sense that people can only do a strict lockdown for so long and then we need a chance to return to something similar to normal for a bit. right now it feels how it felt in early may last year. people were just done with it.,539,106,False,False,True,0,0,2,False,7.6,0.31999999999999995,False,True,False,True,True,False,2021_Q1,15f77160b062b654,0.6767,0.051,0.949,0.0,positive
kpw471,"Does anyone else here in Calgary think or suspect that the lockdowns will go past the supposed end date of Jan 13/21? They said two weeks last time, we all know how that went. Thoughts?","The 2nd lockdown took place Dec 13 I think to Jan 13.Spas hair salons and other businesses.

 Im in Calgary. 

Does anyone here think the lockdowns will be extended past Jan 13 of this year?

I just dont trust the idea of the lockdowns ending on the 13th. It was supposed to be only 2 weeks last year.

 Thoughts",1609717562.0,20,74,Covid-19 Coronavirus,0.83,/r/alberta/comments/kpw471/does_anyone_else_here_in_calgary_think_or_suspect/,https://www.reddit.com/r/alberta/comments/kpw471/does_anyone_else_here_in_calgary_think_or_suspect/,True,False,False,False,False,alberta,"Does anyone else here in Calgary think or suspect that the lockdowns will go past the supposed end date of Jan 13/21? They said two weeks last time, we all know how that went. Thoughts? The 2nd lockdown took place Dec 13 I think to Jan 13.Spas hair salons and other businesses.

 Im in Calgary. 

Does anyone here think the lockdowns will be extended past Jan 13 of this year?

I just dont trust the idea of the lockdowns ending on the 13th. It was supposed to be only 2 weeks last year.

 Thoughts",2021-01-03 23:46:02+00:00,2021,1,3,6,Sunday,53,23,winter,2020-2021_pandemic_era,does anyone else here in calgary think or suspect that the lockdowns will go past the supposed end date of jan ? they said two weeks last time we all know how that went. thoughts? the nd lockdown took place dec i think to jan .spas hair salons and other businesses. im in calgary. does anyone here think the lockdowns will be extended past jan of this year? i just dont trust the idea of the lockdowns ending on the th. it was supposed to be only weeks last year. thoughts,472,91,False,False,True,0,0,1,False,3.5238095238095237,0.17000000000000004,False,True,False,True,True,False,2021_Q1,fb51ce96d434e8df,-0.6643,0.0,0.942,0.058,negative
l2xmmo,"Smith: In the age of lockdowns, this is what job loss looks like",[https://calgaryherald.com/opinion/columnists/smith-in-the-age-of-lockdowns-and-keystone-this-is-what-job-loss-looks-like](https://calgaryherald.com/opinion/columnists/smith-in-the-age-of-lockdowns-and-keystone-this-is-what-job-loss-looks-like),1611351263.0,0,12,UCP,0.42,/r/alberta/comments/l2xmmo/smith_in_the_age_of_lockdowns_this_is_what_job/,https://www.reddit.com/r/alberta/comments/l2xmmo/smith_in_the_age_of_lockdowns_this_is_what_job/,True,False,False,False,False,alberta,"Smith: In the age of lockdowns, this is what job loss looks like [https://calgaryherald.com/opinion/columnists/smith-in-the-age-of-lockdowns-and-keystone-this-is-what-job-loss-looks-like](https://calgaryherald.com/opinion/columnists/smith-in-the-age-of-lockdowns-and-keystone-this-is-what-job-loss-looks-like)",2021-01-22 21:34:23+00:00,2021,1,22,4,Friday,3,21,winter,2020-2021_pandemic_era,smith in the age of lockdowns this is what job loss looks like,62,13,False,False,True,0,0,1,False,12.0,0.5800000000000001,False,True,False,True,True,False,2021_Q1,02d76a3b541e34a3,0.0516,0.158,0.696,0.146,positive
l8q6kc,Canadian Vaccine Rrroll-Out,,1612026478.0,2581,144,Covid-19 Coronavirus,0.97,/r/alberta/comments/l8q6kc/canadian_vaccine_rrrollout/,https://i.redd.it/drrfvgqt4ie61.jpg,False,False,False,False,False,alberta,Canadian Vaccine Rrroll-Out ,2021-01-30 17:07:58+00:00,2021,1,30,5,Saturday,4,17,winter,2020-2021_pandemic_era,canadian vaccine rrroll out,27,4,False,False,True,0,0,1,False,0.055770720371804805,0.030000000000000027,False,True,False,True,True,False,2021_Q1,81695797bc3f71c7,0.0,0.0,1.0,0.0,neutral
ktgo8i,"Alberta's review of supervised consumption sites was flawed and biased, stoking unchecked claims about the links between the service and crime rates, according to the author of a new peer-reviewed article.",,1610155028.0,110,15,News,0.97,/r/alberta/comments/ktgo8i/albertas_review_of_supervised_consumption_sites/,https://a.msn.com/r/2/BB1cAV7Q?m=en-ca,False,False,False,False,False,alberta,"Alberta's review of supervised consumption sites was flawed and biased, stoking unchecked claims about the links between the service and crime rates, according to the author of a new peer-reviewed article. ",2021-01-09 01:17:08+00:00,2021,1,9,5,Saturday,1,1,winter,2020-2021_pandemic_era,alberta s review of supervised consumption sites was flawed and biased stoking unchecked claims about the links between the service and crime rates according to the author of a new peer reviewed article.,203,33,True,False,False,1,0,0,False,0.13513513513513514,0.030000000000000027,False,True,False,True,True,False,2021_Q1,70a85f88b1b8b82e,-0.8271,0.0,0.775,0.225,negative
kqjpph,They called the police.,,1609799348.0,855,184,UCP,0.97,/r/alberta/comments/kqjpph/they_called_the_police/,https://i.redd.it/st1mkyof6e961.jpg,False,False,False,False,False,alberta,They called the police. ,2021-01-04 22:29:08+00:00,2021,1,4,0,Monday,1,22,winter,2020-2021_pandemic_era,they called the police.,23,4,True,False,False,1,0,0,False,0.21495327102803738,0.030000000000000027,False,True,False,True,True,False,2021_Q1,f023ad7c0ed5f66e,0.0,0.0,1.0,0.0,neutral
ksje9x,Let's talk about livestock theft,"I'd like to learn more about livestock theft in Alberta. More specifically, once someone is in possession of stolen animals, what measures are in place that would make it difficult to cash in?  What do theives do to counter such measures?",1610044379.0,1,30,Discussion,0.53,/r/alberta/comments/ksje9x/lets_talk_about_livestock_theft/,https://www.reddit.com/r/alberta/comments/ksje9x/lets_talk_about_livestock_theft/,True,False,False,False,False,alberta,"Let's talk about livestock theft I'd like to learn more about livestock theft in Alberta. More specifically, once someone is in possession of stolen animals, what measures are in place that would make it difficult to cash in?  What do theives do to counter such measures?",2021-01-07 18:32:59+00:00,2021,1,7,3,Thursday,1,18,winter,2020-2021_pandemic_era,let s talk about livestock theft i d like to learn more about livestock theft in alberta. more specifically once someone is in possession of stolen animals what measures are in place that would make it difficult to cash in? what do theives do to counter such measures?,268,48,True,False,False,3,0,0,False,15.0,0.47,False,True,False,True,True,False,2021_Q1,dcd0427bcede9c39,-0.5514,0.047,0.84,0.113,negative
kt2d69,CEWS feels like my boss stealing from me.,"The CEWS program covers 75% of my employers payroll, his employees pay for the CEWS program through their taxes. Why are we subsidizing our own wages while he recieves all the profit? 

I thought you were rewarded in business for taking risks?  With us subsidizing his rent, pay roll and tax remittance what exactly is his risk? At the very least LLC's recieving welfare shouldnt be allowed to issue bonuses and share holder dividends this fiscal year. 

TLDR: All this corporate welfare feels like theft, why not cut out the middle man and introduce UBI?",1610112238.0,17,83,None,0.59,/r/alberta/comments/kt2d69/cews_feels_like_my_boss_stealing_from_me/,https://www.reddit.com/r/alberta/comments/kt2d69/cews_feels_like_my_boss_stealing_from_me/,True,False,False,False,False,alberta,"CEWS feels like my boss stealing from me. The CEWS program covers 75% of my employers payroll, his employees pay for the CEWS program through their taxes. Why are we subsidizing our own wages while he recieves all the profit? 

I thought you were rewarded in business for taking risks?  With us subsidizing his rent, pay roll and tax remittance what exactly is his risk? At the very least LLC's recieving welfare shouldnt be allowed to issue bonuses and share holder dividends this fiscal year. 

TLDR: All this corporate welfare feels like theft, why not cut out the middle man and introduce UBI?",2021-01-08 13:23:58+00:00,2021,1,8,4,Friday,1,13,winter,2020-2021_pandemic_era,cews feels like my boss stealing from me. the cews program covers of my employers payroll his employees pay for the cews program through their taxes. why are we subsidizing our own wages while he recieves all the profit? i thought you were rewarded in business for taking risks? with us subsidizing his rent pay roll and tax remittance what exactly is his risk? at the very least llc s recieving welfare shouldnt be allowed to issue bonuses and share holder dividends this fiscal year. tldr all this corporate welfare feels like theft why not cut out the middle man and introduce ubi?,584,103,True,False,False,1,0,0,False,4.611111111111111,0.41000000000000003,False,True,False,True,True,False,2021_Q1,003fc1d90ada2198,0.8742,0.162,0.75,0.088,positive
l3bx02,To lighten this political overcast; the weather here has been very very nice!,"This might be one of the calmest and warmest winters ever, or at least in my personal memory.

Hopefully the winter won't drag into April... like usual.

...I'm looking forward to some nature photography once things start getting out of hibernation/torpor",1611407799.0,12,16,General,0.78,/r/alberta/comments/l3bx02/to_lighten_this_political_overcast_the_weather/,https://www.reddit.com/r/alberta/comments/l3bx02/to_lighten_this_political_overcast_the_weather/,True,False,False,False,False,alberta,"To lighten this political overcast; the weather here has been very very nice! This might be one of the calmest and warmest winters ever, or at least in my personal memory.

Hopefully the winter won't drag into April... like usual.

...I'm looking forward to some nature photography once things start getting out of hibernation/torpor",2021-01-23 13:16:39+00:00,2021,1,23,5,Saturday,3,13,winter,2020-2021_pandemic_era,to lighten this political overcast the weather here has been very very nice! this might be one of the calmest and warmest winters ever or at least in my personal memory. hopefully the winter won t drag into april... like usual. ...i m looking forward to some nature photography once things start getting out of hibernation torpor,329,57,False,True,False,0,4,0,False,1.2307692307692308,0.21999999999999997,False,True,False,True,True,False,2021_Q1,48fbf2c6a044cb4b,0.9429,0.256,0.717,0.027,positive
kwh9x8,Experts pour cold water on Kenney's eyeing of provincial COVID-19 vaccine procurement | Calgary Herald,,1610547544.0,149,71,Covid-19 Coronavirus,0.99,/r/alberta/comments/kwh9x8/experts_pour_cold_water_on_kenneys_eyeing_of/,https://calgaryherald.com/news/local-news/experts-pour-cold-water-on-kenneys-eyeing-of-provincial-covid-19-vaccine-procurement,False,False,False,False,False,alberta,Experts pour cold water on Kenney's eyeing of provincial COVID-19 vaccine procurement | Calgary Herald ,2021-01-13 14:19:04+00:00,2021,1,13,2,Wednesday,2,14,winter,2020-2021_pandemic_era,experts pour cold water on kenney s eyeing of provincial covid vaccine procurement calgary herald,97,15,False,True,True,0,1,2,False,0.47333333333333333,0.010000000000000009,False,True,False,True,True,False,2021_Q1,31d526a4ae217d1c,0.0,0.0,1.0,0.0,neutral
l6cp2x,"Sorry if this is the wrong sub, but I'd like some help. Got offered an interview for a summer student research job in Lacombe for the government, but already may have cold feet. Any advice?","Forgive me if this is the wrong place to ask, but I'd like some advice. I'm job hunting for my next co-op term, and I'm usually pretty desperate so I apply to everything. I applied to this job on FSWEP, and I've recently been offered an interview. Suddenly, I'm nervous.

I'm from around Toronto, so I'm scared about the transition. I'm worried about being lonely in Lacombe, especially with COVID-19 being a thing. Even if things were normal, I wouldn't even be sure what to do for fun. Am I thinking silly thoughts?",1611776904.0,4,41,Question,0.63,/r/alberta/comments/l6cp2x/sorry_if_this_is_the_wrong_sub_but_id_like_some/,https://www.reddit.com/r/alberta/comments/l6cp2x/sorry_if_this_is_the_wrong_sub_but_id_like_some/,True,False,False,False,False,alberta,"Sorry if this is the wrong sub, but I'd like some help. Got offered an interview for a summer student research job in Lacombe for the government, but already may have cold feet. Any advice? Forgive me if this is the wrong place to ask, but I'd like some advice. I'm job hunting for my next co-op term, and I'm usually pretty desperate so I apply to everything. I applied to this job on FSWEP, and I've recently been offered an interview. Suddenly, I'm nervous.

I'm from around Toronto, so I'm scared about the transition. I'm worried about being lonely in Lacombe, especially with COVID-19 being a thing. Even if things were normal, I wouldn't even be sure what to do for fun. Am I thinking silly thoughts?",2021-01-27 19:48:24+00:00,2021,1,27,2,Wednesday,4,19,winter,2020-2021_pandemic_era,sorry if this is the wrong sub but i d like some help. got offered an interview for a summer student research job in lacombe for the government but already may have cold feet. any advice? forgive me if this is the wrong place to ask but i d like some advice. i m job hunting for my next co op term and i m usually pretty desperate so i apply to everything. i applied to this job on fswep and i ve recently been offered an interview. suddenly i m nervous. i m from around toronto so i m scared about the transition. i m worried about being lonely in lacombe especially with covid being a thing. even if things were normal i wouldn t even be sure what to do for fun. am i thinking silly thoughts?,694,139,False,True,True,0,2,1,False,8.2,0.37,False,True,False,True,True,False,2021_Q1,96013b5b2352afff,0.5668,0.151,0.714,0.135,positive
