id,title,selftext,created_utc,score,num_comments,link_flair_text,upvote_ratio,permalink,url,is_self,over_18,spoiler,stickied,locked,subreddit,full_text,created_date,year,month,day,day_of_week,day_name,week_of_year,hour,season,platform_period,cleaned_text,text_length,word_count,contains_crime_keywords,contains_weather_keywords,contains_pandemic_keywords,crime_keyword_count,weather_keyword_count,pandemic_keyword_count,crime_and_weather_and_pandemic,engagement_rate,controversy_score,is_2020,is_2021,pre_pandemic_declared,post_pandemic_declared,vaccine_rollout,major_variant_wave,quarter,author_hash,sentiment_compound,sentiment_positive,sentiment_neutral,sentiment_negative,sentiment_category
hog2sx,Public Health Alert: Positive COVID-19 Case at Saskatoon Restaurant [Brewhouse Stonebridge],,1594345482.0,133,121,COVID-19,0.98,/r/saskatoon/comments/hog2sx/public_health_alert_positive_covid19_case_at/,https://www.saskhealthauthority.ca/news/releases/Pages/2020/July/Public-Health-Alert-Positive-COVID-19-Case-at-Saskatoon-Restaurant-.aspx,False,False,False,False,False,Saskatoon,Public Health Alert: Positive COVID-19 Case at Saskatoon Restaurant [Brewhouse Stonebridge] ,2020-07-10 01:44:42+00:00,2020,7,10,4,Friday,28,1,summer,2020-2021_pandemic_era,public health alert positive covid case at saskatoon restaurant brewhouse stonebridge,85,11,False,False,True,0,0,2,False,0.9029850746268657,0.020000000000000018,True,False,False,True,False,False,2020_Q3,e70a58275d1e52d0,0.7003,0.392,0.608,0.0,positive
hyd9p5,"COVID-19 Update: 42 New Cases, 13 In Hospital, 11 More Recoveries | News and Media | Government of Saskatchewan",,1595792391.0,67,110,COVID-19,0.92,/r/saskatoon/comments/hyd9p5/covid19_update_42_new_cases_13_in_hospital_11/,https://www.saskatchewan.ca/government/news-and-media/2020/july/26/covid-19-update-july-26,False,False,False,False,False,Saskatoon,"COVID-19 Update: 42 New Cases, 13 In Hospital, 11 More Recoveries | News and Media | Government of Saskatchewan ",2020-07-26 19:39:51+00:00,2020,7,26,6,Sunday,30,19,summer,2020-2021_pandemic_era,covid update new cases in hospital more recoveries news and media government of saskatchewan,92,14,False,False,True,0,0,1,False,1.6176470588235294,0.07999999999999996,True,False,False,True,False,False,2020_Q3,3238566ae691fccc,0.0,0.0,1.0,0.0,neutral
hshajb,"COVID-19 in Sask: Province sees record-high one-day increase of 42 cases, tracker says",,1594930053.0,120,67,COVID-19,0.98,/r/saskatoon/comments/hshajb/covid19_in_sask_province_sees_recordhigh_oneday/,https://www.cbc.ca/amp/1.5651718#click=https://t.co/NvoGWqNvDj,False,False,False,False,False,Saskatoon,"COVID-19 in Sask: Province sees record-high one-day increase of 42 cases, tracker says ",2020-07-16 20:07:33+00:00,2020,7,16,3,Thursday,29,20,summer,2020-2021_pandemic_era,covid in sask province sees record high one day increase of cases tracker says,78,14,False,False,True,0,0,1,False,0.5537190082644629,0.020000000000000018,True,False,False,True,False,False,2020_Q3,afa70f4862a80d14,0.3182,0.15,0.85,0.0,positive
hqnbuv,56 new COVID-19 cases in Sask. since Friday; SHA says expanded testing to begin Tuesday,,1594672881.0,47,77,COVID-19,0.91,/r/saskatoon/comments/hqnbuv/56_new_covid19_cases_in_sask_since_friday_sha/,https://www.ckom.com/2020/07/13/hold-july-13/,False,False,False,False,False,Saskatoon,56 new COVID-19 cases in Sask. since Friday; SHA says expanded testing to begin Tuesday ,2020-07-13 20:41:21+00:00,2020,7,13,0,Monday,29,20,summer,2020-2021_pandemic_era,new covid cases in sask. since friday sha says expanded testing to begin tuesday,80,14,False,False,True,0,0,2,False,1.6041666666666667,0.08999999999999997,True,False,False,True,False,False,2020_Q3,b56fcee39734c6d8,0.0,0.0,1.0,0.0,neutral
hspgyg,Meth-related crime continuing to rise in Saskatoon,[https://www.cbc.ca/news/canada/saskatoon/meth-continuing-to-drive-spike-in-saskatoon-crime-1.5652571](https://www.cbc.ca/news/canada/saskatoon/meth-continuing-to-drive-spike-in-saskatoon-crime-1.5652571),1594960994.0,13,38,None,0.79,/r/saskatoon/comments/hspgyg/methrelated_crime_continuing_to_rise_in_saskatoon/,https://www.reddit.com/r/saskatoon/comments/hspgyg/methrelated_crime_continuing_to_rise_in_saskatoon/,True,False,False,False,False,Saskatoon,Meth-related crime continuing to rise in Saskatoon [https://www.cbc.ca/news/canada/saskatoon/meth-continuing-to-drive-spike-in-saskatoon-crime-1.5652571](https://www.cbc.ca/news/canada/saskatoon/meth-continuing-to-drive-spike-in-saskatoon-crime-1.5652571),2020-07-17 04:43:14+00:00,2020,7,17,4,Friday,29,4,summer,2020-2021_pandemic_era,meth related crime continuing to rise in saskatoon,50,8,True,False,False,1,0,0,False,2.7142857142857144,0.20999999999999996,True,False,False,True,False,False,2020_Q3,fc8bdc21577f3ce6,-0.5423,0.0,0.667,0.333,negative
hkbat9,"Today's sudden change in weather, from the Broadway bridge just before noon.",,1593744751.0,19,0,None,0.88,/r/saskatoon/comments/hkbat9/todays_sudden_change_in_weather_from_the_broadway/,https://imgur.com/u0yMPuR,False,False,False,False,False,Saskatoon,"Today's sudden change in weather, from the Broadway bridge just before noon. ",2020-07-03 02:52:31+00:00,2020,7,3,4,Friday,27,2,summer,2020-2021_pandemic_era,today s sudden change in weather from the broadway bridge just before noon.,75,13,False,True,False,0,1,0,False,0.0,0.12,True,False,False,True,False,False,2020_Q3,6d7162285931186c,0.0,0.0,1.0,0.0,neutral
hu0kz0,Any Summer Colds/Flus (Not Covid) Circulating Right Now?,"I’m getting tested for COVID today as I have a sore throat, cough, and fever. Obviously I really hope it’s not the ‘rona, and so I’m just curious if anyone has had a bad cold or flu recently that tested negative.  Everyone I know is healthy.",1595165728.0,5,26,COVID-19,0.67,/r/saskatoon/comments/hu0kz0/any_summer_coldsflus_not_covid_circulating_right/,https://www.reddit.com/r/saskatoon/comments/hu0kz0/any_summer_coldsflus_not_covid_circulating_right/,True,False,False,False,False,Saskatoon,"Any Summer Colds/Flus (Not Covid) Circulating Right Now? I’m getting tested for COVID today as I have a sore throat, cough, and fever. Obviously I really hope it’s not the ‘rona, and so I’m just curious if anyone has had a bad cold or flu recently that tested negative.  Everyone I know is healthy.",2020-07-19 13:35:28+00:00,2020,7,19,6,Sunday,29,13,summer,2020-2021_pandemic_era,any summer colds flus not covid circulating right now? i m getting tested for covid today as i have a sore throat cough and fever. obviously i really hope it s not the rona and so i m just curious if anyone has had a bad cold or flu recently that tested negative. everyone i know is healthy.,291,58,False,True,True,0,2,1,False,4.333333333333333,0.32999999999999996,True,False,False,True,False,False,2020_Q3,a5c6c9b04e2a94e2,-0.6258,0.115,0.713,0.172,negative
hqn7os,"After going 6 weeks with no new COVID cases, Regina has 4 new over the weekend",,1594672511.0,85,121,None,0.93,/r/regina/comments/hqn7os/after_going_6_weeks_with_no_new_covid_cases/,https://www.saskatchewan.ca/government/health-care-administration-and-provider-resources/treatment-procedures-and-guidelines/emerging-public-health-issues/2019-novel-coronavirus/cases-and-risk-of-covid-19-in-saskatchewan,False,False,False,False,False,Regina,"After going 6 weeks with no new COVID cases, Regina has 4 new over the weekend ",2020-07-13 20:35:11+00:00,2020,7,13,0,Monday,29,20,summer,2020-2021_pandemic_era,after going weeks with no new covid cases regina has new over the weekend,73,14,False,False,True,0,0,1,False,1.4069767441860466,0.06999999999999995,True,False,False,True,False,False,2020_Q3,ca44924238c6f3ac,-0.296,0.0,0.855,0.145,negative
hutd4q,19 more covid cases today in Sask. Can we just mandate masks indoors please?,It has been proven world wide that wearing a mask prevents infection. Why can’t we just mandate it now and prevent further infections. It blows my mind.,1595277896.0,27,90,None,0.66,/r/regina/comments/hutd4q/19_more_covid_cases_today_in_sask_can_we_just/,https://www.reddit.com/r/regina/comments/hutd4q/19_more_covid_cases_today_in_sask_can_we_just/,True,False,False,False,False,Regina,19 more covid cases today in Sask. Can we just mandate masks indoors please? It has been proven world wide that wearing a mask prevents infection. Why can’t we just mandate it now and prevent further infections. It blows my mind.,2020-07-20 20:44:56+00:00,2020,7,20,0,Monday,30,20,summer,2020-2021_pandemic_era,more covid cases today in sask. can we just mandate masks indoors please? it has been proven world wide that wearing a mask prevents infection. why can t we just mandate it now and prevent further infections. it blows my mind.,226,41,False,False,True,0,0,3,False,3.2142857142857144,0.33999999999999997,True,False,False,True,False,False,2020_Q3,9cd5012da6b59a67,0.4019,0.11,0.89,0.0,positive
i07yg0,"50 new COVID-19 cases in SK, 2 of which are in Regina"," [https://www.saskatchewan.ca/government/news-and-media/2020/july/29/covid-19-update-july-29](https://www.saskatchewan.ca/government/news-and-media/2020/july/29/covid-19-update-july-29) 

> There are 50 new cases of COVID-19 to report in Saskatchewan on July 29, bringing the total to 1,268 cases.  The new cases are located in the North (44), South (3), Regina (2) and Central (1) regions.  
>  
>Of the 50 cases reported today, 44 are from one communal living setting.",1596054190.0,50,46,None,0.92,/r/regina/comments/i07yg0/50_new_covid19_cases_in_sk_2_of_which_are_in/,https://www.reddit.com/r/regina/comments/i07yg0/50_new_covid19_cases_in_sk_2_of_which_are_in/,True,False,False,False,False,Regina,"50 new COVID-19 cases in SK, 2 of which are in Regina  [https://www.saskatchewan.ca/government/news-and-media/2020/july/29/covid-19-update-july-29](https://www.saskatchewan.ca/government/news-and-media/2020/july/29/covid-19-update-july-29) 

> There are 50 new cases of COVID-19 to report in Saskatchewan on July 29, bringing the total to 1,268 cases.  The new cases are located in the North (44), South (3), Regina (2) and Central (1) regions.  
>  
>Of the 50 cases reported today, 44 are from one communal living setting.",2020-07-29 20:23:10+00:00,2020,7,29,2,Wednesday,31,20,summer,2020-2021_pandemic_era,new covid cases in sk of which are in regina there are new cases of covid to report in saskatchewan on july bringing the total to cases. the new cases are located in the north south regina and central regions. of the cases reported today are from one communal living setting.,275,51,False,False,True,0,0,1,False,0.9019607843137255,0.07999999999999996,True,False,False,True,False,False,2020_Q3,24c971ec5c999443,0.0,0.0,1.0,0.0,neutral
hoyvge,"YQR has seen zero COVID cases for over a month now. Thanks for staying safe, Regina! Let's keep the vigilance.","&#x200B;

https://preview.redd.it/zuvtagbfy3a51.png?width=620&format=png&auto=webp&s=0a3356ebf5562e91310c44e3feac33f7cf6306f8",1594420903.0,85,38,None,0.97,/r/regina/comments/hoyvge/yqr_has_seen_zero_covid_cases_for_over_a_month/,https://www.reddit.com/r/regina/comments/hoyvge/yqr_has_seen_zero_covid_cases_for_over_a_month/,True,False,False,False,False,Regina,"YQR has seen zero COVID cases for over a month now. Thanks for staying safe, Regina! Let's keep the vigilance. &#x200B;

https://preview.redd.it/zuvtagbfy3a51.png?width=620&format=png&auto=webp&s=0a3356ebf5562e91310c44e3feac33f7cf6306f8",2020-07-10 22:41:43+00:00,2020,7,10,4,Friday,28,22,summer,2020-2021_pandemic_era,yqr has seen zero covid cases for over a month now. thanks for staying safe regina! let s keep the vigilance. x b,113,23,False,False,True,0,0,1,False,0.4418604651162791,0.030000000000000027,True,False,False,True,False,False,2020_Q3,0839dbc7cd97cf33,0.7263,0.225,0.775,0.0,positive
hnl37q,Covid Testing Process,"Edit: I just got my results back... NEGATIVE!!   
Thank you to everyone that wished me well and those that recommended checking the Sask Health Records website. I will be able to sleep tonight now 

&#x200B;

So today I got tested for Covid. Some have asked about the process so I thought I would make a separate post describing the events I went through starting Tuesday.

I called 811 Tuesday morning at 10:00 AM. They asked me about my symptoms; sore throat, slight sniffles, I am also diabetic so I am high risk club. The lady said I met the criteria to get tested. I was told that someone from the testing site would contact me later in the day to inform me when and where to go. I was also informed by 811 that I and anyone else that resides in my residence are confined to my property. I can use my yards but I can not leave them unless it is to go to a doctor/hospital/testing site.

The testing site called me Tuesday afternoon at 4:00 PM to tell me to show up to the testing site, 410 Pioneer Drive, anytime after 9:00 AM but before 3:30 PM on Wednesday. I showed up at 8:50 this morning and was second in the queue. When I arrive I stopped at the entrance and was asked my name, given a mask, assigned a parking spot and told to wait inside my vehicle until a nurse came to get me from my vehicle. When the nurse came for me I was led into the building and sat in a room with another nurse that confirmed my identity and administered the swab. The swab didn't hurt but was uncomfortable. It made my nose run a bit and my eye water on the side that was swabbed.

I should have my results in 1-3 days, others that have had the test told me they had their results in 36 hours.",1594228569.0,45,38,None,0.96,/r/regina/comments/hnl37q/covid_testing_process/,https://www.reddit.com/r/regina/comments/hnl37q/covid_testing_process/,True,False,False,False,False,Regina,"Covid Testing Process Edit: I just got my results back... NEGATIVE!!   
Thank you to everyone that wished me well and those that recommended checking the Sask Health Records website. I will be able to sleep tonight now 

&#x200B;

So today I got tested for Covid. Some have asked about the process so I thought I would make a separate post describing the events I went through starting Tuesday.

I called 811 Tuesday morning at 10:00 AM. They asked me about my symptoms; sore throat, slight sniffles, I am also diabetic so I am high risk club. The lady said I met the criteria to get tested. I was told that someone from the testing site would contact me later in the day to inform me when and where to go. I was also informed by 811 that I and anyone else that resides in my residence are confined to my property. I can use my yards but I can not leave them unless it is to go to a doctor/hospital/testing site.

The testing site called me Tuesday afternoon at 4:00 PM to tell me to show up to the testing site, 410 Pioneer Drive, anytime after 9:00 AM but before 3:30 PM on Wednesday. I showed up at 8:50 this morning and was second in the queue. When I arrive I stopped at the entrance and was asked my name, given a mask, assigned a parking spot and told to wait inside my vehicle until a nurse came to get me from my vehicle. When the nurse came for me I was led into the building and sat in a room with another nurse that confirmed my identity and administered the swab. The swab didn't hurt but was uncomfortable. It made my nose run a bit and my eye water on the side that was swabbed.

I should have my results in 1-3 days, others that have had the test told me they had their results in 36 hours.",2020-07-08 17:16:09+00:00,2020,7,8,2,Wednesday,28,17,summer,2020-2021_pandemic_era,covid testing process edit i just got my results back... negative!! thank you to everyone that wished me well and those that recommended checking the sask health records website. i will be able to sleep tonight now x b so today i got tested for covid. some have asked about the process so i thought i would make a separate post describing the events i went through starting tuesday. i called tuesday morning at am. they asked me about my symptoms sore throat slight sniffles i am also diabetic so i am high risk club. the lady said i met the criteria to get tested. i was told that someone from the testing site would contact me later in the day to inform me when and where to go. i was also informed by that i and anyone else that resides in my residence are confined to my property. i can use my yards but i can not leave them unless it is to go to a doctor hospital testing site. the testing site called me tuesday afternoon at pm to tell me to show up to the testing site ADDRESS anytime after am but before pm on wednesday. i showed up at this morning and was second in the queue. when i arrive i stopped at the entrance and was asked my name given a mask assigned a parking spot and told to wait inside my vehicle until a nurse came to get me from my vehicle. when the nurse came for me i was led into the building and sat in a room with another nurse that confirmed my identity and administered the swab. the swab didn t hurt but was uncomfortable. it made my nose run a bit and my eye water on the side that was swabbed. i should have my results in days others that have had the test told me they had their results in hours.,1632,322,False,False,True,0,0,4,False,0.8260869565217391,0.040000000000000036,True,False,False,True,False,False,2020_Q3,96405fdf5f790b41,-0.9129,0.018,0.933,0.05,negative
hzn52v,"One death, nine new cases of COVID-19 in SK (including one in Regina)","[https://www.cjme.com/2020/07/28/17th-covid-19-death-announced-in-saskatchewan-nine-new-cases-2/](https://www.cjme.com/2020/07/28/17th-covid-19-death-announced-in-saskatchewan-nine-new-cases-2/)

>The Saskatchewan government is announcing a 17th person is dead from COVID-19 as the province adds nine new cases on Tuesday.  
>  
>The person who died was in their 70s in the south region of the province.  
>  
>Tuesday’s nine new cases include three in the south, two in the Saskatoon region, two in the north, one in the central area and one in Regina.  
>  
>Saskatchewan also saw 21 new recoveries, bringing the active case count down to 294 after a one-day spike over 300.  
>  
>The numbers note 13 cases of COVID-19 being treated in hospital, with five of those patients in intensive care — three in Saskatoon and two in Regina.

The government provided a warning for the coming long weekend: 

>“There may be social or peer pressure to attend events that you feel pose an unacceptable amount of risk to you and your family,” the release notes.  
>  
>“Decisions not to attend are your own, and are not cause for ridicule or shame. Family and friends should understand and respect measures that people are taking to stay healthy and prevent the spread of COVID-19.”

&#x200B;",1595970585.0,43,26,None,0.9,/r/regina/comments/hzn52v/one_death_nine_new_cases_of_covid19_in_sk/,https://www.reddit.com/r/regina/comments/hzn52v/one_death_nine_new_cases_of_covid19_in_sk/,True,False,False,False,False,Regina,"One death, nine new cases of COVID-19 in SK (including one in Regina) [https://www.cjme.com/2020/07/28/17th-covid-19-death-announced-in-saskatchewan-nine-new-cases-2/](https://www.cjme.com/2020/07/28/17th-covid-19-death-announced-in-saskatchewan-nine-new-cases-2/)

>The Saskatchewan government is announcing a 17th person is dead from COVID-19 as the province adds nine new cases on Tuesday.  
>  
>The person who died was in their 70s in the south region of the province.  
>  
>Tuesday’s nine new cases include three in the south, two in the Saskatoon region, two in the north, one in the central area and one in Regina.  
>  
>Saskatchewan also saw 21 new recoveries, bringing the active case count down to 294 after a one-day spike over 300.  
>  
>The numbers note 13 cases of COVID-19 being treated in hospital, with five of those patients in intensive care — three in Saskatoon and two in Regina.

The government provided a warning for the coming long weekend: 

>“There may be social or peer pressure to attend events that you feel pose an unacceptable amount of risk to you and your family,” the release notes.  
>  
>“Decisions not to attend are your own, and are not cause for ridicule or shame. Family and friends should understand and respect measures that people are taking to stay healthy and prevent the spread of COVID-19.”

&#x200B;",2020-07-28 21:09:45+00:00,2020,7,28,1,Tuesday,31,21,summer,2020-2021_pandemic_era,one death nine new cases of covid in sk including one in regina the saskatchewan government is announcing a th person is dead from covid as the province adds nine new cases on tuesday. the person who died was in their s in the south region of the province. tuesday s nine new cases include three in the south two in the saskatoon region two in the north one in the central area and one in regina. saskatchewan also saw new recoveries bringing the active case count down to after a one day spike over . the numbers note cases of covid being treated in hospital with five of those patients in intensive care three in saskatoon and two in regina. the government provided a warning for the coming long weekend there may be social or peer pressure to attend events that you feel pose an unacceptable amount of risk to you and your family the release notes. decisions not to attend are your own and are not cause for ridicule or shame. family and friends should understand and respect measures that people are taking to stay healthy and prevent the spread of covid . x b,1064,197,False,False,True,0,0,1,False,0.5909090909090909,0.09999999999999998,True,False,False,True,False,False,2020_Q3,24c971ec5c999443,-0.8031,0.082,0.809,0.109,negative
