id,title,selftext,created_utc,score,num_comments,link_flair_text,upvote_ratio,permalink,url,is_self,over_18,spoiler,stickied,locked,subreddit,full_text,created_date,year,month,day,day_of_week,day_name,week_of_year,hour,season,platform_period,cleaned_text,text_length,word_count,contains_crime_keywords,contains_weather_keywords,contains_pandemic_keywords,crime_keyword_count,weather_keyword_count,pandemic_keyword_count,crime_and_weather_and_pandemic,engagement_rate,controversy_score,is_2020,is_2021,pre_pandemic_declared,post_pandemic_declared,vaccine_rollout,major_variant_wave,quarter,author_hash,sentiment_compound,sentiment_positive,sentiment_neutral,sentiment_negative,sentiment_category
hyxbdb,Severe fire weather forecasts this week across southern Alberta,"Calgary area is potentially in *crossover* today (high temp in degrees C is greater than lowest humidity reading). Crossover indicates potential for rapid fire growth and spread among grasses and trees. Forecast today for the Bow region (Calgary, Canmore, Kananaskis) is 27-29°C and rH 25%.

Crowsnest and Waterton areas are in **RED FLAG** conditions today (Red Flag = humidity significantly below high temp). Forecasts for Crow and Waterton today are for 30°C and rH near 20%.

Several municipalities have instituted fire restrictions (on burning) and I'm hearing some fire departments going out on large fires south of Calgary already.

Stay safe...",1595872842.0,22,4,General,0.94,/r/alberta/comments/hyxbdb/severe_fire_weather_forecasts_this_week_across/,https://www.reddit.com/r/alberta/comments/hyxbdb/severe_fire_weather_forecasts_this_week_across/,True,False,False,False,False,alberta,"Severe fire weather forecasts this week across southern Alberta Calgary area is potentially in *crossover* today (high temp in degrees C is greater than lowest humidity reading). Crossover indicates potential for rapid fire growth and spread among grasses and trees. Forecast today for the Bow region (Calgary, Canmore, Kananaskis) is 27-29°C and rH 25%.

Crowsnest and Waterton areas are in **RED FLAG** conditions today (Red Flag = humidity significantly below high temp). Forecasts for Crow and Waterton today are for 30°C and rH near 20%.

Several municipalities have instituted fire restrictions (on burning) and I'm hearing some fire departments going out on large fires south of Calgary already.

Stay safe...",2020-07-27 18:00:42+00:00,2020,7,27,0,Monday,31,18,summer,2020-2021_pandemic_era,severe fire weather forecasts this week across southern alberta calgary area is potentially in crossover today high temp in degrees c is greater than lowest humidity reading . crossover indicates potential for rapid fire growth and spread among grasses and trees. forecast today for the bow region calgary canmore kananaskis is c and rh . crowsnest and waterton areas are in red flag conditions today red flag humidity significantly below high temp . forecasts for crow and waterton today are for c and rh near . several municipalities have instituted fire restrictions on burning and i m hearing some fire departments going out on large fires south of calgary already. stay safe...,682,112,False,True,True,0,2,1,False,0.17391304347826086,0.06000000000000005,True,False,False,True,False,False,2020_Q3,8ea4a82fef809424,-0.7003,0.064,0.819,0.118,negative
hm1zd6,Almost midnight. Love this time of year (Cold Lake),,1594014640.0,215,5,None,0.97,/r/alberta/comments/hm1zd6/almost_midnight_love_this_time_of_year_cold_lake/,https://i.redd.it/6pn23laee6951.jpg,False,False,False,False,False,alberta,Almost midnight. Love this time of year (Cold Lake) ,2020-07-06 05:50:40+00:00,2020,7,6,0,Monday,28,5,summer,2020-2021_pandemic_era,almost midnight. love this time of year cold lake,49,9,False,True,False,0,1,0,False,0.023148148148148147,0.030000000000000027,True,False,False,True,False,False,2020_Q3,6456bcf3cd5134c8,0.6022,0.329,0.671,0.0,positive
hr84bk,"It's funny because it's true, we can get a lot of snow",,1594754918.0,85,1,General,0.95,/r/alberta/comments/hr84bk/its_funny_because_its_true_we_can_get_a_lot_of/,https://v.redd.it/hvj08bgydua51,False,False,False,False,False,alberta,"It's funny because it's true, we can get a lot of snow ",2020-07-14 19:28:38+00:00,2020,7,14,1,Tuesday,29,19,summer,2020-2021_pandemic_era,it s funny because it s true we can get a lot of snow,53,14,False,True,False,0,1,0,False,0.011627906976744186,0.050000000000000044,True,False,False,True,False,False,2020_Q3,3e76753762d1f730,0.6908,0.322,0.678,0.0,positive
hwkupo,The lack of COVID safety in this province is appalling.,"I'm sitting at a gas station in Calgary and I'm watching people. One person (of about 20) has worn a mask going into the tiny store to buy gas. Two people wore gloves to pump gas. None of the pumps were cleaned between users. Like come on guys! We want our schools to reopen in September and we want life to get back to normal but it literally can't if y'all are acting so careless!

Edit: I appreciate all the responses! Honestly, this post was made in anger and frustration because I've talked to too many people who don't give any fucks about other people's safety and as a teacher preparing to go into classrooms in September, I just want people to be as safe as the can be. You're right that gloves are not expected and shouldn't be. I meant to add that I didn't see anyone sanitizing as they all just drove away but that wouldn't necessarily have been fair either. I was being a bit judgy out of frustration. Thanks for your responses correcting my frustrations. Be safe everyone.",1595528222.0,42,40,None,0.68,/r/alberta/comments/hwkupo/the_lack_of_covid_safety_in_this_province_is/,https://www.reddit.com/r/alberta/comments/hwkupo/the_lack_of_covid_safety_in_this_province_is/,True,False,False,False,False,alberta,"The lack of COVID safety in this province is appalling. I'm sitting at a gas station in Calgary and I'm watching people. One person (of about 20) has worn a mask going into the tiny store to buy gas. Two people wore gloves to pump gas. None of the pumps were cleaned between users. Like come on guys! We want our schools to reopen in September and we want life to get back to normal but it literally can't if y'all are acting so careless!

Edit: I appreciate all the responses! Honestly, this post was made in anger and frustration because I've talked to too many people who don't give any fucks about other people's safety and as a teacher preparing to go into classrooms in September, I just want people to be as safe as the can be. You're right that gloves are not expected and shouldn't be. I meant to add that I didn't see anyone sanitizing as they all just drove away but that wouldn't necessarily have been fair either. I was being a bit judgy out of frustration. Thanks for your responses correcting my frustrations. Be safe everyone.",2020-07-23 18:17:02+00:00,2020,7,23,3,Thursday,30,18,summer,2020-2021_pandemic_era,the lack of covid safety in this province is appalling. i m sitting at a gas station in calgary and i m watching people. one person of about has worn a mask going into the tiny store to buy gas. two people wore gloves to pump gas. none of the pumps were cleaned between users. like come on guys! we want our schools to reopen in september and we want life to get back to normal but it literally can t if y all are acting so careless! edit i appreciate all the responses! honestly this post was made in anger and frustration because i ve talked to too many people who don t give any fucks about other people s safety and as a teacher preparing to go into classrooms in september i just want people to be as safe as the can be. you re right that gloves are not expected and shouldn t be. i meant to add that i didn t see anyone sanitizing as they all just drove away but that wouldn t necessarily have been fair either. i was being a bit judgy out of frustration. thanks for your responses correcting my frustrations. be safe everyone.,1033,202,True,False,True,1,0,2,False,0.9302325581395349,0.31999999999999995,True,False,False,True,False,False,2020_Q3,ec6426934f3fb4a1,-0.3793,0.138,0.736,0.126,negative
hp54ul,Survey: Gov of Alberta is asking for feedback on the Occupational Health and Safety (OHS) Act review,,1594447755.0,11,7,UCP,0.84,/r/alberta/comments/hp54ul/survey_gov_of_alberta_is_asking_for_feedback_on/,https://www.alberta.ca/occupational-health-and-safety-act-review.aspx,False,False,False,False,False,alberta,Survey: Gov of Alberta is asking for feedback on the Occupational Health and Safety (OHS) Act review ,2020-07-11 06:09:15+00:00,2020,7,11,5,Saturday,28,6,summer,2020-2021_pandemic_era,survey gov of alberta is asking for feedback on the occupational health and safety ohs act review,97,17,True,False,False,1,0,0,False,0.5833333333333334,0.16000000000000003,True,False,False,True,False,False,2020_Q3,46f1e75088d12d77,0.4215,0.149,0.851,0.0,positive
