id,title,selftext,created_utc,score,num_comments,link_flair_text,upvote_ratio,permalink,url,is_self,over_18,spoiler,stickied,locked,subreddit,full_text,created_date,year,month,day,day_of_week,day_name,week_of_year,hour,season,platform_period,cleaned_text,text_length,word_count,contains_crime_keywords,contains_weather_keywords,contains_pandemic_keywords,crime_keyword_count,weather_keyword_count,pandemic_keyword_count,crime_and_weather_and_pandemic,engagement_rate,controversy_score,is_2020,is_2021,pre_pandemic_declared,post_pandemic_declared,vaccine_rollout,major_variant_wave,quarter,author_hash,sentiment_compound,sentiment_positive,sentiment_neutral,sentiment_negative,sentiment_category
hbueoc,TIFU by working out in the women’s only section the last 2 weeks,"Since Covid lockdown like many I’ve been antsy for getting back into the gym, and with Brighton’s Motion Fit freshly opened I was excited for a change in scenery. As soon as I could I headed over. First things first, I took a walk touring the areas, equipment, and upstairs cardio deck which has a smaller, secluded room with a basic sets of equipment, and not many people in it. Didn’t think much of it, maybe a place for shyer guests to go?🤷🏽‍♂️ Anyway, with how busy it’s been most of the stuff is in use equating to a lot of waiting around, but oh I got it! Easy solution, I’ll use that room! Yeah perfect, not packed, it’s got the basic stuff I need, in and out quick, nice. I should note I don’t look around much, no one wants to be stared at working out and we’re all there for ourselves so I try to fall into a zone and do my thing. Well after 2 weeks of freely using that room this time I noticed 2 things, now that I think about it Ive only seen women in here, and also, the fact that the room immediately CLEARED out when I came in today. Suddenly other things I had noticed over the last 2 weeks popped into mind, heads turning toward me in my peripheral whenever I walked in and out, subtle looks of surprised the few times I met eyes with people in there... and like a conspiracy theorist bedroom wall with pictures connected by red string the pieces came together, years of watching CSI helping to deduce. Quick feeing of anxious panic I put the dumbbells down and speed walk outside the room, but not without meeting the surprised expression of a girl walking in, further confirming what I believed. I looked to the left side for a women’s only sign, nothing, on the wall walking in, nothing, look overhead the room, nothing, then .. the right of the room.. in big metal letters, W.O.W. - women’s only workout. Oh. My. God. Realizing where this tank topped frat boy looking douche had been slinging weights the last two weeks I quickly went back to grab my shite and re rack. The only girl left in there being very nice as she must’ve noticed the mortified look on my face and just laughed as I apologized quickly. I speed walk outta the gym with my gaze low hella embarrassed. And cherry on top of the shite cake, walking out the doors I look ahead and where I thought I parked behind someone, I was parked in the between the two sets of parking lanes dead centre in the middle of the road, right in front of the front doors, blocking traffic for the last 45 mins. Groups of people walking in watching my douchey looking ass get in my asshole park job and drive off... so I guess all that to say, if you’re one of the ladies in Brighton’s women only room very sorry for creeping you out.. Very embarrassed.. and to Brighton motion fit, see ya, barely new ya, my face isn’t coming around anytime soon.",1592542441.0,92,24,COVID-19,0.95,/r/saskatoon/comments/hbueoc/tifu_by_working_out_in_the_womens_only_section/,https://www.reddit.com/r/saskatoon/comments/hbueoc/tifu_by_working_out_in_the_womens_only_section/,True,False,False,False,False,Saskatoon,"TIFU by working out in the women’s only section the last 2 weeks Since Covid lockdown like many I’ve been antsy for getting back into the gym, and with Brighton’s Motion Fit freshly opened I was excited for a change in scenery. As soon as I could I headed over. First things first, I took a walk touring the areas, equipment, and upstairs cardio deck which has a smaller, secluded room with a basic sets of equipment, and not many people in it. Didn’t think much of it, maybe a place for shyer guests to go?🤷🏽‍♂️ Anyway, with how busy it’s been most of the stuff is in use equating to a lot of waiting around, but oh I got it! Easy solution, I’ll use that room! Yeah perfect, not packed, it’s got the basic stuff I need, in and out quick, nice. I should note I don’t look around much, no one wants to be stared at working out and we’re all there for ourselves so I try to fall into a zone and do my thing. Well after 2 weeks of freely using that room this time I noticed 2 things, now that I think about it Ive only seen women in here, and also, the fact that the room immediately CLEARED out when I came in today. Suddenly other things I had noticed over the last 2 weeks popped into mind, heads turning toward me in my peripheral whenever I walked in and out, subtle looks of surprised the few times I met eyes with people in there... and like a conspiracy theorist bedroom wall with pictures connected by red string the pieces came together, years of watching CSI helping to deduce. Quick feeing of anxious panic I put the dumbbells down and speed walk outside the room, but not without meeting the surprised expression of a girl walking in, further confirming what I believed. I looked to the left side for a women’s only sign, nothing, on the wall walking in, nothing, look overhead the room, nothing, then .. the right of the room.. in big metal letters, W.O.W. - women’s only workout. Oh. My. God. Realizing where this tank topped frat boy looking douche had been slinging weights the last two weeks I quickly went back to grab my shite and re rack. The only girl left in there being very nice as she must’ve noticed the mortified look on my face and just laughed as I apologized quickly. I speed walk outta the gym with my gaze low hella embarrassed. And cherry on top of the shite cake, walking out the doors I look ahead and where I thought I parked behind someone, I was parked in the between the two sets of parking lanes dead centre in the middle of the road, right in front of the front doors, blocking traffic for the last 45 mins. Groups of people walking in watching my douchey looking ass get in my asshole park job and drive off... so I guess all that to say, if you’re one of the ladies in Brighton’s women only room very sorry for creeping you out.. Very embarrassed.. and to Brighton motion fit, see ya, barely new ya, my face isn’t coming around anytime soon.",2020-06-19 04:54:01+00:00,2020,6,19,4,Friday,25,4,summer,2020-2021_pandemic_era,tifu by working out in the women s only section the last weeks since covid lockdown like many i ve been antsy for getting back into the gym and with brighton s motion fit freshly opened i was excited for a change in scenery. as soon as i could i headed over. first things first i took a walk touring the areas equipment and upstairs cardio deck which has a smaller secluded room with a basic sets of equipment and not many people in it. didn t think much of it maybe a place for shyer guests to go? anyway with how busy it s been most of the stuff is in use equating to a lot of waiting around but oh i got it! easy solution i ll use that room! yeah perfect not packed it s got the basic stuff i need in and out quick nice. i should note i don t look around much no one wants to be stared at working out and we re all there for ourselves so i try to fall into a zone and do my thing. well after weeks of freely using that room this time i noticed things now that i think about it ive only seen women in here and also the fact that the room immediately cleared out when i came in today. suddenly other things i had noticed over the last weeks popped into mind heads turning toward me in my peripheral whenever i walked in and out subtle looks of surprised the few times i met eyes with people in there... and like a conspiracy theorist bedroom wall with pictures connected by red string the pieces came together years of watching csi helping to deduce. quick feeing of anxious panic i put the dumbbells down and speed walk outside the room but not without meeting the surprised expression of a girl walking in further confirming what i believed. i looked to the left side for a women s only sign nothing on the wall walking in nothing look overhead the room nothing then .. the right of the room.. in big metal letters w.o.w. women s only workout. oh. my. god. realizing where this tank topped frat boy looking douche had been slinging weights the last two weeks i quickly went back to grab my shite and re rack. the only girl left in there being very nice as she must ve noticed the mortified look on my face and just laughed as i apologized quickly. i speed walk outta the gym with my gaze low hella embarrassed. and cherry on top of the shite cake walking out the doors i look ahead and where i thought i parked behind someone i was parked in the between the two sets of parking lanes dead centre in the middle of the road right in front of the front doors blocking traffic for the last mins. groups of people walking in watching my douchey looking ass get in my asshole park job and drive off... so i guess all that to say if you re one of the ladies in brighton s women only room very sorry for creeping you out.. very embarrassed.. and to brighton motion fit see ya barely new ya my face isn t coming around anytime soon.,2826,554,False,True,True,0,1,2,False,0.25806451612903225,0.050000000000000044,True,False,False,True,False,False,2020_Q2,3934d8d587978250,0.8593,0.095,0.828,0.077,positive
hhi849,"Do any places in town have gym equipment (barbells, weights, etc) back in stock these days?","As the title says, are there any places with gym/workout gear in stock, or is everything still totally sold-out like it was during the lockdown? Looking specifically for a barbell + weights (and a few related accessories) and a couple kettlebells.

I'm getting tired of bodyweight exercises but don't really want to go back to the gym even with our relatively decent covid numbers. I'm hoping to get a few key pieces at home preferably in the near future (and definitely before cold/flu season starts up in the fall).",1593364596.0,3,7,COVID-19,0.67,/r/saskatoon/comments/hhi849/do_any_places_in_town_have_gym_equipment_barbells/,https://www.reddit.com/r/saskatoon/comments/hhi849/do_any_places_in_town_have_gym_equipment_barbells/,True,False,False,False,False,Saskatoon,"Do any places in town have gym equipment (barbells, weights, etc) back in stock these days? As the title says, are there any places with gym/workout gear in stock, or is everything still totally sold-out like it was during the lockdown? Looking specifically for a barbell + weights (and a few related accessories) and a couple kettlebells.

I'm getting tired of bodyweight exercises but don't really want to go back to the gym even with our relatively decent covid numbers. I'm hoping to get a few key pieces at home preferably in the near future (and definitely before cold/flu season starts up in the fall).",2020-06-28 17:16:36+00:00,2020,6,28,6,Sunday,26,17,summer,2020-2021_pandemic_era,do any places in town have gym equipment barbells weights etc back in stock these days? as the title says are there any places with gym workout gear in stock or is everything still totally sold out like it was during the lockdown? looking specifically for a barbell weights and a few related accessories and a couple kettlebells. i m getting tired of bodyweight exercises but don t really want to go back to the gym even with our relatively decent covid numbers. i m hoping to get a few key pieces at home preferably in the near future and definitely before cold flu season starts up in the fall .,597,111,False,True,True,0,2,2,False,1.75,0.32999999999999996,True,False,False,True,False,False,2020_Q2,e9efbfa272768d2b,0.7211,0.093,0.863,0.044,positive
himix7,Today during my night shift I had 4 windows smashed and no theft. Does anyone have any info at all? We don't have a parking lot camera. This is on 8th. Between midnight and 5am. Coworker had one window smashed as well. TIA,,1593520563.0,102,44,None,0.97,/r/saskatoon/comments/himix7/today_during_my_night_shift_i_had_4_windows/,https://i.redd.it/0xp4wjc9l1851.jpg,False,False,False,False,False,Saskatoon,Today during my night shift I had 4 windows smashed and no theft. Does anyone have any info at all? We don't have a parking lot camera. This is on 8th. Between midnight and 5am. Coworker had one window smashed as well. TIA ,2020-06-30 12:36:03+00:00,2020,6,30,1,Tuesday,27,12,summer,2020-2021_pandemic_era,today during my night shift i had windows smashed and no theft. does anyone have any info at all? we don t have a parking lot camera. this is on th. between midnight and am. coworker had one window smashed as well. tia,218,43,True,False,False,1,0,0,False,0.42718446601941745,0.030000000000000027,True,False,False,True,False,False,2020_Q2,f0924ce126f489ae,0.4939,0.113,0.84,0.046,positive
gyj5o2,What is with businesses blaming customers for not wearing masks while they fail to enact policy that all customers must wear a mask or will not be given service? You as business owners are responsible for the safety of your employees.,,1591559759.0,0,29,None,0.35,/r/saskatoon/comments/gyj5o2/what_is_with_businesses_blaming_customers_for_not/,https://www.reddit.com/r/saskatoon/comments/gyj5o2/what_is_with_businesses_blaming_customers_for_not/,True,False,False,False,False,Saskatoon,What is with businesses blaming customers for not wearing masks while they fail to enact policy that all customers must wear a mask or will not be given service? You as business owners are responsible for the safety of your employees. ,2020-06-07 19:55:59+00:00,2020,6,7,6,Sunday,23,19,summer,2020-2021_pandemic_era,what is with businesses blaming customers for not wearing masks while they fail to enact policy that all customers must wear a mask or will not be given service? you as business owners are responsible for the safety of your employees.,234,41,True,False,True,1,0,1,False,29.0,0.65,True,False,False,True,False,False,2020_Q2,eb6937b253b958ec,-0.3818,0.105,0.758,0.137,negative
h0zu6q,Regina Police Association Suggests Community Programs First to Be Defunded,,1591884029.0,83,120,None,0.93,/r/regina/comments/h0zu6q/regina_police_association_suggests_community/,https://twitter.com/QueenCityPolice/status/1270235868121440258?s=20,False,False,False,False,True,Regina,Regina Police Association Suggests Community Programs First to Be Defunded ,2020-06-11 14:00:29+00:00,2020,6,11,3,Thursday,24,14,summer,2020-2021_pandemic_era,regina police association suggests community programs first to be defunded,74,10,True,False,False,1,0,0,False,1.4285714285714286,0.06999999999999995,True,False,False,True,False,False,2020_Q2,1ceb57daaadeb3f7,0.0,0.0,1.0,0.0,neutral
gxyl95,New petition calls for defunding the Regina Police Service,,1591475872.0,4,64,None,0.55,/r/regina/comments/gxyl95/new_petition_calls_for_defunding_the_regina/,https://www.cbc.ca/news/canada/saskatchewan/defund-regina-police-service-petition-1.5601462,False,False,False,False,False,Regina,New petition calls for defunding the Regina Police Service ,2020-06-06 20:37:52+00:00,2020,6,6,5,Saturday,23,20,summer,2020-2021_pandemic_era,new petition calls for defunding the regina police service,58,9,True,False,False,1,0,0,False,12.8,0.44999999999999996,True,False,False,True,False,False,2020_Q2,95a83184978d67b3,0.0,0.0,1.0,0.0,neutral
hav88m,PSA - the City of Regina is back to full enforcement of parking meters,"They took a couple of months off of enforcement in certain areas due to COVID19, but as of this past Monday are back to handing out tickets.",1592413174.0,36,38,None,0.89,/r/regina/comments/hav88m/psa_the_city_of_regina_is_back_to_full/,https://www.reddit.com/r/regina/comments/hav88m/psa_the_city_of_regina_is_back_to_full/,True,False,False,False,False,Regina,"PSA - the City of Regina is back to full enforcement of parking meters They took a couple of months off of enforcement in certain areas due to COVID19, but as of this past Monday are back to handing out tickets.",2020-06-17 16:59:34+00:00,2020,6,17,2,Wednesday,25,16,summer,2020-2021_pandemic_era,psa the city of regina is back to full enforcement of parking meters they took a couple of months off of enforcement in certain areas due to covid but as of this past monday are back to handing out tickets.,206,40,False,False,True,0,0,1,False,1.027027027027027,0.10999999999999999,True,False,False,True,False,False,2020_Q2,9a392023e8b4d6b7,0.1406,0.038,0.962,0.0,positive
h7m7py,Why are threads critical of policing in Regina being locked?,"Threads critical of Regina Police Service have been locked recently.  It seems arbitrary and unnecessary. 

These were the threads:

[https://www.reddit.com/r/regina/comments/h77zq2/stop\_and\_frisk\_but\_for\_cars\_rps\_how\_are\_you\_so/](https://www.reddit.com/r/regina/comments/h77zq2/stop_and_frisk_but_for_cars_rps_how_are_you_so/)

[https://www.reddit.com/r/regina/comments/h0zu6q/regina\_police\_association\_suggests\_community/](https://www.reddit.com/r/regina/comments/h0zu6q/regina_police_association_suggests_community/)

&#x200B;

What's going on?",1591973929.0,104,296,Meta,0.89,/r/regina/comments/h7m7py/why_are_threads_critical_of_policing_in_regina/,https://www.reddit.com/r/regina/comments/h7m7py/why_are_threads_critical_of_policing_in_regina/,True,False,False,False,False,Regina,"Why are threads critical of policing in Regina being locked? Threads critical of Regina Police Service have been locked recently.  It seems arbitrary and unnecessary. 

These were the threads:

[https://www.reddit.com/r/regina/comments/h77zq2/stop\_and\_frisk\_but\_for\_cars\_rps\_how\_are\_you\_so/](https://www.reddit.com/r/regina/comments/h77zq2/stop_and_frisk_but_for_cars_rps_how_are_you_so/)

[https://www.reddit.com/r/regina/comments/h0zu6q/regina\_police\_association\_suggests\_community/](https://www.reddit.com/r/regina/comments/h0zu6q/regina_police_association_suggests_community/)

&#x200B;

What's going on?",2020-06-12 14:58:49+00:00,2020,6,12,4,Friday,24,14,summer,2020-2021_pandemic_era,why are threads critical of policing in regina being locked? threads critical of regina police service have been locked recently. it seems arbitrary and unnecessary. these were the threads x b what s going on?,209,35,True,False,False,1,0,0,False,2.8190476190476192,0.10999999999999999,True,False,False,True,False,False,2020_Q2,862eae0df75c09d6,-0.6072,0.0,0.869,0.131,negative
h923ne,New Regina Police Station.,What is the purpose of centralizing all police services for the city in one location?  Given that North Central has been troublesome for decades wouldn't it benefit from a local police presence? Maybe a precinct in NC with police walking a beat would make a positive difference. What the rps has been doing clearly is not working. How does more of the same make any sense?,1592169967.0,1,86,None,0.52,/r/regina/comments/h923ne/new_regina_police_station/,https://www.reddit.com/r/regina/comments/h923ne/new_regina_police_station/,True,False,False,False,False,Regina,New Regina Police Station. What is the purpose of centralizing all police services for the city in one location?  Given that North Central has been troublesome for decades wouldn't it benefit from a local police presence? Maybe a precinct in NC with police walking a beat would make a positive difference. What the rps has been doing clearly is not working. How does more of the same make any sense?,2020-06-14 21:26:07+00:00,2020,6,14,6,Sunday,24,21,summer,2020-2021_pandemic_era,new regina police station. what is the purpose of centralizing all police services for the city in one location? given that north central has been troublesome for decades wouldn t it benefit from a local police presence? maybe a precinct in nc with police walking a beat would make a positive difference. what the rps has been doing clearly is not working. how does more of the same make any sense?,398,71,True,False,False,1,0,0,False,43.0,0.48,True,False,False,True,False,False,2020_Q2,e596ec5bc3e70c35,0.7608,0.123,0.836,0.041,positive
hf1yp1,Anyone else excited about the apparent 8 hours worth of storms the weather network says we're gonna get?,,1593008882.0,54,36,None,0.89,/r/regina/comments/hf1yp1/anyone_else_excited_about_the_apparent_8_hours/,https://i.redd.it/uq2soedrbv651.jpg,False,False,False,False,False,Regina,Anyone else excited about the apparent 8 hours worth of storms the weather network says we're gonna get? ,2020-06-24 14:28:02+00:00,2020,6,24,2,Wednesday,26,14,summer,2020-2021_pandemic_era,anyone else excited about the apparent ADDRESS orms the weather network says we re gonna get?,93,16,False,True,False,0,2,0,False,0.6545454545454545,0.10999999999999999,True,False,False,True,False,False,2020_Q2,e05567e3c35e0ba5,0.34,0.138,0.862,0.0,positive
hfbn4i,The Weather Network,So I have been using The Weather Network forever but this year when it comes to rain it seems the forecast predictions change by the day and sometimes the hour...  Anyone have a more reliable source for the weather & rain or is that just regina weather for us?,1593040227.0,5,17,None,0.69,/r/regina/comments/hfbn4i/the_weather_network/,https://www.reddit.com/r/regina/comments/hfbn4i/the_weather_network/,True,False,False,False,False,Regina,The Weather Network So I have been using The Weather Network forever but this year when it comes to rain it seems the forecast predictions change by the day and sometimes the hour...  Anyone have a more reliable source for the weather & rain or is that just regina weather for us?,2020-06-24 23:10:27+00:00,2020,6,24,2,Wednesday,26,23,summer,2020-2021_pandemic_era,the weather network so i have been using the weather network forever but this year when it comes to rain it seems the forecast predictions change by the day and sometimes the hour... anyone have a more reliable source for the weather rain or is that just regina weather for us?,277,51,False,True,False,0,2,0,False,2.8333333333333335,0.31000000000000005,True,False,False,True,False,False,2020_Q2,2c89a766d1c6170f,0.0,0.0,1.0,0.0,neutral
gut5jm,Suggestions on Home Alarm System Provider?,"Hi! I would like to ask for recommendations for a home alarm system provider please. I'm helping a family look for a good one for their home.

I have LS installed in my house and have no complaints but since it's the only one I've ever used, I can't say if it's the best.

Some things being considered:

1. Reliable system.
2. Wired connection is okay
3. The need is more for a burglar system than a comprehensive home security - i.e., sensors on doors and windows that give off an alert when tripped. They have a smoke alarm system and there is always someone at home so there is no need for temperature fluctuation or flood detection systems.
4. Outdoor security camera as an option
5. Battery backup in case of power outages
6. Reliable customer service.
7. Cost

**EDIT:** Many many thanks for all your very helpful suggestions. We will now start looking at each one of them to see which option ticks the most boxes. Have a good day everyone! ",1591045897.0,6,19,None,0.8,/r/regina/comments/gut5jm/suggestions_on_home_alarm_system_provider/,https://www.reddit.com/r/regina/comments/gut5jm/suggestions_on_home_alarm_system_provider/,True,False,False,False,False,Regina,"Suggestions on Home Alarm System Provider? Hi! I would like to ask for recommendations for a home alarm system provider please. I'm helping a family look for a good one for their home.

I have LS installed in my house and have no complaints but since it's the only one I've ever used, I can't say if it's the best.

Some things being considered:

1. Reliable system.
2. Wired connection is okay
3. The need is more for a burglar system than a comprehensive home security - i.e., sensors on doors and windows that give off an alert when tripped. They have a smoke alarm system and there is always someone at home so there is no need for temperature fluctuation or flood detection systems.
4. Outdoor security camera as an option
5. Battery backup in case of power outages
6. Reliable customer service.
7. Cost

**EDIT:** Many many thanks for all your very helpful suggestions. We will now start looking at each one of them to see which option ticks the most boxes. Have a good day everyone! ",2020-06-01 21:11:37+00:00,2020,6,1,0,Monday,23,21,summer,2020-2021_pandemic_era,suggestions on home alarm system provider? hi! i would like to ask for recommendations for a home alarm system provider please. i m helping a family look for a good one for their home. i have ls installed in my house and have no complaints but since it s the only one i ve ever used i can t say if it s the best. some things being considered . reliable system. . wired connection is okay . the need is more for a burglar system than a comprehensive home security i.e. sensors on doors and windows that give off an alert when tripped. they have a smoke alarm system and there is always someone at home so there is no need for temperature fluctuation or flood detection systems. . outdoor security camera as an option . battery backup in case of power outages . reliable customer service. . cost edit many many thanks for all your very helpful suggestions. we will now start looking at each one of them to see which option ticks the most boxes. have a good day everyone!,968,183,True,True,False,1,1,0,False,2.7142857142857144,0.19999999999999996,True,False,False,True,False,False,2020_Q2,0839dbc7cd97cf33,0.9833,0.189,0.766,0.045,positive
