id,title,selftext,created_utc,score,num_comments,link_flair_text,upvote_ratio,permalink,url,is_self,over_18,spoiler,stickied,locked,subreddit,full_text,created_date,year,month,day,day_of_week,day_name,week_of_year,hour,season,platform_period,cleaned_text,text_length,word_count,contains_crime_keywords,contains_weather_keywords,contains_pandemic_keywords,crime_keyword_count,weather_keyword_count,pandemic_keyword_count,crime_and_weather_and_pandemic,engagement_rate,controversy_score,is_2020,is_2021,pre_pandemic_declared,post_pandemic_declared,vaccine_rollout,major_variant_wave,quarter,author_hash,sentiment_compound,sentiment_positive,sentiment_neutral,sentiment_negative,sentiment_category
kt8t7x,"If you went to a gathering for Christmas, fuck you.","Seriously, fuck you and and your selfish attitude. Already over 350 cases and 1000 close contacts linked to Christmas gatherings, and more expected. Now our lockdown continues. Why did you think you were exempt from the rules? Why were so many of us at home along, missing our families, and you thought your needs were more important? How many more people will die because you couldn’t handle one Christmas alone? I hope you feel ashamed.

Edit: Thanks for the awards

Edit 2: To the many people sending me DM’s telling me how proud they are that they still gathered and/or telling me that they hope it’s me who dies next: just stop. You are the problem.",1610131549.0,1293,377,COVID-19,0.88,/r/Winnipeg/comments/kt8t7x/if_you_went_to_a_gathering_for_christmas_fuck_you/,https://www.reddit.com/r/Winnipeg/comments/kt8t7x/if_you_went_to_a_gathering_for_christmas_fuck_you/,True,False,False,False,False,Winnipeg,"If you went to a gathering for Christmas, fuck you. Seriously, fuck you and and your selfish attitude. Already over 350 cases and 1000 close contacts linked to Christmas gatherings, and more expected. Now our lockdown continues. Why did you think you were exempt from the rules? Why were so many of us at home along, missing our families, and you thought your needs were more important? How many more people will die because you couldn’t handle one Christmas alone? I hope you feel ashamed.

Edit: Thanks for the awards

Edit 2: To the many people sending me DM’s telling me how proud they are that they still gathered and/or telling me that they hope it’s me who dies next: just stop. You are the problem.",2021-01-08 18:45:49+00:00,2021,1,8,4,Friday,1,18,winter,2020-2021_pandemic_era,if you went to a gathering for christmas fuck you. seriously fuck you and and your selfish attitude. already over cases and close contacts linked to christmas gatherings and more expected. now our lockdown continues. why did you think you were exempt from the rules? why were so many of us at home along missing our families and you thought your needs were more important? how many more people will die because you couldn t handle one christmas alone? i hope you feel ashamed. edit thanks for the awards edit to the many people sending me dm s telling me how proud they are that they still gathered and or telling me that they hope it s me who dies next just stop. you are the problem.,685,127,False,False,True,0,0,1,False,0.29134466769706335,0.12,False,True,False,True,True,False,2021_Q1,2f27b81d3c2760f2,-0.8863,0.117,0.701,0.183,negative
ktb5sb,Manitoba lockdown extended 2 weeks after 355 cases tied to holiday gatherings,,1610138172.0,47,39,COVID-19,0.84,/r/Winnipeg/comments/ktb5sb/manitoba_lockdown_extended_2_weeks_after_355/,https://www.cbc.ca/news/canada/manitoba/manitoba-covid-19-public-health-restrictions-1.5866120,False,False,False,False,False,Winnipeg,Manitoba lockdown extended 2 weeks after 355 cases tied to holiday gatherings ,2021-01-08 20:36:12+00:00,2021,1,8,4,Friday,1,20,winter,2020-2021_pandemic_era,manitoba lockdown extended weeks after cases tied to holiday gatherings,71,10,False,False,True,0,0,1,False,0.8125,0.16000000000000003,False,True,False,True,True,False,2021_Q1,625de04accd67f98,0.4019,0.231,0.769,0.0,positive
kt7wuo,Lockdown extended until Jan 22,[https://news.gov.mb.ca/news/index.html?item=50200&posted=2021-01-08](https://news.gov.mb.ca/news/index.html?item=50200&posted=2021-01-08),1610129010.0,24,42,COVID-19,0.72,/r/Winnipeg/comments/kt7wuo/lockdown_extended_until_jan_22/,https://www.reddit.com/r/Winnipeg/comments/kt7wuo/lockdown_extended_until_jan_22/,True,False,False,False,False,Winnipeg,Lockdown extended until Jan 22 [https://news.gov.mb.ca/news/index.html?item=50200&posted=2021-01-08](https://news.gov.mb.ca/news/index.html?item=50200&posted=2021-01-08),2021-01-08 18:03:30+00:00,2021,1,8,4,Friday,1,18,winter,2020-2021_pandemic_era,lockdown extended until jan,27,4,False,False,True,0,0,1,False,1.68,0.28,False,True,False,True,True,False,2021_Q1,8f8b45c3b6182225,0.0,0.0,1.0,0.0,neutral
kt5rvz,Lockdown Heads Up,"So last month I made a post here talking about the Manitoba Bridge Grant and how the platform was broken when it launched. That all got resolved, I managed to reach out to the team in charge of it and they acknowledged the problem. Had it fixed for submissions within two days. 

So I got approved (thank God) and got my grant payment this week. Now what many people may not know is that the province said there would be a second wave of payments if the lockdown were to continue past the existing health orders. 

Well guys I just got an email to let me know that there's gonna be a second payment. I would take that to mean that there's already been a decision made on extending the lockdown and they just haven't told us yet.",1610122966.0,60,30,COVID-19,0.94,/r/Winnipeg/comments/kt5rvz/lockdown_heads_up/,https://www.reddit.com/r/Winnipeg/comments/kt5rvz/lockdown_heads_up/,True,False,False,False,False,Winnipeg,"Lockdown Heads Up So last month I made a post here talking about the Manitoba Bridge Grant and how the platform was broken when it launched. That all got resolved, I managed to reach out to the team in charge of it and they acknowledged the problem. Had it fixed for submissions within two days. 

So I got approved (thank God) and got my grant payment this week. Now what many people may not know is that the province said there would be a second wave of payments if the lockdown were to continue past the existing health orders. 

Well guys I just got an email to let me know that there's gonna be a second payment. I would take that to mean that there's already been a decision made on extending the lockdown and they just haven't told us yet.",2021-01-08 16:22:46+00:00,2021,1,8,4,Friday,1,16,winter,2020-2021_pandemic_era,lockdown heads up so last month i made a post here talking about the manitoba bridge grant and how the platform was broken when it launched. that all got resolved i managed to reach out to the team in charge of it and they acknowledged the problem. had it fixed for submissions within two days. so i got approved thank god and got my grant payment this week. now what many people may not know is that the province said there would be a second wave of payments if the lockdown were to continue past the existing health orders. well guys i just got an email to let me know that there s gonna be a second payment. i would take that to mean that there s already been a decision made on extending the lockdown and they just haven t told us yet.,739,144,False,False,True,0,0,2,False,0.4918032786885246,0.06000000000000005,False,True,False,True,True,False,2021_Q1,4ff26437e400e7d3,0.8505,0.121,0.842,0.037,positive
l86be7,Insane rent increase at 1155 Grant again... (25%),"In two years our one bed room apartment will have gone from 1000 to 1640 a month. Thats a 30% and 25% increase per year and I already know it will be accepted since apparently that's all they know how to do. This place is absolutely not worth that. 

Thanks a lot Private Pension Partners. And for those wondering yes we are going to leave. We couldn't really look last year due to the original pandemic lockdown scare, unfortunately.",1611959512.0,277,166,Community,0.96,/r/Winnipeg/comments/l86be7/insane_rent_increase_at_1155_grant_again_25/,https://www.reddit.com/r/Winnipeg/comments/l86be7/insane_rent_increase_at_1155_grant_again_25/,True,False,False,False,False,Winnipeg,"Insane rent increase at 1155 Grant again... (25%) In two years our one bed room apartment will have gone from 1000 to 1640 a month. Thats a 30% and 25% increase per year and I already know it will be accepted since apparently that's all they know how to do. This place is absolutely not worth that. 

Thanks a lot Private Pension Partners. And for those wondering yes we are going to leave. We couldn't really look last year due to the original pandemic lockdown scare, unfortunately.",2021-01-29 22:31:52+00:00,2021,1,29,4,Friday,4,22,winter,2020-2021_pandemic_era,insane rent increase at grant again... in two years our one bed room apartment will have gone from to a month. thats a and increase per year and i already know it will be accepted since apparently that s all they know how to do. this place is absolutely not worth that. thanks a lot private pension partners. and for those wondering yes we are going to leave. we couldn t really look last year due to the original pandemic lockdown scare unfortunately.,452,83,False,False,True,0,0,2,False,0.5971223021582733,0.040000000000000036,False,True,False,True,True,False,2021_Q1,a4323472a7774ce0,0.0899,0.143,0.717,0.14,positive
l40vwp,Lack of transparency about Manitoba's vaccine eligibility plan erodes public trust: health experts | CBC News,,1611500493.0,254,79,News,0.94,/r/Winnipeg/comments/l40vwp/lack_of_transparency_about_manitobas_vaccine/,https://www.cbc.ca/news/canada/manitoba/manitoba-vaccine-eligibility-transparency-1.5884796,False,False,False,False,False,Winnipeg,Lack of transparency about Manitoba's vaccine eligibility plan erodes public trust: health experts | CBC News ,2021-01-24 15:01:33+00:00,2021,1,24,6,Sunday,3,15,winter,2020-2021_pandemic_era,lack of transparency about manitoba s vaccine eligibility plan erodes public trust health experts cbc news,106,16,False,False,True,0,0,1,False,0.30980392156862746,0.06000000000000005,False,True,False,True,True,False,2021_Q1,0d8f1d210cb6e749,0.25,0.168,0.714,0.117,positive
l0beyt,Liquor Mart thefts drop 97.5% in 6 months since locked entrances installed,,1611027867.0,648,120,News,0.99,/r/Winnipeg/comments/l0beyt/liquor_mart_thefts_drop_975_in_6_months_since/,https://www.cbc.ca/news/canada/manitoba/liquor-mart-winnipeg-thefts-plummet-security-measures-1.5877638,False,False,False,False,False,Winnipeg,Liquor Mart thefts drop 97.5% in 6 months since locked entrances installed ,2021-01-19 03:44:27+00:00,2021,1,19,1,Tuesday,3,3,winter,2020-2021_pandemic_era,liquor mart thefts drop . in months since locked entrances installed,68,11,True,False,False,1,0,0,False,0.18489984591679506,0.010000000000000009,False,True,False,True,True,False,2021_Q1,1f0d4cd74ae758a8,-0.2732,0.0,0.826,0.174,negative
kuwug6,"Norm, protector of the farm enjoying the recent mild weather",,1610345701.0,273,18,Pictures/Video,0.99,/r/Winnipeg/comments/kuwug6/norm_protector_of_the_farm_enjoying_the_recent/,https://v.redd.it/k8hwjcgrana61,False,False,False,False,False,Winnipeg,"Norm, protector of the farm enjoying the recent mild weather ",2021-01-11 06:15:01+00:00,2021,1,11,0,Monday,2,6,winter,2020-2021_pandemic_era,norm protector of the farm enjoying the recent mild weather,59,10,False,True,False,0,1,0,False,0.06569343065693431,0.010000000000000009,False,True,False,True,True,False,2021_Q1,9a3177fbe7d1d566,0.5267,0.274,0.726,0.0,positive
l8tjhc,"To those who thinks it's cold, this was cold!",,1612035069.0,677,98,Pictures/Video,0.97,/r/Winnipeg/comments/l8tjhc/to_those_who_thinks_its_cold_this_was_cold/,https://i.redd.it/eljtbt0euie61.jpg,False,False,False,False,False,Winnipeg,"To those who thinks it's cold, this was cold! ",2021-01-30 19:31:09+00:00,2021,1,30,5,Saturday,4,19,winter,2020-2021_pandemic_era,to those who thinks it s cold this was cold!,44,10,False,True,False,0,1,0,False,0.14454277286135694,0.030000000000000027,False,True,False,True,True,False,2021_Q1,bcb290e03df38836,0.0,0.0,1.0,0.0,neutral
l49im5,"It was cold today, but not too cold for bubbles. Well, maybe too cold for bubbles.",,1611527891.0,559,8,Pictures/Video,0.99,/r/Winnipeg/comments/l49im5/it_was_cold_today_but_not_too_cold_for_bubbles/,https://v.redd.it/6m3hwr63ycd61,False,False,False,False,False,Winnipeg,"It was cold today, but not too cold for bubbles. Well, maybe too cold for bubbles. ",2021-01-24 22:38:11+00:00,2021,1,24,6,Sunday,3,22,winter,2020-2021_pandemic_era,it was cold today but not too cold for bubbles. well maybe too cold for bubbles.,80,16,False,True,False,0,1,0,False,0.014285714285714285,0.010000000000000009,False,True,False,True,True,False,2021_Q1,d8215b81a09e0e3a,0.3919,0.15,0.85,0.0,positive
l5i3hv,"Over the past 147 years, Winnipeg's annual average temperature has increased by about 2.0°C.",,1611680165.0,53,20,History,0.91,/r/Winnipeg/comments/l5i3hv/over_the_past_147_years_winnipegs_annual_average/,https://i.redd.it/j9gc9oqxipd61.png,False,False,False,False,False,Winnipeg,"Over the past 147 years, Winnipeg's annual average temperature has increased by about 2.0°C. ",2021-01-26 16:56:05+00:00,2021,1,26,1,Tuesday,4,16,winter,2020-2021_pandemic_era,over the past years winnipeg s annual average temperature has increased by about . c.,85,15,False,True,False,0,1,0,False,0.37037037037037035,0.08999999999999997,False,True,False,True,True,False,2021_Q1,bdd9cecfabd99654,0.2732,0.13,0.87,0.0,positive
l4qhi1,-42celsius Welcome back Manitoba Winter temperatures!🥶😮,,1611589743.0,62,21,Satire/Humour,0.8,/r/Winnipeg/comments/l4qhi1/42celsius_welcome_back_manitoba_winter/,https://v.redd.it/8t37dwbd1id61,False,False,False,False,False,Winnipeg,-42celsius Welcome back Manitoba Winter temperatures!🥶😮 ,2021-01-25 15:49:03+00:00,2021,1,25,0,Monday,4,15,winter,2020-2021_pandemic_era,celsius welcome back manitoba winter temperatures!,50,6,False,True,False,0,3,0,False,0.3333333333333333,0.19999999999999996,False,True,False,True,True,False,2021_Q1,f706e7b32dcdaa4d,0.5093,0.397,0.603,0.0,positive
