id,title,selftext,created_utc,score,num_comments,link_flair_text,upvote_ratio,permalink,url,is_self,over_18,spoiler,stickied,locked,subreddit,full_text,created_date,year,month,day,day_of_week,day_name,week_of_year,hour,season,platform_period,cleaned_text,text_length,word_count,contains_crime_keywords,contains_weather_keywords,contains_pandemic_keywords,crime_keyword_count,weather_keyword_count,pandemic_keyword_count,crime_and_weather_and_pandemic,engagement_rate,controversy_score,is_2020,is_2021,pre_pandemic_declared,post_pandemic_declared,vaccine_rollout,major_variant_wave,quarter,author_hash,sentiment_compound,sentiment_positive,sentiment_neutral,sentiment_negative,sentiment_category
hshtux,"COVID-19 in Sask: Province sees record-high one-day increase of 42 cases, tracker says www.cbc.ca",,1594931766.0,87,114,None,0.93,/r/saskatchewan/comments/hshtux/covid19_in_sask_province_sees_recordhigh_oneday/,https://www.cbc.ca/news/canada/saskatoon/covid-19-saskatchewan-hutterite-1.5651718,False,False,False,False,False,saskatchewan,"COVID-19 in Sask: Province sees record-high one-day increase of 42 cases, tracker says www.cbc.ca ",2020-07-16 20:36:06+00:00,2020,7,16,3,Thursday,29,20,summer,2020-2021_pandemic_era,covid in sask province sees record high one day increase of cases tracker says,78,14,False,False,True,0,0,1,False,1.2954545454545454,0.06999999999999995,True,False,False,True,False,False,2020_Q3,ca44924238c6f3ac,0.3182,0.15,0.85,0.0,positive
hqw9zc,"Sask. government boosts funding to Regina, Saskatoon police",,1594707427.0,49,73,None,1.0,/r/saskatchewan/comments/hqw9zc/sask_government_boosts_funding_to_regina/,https://www.cbc.ca/news/canada/saskatchewan/regina-saskatoon-police-government-funding-1.5647793,False,False,False,False,False,saskatchewan,"Sask. government boosts funding to Regina, Saskatoon police ",2020-07-14 06:17:07+00:00,2020,7,14,1,Tuesday,29,6,summer,2020-2021_pandemic_era,sask. government boosts funding to regina saskatoon police,58,8,True,False,False,1,0,0,False,1.46,0.0,True,False,False,True,False,False,2020_Q3,6bf351bb146c2db3,0.3182,0.247,0.753,0.0,positive
hrnrir,Saskatoon police tell residents not to report American cars - Saskatoon,,1594820516.0,54,56,None,0.9,/r/saskatchewan/comments/hrnrir/saskatoon_police_tell_residents_not_to_report/,https://globalnews.ca/news/7177345/saskatoon-police-dont-report-american-cars/amp/,False,False,False,False,False,saskatchewan,Saskatoon police tell residents not to report American cars - Saskatoon ,2020-07-15 13:41:56+00:00,2020,7,15,2,Wednesday,29,13,summer,2020-2021_pandemic_era,saskatoon police tell residents not to report american cars saskatoon,69,10,True,False,False,1,0,0,False,1.018181818181818,0.09999999999999998,True,False,False,True,False,False,2020_Q3,6a243ca89e6f35c1,0.0,0.0,1.0,0.0,neutral
hzivco,My little grapevine survived the endless winter and is making fruit. In late a March it was still snowed under,,1595957220.0,73,7,None,0.95,/r/saskatchewan/comments/hzivco/my_little_grapevine_survived_the_endless_winter/,https://i.redd.it/7yqx14qnumd51.jpg,False,False,False,False,False,saskatchewan,My little grapevine survived the endless winter and is making fruit. In late a March it was still snowed under ,2020-07-28 17:27:00+00:00,2020,7,28,1,Tuesday,31,17,summer,2020-2021_pandemic_era,my little grapevine survived the endless winter and is making fruit. in late a march it was still snowed under,110,20,False,True,False,0,2,0,False,0.0945945945945946,0.050000000000000044,True,False,False,True,False,False,2020_Q3,0c462ad29a60a103,0.4627,0.137,0.863,0.0,positive
hvbkd1,"Manitoba looks to open borders, increase gathering sizes in Phase 4 of COVID-19 recovery. After a recent uptick in cases, this sounds like a greaaat idea.",,1595352111.0,87,38,None,0.9,/r/Manitoba/comments/hvbkd1/manitoba_looks_to_open_borders_increase_gathering/,https://www.cbc.ca/news/canada/manitoba/premier-brian-pallister-safe-services-1.5657331,False,False,False,False,False,manitoba,"Manitoba looks to open borders, increase gathering sizes in Phase 4 of COVID-19 recovery. After a recent uptick in cases, this sounds like a greaaat idea. ",2020-07-21 17:21:51+00:00,2020,7,21,1,Tuesday,30,17,summer,2020-2021_pandemic_era,manitoba looks to open borders increase gathering sizes in phase of covid recovery. after a recent uptick in cases this sounds like a greaaat idea.,147,25,False,False,True,0,0,1,False,0.4318181818181818,0.09999999999999998,True,False,False,True,False,False,2020_Q3,782531567e238872,0.5859,0.173,0.827,0.0,positive
hxni2r,Latest Covid cases,"I understand most of our new cases are on the colonies but for the cases that aren't does anyone know if they are also from out of province travel, or are they community spread in Winnipeg?",1595686933.0,20,4,None,0.89,/r/Manitoba/comments/hxni2r/latest_covid_cases/,https://www.reddit.com/r/Manitoba/comments/hxni2r/latest_covid_cases/,True,False,False,False,False,manitoba,"Latest Covid cases I understand most of our new cases are on the colonies but for the cases that aren't does anyone know if they are also from out of province travel, or are they community spread in Winnipeg?",2020-07-25 14:22:13+00:00,2020,7,25,5,Saturday,30,14,summer,2020-2021_pandemic_era,latest covid cases i understand most of our new cases are on the colonies but for the cases that aren t does anyone know if they are also from out of province travel or are they community spread in winnipeg?,207,40,False,False,True,0,0,1,False,0.19047619047619047,0.10999999999999999,True,False,False,True,False,False,2020_Q3,36e2f14c747d7d58,0.0,0.0,1.0,0.0,neutral
i03ji5,“Safe” to live rural areas around Winnipeg?,"Safe is in quotations because it’s so subjective, but what is the crime like in towns surrounding Winnipeg? Ie Steinbach, Sanford, Warren, Stonewall, Beausejour etc. 

I was looking at property in Selkirk and it seemed like a nice area but I’ve recently found out the crime and substance abuse problems there are high, which is making me think otherwise now.

EDIT: thanks for all the comments! For those asking, I don’t have children (yet). I’m just looking for a bit of that peace and quiet. The replies on Selkirk have helped change my mind, I don’t think I’ll cross it off my list.",1596039808.0,24,71,None,0.81,/r/Manitoba/comments/i03ji5/safe_to_live_rural_areas_around_winnipeg/,https://www.reddit.com/r/Manitoba/comments/i03ji5/safe_to_live_rural_areas_around_winnipeg/,True,False,False,False,False,manitoba,"“Safe” to live rural areas around Winnipeg? Safe is in quotations because it’s so subjective, but what is the crime like in towns surrounding Winnipeg? Ie Steinbach, Sanford, Warren, Stonewall, Beausejour etc. 

I was looking at property in Selkirk and it seemed like a nice area but I’ve recently found out the crime and substance abuse problems there are high, which is making me think otherwise now.

EDIT: thanks for all the comments! For those asking, I don’t have children (yet). I’m just looking for a bit of that peace and quiet. The replies on Selkirk have helped change my mind, I don’t think I’ll cross it off my list.",2020-07-29 16:23:28+00:00,2020,7,29,2,Wednesday,31,16,summer,2020-2021_pandemic_era,safe to live rural areas around winnipeg? safe is in quotations because it s so subjective but what is the crime like in towns surrounding winnipeg? ie steinbach sanford warren stonewall beausejour etc. i was looking at property in selkirk and it seemed like a nice area but i ve recently found out the crime and substance abuse problems there are high which is making me think otherwise now. edit thanks for all the comments! for those asking i don t have children yet . i m just looking for a bit of that peace and quiet. the replies on selkirk have helped change my mind i don t think i ll cross it off my list.,614,117,True,False,False,1,0,0,False,2.84,0.18999999999999995,True,False,False,True,False,False,2020_Q3,0d7cd6336482dca3,0.3616,0.158,0.715,0.127,positive
hvybzs,Instagram hotspot becomes headache for homeowner: cites trespassing and safety concerns,,1595439884.0,63,20,None,0.99,/r/Manitoba/comments/hvybzs/instagram_hotspot_becomes_headache_for_homeowner/,https://www.cbc.ca/news/indigenous/metis-man-property-trespassing-pine-dock-caves-1.5658161?fbclid=IwAR1EuRrXsjwFQum40yUg5EqezdDD7uKKXrN5X4zQDIH5quZ4X5hr9Odk_Cw,False,False,False,False,False,manitoba,Instagram hotspot becomes headache for homeowner: cites trespassing and safety concerns ,2020-07-22 17:44:44+00:00,2020,7,22,2,Wednesday,30,17,summer,2020-2021_pandemic_era,instagram hotspot becomes headache for homeowner cites trespassing and safety concerns,86,11,True,True,False,1,1,0,False,0.3125,0.010000000000000009,True,False,False,True,False,False,2020_Q3,2235cddb371a290b,0.4215,0.219,0.781,0.0,positive
hvw0cy,Fermor Ave @ Lagimodiere Construction zone,Can anyone tell me how long this construction has been going on for?  I don't live in the city and traveled along this path.  I got a photo radar ticket at 5pm with no workers or vehicles present.  Does this happen all the time?,1595432444.0,10,24,None,0.86,/r/Manitoba/comments/hvw0cy/fermor_ave_lagimodiere_construction_zone/,https://www.reddit.com/r/Manitoba/comments/hvw0cy/fermor_ave_lagimodiere_construction_zone/,True,False,False,False,False,manitoba,Fermor Ave @ Lagimodiere Construction zone Can anyone tell me how long this construction has been going on for?  I don't live in the city and traveled along this path.  I got a photo radar ticket at 5pm with no workers or vehicles present.  Does this happen all the time?,2020-07-22 15:40:44+00:00,2020,7,22,2,Wednesday,30,15,summer,2020-2021_pandemic_era,fermor ave lagimodiere construction zone can anyone tell me how long this construction has been going on for? i don t live in the city and traveled along this path. i got a photo radar ticket at pm with no workers or vehicles present. does this happen all the time?,265,50,False,True,False,0,1,0,False,2.1818181818181817,0.14,True,False,False,True,False,False,2020_Q3,f74f7518ce1cef47,-0.3736,0.0,0.95,0.05,negative
hqwe9e,Is another lockdown coming?,"With the increase in cases from this weekend , do you think another one is incoming or is this just an uptick we will have to deal with as the province reopens",1594708045.0,5,40,Covid-19 Coronavirus,0.63,/r/alberta/comments/hqwe9e/is_another_lockdown_coming/,https://www.reddit.com/r/alberta/comments/hqwe9e/is_another_lockdown_coming/,True,False,False,False,False,alberta,"Is another lockdown coming? With the increase in cases from this weekend , do you think another one is incoming or is this just an uptick we will have to deal with as the province reopens",2020-07-14 06:27:25+00:00,2020,7,14,1,Tuesday,29,6,summer,2020-2021_pandemic_era,is another lockdown coming? with the increase in cases from this weekend do you think another one is incoming or is this just an uptick we will have to deal with as the province reopens,185,35,False,False,True,0,0,1,False,6.666666666666667,0.37,True,False,False,True,False,False,2020_Q3,271703fbc9edcffd,0.3182,0.063,0.937,0.0,positive
hmynx3,Alberta's Rural Crime Motion Will Empower Extremist Militias,,1594142009.0,11,17,UCP,0.64,/r/alberta/comments/hmynx3/albertas_rural_crime_motion_will_empower/,https://readpassage.com/albertas-rural-crime-motion-will-empower-extremist-militias/,False,False,False,False,False,alberta,Alberta's Rural Crime Motion Will Empower Extremist Militias ,2020-07-07 17:13:29+00:00,2020,7,7,1,Tuesday,28,17,summer,2020-2021_pandemic_era,alberta s rural crime motion will empower extremist militias,60,9,True,False,False,1,0,0,False,1.4166666666666667,0.36,True,False,False,True,False,False,2020_Q3,901b89a7b590b298,-0.5423,0.0,0.696,0.304,negative
hki79b,Witness shocked at force used by Calgary police dealing with sleeping man,,1593779331.0,261,188,None,0.9,/r/alberta/comments/hki79b/witness_shocked_at_force_used_by_calgary_police/,https://www.cbc.ca/news/canada/calgary/witness-shocked-force-used-calgary-police-1.5629065?fbclid=IwAR3QIyNaXDvQ-LlMoHpfJaZdN7sc6cHWf96hnWvtMY21z7IQFG37kk0xW0w,False,False,False,False,False,alberta,Witness shocked at force used by Calgary police dealing with sleeping man ,2020-07-03 12:28:51+00:00,2020,7,3,4,Friday,27,12,summer,2020-2021_pandemic_era,witness shocked at force used by calgary police dealing with sleeping man,73,12,True,False,False,1,0,0,False,0.7175572519083969,0.09999999999999998,True,False,False,True,False,False,2020_Q3,99725cb4f1cc25ae,-0.3182,0.0,0.827,0.173,negative
hy16ss,Stop Letting Dealership Take Advantage of You!,"After a terrible experience at a local Go Auto yesterday, one that echoes many complaints that I have seen here regarding excessive fees and overall scummy practices, I’ve chosen to reflect on what I could have done as a consumer.

Yes, the most logical thing would have been “Well, don’t go to Go Auto.”

My second logical thing would have been to make use of Alberta’s one-party consent law.  Are you aware that as long as one person consents in a conversation, you can record it without letting the other person know?  This means that at any dealership, Go Auto or otherwise, you can record your conversation with the sales associate without them knowing, as long as you, yourself, are consenting to the recording and are engaging in the conversation.

AMVIC regulations state that a dealer has to obey by “All-In pricing.”  What this means, according to the AMVIC website, is that:

“The price advertised plus GST is the law.
All-in pricing is the law in Alberta. That means when an AMVIC-licensed seller advertises the price of a vehicle it must include ALL fees and charges the seller intends to charge.  The only fee that can be added to the advertised price is GST and any costs associated with financing.

Examples of fees or charges that may be included in the advertised price but cannot be added on to it:
- Freight
- PDI-PDE (pre-delivery inspection/expense)
- Administration (Admin) fee(s)
- Levy recoveries (AMVIC levy, air conditioning levy, etc.)
- Pre-installed products and services (nitrogen/tire protection package, security or theft deterrent products/services such as etching, etc., fuel)”

[All-In Pricing](https://www.amvic.org/consumer/your-rights/all-inpricingisthelaw/)

I know I’m not the only one who suddenly had a bunch of “Extra-fees,” (Etching, anti-theft, et cetera) tacked onto their vehicle purchase, so please know your rights regarding AMVIC regulations, and your right to record the conversations you have with people at the dealership!

As a consumer, you also have the right to request a copy of anything you are asked to sign.  If they don’t let you have a copy, take a picture with your phone.

Bring in a copy of the advertisement you saw on cargurus, autotrader, goauto, et cetera, that clearly shows the price alongside the VIN for the vehicle you’re looking at.

Please start filing complaints through AMVIC’s [Consumer Portal](https://portal.amvic.org/Pages/en_US/Forms/Public/Home/Default.aspx) when sales tactics become aggressive or when the dealership is trying to manipulate you.  File a complaint when they suddenly add $1000 in additional items on top of the advertised price for a vehicle, claiming that “All vehicle purchases come with hidden fees.”  They don’t, and you shouldn’t accept that.

Stop letting them take advantage of you.

Edited to Add:

If AMVIC doesn't do anything, go above AMVIC.  You are protected from fraud, aggressive sales tactics, misrepresentations of fees, and a whole bunch of other stuff under the [Consumer Protection Act.](https://www.alberta.ca/unfair-business-practices.aspx)  Check out Service Alberta's [complaint page.](https://www.alberta.ca/file-consumer-complaint.aspx)

1. File a complaint with the business.

2. File a complaint through BBB.

3. File a complaint with AMVIC.

4. File a complaint with the Consumer Investigations Unit. (Depending on the situation. The misrepresentation of fees such as etching as mandatory would fall under this, as would the dealer refusing to honour the advertised price.)

It’s going to be harder for a business to prove they’re right if you have them on tape saying something else with pictures alongside the recording. Get proof and use it if you need to.

You are also protected from false and misleading advertising by the [Competition Bureau.](https://www.competitionbureau.gc.ca/eic/site/cb-bc.nsf/eng/02776.html) Take a screenshot of the advertisement showing their ""Listed price + GST is all you pay!"" thing and file a complaint with them as well if they don't honour the price they have listed.",1595740224.0,216,81,Discussion,0.97,/r/alberta/comments/hy16ss/stop_letting_dealership_take_advantage_of_you/,https://www.reddit.com/r/alberta/comments/hy16ss/stop_letting_dealership_take_advantage_of_you/,True,False,False,False,False,alberta,"Stop Letting Dealership Take Advantage of You! After a terrible experience at a local Go Auto yesterday, one that echoes many complaints that I have seen here regarding excessive fees and overall scummy practices, I’ve chosen to reflect on what I could have done as a consumer.

Yes, the most logical thing would have been “Well, don’t go to Go Auto.”

My second logical thing would have been to make use of Alberta’s one-party consent law.  Are you aware that as long as one person consents in a conversation, you can record it without letting the other person know?  This means that at any dealership, Go Auto or otherwise, you can record your conversation with the sales associate without them knowing, as long as you, yourself, are consenting to the recording and are engaging in the conversation.

AMVIC regulations state that a dealer has to obey by “All-In pricing.”  What this means, according to the AMVIC website, is that:

“The price advertised plus GST is the law.
All-in pricing is the law in Alberta. That means when an AMVIC-licensed seller advertises the price of a vehicle it must include ALL fees and charges the seller intends to charge.  The only fee that can be added to the advertised price is GST and any costs associated with financing.

Examples of fees or charges that may be included in the advertised price but cannot be added on to it:
- Freight
- PDI-PDE (pre-delivery inspection/expense)
- Administration (Admin) fee(s)
- Levy recoveries (AMVIC levy, air conditioning levy, etc.)
- Pre-installed products and services (nitrogen/tire protection package, security or theft deterrent products/services such as etching, etc., fuel)”

[All-In Pricing](https://www.amvic.org/consumer/your-rights/all-inpricingisthelaw/)

I know I’m not the only one who suddenly had a bunch of “Extra-fees,” (Etching, anti-theft, et cetera) tacked onto their vehicle purchase, so please know your rights regarding AMVIC regulations, and your right to record the conversations you have with people at the dealership!

As a consumer, you also have the right to request a copy of anything you are asked to sign.  If they don’t let you have a copy, take a picture with your phone.

Bring in a copy of the advertisement you saw on cargurus, autotrader, goauto, et cetera, that clearly shows the price alongside the VIN for the vehicle you’re looking at.

Please start filing complaints through AMVIC’s [Consumer Portal](https://portal.amvic.org/Pages/en_US/Forms/Public/Home/Default.aspx) when sales tactics become aggressive or when the dealership is trying to manipulate you.  File a complaint when they suddenly add $1000 in additional items on top of the advertised price for a vehicle, claiming that “All vehicle purchases come with hidden fees.”  They don’t, and you shouldn’t accept that.

Stop letting them take advantage of you.

Edited to Add:

If AMVIC doesn't do anything, go above AMVIC.  You are protected from fraud, aggressive sales tactics, misrepresentations of fees, and a whole bunch of other stuff under the [Consumer Protection Act.](https://www.alberta.ca/unfair-business-practices.aspx)  Check out Service Alberta's [complaint page.](https://www.alberta.ca/file-consumer-complaint.aspx)

1. File a complaint with the business.

2. File a complaint through BBB.

3. File a complaint with AMVIC.

4. File a complaint with the Consumer Investigations Unit. (Depending on the situation. The misrepresentation of fees such as etching as mandatory would fall under this, as would the dealer refusing to honour the advertised price.)

It’s going to be harder for a business to prove they’re right if you have them on tape saying something else with pictures alongside the recording. Get proof and use it if you need to.

You are also protected from false and misleading advertising by the [Competition Bureau.](https://www.competitionbureau.gc.ca/eic/site/cb-bc.nsf/eng/02776.html) Take a screenshot of the advertisement showing their ""Listed price + GST is all you pay!"" thing and file a complaint with them as well if they don't honour the price they have listed.",2020-07-26 05:10:24+00:00,2020,7,26,6,Sunday,30,5,summer,2020-2021_pandemic_era,stop letting dealership take advantage of you! after a terrible experience at a local go auto yesterday one that echoes many complaints that i have seen here regarding excessive fees and overall scummy practices i ve chosen to reflect on what i could have done as a consumer. yes the most logical thing would have been well don t go to go auto. my second logical thing would have been to make use of alberta s one party consent law. are you aware that as long as one person consents in a conversation you can record it without letting the other person know? this means that at any dealership go auto or otherwise you can record your conversation with the sales associate without them knowing as long as you yourself are consenting to the recording and are engaging in the conversation. amvic regulations state that a dealer has to obey by all in pricing. what this means according to the amvic website is that the price advertised plus gst is the law. all in pricing is the law in alberta. that means when an amvic licensed seller advertises the price of a vehicle it must include all fees and charges the seller intends to charge. the only fee that can be added to the advertised price is gst and any costs associated with financing. examples of fees or charges that may be included in the advertised price but cannot be added on to it freight pdi pde pre delivery inspection expense administration admin fee s levy recoveries amvic levy air conditioning levy etc. pre installed products and services nitrogen tire protection package security or theft deterrent products services such as etching etc. fuel all in pricing i know i m not the only one who suddenly had a bunch of extra fees etching anti theft et cetera tacked onto their vehicle purchase so please know your rights regarding amvic regulations and your right to record the conversations you have with people at the dealership! as a consumer you also have the right to request a copy of anything you are asked to sign. if they don t let you have a copy take a picture with your phone. bring in a copy of the advertisement you saw on cargurus autotrader goauto et cetera that clearly shows the price alongside the vin for the vehicle you re looking at. please start filing complaints through amvic s consumer portal when sales tactics become aggressive or when the dealership is trying to manipulate you. file a complaint when they suddenly add in additional items on top of the advertised price for a vehicle claiming that all vehicle purchases come with hidden fees. they don t and you shouldn t accept that. stop letting them take advantage of you. edited to add if amvic doesn t do anything go above amvic. you are protected from fraud aggressive sales tactics misrepresentations of fees and a whole bunch of other stuff under the consumer protection act. check out service alberta s complaint page. . file a complaint with the business. . file a complaint through bbb. . file a complaint with amvic. . file a complaint with the consumer investigations unit. depending on the situation. the misrepresentation of fees such as etching as mandatory would fall under this as would the dealer refusing to honour the advertised price. it s going to be harder for a business to prove they re right if you have them on tape saying something else with pictures alongside the recording. get proof and use it if you need to. you are also protected from false and misleading advertising by the competition bureau. take a screenshot of the advertisement showing their listed price gst is all you pay! thing and file a complaint with them as well if they don t honour the price they have listed.,3647,646,True,True,False,3,2,0,False,0.37327188940092165,0.030000000000000027,True,False,False,True,False,False,2020_Q3,510d8ffa9057890d,-0.5407,0.077,0.841,0.083,negative
