id,title,selftext,created_utc,score,num_comments,link_flair_text,upvote_ratio,permalink,url,is_self,over_18,spoiler,stickied,locked,subreddit,full_text,created_date,year,month,day,day_of_week,day_name,week_of_year,hour,season,platform_period,cleaned_text,text_length,word_count,contains_crime_keywords,contains_weather_keywords,contains_pandemic_keywords,crime_keyword_count,weather_keyword_count,pandemic_keyword_count,crime_and_weather_and_pandemic,engagement_rate,controversy_score,is_2020,is_2021,pre_pandemic_declared,post_pandemic_declared,vaccine_rollout,major_variant_wave,quarter,author_hash,sentiment_compound,sentiment_positive,sentiment_neutral,sentiment_negative,sentiment_category
heikr2,"Manitoba will pay people $2,000 to get off COVID-19 benefits and go back to work | CBC News",,1592932248.0,113,166,News,0.94,/r/Winnipeg/comments/heikr2/manitoba_will_pay_people_2000_to_get_off_covid19/,https://www.cbc.ca/news/canada/manitoba/pallister-employment-initiative-1.5623580,False,False,False,False,False,Winnipeg,"Manitoba will pay people $2,000 to get off COVID-19 benefits and go back to work | CBC News ",2020-06-23 17:10:48+00:00,2020,6,23,1,Tuesday,26,17,summer,2020-2021_pandemic_era,manitoba will pay people to get off covid benefits and go back to work cbc news,79,16,False,False,True,0,0,1,False,1.456140350877193,0.06000000000000005,True,False,False,True,False,False,2020_Q2,a02afae3bebfc36f,0.296,0.144,0.778,0.078,positive
h9y0wj,Thinking of moving to Winnipeg - crime question,"I'm thinking of moving to Winnipeg (from Toronto). When I told my friends they told me that I should probably consider other places because there's lots of crime and drugs there. I've seen news articles about random bus stabbings, homicides, sexual assaults, people chasing people with a chainsaw, gun shots, etc. I live in a safe area in Toronto and this really scares me. 

Is crime really that bad in Winnipeg? 

Is it everywhere or only in specific neighbourhoods? 

Is it safe to take the bus/public transit?

Is it safe to walk around during the day and at night?

How do you stay safe? (if that's possible)",1592287801.0,12,90,Ask Winnipeg,0.7,/r/Winnipeg/comments/h9y0wj/thinking_of_moving_to_winnipeg_crime_question/,https://www.reddit.com/r/Winnipeg/comments/h9y0wj/thinking_of_moving_to_winnipeg_crime_question/,True,False,False,False,False,Winnipeg,"Thinking of moving to Winnipeg - crime question I'm thinking of moving to Winnipeg (from Toronto). When I told my friends they told me that I should probably consider other places because there's lots of crime and drugs there. I've seen news articles about random bus stabbings, homicides, sexual assaults, people chasing people with a chainsaw, gun shots, etc. I live in a safe area in Toronto and this really scares me. 

Is crime really that bad in Winnipeg? 

Is it everywhere or only in specific neighbourhoods? 

Is it safe to take the bus/public transit?

Is it safe to walk around during the day and at night?

How do you stay safe? (if that's possible)",2020-06-16 06:10:01+00:00,2020,6,16,1,Tuesday,25,6,summer,2020-2021_pandemic_era,thinking of moving to winnipeg crime question i m thinking of moving to winnipeg from toronto . when i told my friends they told me that i should probably consider other places because there s lots of crime and drugs there. i ve seen news articles about random bus stabbings homicides sexual assaults people chasing people with a chainsaw gun shots etc. i live in a safe area in toronto and this really scares me. is crime really that bad in winnipeg? is it everywhere or only in specific neighbourhoods? is it safe to take the bus public transit? is it safe to walk around during the day and at night? how do you stay safe? if that s possible,643,120,True,True,False,4,1,0,False,6.923076923076923,0.30000000000000004,True,False,False,True,False,False,2020_Q2,a720535486381881,-0.8788,0.1,0.737,0.163,negative
hdfvrg,June 21 - Edmonton Cases Of COVID-19,,1592778226.0,250,123,Covid-19 Coronavirus,0.98,/r/Edmonton/comments/hdfvrg/june_21_edmonton_cases_of_covid19/,https://i.redd.it/wkqsbg9l9c651.jpg,False,False,False,False,False,Edmonton,June 21 - Edmonton Cases Of COVID-19 ,2020-06-21 22:23:46+00:00,2020,6,21,6,Sunday,25,22,summer,2020-2021_pandemic_era,june edmonton cases of covid,28,5,False,False,True,0,0,1,False,0.4900398406374502,0.020000000000000018,True,False,False,True,False,False,2020_Q2,257065bb11772fa3,0.0,0.0,1.0,0.0,neutral
h0l8du,June 10 - Edmonton Cases Of COVID-19,,1591826091.0,202,116,Covid-19 Coronavirus,0.97,/r/Edmonton/comments/h0l8du/june_10_edmonton_cases_of_covid19/,https://i.redd.it/zvxe8c0dm5451.jpg,False,False,False,False,False,Edmonton,June 10 - Edmonton Cases Of COVID-19 ,2020-06-10 21:54:51+00:00,2020,6,10,2,Wednesday,24,21,summer,2020-2021_pandemic_era,june edmonton cases of covid,28,5,False,False,True,0,0,1,False,0.5714285714285714,0.030000000000000027,True,False,False,True,False,False,2020_Q2,257065bb11772fa3,0.0,0.0,1.0,0.0,neutral
gzao9j,June 8 - Edmonton Cases of COVID-19 (Corrected),,1591657923.0,186,107,Covid-19 Coronavirus,0.96,/r/Edmonton/comments/gzao9j/june_8_edmonton_cases_of_covid19_corrected/,https://i.redd.it/62cbfbr7qr351.png,False,False,False,False,False,Edmonton,June 8 - Edmonton Cases of COVID-19 (Corrected) ,2020-06-08 23:12:03+00:00,2020,6,8,0,Monday,24,23,summer,2020-2021_pandemic_era,june edmonton cases of covid corrected,38,6,False,False,True,0,0,1,False,0.5721925133689839,0.040000000000000036,True,False,False,True,False,False,2020_Q2,257065bb11772fa3,0.0,0.0,1.0,0.0,neutral
hh2oy9,June 27 - Edmonton Cases Of COVID-19,,1593295923.0,190,105,Covid-19 Coronavirus,0.98,/r/Edmonton/comments/hh2oy9/june_27_edmonton_cases_of_covid19/,https://i.redd.it/byaqzhi21j751.jpg,False,False,False,False,False,Edmonton,June 27 - Edmonton Cases Of COVID-19 ,2020-06-27 22:12:03+00:00,2020,6,27,5,Saturday,26,22,summer,2020-2021_pandemic_era,june edmonton cases of covid,28,5,False,False,True,0,0,1,False,0.5497382198952879,0.020000000000000018,True,False,False,True,False,False,2020_Q2,257065bb11772fa3,0.0,0.0,1.0,0.0,neutral
hfamay,June 24 - Edmonton Cases Of COVID-19,,1593036562.0,181,105,Covid-19 Coronavirus,0.96,/r/Edmonton/comments/hfamay/june_24_edmonton_cases_of_covid19/,https://i.redd.it/ng2hrpstlx651.jpg,False,False,False,False,False,Edmonton,June 24 - Edmonton Cases Of COVID-19 ,2020-06-24 22:09:22+00:00,2020,6,24,2,Wednesday,26,22,summer,2020-2021_pandemic_era,june edmonton cases of covid,28,5,False,False,True,0,0,1,False,0.5769230769230769,0.040000000000000036,True,False,False,True,False,False,2020_Q2,257065bb11772fa3,0.0,0.0,1.0,0.0,neutral
gyh402,Infographic From A Recent Nature Magazine Article Modelling The Effectiveness Of Different Proposed Personal Behavioral Distancing Strategies To Use Post-Lockdown.,,1591553045.0,1,1,Covid-19 Coronavirus,0.53,/r/Edmonton/comments/gyh402/infographic_from_a_recent_nature_magazine_article/,https://i.redd.it/fl1j8w831j351.jpg,False,False,False,False,False,Edmonton,Infographic From A Recent Nature Magazine Article Modelling The Effectiveness Of Different Proposed Personal Behavioral Distancing Strategies To Use Post-Lockdown. ,2020-06-07 18:04:05+00:00,2020,6,7,6,Sunday,23,18,summer,2020-2021_pandemic_era,infographic from a recent nature magazine article modelling the effectiveness of different proposed personal behavioral distancing strategies to use post lockdown.,163,21,False,False,True,0,0,1,False,0.5,0.47,True,False,False,True,False,False,2020_Q2,e1bf2fcaf792ed9b,0.0,0.0,1.0,0.0,neutral
gxztuc,June 6 - Edmonton Cases of COVID-19,,1591480432.0,128,61,Covid-19 Coronavirus,0.97,/r/Edmonton/comments/gxztuc/june_6_edmonton_cases_of_covid19/,https://i.redd.it/e4k5m63v2d351.png,False,False,False,False,False,Edmonton,June 6 - Edmonton Cases of COVID-19 ,2020-06-06 21:53:52+00:00,2020,6,6,5,Saturday,23,21,summer,2020-2021_pandemic_era,june edmonton cases of covid,28,5,False,False,True,0,0,1,False,0.4728682170542636,0.030000000000000027,True,False,False,True,False,False,2020_Q2,257065bb11772fa3,0.0,0.0,1.0,0.0,neutral
hiwvh0,Edmonton police to watch some high-crime areas with CCTV cameras,,1593553010.0,34,29,General,0.95,/r/Edmonton/comments/hiwvh0/edmonton_police_to_watch_some_highcrime_areas/,https://www.cbc.ca/news/canada/edmonton/cctv-edmonton-police-surveillance-cameras-1.5633306,False,False,False,False,False,Edmonton,Edmonton police to watch some high-crime areas with CCTV cameras ,2020-06-30 21:36:50+00:00,2020,6,30,1,Tuesday,27,21,summer,2020-2021_pandemic_era,edmonton police to watch some high crime areas with cctv cameras,64,11,True,False,False,2,0,0,False,0.8285714285714286,0.050000000000000044,True,False,False,True,False,False,2020_Q2,f193edd226fa0045,-0.5423,0.0,0.741,0.259,negative
hi03uo,Liquor retailer cheered by dramatic drop in thefts at stores testing ID scanner technology | CBC News,,1593438305.0,54,59,News,0.85,/r/Edmonton/comments/hi03uo/liquor_retailer_cheered_by_dramatic_drop_in/,https://www.cbc.ca/news/canada/edmonton/liquor-store-theft-id-scanner-1.5629652,False,False,False,False,False,Edmonton,Liquor retailer cheered by dramatic drop in thefts at stores testing ID scanner technology | CBC News ,2020-06-29 13:45:05+00:00,2020,6,29,0,Monday,27,13,summer,2020-2021_pandemic_era,liquor retailer cheered by dramatic drop in thefts at stores testing id scanner technology cbc news,99,16,True,False,True,1,0,1,False,1.0727272727272728,0.15000000000000002,True,False,False,True,False,False,2020_Q2,04336ef6475e3f79,0.296,0.17,0.722,0.108,positive
gx3mmf,🥇Today's ~5am low of -0.5°C is the lowest temperature Edmonton-Airport has recorded on Jun 5th since records began in 1959.,,1591360085.0,39,20,None,0.87,/r/Edmonton/comments/gx3mmf/todays_5am_low_of_05c_is_the_lowest_temperature/,https://i.redd.it/2oa7ioct43351.png,False,False,False,False,False,Edmonton,🥇Today's ~5am low of -0.5°C is the lowest temperature Edmonton-Airport has recorded on Jun 5th since records began in 1959. ,2020-06-05 12:28:05+00:00,2020,6,5,4,Friday,23,12,summer,2020-2021_pandemic_era,today s am low of . c is the lowest temperature edmonton airport has recorded on jun th since records began in .,112,23,False,True,False,0,1,0,False,0.5,0.13,True,False,False,True,False,False,2020_Q2,bdd9cecfabd99654,-0.5719,0.0,0.817,0.183,negative
h890xa,"Between 2012 and 2016, the ""Starlight tours"" section of the Saskatoon Police Service's Wikipedia article was deleted several times. An internal investigation revealed that two of the edits originated from a computer within the police service. A spokesperson for the force denied that the removal.",,1592060171.0,161,41,unverified,0.9,/r/saskatchewan/comments/h890xa/between_2012_and_2016_the_starlight_tours_section/,https://en.wikipedia.org/wiki/Saskatoon_freezing_deaths,False,False,False,False,False,saskatchewan,"Between 2012 and 2016, the ""Starlight tours"" section of the Saskatoon Police Service's Wikipedia article was deleted several times. An internal investigation revealed that two of the edits originated from a computer within the police service. A spokesperson for the force denied that the removal. ",2020-06-13 14:56:11+00:00,2020,6,13,5,Saturday,24,14,summer,2020-2021_pandemic_era,between and the starlight tours section of the saskatoon police service s wikipedia article was deleted several times. an internal investigation revealed that two of the edits originated from a computer within the police service. a spokesperson for the force denied that the removal.,283,44,True,False,False,1,0,0,False,0.25308641975308643,0.09999999999999998,True,False,False,True,False,False,2020_Q2,b2148d6d7050ac73,-0.4404,0.0,0.937,0.063,negative
hc8pxk,My poor friggin tomatoes. Juneteenth and I am covering them. Not frost but WAY too cold Batoche,,1592600612.0,78,26,None,0.87,/r/saskatchewan/comments/hc8pxk/my_poor_friggin_tomatoes_juneteenth_and_i_am/,https://i.redd.it/3ckb4c0plx551.jpg,False,False,False,False,False,saskatchewan,My poor friggin tomatoes. Juneteenth and I am covering them. Not frost but WAY too cold Batoche ,2020-06-19 21:03:32+00:00,2020,6,19,4,Friday,25,21,summer,2020-2021_pandemic_era,my poor friggin tomatoes. juneteenth and i am covering them. not frost but way too cold batoche,95,17,False,True,False,0,2,0,False,0.3291139240506329,0.13,True,False,False,True,False,False,2020_Q2,0c462ad29a60a103,-0.2617,0.0,0.886,0.114,negative
gy1qgd,"Skating on a homemade rink, 1989. Not much snow in those years. This was near Vanscoy, Sk They also skated at the local rink",,1591487356.0,54,2,None,0.94,/r/saskatchewan/comments/gy1qgd/skating_on_a_homemade_rink_1989_not_much_snow_in/,https://i.redd.it/0w5cm1sfnd351.jpg,False,False,False,False,False,saskatchewan,"Skating on a homemade rink, 1989. Not much snow in those years. This was near Vanscoy, Sk They also skated at the local rink ",2020-06-06 23:49:16+00:00,2020,6,6,5,Saturday,23,23,summer,2020-2021_pandemic_era,skating on a homemade rink . not much snow in those years. this was near vanscoy sk they also skated at the local rink,118,24,False,True,False,0,1,0,False,0.03636363636363636,0.06000000000000005,True,False,False,True,False,False,2020_Q2,0c462ad29a60a103,0.0,0.0,1.0,0.0,neutral
gy35bh,My beloved clothesline with river valley view. See the snow? Taken April 25 this year,,1591492636.0,3,2,None,0.59,/r/saskatchewan/comments/gy35bh/my_beloved_clothesline_with_river_valley_view_see/,https://i.redd.it/i5ykttm43e351.jpg,False,False,False,False,False,saskatchewan,My beloved clothesline with river valley view. See the snow? Taken April 25 this year ,2020-06-07 01:17:16+00:00,2020,6,7,6,Sunday,23,1,summer,2020-2021_pandemic_era,my beloved clothesline with river valley view. see the snow? taken april this year,82,14,False,True,False,0,1,0,False,0.5,0.41000000000000003,True,False,False,True,False,False,2020_Q2,0c462ad29a60a103,0.5106,0.202,0.798,0.0,positive
hiyu2v,Regina public safety alert,,1593559685.0,21,7,None,0.93,/r/saskatchewan/comments/hiyu2v/regina_public_safety_alert/,https://reginapolice.ca/2020/06/public-safety-alert-male-subject-high-risk-to-reoffend-8/,False,False,False,False,False,saskatchewan,Regina public safety alert ,2020-06-30 23:28:05+00:00,2020,6,30,1,Tuesday,27,23,summer,2020-2021_pandemic_era,regina public safety alert,26,4,True,False,False,1,0,0,False,0.3181818181818182,0.06999999999999995,True,False,False,True,False,False,2020_Q2,10da9e748f13b670,0.6124,0.714,0.286,0.0,positive
heikdy,"Manitoba will pay people $2,000 to get off COVID-19 benefits and go back to work | CBC News",,1592932216.0,4,7,None,1.0,/r/Manitoba/comments/heikdy/manitoba_will_pay_people_2000_to_get_off_covid19/,https://www.cbc.ca/news/canada/manitoba/pallister-employment-initiative-1.5623580,False,False,False,False,False,manitoba,"Manitoba will pay people $2,000 to get off COVID-19 benefits and go back to work | CBC News ",2020-06-23 17:10:16+00:00,2020,6,23,1,Tuesday,26,17,summer,2020-2021_pandemic_era,manitoba will pay people to get off covid benefits and go back to work cbc news,79,16,False,False,True,0,0,1,False,1.4,0.0,True,False,False,True,False,False,2020_Q2,a02afae3bebfc36f,0.296,0.144,0.778,0.078,positive
gzqlkc,Concerns raised over planned changes to Alberta Victims of Crime Fund,,1591720416.0,88,13,UCP,0.95,/r/alberta/comments/gzqlkc/concerns_raised_over_planned_changes_to_alberta/,https://calgary.ctvnews.ca/mobile/concerns-raised-over-planned-changes-to-alberta-victims-of-crime-fund-1.4975468?cid=sm%3Atrueanthem%3Actvedmonton%3Amanualpost&utm_campaign=trueAnthem%3A+Trending+Content&utm_medium=trueAnthem&utm_source=facebook,False,False,False,False,False,alberta,Concerns raised over planned changes to Alberta Victims of Crime Fund ,2020-06-09 16:33:36+00:00,2020,6,9,1,Tuesday,24,16,summer,2020-2021_pandemic_era,concerns raised over planned changes to alberta victims of crime fund,69,11,True,False,False,2,0,0,False,0.14606741573033707,0.050000000000000044,True,False,False,True,False,False,2020_Q2,4cf966ddba2df02c,-0.7003,0.0,0.608,0.392,negative
h7tpos,Love that Alberta weather!!,,1591997898.0,37,5,Pics,0.81,/r/alberta/comments/h7tpos/love_that_alberta_weather/,https://i.redd.it/g17cgnaltj451.jpg,False,False,False,False,False,alberta,Love that Alberta weather!! ,2020-06-12 21:38:18+00:00,2020,6,12,4,Friday,24,21,summer,2020-2021_pandemic_era,love that alberta weather!!,27,4,False,True,False,0,1,0,False,0.13157894736842105,0.18999999999999995,True,False,False,True,False,False,2020_Q2,884b94056a493036,0.6988,0.615,0.385,0.0,positive
hayopn,Slow start to Alberta wildfire season linked to weather and COVID-19 restrictions,,1592423340.0,22,5,General,0.9,/r/alberta/comments/hayopn/slow_start_to_alberta_wildfire_season_linked_to/,https://www.cbc.ca/news/canada/edmonton/wildfire-season-slow-start-alberta-weather-covid-19-1.5613945,False,False,False,False,False,alberta,Slow start to Alberta wildfire season linked to weather and COVID-19 restrictions ,2020-06-17 19:49:00+00:00,2020,6,17,2,Wednesday,25,19,summer,2020-2021_pandemic_era,slow start to alberta wildfire season linked to weather and covid restrictions,78,12,False,True,True,0,2,2,False,0.21739130434782608,0.09999999999999998,True,False,False,True,False,False,2020_Q2,2432b62ea36611d6,0.0,0.0,1.0,0.0,neutral
