id,title,selftext,created_utc,score,num_comments,link_flair_text,upvote_ratio,permalink,url,is_self,over_18,spoiler,stickied,locked,subreddit,full_text,created_date,year,month,day,day_of_week,day_name,week_of_year,hour,season,platform_period,cleaned_text,text_length,word_count,contains_crime_keywords,contains_weather_keywords,contains_pandemic_keywords,crime_keyword_count,weather_keyword_count,pandemic_keyword_count,crime_and_weather_and_pandemic,engagement_rate,controversy_score,is_2020,is_2021,pre_pandemic_declared,post_pandemic_declared,vaccine_rollout,major_variant_wave,quarter,author_hash,sentiment_compound,sentiment_positive,sentiment_neutral,sentiment_negative,sentiment_category
l0nu54,Government of Saskatchewan - New Covid-19 Update at 3:00 pm Today,,1611075313.0,61,162,COVID-19,0.95,/r/saskatoon/comments/l0nu54/government_of_saskatchewan_new_covid19_update_at/,https://www.facebook.com/465410500144023/posts/4033190856699285/?d=n,False,False,False,False,False,Saskatoon,Government of Saskatchewan - New Covid-19 Update at 3:00 pm Today ,2021-01-19 16:55:13+00:00,2021,1,19,1,Tuesday,3,16,winter,2020-2021_pandemic_era,government of saskatchewan new covid update at pm today,55,9,False,False,True,0,0,1,False,2.6129032258064515,0.050000000000000044,False,True,False,True,True,False,2021_Q1,879dac5b8b6c5ed2,0.0,0.0,1.0,0.0,neutral
kw718p,Shahab says more COVID-19 transmission is linked to bars,,1610505394.0,91,96,COVID-19,0.97,/r/saskatoon/comments/kw718p/shahab_says_more_covid19_transmission_is_linked/,https://saskatoon.ctvnews.ca/business-owners-are-not-complying-with-the-guidelines-shahab-says-more-covid-19-transmission-is-linked-to-bars-1.5264349,False,False,False,False,False,Saskatoon,Shahab says more COVID-19 transmission is linked to bars ,2021-01-13 02:36:34+00:00,2021,1,13,2,Wednesday,2,2,winter,2020-2021_pandemic_era,shahab says more covid transmission is linked to bars,53,9,False,False,True,0,0,1,False,1.0434782608695652,0.030000000000000027,False,True,False,True,True,False,2021_Q1,42d30bf83eff6400,0.0,0.0,1.0,0.0,neutral
kxa63b,Shahab: tighter COVID-19 restrictions likely,,1610645080.0,39,74,COVID-19,0.85,/r/saskatoon/comments/kxa63b/shahab_tighter_covid19_restrictions_likely/,https://www.ckom.com/2021/01/14/shahab-tighter-covid-19-restrictions-likely/,False,False,False,False,False,Saskatoon,Shahab: tighter COVID-19 restrictions likely ,2021-01-14 17:24:40+00:00,2021,1,14,3,Thursday,2,17,winter,2020-2021_pandemic_era,shahab tighter covid restrictions likely,40,5,False,False,True,0,0,2,False,1.85,0.15000000000000002,False,True,False,True,True,False,2021_Q1,d4593778858fbd7a,0.0,0.0,1.0,0.0,neutral
l5nnkc,COVID-19 public health orders in Saskatchewan extended to Feb. 19,,1611695141.0,51,61,COVID-19,0.93,/r/saskatoon/comments/l5nnkc/covid19_public_health_orders_in_saskatchewan/,https://globalnews.ca/news/7600747/covid-19-public-health-orders-saskatchewan-coronavirus/,False,False,False,False,False,Saskatoon,COVID-19 public health orders in Saskatchewan extended to Feb. 19 ,2021-01-26 21:05:41+00:00,2021,1,26,1,Tuesday,4,21,winter,2020-2021_pandemic_era,covid public health orders in saskatchewan extended to feb.,59,9,False,False,True,0,0,2,False,1.1730769230769231,0.06999999999999995,False,True,False,True,True,False,2021_Q1,2722069b05a2697c,0.0,0.0,1.0,0.0,neutral
kvz0lj,"Jan. 12: 248 New, 226 Recovered, 5 Deaths, 932 Vaccinations. Total Active Cases 3,752",,1610480602.0,55,154,None,0.92,/r/saskatoon/comments/kvz0lj/jan_12_248_new_226_recovered_5_deaths_932/,https://i.imgur.com/ZdUd49f.jpg,False,False,False,False,False,Saskatoon,"Jan. 12: 248 New, 226 Recovered, 5 Deaths, 932 Vaccinations. Total Active Cases 3,752 ",2021-01-12 19:43:22+00:00,2021,1,12,1,Tuesday,2,19,winter,2020-2021_pandemic_era,jan. new recovered deaths vaccinations. total active cases,58,8,False,False,True,0,0,1,False,2.75,0.07999999999999996,False,True,False,True,True,False,2021_Q1,b56fcee39734c6d8,0.4576,0.3,0.7,0.0,positive
ksmioy,How to report a crime -- Courtesy Saskatoon Police,,1610052877.0,215,40,None,0.98,/r/saskatoon/comments/ksmioy/how_to_report_a_crime_courtesy_saskatoon_police/,https://i.redd.it/rh74vzbb4z961.jpg,False,False,False,False,False,Saskatoon,How to report a crime -- Courtesy Saskatoon Police ,2021-01-07 20:54:37+00:00,2021,1,7,3,Thursday,1,20,winter,2020-2021_pandemic_era,how to report a crime courtesy saskatoon police,47,8,True,False,False,2,0,0,False,0.18518518518518517,0.020000000000000018,False,True,False,True,True,False,2021_Q1,231d51ba409a3c34,-0.25,0.208,0.5,0.292,negative
l3bwna,"Lawsuit accuses Saskatoon police officer of sexual assault, abuse of power",,1611407754.0,159,84,None,0.98,/r/saskatoon/comments/l3bwna/lawsuit_accuses_saskatoon_police_officer_of/,https://www.cbc.ca/news/canada/saskatoon/saskatoon-police-officer-patrick-skinnider-lawsuit-1.5884194,False,False,False,False,False,Saskatoon,"Lawsuit accuses Saskatoon police officer of sexual assault, abuse of power ",2021-01-23 13:15:54+00:00,2021,1,23,5,Saturday,3,13,winter,2020-2021_pandemic_era,lawsuit accuses saskatoon police officer of sexual assault abuse of power,73,11,True,False,False,2,0,0,False,0.525,0.020000000000000018,False,True,False,True,True,False,2021_Q1,ab25f2178dee2312,-0.9062,0.0,0.363,0.637,negative
l0kicm,Get scammed while buying AirPod Pro,"I was being really stupid last night and bought a fake AirPod pro from a guy while the guy claiming it was real. In half an hour of buying it, I realized it is fake and I tried to contact the buyer and as expected he block me on Facebook. I was very skeptical from the beginning of the deal and took a picture of his ID card. 

I just checked using wife’s Facebook account he’s still selling those in marketplace. Is it worth going to the police or is there anything else I should do? I checked the online reporting section of Saskatoon police page, and it has a criteria called ‘theft under $5000’. I don’t think it’s considered being theft, rather me being stupid. Probably its a learning experience for me, but what would be the best away to make people aware about this sketchy guy?",1611065331.0,35,39,None,0.9,/r/saskatoon/comments/l0kicm/get_scammed_while_buying_airpod_pro/,https://www.reddit.com/r/saskatoon/comments/l0kicm/get_scammed_while_buying_airpod_pro/,True,False,False,False,False,Saskatoon,"Get scammed while buying AirPod Pro I was being really stupid last night and bought a fake AirPod pro from a guy while the guy claiming it was real. In half an hour of buying it, I realized it is fake and I tried to contact the buyer and as expected he block me on Facebook. I was very skeptical from the beginning of the deal and took a picture of his ID card. 

I just checked using wife’s Facebook account he’s still selling those in marketplace. Is it worth going to the police or is there anything else I should do? I checked the online reporting section of Saskatoon police page, and it has a criteria called ‘theft under $5000’. I don’t think it’s considered being theft, rather me being stupid. Probably its a learning experience for me, but what would be the best away to make people aware about this sketchy guy?",2021-01-19 14:08:51+00:00,2021,1,19,1,Tuesday,3,14,winter,2020-2021_pandemic_era,get scammed while buying airpod pro i was being really stupid last night and bought a fake airpod pro from a guy while the guy claiming it was real. in half an hour of buying it i realized it is fake and i tried to contact the buyer and as expected he block me on facebook. i was very skeptical from the beginning of the deal and took a picture of his id card. i just checked using wife s facebook account he s still selling those in marketplace. is it worth going to the police or is there anything else i should do? i checked the online reporting section of saskatoon police page and it has a criteria called theft under . i don t think it s considered being theft rather me being stupid. probably its a learning experience for me but what would be the best away to make people aware about this sketchy guy?,809,158,True,False,False,3,0,0,False,1.0833333333333333,0.09999999999999998,False,True,False,True,True,False,2021_Q1,d7768573ef3b71f5,-0.3618,0.043,0.882,0.075,negative
l4t0f8,I Thought There Was A Cold Weather Patch This Year?,"Can somebody get in touch with the devs? Up until this week we haven't had to worry about the cold weather at all, so I think we may be experiencing a bug on their end. Thanks",1611596623.0,39,22,None,0.8,/r/saskatoon/comments/l4t0f8/i_thought_there_was_a_cold_weather_patch_this_year/,https://www.reddit.com/r/saskatoon/comments/l4t0f8/i_thought_there_was_a_cold_weather_patch_this_year/,True,False,False,False,False,Saskatoon,"I Thought There Was A Cold Weather Patch This Year? Can somebody get in touch with the devs? Up until this week we haven't had to worry about the cold weather at all, so I think we may be experiencing a bug on their end. Thanks",2021-01-25 17:43:43+00:00,2021,1,25,0,Monday,4,17,winter,2020-2021_pandemic_era,i thought there was a cold weather patch this year? can somebody get in touch with the devs? up until this week we haven t had to worry about the cold weather at all so i think we may be experiencing a bug on their end. thanks,226,47,False,True,False,0,2,0,False,0.55,0.19999999999999996,False,True,False,True,True,False,2021_Q1,b9458c233d1b36f2,0.0,0.057,0.886,0.057,neutral
kwi367,High winds prompt special weather statements for Sask.,,1610550047.0,41,12,None,0.99,/r/saskatoon/comments/kwi367/high_winds_prompt_special_weather_statements_for/,https://thestarphoenix.com/news/saskatchewan/high-winds-prompt-special-weather-statements-for-sask,False,False,False,False,False,Saskatoon,High winds prompt special weather statements for Sask. ,2021-01-13 15:00:47+00:00,2021,1,13,2,Wednesday,2,15,winter,2020-2021_pandemic_era,high winds prompt special weather statements for sask.,54,8,False,True,False,0,1,0,False,0.2857142857142857,0.010000000000000009,False,True,False,True,True,False,2021_Q1,fc7145b39873c884,0.4019,0.278,0.722,0.0,positive
l7hg8z,"-44°C temperature in Saskatchewan , Saskatoon, Canada | Extreme Cold Weather in Saskatchewan",,1611889766.0,0,3,None,0.19,/r/saskatoon/comments/l7hg8z/44c_temperature_in_saskatchewan_saskatoon_canada/,https://v.redd.it/rdg2c56ws6e61,False,False,False,False,False,Saskatoon,"-44°C temperature in Saskatchewan , Saskatoon, Canada | Extreme Cold Weather in Saskatchewan ",2021-01-29 03:09:26+00:00,2021,1,29,4,Friday,4,3,winter,2020-2021_pandemic_era,c temperature in saskatchewan saskatoon canada extreme cold weather in saskatchewan,83,11,False,True,False,0,4,0,False,3.0,0.81,False,True,False,True,True,False,2021_Q1,e13f7808f7f481e6,0.0,0.0,1.0,0.0,neutral
l6kgkg,‘Overzealous’ bylaw officers upset parents during cold snap,,1611797579.0,29,45,None,0.89,/r/saskatoon/comments/l6kgkg/overzealous_bylaw_officers_upset_parents_during/,https://www.ckom.com/2021/01/27/overzealous-bylaw-officers-upset-parents-during-cold-snap/,False,False,False,False,False,Saskatoon,‘Overzealous’ bylaw officers upset parents during cold snap ,2021-01-28 01:32:59+00:00,2021,1,28,3,Thursday,4,1,winter,2020-2021_pandemic_era,overzealous bylaw officers upset parents during cold snap,57,8,False,True,False,0,1,0,False,1.5,0.10999999999999999,False,True,False,True,True,False,2021_Q1,b0b4fb95e551b9ef,-0.3818,0.0,0.729,0.271,negative
l2n7a7,Stolen Snow Tires,"So I live in an apartment & have a designated parking spot.  Went to go out yesterday & saw that my left front & rear Federal Himalaya Snow tires along with my steel rims are gone.  Who ever took them were kind enough to put on 2 old flat tires to replace them, they also took the time to put the lugs on the rear tire, but nothing on the front.  The jack was left behind, so I'm assuming they were spooked off.  This just really rips me to no end.  Apartment has security cameras, so hopefully they caught the asshole, in order to access the security camera, I have to file a police report (which I did) & already have a file #.  Just be aware that this happened on Girgulis Cres.  I have lived here for 5 yrs. & nothing like this has ever happened.  My question...is there something I can do to deter this happening again.  I have been looking at locking lug nuts, just wondering if they are worth the money or if there is something else I can do to prevent this from happening again.  This really pisses me off.  Thanks",1611320277.0,36,37,None,1.0,/r/saskatoon/comments/l2n7a7/stolen_snow_tires/,https://www.reddit.com/r/saskatoon/comments/l2n7a7/stolen_snow_tires/,True,False,False,False,False,Saskatoon,"Stolen Snow Tires So I live in an apartment & have a designated parking spot.  Went to go out yesterday & saw that my left front & rear Federal Himalaya Snow tires along with my steel rims are gone.  Who ever took them were kind enough to put on 2 old flat tires to replace them, they also took the time to put the lugs on the rear tire, but nothing on the front.  The jack was left behind, so I'm assuming they were spooked off.  This just really rips me to no end.  Apartment has security cameras, so hopefully they caught the asshole, in order to access the security camera, I have to file a police report (which I did) & already have a file #.  Just be aware that this happened on Girgulis Cres.  I have lived here for 5 yrs. & nothing like this has ever happened.  My question...is there something I can do to deter this happening again.  I have been looking at locking lug nuts, just wondering if they are worth the money or if there is something else I can do to prevent this from happening again.  This really pisses me off.  Thanks",2021-01-22 12:57:57+00:00,2021,1,22,4,Friday,3,12,winter,2020-2021_pandemic_era,stolen snow tires so i live in an apartment have a designated parking spot. went to go out yesterday saw that my left front rear federal himalaya snow tires along with my steel rims are gone. who ever took them were kind enough to put on old flat tires to replace them they also took the time to put the lugs on the rear tire but nothing on the front. the jack was left behind so i m assuming they were spooked off. this just really rips me to no end. apartment has security cameras so hopefully they caught the asshole in order to access the security camera i have to file a police report which i did already have a file . just be aware that this happened on girgulis cres. i have lived here for yrs. nothing like this has ever happened. my question...is there something i can do to deter this happening again. i have been looking at locking lug nuts just wondering if they are worth the money or if there is something else i can do to prevent this from happening again. this really pisses me off. thanks,1005,193,True,True,False,4,1,0,False,1.0,0.0,False,True,False,True,True,False,2021_Q1,bc612d5fdbe4e4bf,0.6893,0.092,0.843,0.065,positive
l1n1og,"Veteran Regina radio broadcaster Warren ""Woodsy"" Woods dies at age 66 of COVID-19",,1611190152.0,156,24,None,0.98,/r/regina/comments/l1n1og/veteran_regina_radio_broadcaster_warren_woodsy/,https://twitter.com/ctvregina/status/1352044704393814020?s=19,False,False,False,False,False,Regina,"Veteran Regina radio broadcaster Warren ""Woodsy"" Woods dies at age 66 of COVID-19 ",2021-01-21 00:49:12+00:00,2021,1,21,3,Thursday,3,0,winter,2020-2021_pandemic_era,veteran regina radio broadcaster warren woodsy woods dies at age of covid,73,12,False,False,True,0,0,1,False,0.15286624203821655,0.020000000000000018,False,True,False,True,True,False,2021_Q1,24c971ec5c999443,0.0,0.0,1.0,0.0,neutral
l5nnuu,COVID-19 public health orders in Saskatchewan extended to Feb. 19,,1611695162.0,36,35,None,0.85,/r/regina/comments/l5nnuu/covid19_public_health_orders_in_saskatchewan/,https://globalnews.ca/news/7600747/covid-19-public-health-orders-saskatchewan-coronavirus/,False,False,False,False,False,Regina,COVID-19 public health orders in Saskatchewan extended to Feb. 19 ,2021-01-26 21:06:02+00:00,2021,1,26,1,Tuesday,4,21,winter,2020-2021_pandemic_era,covid public health orders in saskatchewan extended to feb.,59,9,False,False,True,0,0,2,False,0.9459459459459459,0.15000000000000002,False,True,False,True,True,False,2021_Q1,2722069b05a2697c,0.0,0.0,1.0,0.0,neutral
kxdmgy,Saskatchewan now has highest active case rate of COVID-19 in country: Health Canada,,1610654953.0,44,18,None,0.88,/r/regina/comments/kxdmgy/saskatchewan_now_has_highest_active_case_rate_of/,https://www.cbc.ca/news/canada/saskatoon/saskatchewan-now-has-highest-active-case-rate-of-covid-19-in-country-health-canada-1.5871107,False,False,False,False,False,Regina,Saskatchewan now has highest active case rate of COVID-19 in country: Health Canada ,2021-01-14 20:09:13+00:00,2021,1,14,3,Thursday,2,20,winter,2020-2021_pandemic_era,saskatchewan now has highest active case rate of covid in country health canada,79,13,False,False,True,0,0,1,False,0.4,0.12,False,True,False,True,True,False,2021_Q1,2b6ed3dd3d0837b2,0.4019,0.184,0.816,0.0,positive
ksjkg4,Vaccines in Regina,"Will you get vaccinated? If not feel free to include your reasoning. Happy voting!

Edit: 620 votes! Looks like the yay’s have it. Thanks guys n girls didn’t think that many of you would vote. Also assumed there had been a similar vote here in the past. Guess not. Good discussions too!

[View Poll](https://www.reddit.com/poll/ksjkg4)",1610044854.0,10,55,Discussion,0.67,/r/regina/comments/ksjkg4/vaccines_in_regina/,https://www.reddit.com/r/regina/comments/ksjkg4/vaccines_in_regina/,True,False,False,False,False,Regina,"Vaccines in Regina Will you get vaccinated? If not feel free to include your reasoning. Happy voting!

Edit: 620 votes! Looks like the yay’s have it. Thanks guys n girls didn’t think that many of you would vote. Also assumed there had been a similar vote here in the past. Guess not. Good discussions too!

[View Poll](https://www.reddit.com/poll/ksjkg4)",2021-01-07 18:40:54+00:00,2021,1,7,3,Thursday,1,18,winter,2020-2021_pandemic_era,vaccines in regina will you get vaccinated? if not feel free to include your reasoning. happy voting! edit votes! looks like the yay s have it. thanks guys n girls didn t think that many of you would vote. also assumed there had been a similar vote here in the past. guess not. good discussions too! view poll,309,58,False,False,True,0,0,1,False,5.0,0.32999999999999996,False,True,False,True,True,False,2021_Q1,6c9e5839af84457c,0.8507,0.19,0.738,0.072,positive
ky35bp,Cold out there. But keep smiling.,,1610742731.0,177,12,None,0.97,/r/regina/comments/ky35bp/cold_out_there_but_keep_smiling/,https://www.reddit.com/gallery/ky35bp,False,False,False,False,False,Regina,Cold out there. But keep smiling. ,2021-01-15 20:32:11+00:00,2021,1,15,4,Friday,2,20,winter,2020-2021_pandemic_era,cold out there. but keep smiling.,33,6,False,True,False,0,1,0,False,0.06741573033707865,0.030000000000000027,False,True,False,True,True,False,2021_Q1,366b88df313e0f89,0.6124,0.444,0.556,0.0,positive
l5c4rd,City of Regina | Residential Snow Plow Schedule,,1611660328.0,25,29,None,0.9,/r/regina/comments/l5c4rd/city_of_regina_residential_snow_plow_schedule/,https://www.regina.ca/transportation-roads-parking/seasonal-maintenance/snow-ice-control/residential-plow/,False,False,False,False,False,Regina,City of Regina | Residential Snow Plow Schedule ,2021-01-26 11:25:28+00:00,2021,1,26,1,Tuesday,4,11,winter,2020-2021_pandemic_era,city of regina residential snow plow schedule,45,7,False,True,False,0,1,0,False,1.1153846153846154,0.09999999999999998,False,True,False,True,True,False,2021_Q1,9097da05ed068b6e,0.0,0.0,1.0,0.0,neutral
l5i2m3,"Over the past 136 years, Regina's annual average temperature has increased by about 2.1°C.",,1611680096.0,78,91,None,0.91,/r/regina/comments/l5i2m3/over_the_past_136_years_reginas_annual_average/,https://i.redd.it/rhfmvmyoipd61.png,False,False,False,False,False,Regina,"Over the past 136 years, Regina's annual average temperature has increased by about 2.1°C. ",2021-01-26 16:54:56+00:00,2021,1,26,1,Tuesday,4,16,winter,2020-2021_pandemic_era,over the past years regina s annual average temperature has increased by about . c.,83,15,False,True,False,0,1,0,False,1.1518987341772151,0.08999999999999997,False,True,False,True,True,False,2021_Q1,bdd9cecfabd99654,0.2732,0.13,0.87,0.0,positive
kqliqz,Free McDonalds fries next time you order,"I used to work at McDonalds n they follow strict policy. Their policy is to deliver hot fries 60 seconds after they come out of the fryer. 

So the next time you order, you check your fries for temperature, if they are not hot tell the crew your fries are expired and cold, and that you want fries hot as according to McDonalds 60 second policy. 

Don’t allow them to check for temperature, they will immediately give you another fries for the price of one, and let you keep the cold fries. (They will throw out the cold fries anyway)

And if someone doesn’t make your sandwich according the the picture, ask for another one made proper.",1609804695.0,0,29,None,0.3,/r/regina/comments/kqliqz/free_mcdonalds_fries_next_time_you_order/,https://www.reddit.com/r/regina/comments/kqliqz/free_mcdonalds_fries_next_time_you_order/,True,False,False,False,False,Regina,"Free McDonalds fries next time you order I used to work at McDonalds n they follow strict policy. Their policy is to deliver hot fries 60 seconds after they come out of the fryer. 

So the next time you order, you check your fries for temperature, if they are not hot tell the crew your fries are expired and cold, and that you want fries hot as according to McDonalds 60 second policy. 

Don’t allow them to check for temperature, they will immediately give you another fries for the price of one, and let you keep the cold fries. (They will throw out the cold fries anyway)

And if someone doesn’t make your sandwich according the the picture, ask for another one made proper.",2021-01-04 23:58:15+00:00,2021,1,4,0,Monday,1,23,winter,2020-2021_pandemic_era,free mcdonalds fries next time you order i used to work at mcdonalds n they follow strict policy. their policy is to deliver hot fries seconds after they come out of the fryer. so the next time you order you check your fries for temperature if they are not hot tell the crew your fries are expired and cold and that you want fries hot as according to mcdonalds second policy. don t allow them to check for temperature they will immediately give you another fries for the price of one and let you keep the cold fries. they will throw out the cold fries anyway and if someone doesn t make your sandwich according the the picture ask for another one made proper.,659,124,False,True,False,0,3,0,False,29.0,0.7,False,True,False,True,True,False,2021_Q1,51d4710e6d12230e,0.6705,0.051,0.949,0.0,positive
l0zh38,'Quite wrong' that Winnipeg city hall gym open while others closed during lockdown: councillor,,1611109292.0,140,32,News,0.97,/r/Winnipeg/comments/l0zh38/quite_wrong_that_winnipeg_city_hall_gym_open/,https://www.cbc.ca/news/canada/manitoba/city-of-winnipeg-city-hall-gym-shawn-nason-1.5879649?cmp=rss,False,False,False,False,False,Winnipeg,'Quite wrong' that Winnipeg city hall gym open while others closed during lockdown: councillor ,2021-01-20 02:21:32+00:00,2021,1,20,2,Wednesday,3,2,winter,2020-2021_pandemic_era,quite wrong that winnipeg city hall gym open while others closed during lockdown councillor,91,14,False,False,True,0,0,1,False,0.22695035460992907,0.030000000000000027,False,True,False,True,True,False,2021_Q1,154cb0d27fde9c4a,-0.5256,0.0,0.793,0.207,negative
