id,title,selftext,created_utc,score,num_comments,link_flair_text,upvote_ratio,permalink,url,is_self,subreddit,full_text,created_date,year,month,day,day_of_week,day_name,week_of_year,season,platform_period,is_pandemic,cleaned_text,text_length,word_count,contains_crime_keywords,contains_weather_keywords,crime_keyword_count,weather_keyword_count,engagement_rate,author_hash,sentiment_compound,sentiment_positive,sentiment_neutral,sentiment_negative,sentiment_category
1jttrvw,A lovely act of kindness,"I just wanted to share a lovely act of kindness I experienced this morning.


To start, I live in a neighborhood in the alphabets that is generally considered 'rough' or 'sketchy'. I personally love the area and haven't had any major complaints (some incidents here and there but nothing to write home about).


Anyways, there was very loud knocking on my door this morning and it took me awhile to answer as I was preoccupied, but the very loud knocking continued and I started questioning if I should even open the door. I decided to answer and here is this man holding my partner's wallet!!! He said he found it down the street and around the corner, looked at the address on the ID and walked here. I was surprised and confused to say the least, and immediately called my partner at work who didn't even realize he dropped it, he then came home on his break and everything was there (ID, health card, debit card, credit card, etc) and checked his bank accounts and there were no unaccounted transactions done. Truly a very lucky experience to say the least! 


I guess my point is that sure, there is crime everywhere in the city right now, and in some areas it's more noticeable, but there is also kindness everywhere too. So once again I want to say thank you to this kind stranger who took his time to walk to our address to return the wallet. I hope the kindness is returned to you ten fold :)",1744053702.0,310,19,General,0.98,/r/saskatoon/comments/1jttrvw/a_lovely_act_of_kindness/,https://www.reddit.com/r/saskatoon/comments/1jttrvw/a_lovely_act_of_kindness/,True,Saskatoon,"A lovely act of kindness I just wanted to share a lovely act of kindness I experienced this morning.


To start, I live in a neighborhood in the alphabets that is generally considered 'rough' or 'sketchy'. I personally love the area and haven't had any major complaints (some incidents here and there but nothing to write home about).


Anyways, there was very loud knocking on my door this morning and it took me awhile to answer as I was preoccupied, but the very loud knocking continued and I started questioning if I should even open the door. I decided to answer and here is this man holding my partner's wallet!!! He said he found it down the street and around the corner, looked at the address on the ID and walked here. I was surprised and confused to say the least, and immediately called my partner at work who didn't even realize he dropped it, he then came home on his break and everything was there (ID, health card, debit card, credit card, etc) and checked his bank accounts and there were no unaccounted transactions done. Truly a very lucky experience to say the least! 


I guess my point is that sure, there is crime everywhere in the city right now, and in some areas it's more noticeable, but there is also kindness everywhere too. So once again I want to say thank you to this kind stranger who took his time to walk to our address to return the wallet. I hope the kindness is returned to you ten fold :)",2025-04-07 19:21:42+00:00,2025,4,7,0,Monday,15,spring,post_api,False,a lovely act of kindness i just wanted to share a lovely act of kindness i experienced this morning. to start i live in a neighborhood in the alphabets that is generally considered rough or sketchy . i personally love the area and haven t had any major complaints some incidents here and there but nothing to write home about . anyways there was very loud knocking on my door this morning and it took me awhile to answer as i was preoccupied but the very loud knocking continued and i started questioning if i should even open the door. i decided to answer and here is this man holding my partner s wallet!!! he said he found it down the street and around the corner looked at the address on the id and walked here. i was surprised and confused to say the least and immediately called my partner at work who didn t even realize he dropped it he then came home on his break and everything was there id health card debit card credit card etc and checked his bank accounts and there were no unaccounted transactions done. truly a very lucky experience to say the least! i guess my point is that sure there is crime everywhere in the city right now and in some areas it s more noticeable but there is also kindness everywhere too. so once again i want to say thank you to this kind stranger who took his time to walk to our address to return the wallet. i hope the kindness is returned to you ten fold,1397,267,True,False,1,0,0.06109324758842444,bf86bf180f1b4ab6,0.9884,0.165,0.789,0.045,positive
1k5jcr5,Police service - frustration,"I was recently sexually assaulted and my case has been moving along after the investigation. Initially I felt very supported with the police service and victims services, but now it’s crickets. At first they were very responsive and helpful, now (only like 2 months after initial investigation) I can’t get into contact with anyone, tried calling multiple times. On days that I was promised to get a call for an update on my case I have had to call, with no answer. Is this how victims are treated? Getting left in the dark after being traumatised? I’ve called multiple different numbers and I get no response. Has anyone else experienced something similar, and should I give up at this point and try to move on?",1745360497.0,129,43,Rants 🤬,0.89,/r/saskatoon/comments/1k5jcr5/police_service_frustration/,https://www.reddit.com/r/saskatoon/comments/1k5jcr5/police_service_frustration/,True,Saskatoon,"Police service - frustration I was recently sexually assaulted and my case has been moving along after the investigation. Initially I felt very supported with the police service and victims services, but now it’s crickets. At first they were very responsive and helpful, now (only like 2 months after initial investigation) I can’t get into contact with anyone, tried calling multiple times. On days that I was promised to get a call for an update on my case I have had to call, with no answer. Is this how victims are treated? Getting left in the dark after being traumatised? I’ve called multiple different numbers and I get no response. Has anyone else experienced something similar, and should I give up at this point and try to move on?",2025-04-22 22:21:37+00:00,2025,4,22,1,Tuesday,17,spring,post_api,False,police service frustration i was recently sexually assaulted and my case has been moving along after the investigation. initially i felt very supported with the police service and victims services but now it s crickets. at first they were very responsive and helpful now only like months after initial investigation i can t get into contact with anyone tried calling multiple times. on days that i was promised to get a call for an update on my case i have had to call with no answer. is this how victims are treated? getting left in the dark after being traumatised? i ve called multiple different numbers and i get no response. has anyone else experienced something similar and should i give up at this point and try to move on?,730,130,True,False,3,0,0.33076923076923076,ceb80709ca3a7513,0.1954,0.105,0.774,0.121,positive
1jx24lm,Two people stabbed in Saskatoon on Thursday night: Police,"https://www.ckom.com/2025/04/11/974243/

What can be done to improve safety in this neighbourhood?",1744409591.0,57,46,News 📰,0.89,/r/saskatoon/comments/1jx24lm/two_people_stabbed_in_saskatoon_on_thursday_night/,https://www.reddit.com/r/saskatoon/comments/1jx24lm/two_people_stabbed_in_saskatoon_on_thursday_night/,True,Saskatoon,"Two people stabbed in Saskatoon on Thursday night: Police https://www.ckom.com/2025/04/11/974243/

What can be done to improve safety in this neighbourhood?",2025-04-11 22:13:11+00:00,2025,4,11,4,Friday,15,spring,post_api,False,two people stabbed in saskatoon on thursday night police what can be done to improve safety in this neighbourhood?,114,19,True,False,2,0,0.7931034482758621,75ba4feffa221781,0.4215,0.232,0.65,0.118,positive
1k81dei,How likely are police to follow up?,"Was in the city a few hours ago for supper and saw a couple put their baby in the front middle (bench) seat of their truck (after they also parked in the handicapped spot being very clearly not disabled). There was no child seat, and they just put a seat belt around the poor child (who was such a small baby you couldn't even see its head over the dash). We would like to report child neglect, but as we live in a different town, are unsure if any follow through will happen? We have a license plate and everything.

Even if nothing will happen, I think I will report as the sask page says we have a legal obligation to report child matters, but I'm just wondering out of curiosity if anything usually happens in this case?",1745630904.0,0,32,Crime ⚠️,0.45,/r/saskatoon/comments/1k81dei/how_likely_are_police_to_follow_up/,https://www.reddit.com/r/saskatoon/comments/1k81dei/how_likely_are_police_to_follow_up/,True,Saskatoon,"How likely are police to follow up? Was in the city a few hours ago for supper and saw a couple put their baby in the front middle (bench) seat of their truck (after they also parked in the handicapped spot being very clearly not disabled). There was no child seat, and they just put a seat belt around the poor child (who was such a small baby you couldn't even see its head over the dash). We would like to report child neglect, but as we live in a different town, are unsure if any follow through will happen? We have a license plate and everything.

Even if nothing will happen, I think I will report as the sask page says we have a legal obligation to report child matters, but I'm just wondering out of curiosity if anything usually happens in this case?",2025-04-26 01:28:24+00:00,2025,4,26,5,Saturday,17,spring,post_api,False,how likely are police to follow up? was in the city a few hours ago for supper and saw a couple put their baby in the front middle bench seat of their truck after they also parked in the handicapped spot being very clearly not disabled . there was no child seat and they just put a seat belt around the poor child who was such a small baby you couldn t even see its head over the dash . we would like to report child neglect but as we live in a different town are unsure if any follow through will happen? we have a license plate and everything. even if nothing will happen i think i will report as the sask page says we have a legal obligation to report child matters but i m just wondering out of curiosity if anything usually happens in this case?,750,149,True,False,1,0,32.0,9313c40d1349fbf7,-0.2602,0.043,0.908,0.05,negative
1jr43mu,Hit & run; found other car and reported to police but will they contact you?,"On Saturday night my vehicle was hit by someone and no info left. I reported it when I found it and spoke to sgi/police on phone Monday. 

Today my FIL found who hit me; I have the pieces of their car still in my loaner to drop off with police but the pieces matched to photos and my car’s paint was across the side of car so pretty obvious. 

I contacted police with the plate and car. They contacted my FIL to get the car’s location on he street. I also emailed my SGI adjuster. 

Do the police contact you to update you if it was your perp or not? Will SGI still take the deductible out for a totaled car (it was a beater so no way it won’t be totaled for 2 broken doors) then just send me a cheque later? 

The last hit and run I had the guy was never found despite video of him running his e-bike into my car so I’m unsure how this works. ",1743743258.0,14,12,Question ❔,0.82,/r/saskatoon/comments/1jr43mu/hit_run_found_other_car_and_reported_to_police/,https://www.reddit.com/r/saskatoon/comments/1jr43mu/hit_run_found_other_car_and_reported_to_police/,True,Saskatoon,"Hit & run; found other car and reported to police but will they contact you? On Saturday night my vehicle was hit by someone and no info left. I reported it when I found it and spoke to sgi/police on phone Monday. 

Today my FIL found who hit me; I have the pieces of their car still in my loaner to drop off with police but the pieces matched to photos and my car’s paint was across the side of car so pretty obvious. 

I contacted police with the plate and car. They contacted my FIL to get the car’s location on he street. I also emailed my SGI adjuster. 

Do the police contact you to update you if it was your perp or not? Will SGI still take the deductible out for a totaled car (it was a beater so no way it won’t be totaled for 2 broken doors) then just send me a cheque later? 

The last hit and run I had the guy was never found despite video of him running his e-bike into my car so I’m unsure how this works. ",2025-04-04 05:07:38+00:00,2025,4,4,4,Friday,14,spring,post_api,False,hit run found other car and reported to police but will they contact you? on saturday night my vehicle was hit by someone and no info left. i reported it when i found it and spoke to sgi police on phone monday. today my fil found who hit me i have the pieces of their car still in my loaner to drop off with police but the pieces matched to photos and my car s paint was across the side of car so pretty obvious. i contacted police with the plate and car. they contacted my fil to get the car s location on he street. i also emailed my sgi adjuster. do the police contact you to update you if it was your perp or not? will sgi still take the deductible out for a totaled car it was a beater so no way it won t be totaled for broken doors then just send me a cheque later? the last hit and run i had the guy was never found despite video of him running his e bike into my car so i m unsure how this works.,904,190,True,True,1,1,0.8,71022c2d9d755cd4,-0.6262,0.051,0.869,0.08,negative
1jt4z9v,Weather Conditions?,"I’m visiting lovely Saskatoon next week (arriving Friday for the weekend) and wondered if packing outdoor shoes (vs boots) is folly or has the snow melted enough that I might be able to wear them? Any insights are welcome! Thanks in advance. 
",1743974848.0,0,7,Weather 🌡️,0.2,/r/saskatoon/comments/1jt4z9v/weather_conditions/,https://www.reddit.com/r/saskatoon/comments/1jt4z9v/weather_conditions/,True,Saskatoon,"Weather Conditions? I’m visiting lovely Saskatoon next week (arriving Friday for the weekend) and wondered if packing outdoor shoes (vs boots) is folly or has the snow melted enough that I might be able to wear them? Any insights are welcome! Thanks in advance. 
",2025-04-06 21:27:28+00:00,2025,4,6,6,Sunday,14,spring,post_api,False,weather conditions? i m visiting lovely saskatoon next week arriving friday for the weekend and wondered if packing outdoor shoes vs boots is folly or has the snow melted enough that i might be able to wear them? any insights are welcome! thanks in advance.,257,45,False,True,0,2,7.0,d86807e226eb4cc0,0.8847,0.198,0.802,0.0,positive
1jyewox,Is it time to switch to summer tires yet?,"I’m on the fence, on the one hand the weather looks good for the foreseeable future.. on the other hand, we live in Saskatchewan. What are you folks doing?",1744570160.0,21,45,Question ❔,0.68,/r/saskatoon/comments/1jyewox/is_it_time_to_switch_to_summer_tires_yet/,https://www.reddit.com/r/saskatoon/comments/1jyewox/is_it_time_to_switch_to_summer_tires_yet/,True,Saskatoon,"Is it time to switch to summer tires yet? I’m on the fence, on the one hand the weather looks good for the foreseeable future.. on the other hand, we live in Saskatchewan. What are you folks doing?",2025-04-13 18:49:20+00:00,2025,4,13,6,Sunday,15,spring,post_api,False,is it time to switch to summer tires yet? i m on the fence on the one hand the weather looks good for the foreseeable future.. on the other hand we live in saskatchewan. what are you folks doing?,195,39,False,True,0,2,2.0454545454545454,2457baa69ded1b8e,0.8645,0.212,0.788,0.0,positive
1juu6dk,Show us your TICKS,"I do a lot of walking and hiking in the Saskatoon area.  I'm curious about the level of ticks right now and and the species.   I'd really appreciate some close up photos of what you've found,  macro if possible,  and pictures of nests. Also,  the general location, if you don't mind sharing that info.

Enjoy the springtime weather!",1744162210.0,0,39,Question ❔,0.5,/r/saskatoon/comments/1juu6dk/show_us_your_ticks/,https://www.reddit.com/r/saskatoon/comments/1juu6dk/show_us_your_ticks/,True,Saskatoon,"Show us your TICKS I do a lot of walking and hiking in the Saskatoon area.  I'm curious about the level of ticks right now and and the species.   I'd really appreciate some close up photos of what you've found,  macro if possible,  and pictures of nests. Also,  the general location, if you don't mind sharing that info.

Enjoy the springtime weather!",2025-04-09 01:30:10+00:00,2025,4,9,2,Wednesday,15,spring,post_api,False,show us your ticks i do a lot of walking and hiking in the saskatoon area. i m curious about the level of ticks right now and and the species. i d really appreciate some close up photos of what you ve found macro if possible and pictures of nests. also the general location if you don t mind sharing that info. enjoy the springtime weather!,340,66,False,True,0,3,39.0,5edff95b3b1b1b12,0.8906,0.157,0.843,0.0,positive
