id,title,selftext,created_utc,score,num_comments,link_flair_text,upvote_ratio,permalink,url,is_self,subreddit,full_text,created_date,year,month,day,day_of_week,day_name,week_of_year,season,platform_period,is_pandemic,cleaned_text,text_length,word_count,contains_crime_keywords,contains_weather_keywords,crime_keyword_count,weather_keyword_count,engagement_rate,author_hash,sentiment_compound,sentiment_positive,sentiment_neutral,sentiment_negative,sentiment_category
1f4g6jn,Snow crab availability ,"I have family visiting tomorrow and we want to have a snow crab feast but can’t make it out to shop around. Anyone come across decent inventory at decent prices anywhere?
I’ll go to the fish market if I have to but there’s gotta be deals around somewhere.",1724972458.0,2,4,Question,0.6,/r/regina/comments/1f4g6jn/snow_crab_availability/,https://www.reddit.com/r/regina/comments/1f4g6jn/snow_crab_availability/,True,Regina,"Snow crab availability  I have family visiting tomorrow and we want to have a snow crab feast but can’t make it out to shop around. Anyone come across decent inventory at decent prices anywhere?
I’ll go to the fish market if I have to but there’s gotta be deals around somewhere.",2024-08-29 23:00:58+00:00,2024,8,29,3,Thursday,35,summer,post_api,False,snow crab availability i have family visiting tomorrow and we want to have a snow crab feast but can t make it out to shop around. anyone come across decent inventory at decent prices anywhere? i ll go to the fish market if i have to but there s gotta be deals around somewhere.,278,54,False,True,0,1,1.3333333333333333,0c07afa5560a5b1d,0.0387,0.021,0.979,0.0,neutral
1ekb6f9,Major crimes unit arrest process?,"Does anyone have any idea how the process goes when someone is arrested and brought to the major crimes unit? Isn't everyone allowed one personal call and should be able to talk to their lawyer at minimum? I am in winnipeg, Manitoba and my husband was arrested early this morning. The investigators came to my home and told me he was arrested and is in the major crimes unit. I called our lawyer and he said noone will let him connect with my husband and that they are refusing him his one phone call and to speak to a lawyer. Our lawyer had to leave his number and it's been 5 hours since he left his number and still he hasn't been able to call the lawyer yet. What is the process for this? ",1722820084.0,0,9,Ask Winnipeg,0.42,/r/Winnipeg/comments/1ekb6f9/major_crimes_unit_arrest_process/,https://www.reddit.com/r/Winnipeg/comments/1ekb6f9/major_crimes_unit_arrest_process/,True,Winnipeg,"Major crimes unit arrest process? Does anyone have any idea how the process goes when someone is arrested and brought to the major crimes unit? Isn't everyone allowed one personal call and should be able to talk to their lawyer at minimum? I am in winnipeg, Manitoba and my husband was arrested early this morning. The investigators came to my home and told me he was arrested and is in the major crimes unit. I called our lawyer and he said noone will let him connect with my husband and that they are refusing him his one phone call and to speak to a lawyer. Our lawyer had to leave his number and it's been 5 hours since he left his number and still he hasn't been able to call the lawyer yet. What is the process for this? ",2024-08-05 01:08:04+00:00,2024,8,5,0,Monday,32,summer,post_api,False,major crimes unit arrest process? does anyone have any idea how the process goes when someone is arrested and brought to the major crimes unit? isn t everyone allowed one personal call and should be able to talk to their lawyer at minimum? i am in winnipeg manitoba and my husband was arrested early this morning. the investigators came to my home and told me he was arrested and is in the major crimes unit. i called our lawyer and he said noone will let him connect with my husband and that they are refusing him his one phone call and to speak to a lawyer. our lawyer had to leave his number and it s been ADDRESS ill he hasn t been able to call the lawyer yet. what is the process for this?,694,135,True,False,2,0,9.0,19c7283f063f2280,-0.954,0.009,0.859,0.133,negative
1elky35,Fatal accident involving cyclist and semi,"Release:

Fatal Collision – Investigation: C24-178822

On August 2, 2024, at approximately 2:27 p.m., emergency personel responded to the report of a motor vehicle collision involving a cyclist and a semi-truck trailer. 

The 67-year-old victim was transported to hospital in critical condition, where he subsequently succumbed to his injuries. Family notifications have been made.  

It was learned through investigation that the male cyclist, who was traveling at a high rate of speed, collided with the rear of the semi-truck trailer, which was parked with hazard lights on, on the northbound shoulder of Kenaston Boulevard, south of Waverley Street.

The investigation is continuing by the members of the Traffic Division. 

Anyone with information, including possible dash camera footage or home surveillance, please call the Traffic Division at 204-986-7085 or anonymously at Crime Stoppers 204-786-TIPS or winnipegcrimestoppers.org",1722958624.0,131,214,News,0.93,/r/Winnipeg/comments/1elky35/fatal_accident_involving_cyclist_and_semi/,https://www.reddit.com/r/Winnipeg/comments/1elky35/fatal_accident_involving_cyclist_and_semi/,True,Winnipeg,"Fatal accident involving cyclist and semi Release:

Fatal Collision – Investigation: C24-178822

On August 2, 2024, at approximately 2:27 p.m., emergency personel responded to the report of a motor vehicle collision involving a cyclist and a semi-truck trailer. 

The 67-year-old victim was transported to hospital in critical condition, where he subsequently succumbed to his injuries. Family notifications have been made.  

It was learned through investigation that the male cyclist, who was traveling at a high rate of speed, collided with the rear of the semi-truck trailer, which was parked with hazard lights on, on the northbound shoulder of Kenaston Boulevard, south of Waverley Street.

The investigation is continuing by the members of the Traffic Division. 

Anyone with information, including possible dash camera footage or home surveillance, please call the Traffic Division at 204-986-7085 or anonymously at Crime Stoppers 204-786-TIPS or winnipegcrimestoppers.org",2024-08-06 15:37:04+00:00,2024,8,6,1,Tuesday,32,summer,post_api,False,fatal accident involving cyclist and semi release fatal collision investigation c on august at approximately p.m. emergency personel responded to the report of a motor vehicle collision involving a cyclist and a semi truck trailer. the year old victim was transported to hospital in critical condition where he subsequently succumbed to his injuries. family notifications have been made. it was learned through investigation that the male cyclist who was traveling at a high rate of speed collided with the rear of the semi truck trailer which was parked with hazard lights on on the northbound shoulder of kenaston boulevard south of waverley street. the investigation is continuing by the members of the traffic division. anyone with information including possible dash camera footage or home surveillance please call the traffic division at PHONE or anonymously at crime stoppers tips or winnipegcrimestoppers.org,916,140,True,False,2,0,1.621212121212121,94c6e27b6a4094aa,-0.9694,0.015,0.823,0.162,negative
