id,title,selftext,created_utc,score,num_comments,link_flair_text,upvote_ratio,permalink,url,is_self,subreddit,full_text,created_date,year,month,day,day_of_week,day_name,week_of_year,season,platform_period,is_pandemic,cleaned_text,text_length,word_count,contains_crime_keywords,contains_weather_keywords,crime_keyword_count,weather_keyword_count,engagement_rate,author_hash,sentiment_compound,sentiment_positive,sentiment_neutral,sentiment_negative,sentiment_category
1k1hdps,considering move to Gimli area,"Hi, I am moving to Canada after living in the US for a number of years, having grown up in QC. I was told the Evergreen School District has a great reading program and one of my kids is dyslexic so this is important to me. I work remote so I can work anywhere. I am considering moving to the Gimli area. I do understand it gets bitterly cold in MB. What else do I need to know? Are there long waitlists in that area for occupational therapy and speech therapy for kids? I have one diagnosed with autism and was also wondering how it works with funding for that in MB. Are the mosquitoes really that bad in the summer? I live in a state where they are bad already so I just assume it will be the same but just a few months a year instead of year round. What are sports programs like for kids? If you have a better suggestion of where I should check out, pls let me know. ",1744908077.0,23,20,Question,0.81,/r/Manitoba/comments/1k1hdps/considering_move_to_gimli_area/,https://www.reddit.com/r/Manitoba/comments/1k1hdps/considering_move_to_gimli_area/,True,manitoba,"considering move to Gimli area Hi, I am moving to Canada after living in the US for a number of years, having grown up in QC. I was told the Evergreen School District has a great reading program and one of my kids is dyslexic so this is important to me. I work remote so I can work anywhere. I am considering moving to the Gimli area. I do understand it gets bitterly cold in MB. What else do I need to know? Are there long waitlists in that area for occupational therapy and speech therapy for kids? I have one diagnosed with autism and was also wondering how it works with funding for that in MB. Are the mosquitoes really that bad in the summer? I live in a state where they are bad already so I just assume it will be the same but just a few months a year instead of year round. What are sports programs like for kids? If you have a better suggestion of where I should check out, pls let me know. ",2025-04-17 16:41:17+00:00,2025,4,17,3,Thursday,16,spring,post_api,False,considering move to gimli area hi i am moving to canada after living in the us for a number of years having grown up in qc. i was told the evergreen school district has a great reading program and one of my kids is dyslexic so this is important to me. i work remote so i can work anywhere. i am considering moving to the gimli area. i do understand it gets bitterly cold in mb. what else do i need to know? are there long waitlists in that area for occupational therapy and speech therapy for kids? i have one diagnosed with autism and was also wondering how it works with funding for that in mb. are the mosquitoes really that bad in the summer? i live in a state where they are bad already so i just assume it will be the same but just a few months a year instead of year round. what are sports programs like for kids? if you have a better suggestion of where i should check out pls let me know.,897,179,False,True,0,2,0.8333333333333334,ff98cc8ebbad3e92,0.7965,0.077,0.888,0.035,positive
1kbj4an,MPI is awesome and underrated,"I parked at Richardson Intl Airport for a few days while I traveled. When I returned, someone had broken into my vehicle, and apparently had used it as place to crash. Honestly, screw that person, but also, they could've left my vehicle in a way worse state. The only evidence they were there were their makeshift curtains, and the damage to my window.

Fuck Richardson Intl for not having any idea this happened. They still haven't responded to my email. I haven't heard shit from WPS other than my police report was accepted. Meanwhile, my MPI claim has already been processed. 

I called MPI to file the claim. The guy on the phone processed my claim at lightspeed, no hold time. I got an appointment for MPI service centre the next day. Guy at the service centre didn't make me remove my tape or anything, didn't need photos. He took me on my word and on the police report number. MPI didn't even ask to see photos of the damage. And so, in <24h I have the papers needed to get my window replaced. Zero adversarialism, zero deductible (vandalism), zero hardships, other than the fact that my vehicle was vandalized. I realize my situation is pretty open and shut, but when I think about the insurance situation in Ontario, and compare it to what I just went through and why it was so easy, I realize that we are very lucky to have this MPI. I just wanted to give a shout out to MPI and express gratitude for great government entities, even if it's not perfect, it's at least $7000/year in premiums better than what it would be like in Ontario.",1746026413.0,248,54,Opinion Piece,0.94,/r/Manitoba/comments/1kbj4an/mpi_is_awesome_and_underrated/,https://www.reddit.com/r/Manitoba/comments/1kbj4an/mpi_is_awesome_and_underrated/,True,manitoba,"MPI is awesome and underrated I parked at Richardson Intl Airport for a few days while I traveled. When I returned, someone had broken into my vehicle, and apparently had used it as place to crash. Honestly, screw that person, but also, they could've left my vehicle in a way worse state. The only evidence they were there were their makeshift curtains, and the damage to my window.

Fuck Richardson Intl for not having any idea this happened. They still haven't responded to my email. I haven't heard shit from WPS other than my police report was accepted. Meanwhile, my MPI claim has already been processed. 

I called MPI to file the claim. The guy on the phone processed my claim at lightspeed, no hold time. I got an appointment for MPI service centre the next day. Guy at the service centre didn't make me remove my tape or anything, didn't need photos. He took me on my word and on the police report number. MPI didn't even ask to see photos of the damage. And so, in <24h I have the papers needed to get my window replaced. Zero adversarialism, zero deductible (vandalism), zero hardships, other than the fact that my vehicle was vandalized. I realize my situation is pretty open and shut, but when I think about the insurance situation in Ontario, and compare it to what I just went through and why it was so easy, I realize that we are very lucky to have this MPI. I just wanted to give a shout out to MPI and express gratitude for great government entities, even if it's not perfect, it's at least $7000/year in premiums better than what it would be like in Ontario.",2025-04-30 15:20:13+00:00,2025,4,30,2,Wednesday,18,spring,post_api,False,mpi is awesome and underrated i parked at richardson intl airport for a few days while i traveled. when i returned someone had broken into my vehicle and apparently had used it as place to crash. honestly screw that person but also they could ve left my vehicle in a way worse state. the only evidence they were there were their makeshift curtains and the damage to my window. fuck richardson intl for not having any idea this happened. they still haven t responded to my email. i haven t heard shit from wps other than my police report was accepted. meanwhile my mpi claim has already been processed. i called mpi to file the claim. the guy on the phone processed my claim at lightspeed no hold time. i got an appointment for mpi service centre the next day. guy at the service centre didn t make me remove my tape or anything didn t need photos. he took me on my word and on the police report number. mpi didn t even ask to see photos of the damage. and so in h i have the papers needed to get my window replaced. zero adversarialism zero deductible vandalism zero hardships other than the fact that my vehicle was vandalized. i realize my situation is pretty open and shut but when i think about the insurance situation in ontario and compare it to what i just went through and why it was so easy i realize that we are very lucky to have this mpi. i just wanted to give a shout out to mpi and express gratitude for great government entities even if it s not perfect it s at least year in premiums better than what it would be like in ontario.,1545,295,True,True,2,1,0.21686746987951808,b67d99e51e844cd2,0.7273,0.113,0.788,0.099,positive
1jv7362,3 Strikes,"I'd love to hear an argument against this.  
The main point is that an infinitely small percentage of the population of canada is ruining it for everybody.  
One of the stats - The Vancouver Police have arrested the same 40 people SIX THOUSAND times!

Yes that is a Vancouver stat, but its a perfect representation about what is happening in rural Manitoba right now.

[https://youtu.be/SQqlrh2Huf8?si=IB9viROdJVBC-uT5](https://youtu.be/SQqlrh2Huf8?si=IB9viROdJVBC-uT5)

Edit: to add to this.  Last fall one of my buddies had a shop that was broken into and I helped him collect all of his camera footage for the RCMP.  As soon as they saw the footage they knew who the people were from dealing with them over and over and over again.   They went through the steps of collecting the evidence, but you could easily tell they were beyond frustrated with the fact that there was basically no point in doing what they were doing because it meant nothing.   This was a relatively serious theft with 6 figures worth of damages and stolen property.  An ABOSLUTELY MONUMENTAL pain in the ass for someone who is just trying to run a business.

""bUT iNsURanCe ShOUld cOVer eVEryThiNg,""  It obviously is not that simple when a small business owner is just doing his own thing, and gets blindsided by losing his tools/equipment and isn't able to finish contracts that he's working on.  Then has to try to replace everything after paying MULTIPLE deductibles and losing hundreds of hours to paperwork and other hoops that he's forced to jump through.

",1744208785.0,0,33,Politics,0.46,/r/Manitoba/comments/1jv7362/3_strikes/,https://www.reddit.com/r/Manitoba/comments/1jv7362/3_strikes/,True,manitoba,"3 Strikes I'd love to hear an argument against this.  
The main point is that an infinitely small percentage of the population of canada is ruining it for everybody.  
One of the stats - The Vancouver Police have arrested the same 40 people SIX THOUSAND times!

Yes that is a Vancouver stat, but its a perfect representation about what is happening in rural Manitoba right now.

[https://youtu.be/SQqlrh2Huf8?si=IB9viROdJVBC-uT5](https://youtu.be/SQqlrh2Huf8?si=IB9viROdJVBC-uT5)

Edit: to add to this.  Last fall one of my buddies had a shop that was broken into and I helped him collect all of his camera footage for the RCMP.  As soon as they saw the footage they knew who the people were from dealing with them over and over and over again.   They went through the steps of collecting the evidence, but you could easily tell they were beyond frustrated with the fact that there was basically no point in doing what they were doing because it meant nothing.   This was a relatively serious theft with 6 figures worth of damages and stolen property.  An ABOSLUTELY MONUMENTAL pain in the ass for someone who is just trying to run a business.

""bUT iNsURanCe ShOUld cOVer eVEryThiNg,""  It obviously is not that simple when a small business owner is just doing his own thing, and gets blindsided by losing his tools/equipment and isn't able to finish contracts that he's working on.  Then has to try to replace everything after paying MULTIPLE deductibles and losing hundreds of hours to paperwork and other hoops that he's forced to jump through.

",2025-04-09 14:26:25+00:00,2025,4,9,2,Wednesday,15,spring,post_api,False,strikes i d love to hear an argument against this. the main point is that an infinitely small percentage of the population of canada is ruining it for everybody. one of the stats the vancouver police have arrested the same people six thousand times! yes that is a vancouver stat but its a perfect representation about what is happening in rural manitoba right now. edit to add to this. last fall one of my buddies had a shop that was broken into and i helped him collect all of his camera footage for the rcmp. as soon as they saw the footage they knew who the people were from dealing with them over and over and over again. they went through the steps of collecting the evidence but you could easily tell they were beyond frustrated with the fact that there was basically no point in doing what they were doing because it meant nothing. this was a relatively serious theft with ADDRESS olen property. an aboslutely monumental pain in the ass for someone who is just trying to run a business. but insurance should cover everything it obviously is not that simple when a small business owner is just doing his own thing and gets blindsided by losing his tools equipment and isn t able to finish contracts that he s working on. then has to try to replace everything after paying multiple deductibles and losing hundreds of hours to paperwork and other hoops that he s forced to jump through.,1390,252,True,True,6,1,33.0,96e610c8cc309725,-0.9793,0.044,0.816,0.14,negative
1jw64dd,Dougald Lamont digs up some inconvenient stats on the Tories problem with criminality,"https://open.substack.com/pub/dougaldlamont/p/tough-on-crime-unless-theyre-tories?utm_source=share&utm_medium=android&r=2mn9tw

",1744312451.0,239,124,Politics,0.92,/r/Manitoba/comments/1jw64dd/dougald_lamont_digs_up_some_inconvenient_stats_on/,https://i.redd.it/xmeoj44h42ue1.png,False,manitoba,"Dougald Lamont digs up some inconvenient stats on the Tories problem with criminality https://open.substack.com/pub/dougaldlamont/p/tough-on-crime-unless-theyre-tories?utm_source=share&utm_medium=android&r=2mn9tw

",2025-04-10 19:14:11+00:00,2025,4,10,3,Thursday,15,spring,post_api,False,dougald lamont digs up some inconvenient stats on the tories problem with criminality,85,13,True,False,2,0,0.5166666666666667,33d9b59cd32cbe32,-0.6249,0.0,0.683,0.317,negative
1jooel2,BREAKING MONARCH NEWS: Butterflies depart Mexico colony.,"This week the majority of Monarch Butterflies left the El Rosario, Mexico area where the majority of the Eastern population spends the winter in mass numbers, beginning their long journey northwards across the United States and finally to Canada. 

While these are the same animals which left Canada (and the United States) last autumn, they will spend multiple generations on their trip back.


They typically arrive in Winnipeg, Manitoba late May to early June. 

Last year they had begun arriving early however. 



Full report below:

https://journeynorth.org/monarchs/news/spring-2025/032725-last-el-rosarios-colony-leaves-season

Also, King Charles is still alive.",1743486246.0,146,4,News,0.96,/r/Manitoba/comments/1jooel2/breaking_monarch_news_butterflies_depart_mexico/,https://www.reddit.com/r/Manitoba/comments/1jooel2/breaking_monarch_news_butterflies_depart_mexico/,True,manitoba,"BREAKING MONARCH NEWS: Butterflies depart Mexico colony. This week the majority of Monarch Butterflies left the El Rosario, Mexico area where the majority of the Eastern population spends the winter in mass numbers, beginning their long journey northwards across the United States and finally to Canada. 

While these are the same animals which left Canada (and the United States) last autumn, they will spend multiple generations on their trip back.


They typically arrive in Winnipeg, Manitoba late May to early June. 

Last year they had begun arriving early however. 



Full report below:

https://journeynorth.org/monarchs/news/spring-2025/032725-last-el-rosarios-colony-leaves-season

Also, King Charles is still alive.",2025-04-01 05:44:06+00:00,2025,4,1,1,Tuesday,14,spring,post_api,False,breaking monarch news butterflies depart mexico colony. this week the majority of monarch butterflies left the el rosario mexico area where the majority of the eastern population spends the winter in mass numbers beginning their long journey northwards across the united states and finally to canada. while these are the same animals which left canada and the united states last autumn they will spend multiple generations on their trip back. they typically arrive in winnipeg manitoba late may to early june. last year they had begun arriving early however. full report below also king charles is still alive.,610,98,False,True,0,3,0.027210884353741496,fa358dbb7021f6ef,0.802,0.079,0.921,0.0,positive
1k56ndr,Nice knowing you…,That’s a lot of snow…,1745329428.0,130,39,Pictures/Video,0.96,/r/Manitoba/comments/1k56ndr/nice_knowing_you/,https://i.redd.it/1t3u7wrg4ewe1.jpeg,False,manitoba,Nice knowing you… That’s a lot of snow…,2025-04-22 13:43:48+00:00,2025,4,22,1,Tuesday,17,spring,post_api,False,nice knowing you that s a lot of snow,37,9,False,True,0,1,0.29770992366412213,745daf27ced9d07c,0.4215,0.259,0.741,0.0,positive
1joxgnw,The Alberta Mentality,"I moved to Alberta just over 3 years ago. I love the mountains, and the sports (Go Flames and Elks! ) but I am really getting worn out with the ""Alberta Mentality"" of corporate profits over people and outright racism. 
The cutting cookies for cancer kids has simply put it over the top. Of all the things to cut, they pick that. What a disconnect from the top execs of AHS and the UCP government to the front lines. They can spend money trying to please Trump, give $100 in royalty credits to oil companies to clean up the messes they were responsible for cleaning up in the first place, money for millionaire hockey teams, but God forbid we give something of comfort to children going through the hardest times in their lives, fighting for their life. And when I mention to other lifelong Albertans, the answer I get is ""Well they should pay for their own"". REALLY??? DO YOU HEAR YOURSELVES? Are you THAT brainwashed?
And then we have the victim mentality of ""Canada screws us"". I mean, grow up and be part of this country or GTFO. 
Then the racism. We recently had a first nations person commit a crime of arson in my town. People went off on FB about sending ""all of them"" back to reserve and how they are sick of first nations people. ZERO interest in maybe finding out the back story. I went to this guys FB profile. Turns out he used to run a ranch. And one by one, over the last 5-6 years, all his relatives died. It was clear he was FULL of heavy grief, and more than likely didn't have the resources to deal with it. Then there was a gap of a year between FB posts. Then he was on the streets, living in the shelter. Clearly things went out of control for him. Here we have a hard working citizen who lost many family members, more than likely broke down and didn't know how to deal with it, ended up on the street and now ""F that indian"" is all this province can come up with. Zero compassion. The justice system will deal with him, but now he has a lifelong google history that will only increase shame and make it much harder to bounce back. And it is even worse because of his skin colour. 
Not sure how much more of this stupid mentality I can handle, I just want to wack all this idiots upside the head, but it would take a lifetime. I guess the only way forward is to try and love everyone and show compassion, but I am getting very frustrated.",1743518978.0,2101,448,Opinion,0.93,/r/alberta/comments/1joxgnw/the_alberta_mentality/,https://www.reddit.com/r/alberta/comments/1joxgnw/the_alberta_mentality/,True,alberta,"The Alberta Mentality I moved to Alberta just over 3 years ago. I love the mountains, and the sports (Go Flames and Elks! ) but I am really getting worn out with the ""Alberta Mentality"" of corporate profits over people and outright racism. 
The cutting cookies for cancer kids has simply put it over the top. Of all the things to cut, they pick that. What a disconnect from the top execs of AHS and the UCP government to the front lines. They can spend money trying to please Trump, give $100 in royalty credits to oil companies to clean up the messes they were responsible for cleaning up in the first place, money for millionaire hockey teams, but God forbid we give something of comfort to children going through the hardest times in their lives, fighting for their life. And when I mention to other lifelong Albertans, the answer I get is ""Well they should pay for their own"". REALLY??? DO YOU HEAR YOURSELVES? Are you THAT brainwashed?
And then we have the victim mentality of ""Canada screws us"". I mean, grow up and be part of this country or GTFO. 
Then the racism. We recently had a first nations person commit a crime of arson in my town. People went off on FB about sending ""all of them"" back to reserve and how they are sick of first nations people. ZERO interest in maybe finding out the back story. I went to this guys FB profile. Turns out he used to run a ranch. And one by one, over the last 5-6 years, all his relatives died. It was clear he was FULL of heavy grief, and more than likely didn't have the resources to deal with it. Then there was a gap of a year between FB posts. Then he was on the streets, living in the shelter. Clearly things went out of control for him. Here we have a hard working citizen who lost many family members, more than likely broke down and didn't know how to deal with it, ended up on the street and now ""F that indian"" is all this province can come up with. Zero compassion. The justice system will deal with him, but now he has a lifelong google history that will only increase shame and make it much harder to bounce back. And it is even worse because of his skin colour. 
Not sure how much more of this stupid mentality I can handle, I just want to wack all this idiots upside the head, but it would take a lifetime. I guess the only way forward is to try and love everyone and show compassion, but I am getting very frustrated.",2025-04-01 14:49:38+00:00,2025,4,1,1,Tuesday,14,spring,post_api,False,the alberta mentality i moved to alberta just over years ago. i love the mountains and the sports go flames and elks! but i am really getting worn out with the alberta mentality of corporate profits over people and outright racism. the cutting cookies for cancer kids has simply put it over the top. of all the things to cut they pick that. what a disconnect from the top execs of ahs and the ucp government to the front lines. they can spend money trying to please trump give in royalty credits to oil companies to clean up the messes they were responsible for cleaning up in the first place money for millionaire hockey teams but god forbid we give something of comfort to children going through the hardest times in their lives fighting for their life. and when i mention to other lifelong albertans the answer i get is well they should pay for their own . really??? do you hear yourselves? are you that brainwashed? and then we have the victim mentality of canada screws us . i mean grow up and be part of this country or gtfo. then the racism. we recently had a first nations person commit a crime of arson in my town. people went off on fb about sending all of them back to reserve and how they are sick of first nations people. zero interest in maybe finding out the back story. i went to this guys fb profile. turns out he used to run a ranch. and one by one over the last years all his relatives died. it was clear he was full of heavy grief and more than likely didn t have the resources to deal with it. then there was a gap of a year between fb posts. then he was on the streets living in the shelter. clearly things went out of control for him. here we have a hard working citizen who lost many family members more than likely broke down and didn t know how to deal with it ended up on the street and now f that indian is all this province can come up with. zero compassion. the justice system will deal with him but now he has a lifelong google history that will only increase shame and make it much harder to bounce back. and it is even worse because of his skin colour. not sure how much more of this stupid mentality i can handle i just want to wack all this idiots upside the head but it would take a lifetime. i guess the only way forward is to try and love everyone and show compassion but i am getting very frustrated.,2339,452,True,True,2,1,0.2131303520456708,45d3411a08026280,-0.9798,0.119,0.725,0.156,negative
