id,title,selftext,created_utc,score,num_comments,link_flair_text,upvote_ratio,permalink,url,is_self,subreddit,full_text,created_date,year,month,day,day_of_week,day_name,week_of_year,season,platform_period,is_pandemic,cleaned_text,text_length,word_count,contains_crime_keywords,contains_weather_keywords,crime_keyword_count,weather_keyword_count,engagement_rate,author_hash,sentiment_compound,sentiment_positive,sentiment_neutral,sentiment_negative,sentiment_category
1ema636,"Saskatchewan MP blames federal government for crime, homelessness and addiction problems",[https://globalnews.ca/news/10684459/saskatchewan-mp-blames-federal-government-crime-homelessness-addiction/](https://globalnews.ca/news/10684459/saskatchewan-mp-blames-federal-government-crime-homelessness-addiction/),1723032746.0,62,64,News,0.81,/r/saskatoon/comments/1ema636/saskatchewan_mp_blames_federal_government_for/,https://www.reddit.com/r/saskatoon/comments/1ema636/saskatchewan_mp_blames_federal_government_for/,True,Saskatoon,"Saskatchewan MP blames federal government for crime, homelessness and addiction problems [https://globalnews.ca/news/10684459/saskatchewan-mp-blames-federal-government-crime-homelessness-addiction/](https://globalnews.ca/news/10684459/saskatchewan-mp-blames-federal-government-crime-homelessness-addiction/)",2024-08-07 12:12:26+00:00,2024,8,7,2,Wednesday,32,summer,post_api,False,saskatchewan mp blames federal government for crime homelessness and addiction problems,87,11,True,False,1,0,1.0158730158730158,fb078a2689fc796f,-0.836,0.0,0.473,0.527,negative
1end1lx,Saskatoon police confirm uptick in violent crime continued through first half of 2024,"[Violent crime in Saskatoon was up by over 10 per cent year-over-year in the second quarter of 2024, according to new data from the Saskatoon police.](https://saskatoon.ctvnews.ca/saskatoon-police-confirm-uptick-in-violent-crime-continued-through-first-half-of-2024-1.6993298)",1723140716.0,51,35,News,0.91,/r/saskatoon/comments/1end1lx/saskatoon_police_confirm_uptick_in_violent_crime/,https://www.reddit.com/r/saskatoon/comments/1end1lx/saskatoon_police_confirm_uptick_in_violent_crime/,True,Saskatoon,"Saskatoon police confirm uptick in violent crime continued through first half of 2024 [Violent crime in Saskatoon was up by over 10 per cent year-over-year in the second quarter of 2024, according to new data from the Saskatoon police.](https://saskatoon.ctvnews.ca/saskatoon-police-confirm-uptick-in-violent-crime-continued-through-first-half-of-2024-1.6993298)",2024-08-08 18:11:56+00:00,2024,8,8,3,Thursday,32,summer,post_api,False,saskatoon police confirm uptick in violent crime continued through first half of violent crime in saskatoon was up by over per cent year over year in the second quarter of according to new data from the saskatoon police.,220,38,True,False,2,0,0.6730769230769231,780feccba824b170,-0.9413,0.0,0.697,0.303,negative
1euyze5,Crime statistics ,"On Thursday, the Board of Police Commissioners received the latest crime statistics. 2023 saw an increase in many types of crime when compared to both the previous year and the 10-year average. Crimes against the person (violent crime or intimidation) were higher than in 2022 and were 14% higher than the 10-year average. Property crimes were 9% higher than average. Other crimes were 11% higher than average.

The picture for the second quarter of 2024 is mixed. Violent crimes are up yet again, 11% higher than in the second quarter of 2023. Property crimes are down 10%, and other crimes are down 18%. Notably, there were five traffic fatalities in the quarter compared with one in the second quarter of 2022. Total calls for service were up 4%.",1723949138.0,15,10,Police Updates,0.8,/r/saskatoon/comments/1euyze5/crime_statistics/,https://www.reddit.com/r/saskatoon/comments/1euyze5/crime_statistics/,True,Saskatoon,"Crime statistics  On Thursday, the Board of Police Commissioners received the latest crime statistics. 2023 saw an increase in many types of crime when compared to both the previous year and the 10-year average. Crimes against the person (violent crime or intimidation) were higher than in 2022 and were 14% higher than the 10-year average. Property crimes were 9% higher than average. Other crimes were 11% higher than average.

The picture for the second quarter of 2024 is mixed. Violent crimes are up yet again, 11% higher than in the second quarter of 2023. Property crimes are down 10%, and other crimes are down 18%. Notably, there were five traffic fatalities in the quarter compared with one in the second quarter of 2022. Total calls for service were up 4%.",2024-08-18 02:45:38+00:00,2024,8,18,6,Sunday,33,summer,post_api,False,crime statistics on thursday the board of police commissioners received the latest crime statistics. saw an increase in many types of crime when compared to both the previous year and the year average. crimes against the person violent crime or intimidation were higher than in and were higher than the year average. property crimes were higher than average. other crimes were higher than average. the picture for the second quarter of is mixed. violent crimes are up yet again higher than in the second quarter of . property crimes are down and other crimes are down . notably there were five traffic fatalities in the quarter compared with one in the second quarter of . total calls for service were up .,706,122,True,False,2,0,0.625,ca01b257783bd70b,-0.9803,0.016,0.786,0.198,negative
1ewhfjz,Civic Election - How do I educate myself on the Candidates?,"This is the first time I'm (50+ F) wanting to really engage in the civic election. Mostly because of crime epidemic and an increasing feeling of peril regardless of time of day or neighbourhood. I know that addictions, homelessness and mental illness are complex problems--and little can be done at the municipal level. As another Redditor as well as police buddy working directly with this population has pointed out, the current SK gov't has ""gutted social programs"" that have had a profoundly negative impact. But civic is still a small place to start. I see at least 3, maybe all 4, mayoral candidates are placing at least lip-service priority on these issues. QUESTION: How can I sort through who might have the best chance of positive impact on this issue? Initially Cynthia Block in her candidacy announcement addressed this with some concrete ideas. Then I see Gord Wyant's connection with the Provincial gov't--which in my uneducated opinion--could be a plus or minus. (Knows how to navigate, advocate for provincial funding...but he belongs the party that gutted needed programs.) Then Atchison's experience might also have some impact. I'd appreciate your thoughts...

  
ETA: Really appreciate the genuine advice. Plan to follow up on everything offered thus far.",1724112548.0,25,79,Politics,0.75,/r/saskatoon/comments/1ewhfjz/civic_election_how_do_i_educate_myself_on_the/,https://www.reddit.com/r/saskatoon/comments/1ewhfjz/civic_election_how_do_i_educate_myself_on_the/,True,Saskatoon,"Civic Election - How do I educate myself on the Candidates? This is the first time I'm (50+ F) wanting to really engage in the civic election. Mostly because of crime epidemic and an increasing feeling of peril regardless of time of day or neighbourhood. I know that addictions, homelessness and mental illness are complex problems--and little can be done at the municipal level. As another Redditor as well as police buddy working directly with this population has pointed out, the current SK gov't has ""gutted social programs"" that have had a profoundly negative impact. But civic is still a small place to start. I see at least 3, maybe all 4, mayoral candidates are placing at least lip-service priority on these issues. QUESTION: How can I sort through who might have the best chance of positive impact on this issue? Initially Cynthia Block in her candidacy announcement addressed this with some concrete ideas. Then I see Gord Wyant's connection with the Provincial gov't--which in my uneducated opinion--could be a plus or minus. (Knows how to navigate, advocate for provincial funding...but he belongs the party that gutted needed programs.) Then Atchison's experience might also have some impact. I'd appreciate your thoughts...

  
ETA: Really appreciate the genuine advice. Plan to follow up on everything offered thus far.",2024-08-20 00:09:08+00:00,2024,8,20,1,Tuesday,34,summer,post_api,False,civic election how do i educate myself on the candidates? this is the first time i m f wanting to really engage in the civic election. mostly because of crime epidemic and an increasing feeling of peril regardless of time of day or neighbourhood. i know that addictions homelessness and mental illness are complex problems and little can be done at the municipal level. as another redditor as well as police buddy working directly with this population has pointed out the current sk gov t has gutted social programs that have had a profoundly negative impact. but civic is still a small place to start. i see at least maybe all mayoral candidates are placing at least lip service priority on these issues. question how can i sort through who might have the best chance of positive impact on this issue? initially cynthia block in her candidacy announcement addressed this with some concrete ideas. then i see gord wyant s connection with the provincial gov t which in my uneducated opinion could be a plus or minus. knows how to navigate advocate for provincial funding...but he belongs the party that gutted needed programs. then atchison s experience might also have some impact. i d appreciate your thoughts... eta really appreciate the genuine advice. plan to follow up on everything offered thus far.,1305,222,True,False,2,0,3.0384615384615383,80e336cf16ca8490,0.9538,0.117,0.827,0.056,positive
1ex5d7z,Saskatoon police chief defends amount of force used in cruise weekend arrest caught on camera,[Saskatoon's police chief said he's watched videos of a Saturday night arrest and is defending his officers.](https://saskatoon.ctvnews.ca/saskatoon-police-chief-defends-amount-of-force-used-in-cruise-weekend-arrest-caught-on-camera-1.7007735),1724183984.0,77,138,News,0.9,/r/saskatoon/comments/1ex5d7z/saskatoon_police_chief_defends_amount_of_force/,https://www.reddit.com/r/saskatoon/comments/1ex5d7z/saskatoon_police_chief_defends_amount_of_force/,True,Saskatoon,Saskatoon police chief defends amount of force used in cruise weekend arrest caught on camera [Saskatoon's police chief said he's watched videos of a Saturday night arrest and is defending his officers.](https://saskatoon.ctvnews.ca/saskatoon-police-chief-defends-amount-of-force-used-in-cruise-weekend-arrest-caught-on-camera-1.7007735),2024-08-20 19:59:44+00:00,2024,8,20,1,Tuesday,34,summer,post_api,False,saskatoon police chief defends amount of force used in cruise weekend arrest caught on camera saskatoon s police chief said he s watched videos of a saturday night arrest and is defending his officers.,201,34,True,False,2,0,1.7692307692307692,780feccba824b170,-0.5859,0.0,0.87,0.13,negative
1ehrya6,"Cash, cocaine and cars seized by Saskatoon police. ","https://www.ckom.com/2024/08/01/cash-cocaine-and-cars-seized-by-saskatoon-police/

God I hope some charges stick and these people spends serious time behind bars. This doesn’t seem like some small timers judging by the amount of cash and drugs they had on hand. ",1722546653.0,58,36,News,0.95,/r/saskatoon/comments/1ehrya6/cash_cocaine_and_cars_seized_by_saskatoon_police/,https://www.reddit.com/r/saskatoon/comments/1ehrya6/cash_cocaine_and_cars_seized_by_saskatoon_police/,True,Saskatoon,"Cash, cocaine and cars seized by Saskatoon police.  https://www.ckom.com/2024/08/01/cash-cocaine-and-cars-seized-by-saskatoon-police/

God I hope some charges stick and these people spends serious time behind bars. This doesn’t seem like some small timers judging by the amount of cash and drugs they had on hand. ",2024-08-01 21:10:53+00:00,2024,8,1,3,Thursday,31,summer,post_api,False,cash cocaine and cars seized by saskatoon police. god i hope some charges stick and these people spends serious time behind bars. this doesn t seem like some small timers judging by the amount of cash and drugs they had on hand.,228,42,True,False,1,0,0.6101694915254238,0de2f6473e372d13,0.8074,0.214,0.719,0.068,positive
1f5wih9,Large police presence behind Preston Crossing,"I was riding my bike out to the forestry farm, and when I was cutting behind Preston crossing to take The pedestrian bridge, there were tons of cop cars , ambulances and a fire truck in the loading zone behind Canadian tire. They had the whole area taped off.

Anyone hear anything about it?",1725135622.0,33,17,Question❔,0.82,/r/saskatoon/comments/1f5wih9/large_police_presence_behind_preston_crossing/,https://www.reddit.com/r/saskatoon/comments/1f5wih9/large_police_presence_behind_preston_crossing/,True,Saskatoon,"Large police presence behind Preston Crossing I was riding my bike out to the forestry farm, and when I was cutting behind Preston crossing to take The pedestrian bridge, there were tons of cop cars , ambulances and a fire truck in the loading zone behind Canadian tire. They had the whole area taped off.

Anyone hear anything about it?",2024-08-31 20:20:22+00:00,2024,8,31,5,Saturday,35,summer,post_api,False,large police presence behind preston crossing i was riding my bike out to the forestry farm and when i was cutting behind preston crossing to take the pedestrian bridge there were tons of cop cars ambulances and a fire truck in the loading zone behind canadian tire. they had the whole area taped off. anyone hear anything about it?,332,59,True,False,1,0,0.5,ff4561b7ed7edd07,-0.4404,0.0,0.936,0.064,negative
1et8do0,Police Encounter,"Just drove past an SUV that was pulled over by police, except it was like 4-5 police vans with lights flashing for one vehicle, didn't appear to be an accident- anyone know what's going on? 
Was on hwy 16 just past college drive going south",1723760640.0,0,18,Question,0.11,/r/saskatoon/comments/1et8do0/police_encounter/,https://www.reddit.com/r/saskatoon/comments/1et8do0/police_encounter/,True,Saskatoon,"Police Encounter Just drove past an SUV that was pulled over by police, except it was like 4-5 police vans with lights flashing for one vehicle, didn't appear to be an accident- anyone know what's going on? 
Was on hwy 16 just past college drive going south",2024-08-15 22:24:00+00:00,2024,8,15,3,Thursday,33,summer,post_api,False,police encounter just drove past an suv that was pulled over by police except it was like police vans with lights flashing for one vehicle didn t appear to be an accident anyone know what s going on? was on hwy ADDRESS going south,230,44,True,False,1,0,18.0,233f804840a83702,-0.1531,0.053,0.882,0.065,negative
1einzyh,Saskatoon police to provide update on landfill search for Mackenzie Trottier,[Saskatoon police are scheduled to provide an update on a search of the city landfill for the remains of a young woman missing since 2020.](https://saskatoon.ctvnews.ca/saskatoon-police-to-provide-update-on-landfill-search-for-mackenzie-trottier-1.6987989),1722639865.0,44,14,News,0.89,/r/saskatoon/comments/1einzyh/saskatoon_police_to_provide_update_on_landfill/,https://www.reddit.com/r/saskatoon/comments/1einzyh/saskatoon_police_to_provide_update_on_landfill/,True,Saskatoon,Saskatoon police to provide update on landfill search for Mackenzie Trottier [Saskatoon police are scheduled to provide an update on a search of the city landfill for the remains of a young woman missing since 2020.](https://saskatoon.ctvnews.ca/saskatoon-police-to-provide-update-on-landfill-search-for-mackenzie-trottier-1.6987989),2024-08-02 23:04:25+00:00,2024,8,2,4,Friday,31,summer,post_api,False,saskatoon police to provide update on landfill search for mackenzie trottier saskatoon police are scheduled to provide an update on a search of the city landfill for the remains of a young woman missing since .,210,36,True,False,1,0,0.3111111111111111,780feccba824b170,-0.296,0.0,0.941,0.059,negative
1el8shz,Police presence on Bradwell Ave?,"Anyone know what's up? Around 6:30, three cop vehicles pulled up pretty quickly and walked to a house a few houses down from mine and now that I'm back from my movie, there's still one parked in front of that house. Anyone know what's up? It'd be nice to know what's going on.",1722918745.0,0,5,Question,0.29,/r/saskatoon/comments/1el8shz/police_presence_on_bradwell_ave/,https://www.reddit.com/r/saskatoon/comments/1el8shz/police_presence_on_bradwell_ave/,True,Saskatoon,"Police presence on Bradwell Ave? Anyone know what's up? Around 6:30, three cop vehicles pulled up pretty quickly and walked to a house a few houses down from mine and now that I'm back from my movie, there's still one parked in front of that house. Anyone know what's up? It'd be nice to know what's going on.",2024-08-06 04:32:25+00:00,2024,8,6,1,Tuesday,32,summer,post_api,False,police presence on bradwell ave? anyone know what s up? around three cop vehicles pulled up pretty quickly and walked to a house a few houses down from mine and now that i m back from my movie there s still one parked in front of that house. anyone know what s up? it d be nice to know what s going on.,302,63,True,False,1,0,5.0,d27a529b66629546,0.7608,0.097,0.903,0.0,positive
