id,title,selftext,created_utc,score,num_comments,link_flair_text,upvote_ratio,permalink,url,is_self,subreddit,full_text,created_date,year,month,day,day_of_week,day_name,week_of_year,season,platform_period,is_pandemic,cleaned_text,text_length,word_count,contains_crime_keywords,contains_weather_keywords,crime_keyword_count,weather_keyword_count,engagement_rate,author_hash,sentiment_compound,sentiment_positive,sentiment_neutral,sentiment_negative,sentiment_category
1kbudco,Homestead Ice Cream New Owners,"I was excited to see that Homestead is under new ownership. That is until I read the comments... I have the greatest memories as a kid going to Homestead, so it's really unfortunate that they continue to treat the community this way instead of handling legitimate concerns as a business professional should. 

What do you think? Are you going to give them another shot?

  
\*I blurred out the names in the screenshot but nothing else is altered. ",1746055087.0,301,180,Food & Restaurants 🍽️,0.96,/r/saskatoon/comments/1kbudco/homestead_ice_cream_new_owners/,https://www.reddit.com/gallery/1kbudco,False,Saskatoon,"Homestead Ice Cream New Owners I was excited to see that Homestead is under new ownership. That is until I read the comments... I have the greatest memories as a kid going to Homestead, so it's really unfortunate that they continue to treat the community this way instead of handling legitimate concerns as a business professional should. 

What do you think? Are you going to give them another shot?

  
\*I blurred out the names in the screenshot but nothing else is altered. ",2025-04-30 23:18:07+00:00,2025,4,30,2,Wednesday,18,spring,post_api,False,homestead ice cream new owners i was excited to see that homestead is under new ownership. that is until i read the comments... i have the greatest memories as a kid going to homestead so it s really unfortunate that they continue to treat the community this way instead of handling legitimate concerns as a business professional should. what do you think? are you going to give them another shot? i blurred out the names in the screenshot but nothing else is altered.,468,83,False,True,0,1,0.5960264900662252,22cdc78e7ec2befc,0.5209,0.074,0.901,0.024,positive
1k8sfp1,Saskatoon woman questions her removal from Conservative rally by police,,1745717089.0,292,185,News 📰,0.86,/r/saskatoon/comments/1k8sfp1/saskatoon_woman_questions_her_removal_from/,https://www.thestar.com/politics/federal-elections/saskatoon-woman-questions-her-removal-from-conservative-rally-by-police/article_c51f3139-27e4-5490-9a13-79bec44609ec.html,False,Saskatoon,Saskatoon woman questions her removal from Conservative rally by police ,2025-04-27 01:24:49+00:00,2025,4,27,6,Sunday,17,spring,post_api,False,saskatoon woman questions her removal from conservative rally by police,71,10,True,False,1,0,0.6313993174061433,ea21b71ec4b98443,0.0,0.0,1.0,0.0,neutral
1jwtniq,Bessborough Hotel,This is the first Lego Saskatoon model I made but have not yet posted on this sub. More will be coming once I finish the commission I've been working on for the last couple of months. Stay tuned!,1744387883.0,257,14,Saskatoon History 💾,0.96,/r/saskatoon/comments/1jwtniq/bessborough_hotel/,https://www.reddit.com/gallery/1jwtniq,False,Saskatoon,Bessborough Hotel This is the first Lego Saskatoon model I made but have not yet posted on this sub. More will be coming once I finish the commission I've been working on for the last couple of months. Stay tuned!,2025-04-11 16:11:23+00:00,2025,4,11,4,Friday,15,spring,post_api,False,bessborough hotel this is the first lego saskatoon model i made but have not yet posted on this sub. more will be coming once i finish the commission i ve been working on for the last couple of months. stay tuned!,213,41,False,True,0,1,0.05426356589147287,86254eeb074446d7,0.0,0.0,1.0,0.0,neutral
1k8836g,Regina Police Plane Flying Now?,There's a low-flying plane circling around that I can see out of my house's south windows (I'm in Uplands). Pretty sure it must be the police plane. Definitely not something I was expecting to see tonight.,1745655546.0,4,19,Discussion,0.55,/r/regina/comments/1k8836g/regina_police_plane_flying_now/,https://www.reddit.com/r/regina/comments/1k8836g/regina_police_plane_flying_now/,True,Regina,Regina Police Plane Flying Now? There's a low-flying plane circling around that I can see out of my house's south windows (I'm in Uplands). Pretty sure it must be the police plane. Definitely not something I was expecting to see tonight.,2025-04-26 08:19:06+00:00,2025,4,26,5,Saturday,17,spring,post_api,False,regina police plane flying now? there s a low flying plane circling around that i can see out of my house s south windows i m in uplands . pretty sure it must be the police plane. definitely not something i was expecting to see tonight.,236,46,True,False,1,0,3.8,e58985c399bb3080,0.7269,0.157,0.803,0.04,positive
1jvmb82,Damned bike thieves,"This is the second time in the past year that my bf has lost a decent bike. Is the only way to prevent bike theft in this city not to own a bike in the first place? Do you guys use some heavy duty locks or something with an alarm on your bikes? Suggestions appreciated, though I doubt he's gonna invest in one for the near future since it seems like they are bound to be stolen sooner or later.",1744248573.0,51,38,Discussion,0.93,/r/regina/comments/1jvmb82/damned_bike_thieves/,https://www.reddit.com/r/regina/comments/1jvmb82/damned_bike_thieves/,True,Regina,"Damned bike thieves This is the second time in the past year that my bf has lost a decent bike. Is the only way to prevent bike theft in this city not to own a bike in the first place? Do you guys use some heavy duty locks or something with an alarm on your bikes? Suggestions appreciated, though I doubt he's gonna invest in one for the near future since it seems like they are bound to be stolen sooner or later.",2025-04-10 01:29:33+00:00,2025,4,10,3,Thursday,15,spring,post_api,False,damned bike thieves this is the second time in the past year that my bf has lost a decent bike. is the only way to prevent bike theft in this city not to own a bike in the first place? do you guys use some heavy duty locks or something with an alarm on your bikes? suggestions appreciated though i doubt he s gonna invest in one for the near future since it seems like they are bound to be stolen sooner or later.,413,84,True,False,3,0,0.7307692307692307,00bd210bb1cd79b1,-0.8677,0.07,0.761,0.169,negative
1k2nchi,Honest question for fellow reginians.,"Im about to celebrate 15 years living in the Queen City and for the life of me there are business that I simply can’t find an explanation how they are still open as I have NEVER EVER have seen them either busy or with the foot traffic that would explain a breaking-even/just getting by business scenario (yet somehow they have managed to weather the pandemic shutdown) e.g: Taco time in harbour landing, Mr. Mikes south, any travel agency.   ",1745034060.0,62,109,Question,0.91,/r/regina/comments/1k2nchi/honest_question_for_fellow_reginians/,https://www.reddit.com/r/regina/comments/1k2nchi/honest_question_for_fellow_reginians/,True,Regina,"Honest question for fellow reginians. Im about to celebrate 15 years living in the Queen City and for the life of me there are business that I simply can’t find an explanation how they are still open as I have NEVER EVER have seen them either busy or with the foot traffic that would explain a breaking-even/just getting by business scenario (yet somehow they have managed to weather the pandemic shutdown) e.g: Taco time in harbour landing, Mr. Mikes south, any travel agency.   ",2025-04-19 03:41:00+00:00,2025,4,19,5,Saturday,16,spring,post_api,False,honest question for fellow reginians. im about to celebrate years living in the queen city and for the life of me there are business that i simply can t find an explanation how they are still open as i have never ever have seen them either busy or with the foot traffic that would explain a breaking even just getting by business scenario yet somehow they have managed to weather the pandemic shutdown e.g taco time in harbour landing mr. mikes south any travel agency.,469,85,False,True,0,1,1.7301587301587302,1accad60ea9e3096,0.7906,0.078,0.922,0.0,positive
1jvggwn,Creative date ideas in the city?,"I'm looking for some creative/out of the ordinary, under $100 date ideas in Regina. 

Some of the things we HAVE done are: 

Charcuterie (Italian Star Deli) picnic in the park, walking pretty much anywhere you can imagine (trails, downtown, cathedral, etc), geo-caching, Wascana Trails, Regina Beach Trails, Echo Valley trails...I think you get the idea on that, 

Anyway, the weather is getting nice, we love being outside, and I want to try to plan something special for 5 years, which is coming up. Any suggestions for people who are out-doorsy that would be unique, different, and memorable?",1744231921.0,22,23,Community,0.83,/r/regina/comments/1jvggwn/creative_date_ideas_in_the_city/,https://www.reddit.com/r/regina/comments/1jvggwn/creative_date_ideas_in_the_city/,True,Regina,"Creative date ideas in the city? I'm looking for some creative/out of the ordinary, under $100 date ideas in Regina. 

Some of the things we HAVE done are: 

Charcuterie (Italian Star Deli) picnic in the park, walking pretty much anywhere you can imagine (trails, downtown, cathedral, etc), geo-caching, Wascana Trails, Regina Beach Trails, Echo Valley trails...I think you get the idea on that, 

Anyway, the weather is getting nice, we love being outside, and I want to try to plan something special for 5 years, which is coming up. Any suggestions for people who are out-doorsy that would be unique, different, and memorable?",2025-04-09 20:52:01+00:00,2025,4,9,2,Wednesday,15,spring,post_api,False,creative date ideas in the city? i m looking for some creative out of the ordinary under date ideas in regina. some of the things we have done are charcuterie italian star deli picnic in the park walking pretty much anywhere you can imagine trails downtown cathedral etc geo caching wascana trails regina beach trails echo valley trails...i think you get the idea on that anyway the weather is getting nice we love being outside and i want to try to plan something special for years which is coming up. any suggestions for people who are out doorsy that would be unique different and memorable?,594,105,False,True,0,1,1.0,1ad1b59b7041b213,0.9605,0.172,0.828,0.0,positive
1k0sztv,Best Rollerblading Streets,"Now that the warm weather’s here, I’m on the hunt for the smoothest streets in Regina to rollerblade on. Quieter neighbourhood streets are a plus. I unfortunately live in a not-so-great area and the sidewalks and roads are awful. I know the city has some great bike paths but some of them have really rough sections that are not the best for rollerblading. I appreciate any suggestions! So stoked for the spring weather! 

Cheers Queen City! 

",1744831407.0,2,9,Discussion,0.6,/r/regina/comments/1k0sztv/best_rollerblading_streets/,https://www.reddit.com/r/regina/comments/1k0sztv/best_rollerblading_streets/,True,Regina,"Best Rollerblading Streets Now that the warm weather’s here, I’m on the hunt for the smoothest streets in Regina to rollerblade on. Quieter neighbourhood streets are a plus. I unfortunately live in a not-so-great area and the sidewalks and roads are awful. I know the city has some great bike paths but some of them have really rough sections that are not the best for rollerblading. I appreciate any suggestions! So stoked for the spring weather! 

Cheers Queen City! 

",2025-04-16 19:23:27+00:00,2025,4,16,2,Wednesday,16,spring,post_api,False,best rollerblading streets now that the warm weather s here i m on the hunt for the smoothest streets in regina to rollerblade on. quieter neighbourhood streets are a plus. i unfortunately live in a not so great area and the sidewalks and roads are awful. i know the city has some great bike paths but some of them have really rough sections that are not the best for rollerblading. i appreciate any suggestions! so stoked for the spring weather! cheers queen city!,465,83,False,True,0,3,3.0,a1c4d4ead0ff412d,0.6547,0.152,0.74,0.108,positive
1jymyyx,I see you 2200 block Retallack,Always artistic on Retallack. Happy Spring!,1744592960.0,460,14,Community,0.99,/r/regina/comments/1jymyyx/i_see_you_2200_block_retallack/,https://i.redd.it/paekbqhkapue1.jpeg,False,Regina,I see you 2200 block Retallack Always artistic on Retallack. Happy Spring!,2025-04-14 01:09:20+00:00,2025,4,14,0,Monday,16,spring,post_api,False,i see you block retallack always artistic on retallack. happy spring!,69,11,False,True,0,1,0.03036876355748373,86bfbbafeb8f4c2a,0.2714,0.251,0.566,0.182,positive
1k440u0,"Walkway over the Ring Road. Regina, Sask, Canada. Taken with my Samsung s22 last summer.",,1745206042.0,417,13,Community,0.99,/r/regina/comments/1k440u0/walkway_over_the_ring_road_regina_sask_canada/,https://i.redd.it/sof46ycrw3we1.jpeg,False,Regina,"Walkway over the Ring Road. Regina, Sask, Canada. Taken with my Samsung s22 last summer. ",2025-04-21 03:27:22+00:00,2025,4,21,0,Monday,17,spring,post_api,False,walkway over the ring road. regina sask canada. taken with my samsung s last summer.,84,15,False,True,0,1,0.03110047846889952,c65b1b5c0f186884,0.0,0.0,1.0,0.0,neutral
1jpxy65,Termination of fee collection agreement with URSU,"Just got an email regarding an update for the URSU:

Dear students,
 
I am writing to provide important information regarding the relationship between the University of Regina and the University of Regina Students’ Union (URSU).
 
After reviewing URSU’s 2024 audited financial statements, the University raised significant concerns with URSU regarding its financial situation. This is a matter we take very seriously – the University’s highest priority is the best interests of our students.
 
Over the past several months, the University has tried to work with URSU leadership, offering financial and governance assistance. Unfortunately, URSU has not undertaken the steps recommended by the University to improve and address these matters. As a result, the University has lost confidence in URSU’s ability to serve and represent the University’s students and has made the decision to terminate the agreement pursuant to which the University levies and collects student fees on behalf of URSU, effective August 31, 2025.
 
The University wishes to assure students that core student services will continue in the Fall 2025 term, as will the collection of student fees that fund those services. The necessary arrangements will be put in place over the coming months.
 
These are complex situations to navigate, and this is a decision we do not take lightly. We value and respect the independence of student associations. The University remains committed to working in good faith with a student union that demonstrates a commitment to good governance and sound financial management. 
 
We are aware that steps are being taken by URSU’s student members that may result in changes to how student views are represented at the University of Regina. It is critical for that process to be driven by and for students and we hope that it leads to a sustainable path forward to an effective and accountable student representative organization.
 
Yours sincerely,
 
Jeff Keshen
President and Vice-Chancellor

TL;DR:
The University of Regina is ending its agreement with the URSU to collect fees on their behalf starting August 31, 2025, due to concerns over URSU’s finances and lack of action to fix the issues. The university will ensure essential student services continue and is open to working with a student union that shows better governance and accountability. Students may be organizing changes themselves, and the university supports a student-led solution moving forward.",1743623333.0,235,116,Discussion,0.98,/r/regina/comments/1jpxy65/termination_of_fee_collection_agreement_with_ursu/,https://www.reddit.com/r/regina/comments/1jpxy65/termination_of_fee_collection_agreement_with_ursu/,True,Regina,"Termination of fee collection agreement with URSU Just got an email regarding an update for the URSU:

Dear students,
 
I am writing to provide important information regarding the relationship between the University of Regina and the University of Regina Students’ Union (URSU).
 
After reviewing URSU’s 2024 audited financial statements, the University raised significant concerns with URSU regarding its financial situation. This is a matter we take very seriously – the University’s highest priority is the best interests of our students.
 
Over the past several months, the University has tried to work with URSU leadership, offering financial and governance assistance. Unfortunately, URSU has not undertaken the steps recommended by the University to improve and address these matters. As a result, the University has lost confidence in URSU’s ability to serve and represent the University’s students and has made the decision to terminate the agreement pursuant to which the University levies and collects student fees on behalf of URSU, effective August 31, 2025.
 
The University wishes to assure students that core student services will continue in the Fall 2025 term, as will the collection of student fees that fund those services. The necessary arrangements will be put in place over the coming months.
 
These are complex situations to navigate, and this is a decision we do not take lightly. We value and respect the independence of student associations. The University remains committed to working in good faith with a student union that demonstrates a commitment to good governance and sound financial management. 
 
We are aware that steps are being taken by URSU’s student members that may result in changes to how student views are represented at the University of Regina. It is critical for that process to be driven by and for students and we hope that it leads to a sustainable path forward to an effective and accountable student representative organization.
 
Yours sincerely,
 
Jeff Keshen
President and Vice-Chancellor

TL;DR:
The University of Regina is ending its agreement with the URSU to collect fees on their behalf starting August 31, 2025, due to concerns over URSU’s finances and lack of action to fix the issues. The university will ensure essential student services continue and is open to working with a student union that shows better governance and accountability. Students may be organizing changes themselves, and the university supports a student-led solution moving forward.",2025-04-02 19:48:53+00:00,2025,4,2,2,Wednesday,14,spring,post_api,False,termination of fee collection agreement with ursu just got an email regarding an update for the ursu dear students i am writing to provide important information regarding the relationship between the university of regina and the university of regina students union ursu . after reviewing ursu s ADDRESS atements the university raised significant concerns with ursu regarding its financial situation. this is a matter we take very seriously the university s highest priority is the best interests of our students. over the past several months the university has tried to work with ursu leadership offering financial and governance assistance. unfortunately ursu has not undertaken the steps recommended by the university to improve and address these matters. as a result the university has lost confidence in ursu s ability to serve and represent the university s students and has made the decision to terminate the agreement pursuant to which the university levies and collects student fees on behalf of ursu effective august . the university wishes to assure students that core student services will continue in the fall term as will the collection of student fees that fund those services. the necessary arrangements will be put in place over the coming months. these are complex situations to navigate and this is a decision we do not take lightly. we value and respect the independence of student associations. the university remains committed to working in good faith with a student union that demonstrates a commitment to good governance and sound financial management. we are aware that steps are being taken by ursu s student members that may result in changes to how student views are represented at the university of regina. it is critical for that process to be driven by and for students and we hope that it leads to a sustainable path forward to an effective and accountable student representative organization. yours sincerely jeff keshen president and vice chancellor tl dr the university of regina is ending its agreement with the ursu to collect fees on their behalf starting august due to concerns over ursu s finances and lack of action to fix the issues. the university will ensure essential student services continue and is open to working with a student union that shows better governance and accountability. students may be organizing changes themselves and the university supports a student led solution moving forward.,2443,394,False,True,0,1,0.4915254237288136,c2aa39a8f01b15ab,0.9959,0.178,0.797,0.025,positive
1k8lb3l,Influencer appropriation of queer culture,"A Regina influencer made a story post of her daughter and used a RuPaul and a Chappell Roan song. I would have no problem with that if her husband wasn’t on a “vote conservative” tirade on instagram. 

We’ve constantly heard anti-queer and transphobic rhetoric from the Conservative Party. 

Remember when 13/14 of Saskatchewan MPs voted against a bill that would criminalize conversion therapy?

Or when Poilievre said he is aware of only two genders? Or that he believes DEI policies are garbage? Or how he supports the use of the notwithstanding clause? Or that he wants to ban trans women from women’s sports teams? Or how he’s spoken out against gender affirming care?

So while our LGBTQ2S+ community is fighting for their rights against conservative governments, which her husband is very much making promoting this government his current marketing grab, she’s going to play music from that community for her own marketing purposes? Sashay away. ",1745696367.0,175,278,Discussion,0.64,/r/regina/comments/1k8lb3l/influencer_appropriation_of_queer_culture/,https://www.reddit.com/r/regina/comments/1k8lb3l/influencer_appropriation_of_queer_culture/,True,Regina,"Influencer appropriation of queer culture A Regina influencer made a story post of her daughter and used a RuPaul and a Chappell Roan song. I would have no problem with that if her husband wasn’t on a “vote conservative” tirade on instagram. 

We’ve constantly heard anti-queer and transphobic rhetoric from the Conservative Party. 

Remember when 13/14 of Saskatchewan MPs voted against a bill that would criminalize conversion therapy?

Or when Poilievre said he is aware of only two genders? Or that he believes DEI policies are garbage? Or how he supports the use of the notwithstanding clause? Or that he wants to ban trans women from women’s sports teams? Or how he’s spoken out against gender affirming care?

So while our LGBTQ2S+ community is fighting for their rights against conservative governments, which her husband is very much making promoting this government his current marketing grab, she’s going to play music from that community for her own marketing purposes? Sashay away. ",2025-04-26 19:39:27+00:00,2025,4,26,5,Saturday,17,spring,post_api,False,influencer appropriation of queer culture a regina influencer made a story post of her daughter and used a rupaul and a chappell roan song. i would have no problem with that if her husband wasn t on a vote conservative tirade on instagram. we ve constantly heard anti queer and transphobic rhetoric from the conservative party. remember when of saskatchewan mps voted against a bill that would criminalize conversion therapy? or when poilievre said he is aware of only two genders? or that he believes dei policies are garbage? or how he supports the use of the notwithstanding clause? or that he wants to ban trans women from women s sports teams? or how he s spoken out against gender affirming care? so while our lgbtq s community is fighting for their rights against conservative governments which her husband is very much making promoting this government his current marketing grab she s going to play music from that community for her own marketing purposes? sashay away.,977,166,True,False,1,0,1.5795454545454546,8a9dcb09776a39d4,0.8117,0.092,0.862,0.046,positive
