id,title,selftext,created_utc,score,num_comments,link_flair_text,upvote_ratio,permalink,url,is_self,subreddit,full_text,created_date,year,month,day,day_of_week,day_name,week_of_year,season,platform_period,is_pandemic,cleaned_text,text_length,word_count,contains_crime_keywords,contains_weather_keywords,crime_keyword_count,weather_keyword_count,engagement_rate,author_hash,sentiment_compound,sentiment_positive,sentiment_neutral,sentiment_negative,sentiment_category
1ek0snz,Stolen car with Minnesota plates,"Hello all!

I moved back up for my 4th year at UM and within 30 hours of moving into my apartment my vehicle was stolen. I’m hoping since it has Minnesota plates it’s easier to spot. It’s a 2002 gold Chrysler Concorde but it looks rose gold in certain lighting. No stickers or dents or anything. Stolen from the lot at Edmonton and Broadway. Tow company doesn’t have it. 

I have no clue how they stole it. Car was locked (at least should have been) and I have the keys. Im hoping it will turn up in some parking lot, but of course Im prepared for the worst. 

Just posting this as a shot in the dark. It’s all reported to the police. 

Edit: it was found!! In a parking lot in the North End. Not sure why anyone would take a rare car with MN plates. That thing sticks out like a sore thumb here. 

Thanks :)",1722792710.0,81,17,Community,0.95,/r/Winnipeg/comments/1ek0snz/stolen_car_with_minnesota_plates/,https://www.reddit.com/r/Winnipeg/comments/1ek0snz/stolen_car_with_minnesota_plates/,True,Winnipeg,"Stolen car with Minnesota plates Hello all!

I moved back up for my 4th year at UM and within 30 hours of moving into my apartment my vehicle was stolen. I’m hoping since it has Minnesota plates it’s easier to spot. It’s a 2002 gold Chrysler Concorde but it looks rose gold in certain lighting. No stickers or dents or anything. Stolen from the lot at Edmonton and Broadway. Tow company doesn’t have it. 

I have no clue how they stole it. Car was locked (at least should have been) and I have the keys. Im hoping it will turn up in some parking lot, but of course Im prepared for the worst. 

Just posting this as a shot in the dark. It’s all reported to the police. 

Edit: it was found!! In a parking lot in the North End. Not sure why anyone would take a rare car with MN plates. That thing sticks out like a sore thumb here. 

Thanks :)",2024-08-04 17:31:50+00:00,2024,8,4,6,Sunday,31,summer,post_api,False,stolen car with minnesota plates hello all! i moved back up for my th year at um and within ADDRESS olen. i m hoping since it has minnesota plates it s easier to spot. it s a gold chrysler concorde but it looks rose gold in certain lighting. no stickers or dents or anything. stolen from the lot at edmonton and broadway. tow company doesn t have it. i have no clue how they stole it. car was locked at least should have been and i have the keys. im hoping it will turn up in some parking lot but of course im prepared for the worst. just posting this as a shot in the dark. it s all reported to the police. edit it was found!! in a parking lot in the north end. not sure why anyone would take a rare car with mn plates. that thing sticks out like a sore thumb here. thanks,773,157,True,True,3,1,0.2073170731707317,bbac1b28b1ba54f4,-0.8186,0.101,0.769,0.13,negative
1f24hd1,Is it a bad idea to backfill house foundation with free-draining rock in our weather?,"I'm waterproofing our foundation and an engineer and contractor recommend backfilling with rock instead of soil to prevent hydrostatic pressure. However, I'm concerned if this is an expense that could lead to issues such as water sitting at the bottom of the foundation and freezing, potentially increasing the chance of the rock letting cold air pass through it, and any water that’s sitting down at the bottom will freeze and potentially heave the footings and walls.

Has anyone ever done a project like this an have some good insights? We will be installing a new drainage system and sump pump to handle the water.",1724720432.0,2,11,Community,0.56,/r/Winnipeg/comments/1f24hd1/is_it_a_bad_idea_to_backfill_house_foundation/,https://www.reddit.com/r/Winnipeg/comments/1f24hd1/is_it_a_bad_idea_to_backfill_house_foundation/,True,Winnipeg,"Is it a bad idea to backfill house foundation with free-draining rock in our weather? I'm waterproofing our foundation and an engineer and contractor recommend backfilling with rock instead of soil to prevent hydrostatic pressure. However, I'm concerned if this is an expense that could lead to issues such as water sitting at the bottom of the foundation and freezing, potentially increasing the chance of the rock letting cold air pass through it, and any water that’s sitting down at the bottom will freeze and potentially heave the footings and walls.

Has anyone ever done a project like this an have some good insights? We will be installing a new drainage system and sump pump to handle the water.",2024-08-27 01:00:32+00:00,2024,8,27,1,Tuesday,35,summer,post_api,False,is it a bad idea to backfill house foundation with free draining rock in our weather? i m waterproofing our foundation and an engineer and contractor recommend backfilling with rock instead of soil to prevent hydrostatic pressure. however i m concerned if this is an expense that could lead to issues such as water sitting at the bottom of the foundation and freezing potentially increasing the chance of the rock letting cold air pass through it and any water that s sitting down at the bottom will freeze and potentially heave the footings and walls. has anyone ever done a project like this an have some good insights? we will be installing a new drainage system and sump pump to handle the water.,700,123,False,True,0,5,3.6666666666666665,049ec4c213a5a38d,0.7757,0.117,0.831,0.052,positive
1el2ket,Snow Clearing ,"Random question, I just got my annual agreement for the snow clearing this coming winter.  They want $190 a month for unlimited clearing after 2.5 cm. 

I have four steps from the front door and about 8 ft of sidewalk to the driveway. They don't do the sidewalk at all, they only do the driveway. The driveway is suitable for four medium size cars.

For anybody who has snow clearing, how much are you paying for this?",1722900426.0,2,9,Ask Winnipeg,0.57,/r/Winnipeg/comments/1el2ket/snow_clearing/,https://www.reddit.com/r/Winnipeg/comments/1el2ket/snow_clearing/,True,Winnipeg,"Snow Clearing  Random question, I just got my annual agreement for the snow clearing this coming winter.  They want $190 a month for unlimited clearing after 2.5 cm. 

I have four steps from the front door and about 8 ft of sidewalk to the driveway. They don't do the sidewalk at all, they only do the driveway. The driveway is suitable for four medium size cars.

For anybody who has snow clearing, how much are you paying for this?",2024-08-05 23:27:06+00:00,2024,8,5,0,Monday,32,summer,post_api,False,snow clearing random question i just got my annual agreement for the snow clearing this coming winter. they want a month for unlimited clearing after . cm. i have four steps from the front door and about ADDRESS way. they don t do the sidewalk at all they only do the driveway. the driveway is suitable for four medium size cars. for anybody who has snow clearing how much are you paying for this?,397,74,False,True,0,2,3.0,631f755ccdc9605d,0.5423,0.059,0.941,0.0,positive
1exbec5,So angry,"Today my kids - 9, 12 and 17 - set up a free lemonade stand in Belgravia. Their slogan was ""Lemonade is a human right!"" and they were giving drinks to bikers and joggers as a way to make people happy. 

They were about 45 minutes in when a guy on a bike stopped and started screaming at them saying they were F&CK&NG COMMUNISTS and they should DIE LIKE THE SCUM THEY ARE. My daughters are still sobbing in fear and terror. 

Dude did not seem to be afflicted by drugs or demons, he said he was an anarch-capitalist and my kids were scum. He was short, wearing a fake camo bullet proof vest, a camo pseudo-military bike helmet, and carrying a baton strapped to his waist. If you know somebody of that description, tell him to keep his ""anarcho-capitalist"" preaching in his pie-hole. My kids just wanted to spread some joy, and now they're terrified and crying. 

Edit: Thanks for all the support, outrage shared is outrage halved. 

Update 2: My MLA Lori Sigurdson and Mill Woods MLA Christina Gray stopped by with nice official-looking Legislature Lemonade awards, which they gave to my daughters. They're on top of the world, they were tickled pink. Also, a police report has been filed, so those in this thread who are saying I'm a liar can add perjury to their suspicions.",1724199115.0,2058,380,General,0.92,/r/Edmonton/comments/1exbec5/so_angry/,https://www.reddit.com/r/Edmonton/comments/1exbec5/so_angry/,True,Edmonton,"So angry Today my kids - 9, 12 and 17 - set up a free lemonade stand in Belgravia. Their slogan was ""Lemonade is a human right!"" and they were giving drinks to bikers and joggers as a way to make people happy. 

They were about 45 minutes in when a guy on a bike stopped and started screaming at them saying they were F&CK&NG COMMUNISTS and they should DIE LIKE THE SCUM THEY ARE. My daughters are still sobbing in fear and terror. 

Dude did not seem to be afflicted by drugs or demons, he said he was an anarch-capitalist and my kids were scum. He was short, wearing a fake camo bullet proof vest, a camo pseudo-military bike helmet, and carrying a baton strapped to his waist. If you know somebody of that description, tell him to keep his ""anarcho-capitalist"" preaching in his pie-hole. My kids just wanted to spread some joy, and now they're terrified and crying. 

Edit: Thanks for all the support, outrage shared is outrage halved. 

Update 2: My MLA Lori Sigurdson and Mill Woods MLA Christina Gray stopped by with nice official-looking Legislature Lemonade awards, which they gave to my daughters. They're on top of the world, they were tickled pink. Also, a police report has been filed, so those in this thread who are saying I'm a liar can add perjury to their suspicions.",2024-08-21 00:11:55+00:00,2024,8,21,2,Wednesday,34,summer,post_api,False,so angry today my kids and set up a free lemonade stand in belgravia. their slogan was lemonade is a human right! and they were giving drinks to bikers and joggers as a way to make people happy. they were about ADDRESS arted screaming at them saying they were f ck ng communists and they should die like the scum they are. my daughters are still sobbing in fear and terror. dude did not seem to be afflicted by drugs or demons he said he was an anarch capitalist and my kids were scum. he was short wearing a fake camo bullet proof vest a camo pseudo military bike helmet and carrying a baton strapped to his waist. if you know somebody of that description tell him to keep his anarcho capitalist preaching in his pie hole. my kids just wanted to spread some joy and now they re terrified and crying. edit thanks for all the support outrage shared is outrage halved. update my mla lori sigurdson and mill woods mla christina gray stopped by with nice official looking legislature lemonade awards which they gave to my daughters. they re on top of the world they were tickled pink. also a police report has been filed so those in this thread who are saying i m a liar can add perjury to their suspicions.,1203,225,True,False,1,0,0.18455560951918407,773e654b27c73a2e,-0.9595,0.112,0.71,0.178,negative
1elseb7,Someone got attacked with a knife on my bus ,"On the 7 downtown bus stop before the 107 Ave and 135 St intersection 

This lady with tattoos got on and began talking to this couple, as they got off the woman in the couple and the stranger lady got into an argument 

As the man came to defend, the lady sliced him near his eye with a weapon, and he began bleeding everywhere! 

Passengers called the police and got a picture of the victim and we got transferred to the next bus 

This city is becoming more and more unsafe everyday! 

Edit: as some redditors pointed out, this last statement isn’t in line with crime statistics. I believe the emotionality of that event had a toll on me at that time. I hope all edmontonians live their life being as safe as possible! ",1722976376.0,370,264,Commuting/Transit,0.87,/r/Edmonton/comments/1elseb7/someone_got_attacked_with_a_knife_on_my_bus/,https://www.reddit.com/r/Edmonton/comments/1elseb7/someone_got_attacked_with_a_knife_on_my_bus/,True,Edmonton,"Someone got attacked with a knife on my bus  On the 7 downtown bus stop before the 107 Ave and 135 St intersection 

This lady with tattoos got on and began talking to this couple, as they got off the woman in the couple and the stranger lady got into an argument 

As the man came to defend, the lady sliced him near his eye with a weapon, and he began bleeding everywhere! 

Passengers called the police and got a picture of the victim and we got transferred to the next bus 

This city is becoming more and more unsafe everyday! 

Edit: as some redditors pointed out, this last statement isn’t in line with crime statistics. I believe the emotionality of that event had a toll on me at that time. I hope all edmontonians live their life being as safe as possible! ",2024-08-06 20:32:56+00:00,2024,8,6,1,Tuesday,32,summer,post_api,False,someone got attacked with a knife on my bus on the ADDRESS intersection this lady with tattoos got on and began talking to this couple as they got off the woman in the couple and the stranger lady got into an argument as the man came to defend the lady sliced him near his eye with a weapon and he began bleeding everywhere! passengers called the police and got a picture of the victim and we got transferred to the next bus this city is becoming more and more unsafe everyday! edit as some redditors pointed out this last statement isn t in line with crime statistics. i believe the emotionality of that event had a toll on me at that time. i hope all edmontonians live their life being as safe as possible!,708,134,True,False,4,0,0.7115902964959568,e48446d7e7d1b851,-0.8114,0.039,0.864,0.096,negative
1f14eq8,Police investigating fatal pedestrian collision in southeast Edmonton,"Reminder to all, only cross the street when safe and keep an eye on the approaching vehicles.  The pedestrian loses every single time, this lady lost her life.",1724613526.0,96,201,News Article,0.82,/r/Edmonton/comments/1f14eq8/police_investigating_fatal_pedestrian_collision/,https://www.reddit.com/r/Edmonton/comments/1f14eq8/police_investigating_fatal_pedestrian_collision/,True,Edmonton,"Police investigating fatal pedestrian collision in southeast Edmonton Reminder to all, only cross the street when safe and keep an eye on the approaching vehicles.  The pedestrian loses every single time, this lady lost her life.",2024-08-25 19:18:46+00:00,2024,8,25,6,Sunday,34,summer,post_api,False,police investigating fatal pedestrian collision in southeast edmonton reminder to all only cross the street when safe and keep an eye on the approaching vehicles. the pedestrian loses every single time this lady lost her life.,226,36,True,False,1,0,2.0721649484536084,c49d9c432d3c5e65,-0.7717,0.065,0.697,0.238,negative
1f5byrm,Police Helicopter?,Has anyone else noticed the police helicopter out super frequently? I swear I hear it every day now - do we have the money for this? It must be expensive to fly,1725068224.0,0,33,Question,0.27,/r/Edmonton/comments/1f5byrm/police_helicopter/,https://www.reddit.com/r/Edmonton/comments/1f5byrm/police_helicopter/,True,Edmonton,Police Helicopter? Has anyone else noticed the police helicopter out super frequently? I swear I hear it every day now - do we have the money for this? It must be expensive to fly,2024-08-31 01:37:04+00:00,2024,8,31,5,Saturday,35,summer,post_api,False,police helicopter? has anyone else noticed the police helicopter out super frequently? i swear i hear it every day now do we have the money for this? it must be expensive to fly,177,33,True,False,1,0,33.0,c6f5f2fa60e7a410,0.6416,0.121,0.846,0.033,positive
1ewfja0,I saw my stolen stuff on the marketplace,"Last year, I had a digital keyboard (RD88) stolen from me. Shortly after the theft, an ad for the same model keyboard was put up. I reached out wanting to confirm the serial number. I was ignored and the ad was taken down. 

One year later, the same seller puts the ad back up. I can't 100% confirm it's mine, but there are some small identifying features I recognize, like the immaculate LED screen from the factory sticker freshly peeled, and a scratch visible on the pictures in the ad. 

EPS told me not to meet them until the investigating officer gets back to me. 

What else can I do? 
",1724107415.0,130,79,Question,0.9,/r/Edmonton/comments/1ewfja0/i_saw_my_stolen_stuff_on_the_marketplace/,https://www.reddit.com/r/Edmonton/comments/1ewfja0/i_saw_my_stolen_stuff_on_the_marketplace/,True,Edmonton,"I saw my stolen stuff on the marketplace Last year, I had a digital keyboard (RD88) stolen from me. Shortly after the theft, an ad for the same model keyboard was put up. I reached out wanting to confirm the serial number. I was ignored and the ad was taken down. 

One year later, the same seller puts the ad back up. I can't 100% confirm it's mine, but there are some small identifying features I recognize, like the immaculate LED screen from the factory sticker freshly peeled, and a scratch visible on the pictures in the ad. 

EPS told me not to meet them until the investigating officer gets back to me. 

What else can I do? 
",2024-08-19 22:43:35+00:00,2024,8,19,0,Monday,34,summer,post_api,False,i saw my stolen stuff on the marketplace last year i had a digital keyboard rd stolen from me. shortly after the theft an ad for the same model keyboard was put up. i reached out wanting to confirm the serial number. i was ignored and the ad was taken down. one year later the same seller puts the ad back up. i can t confirm it s mine but there are some small identifying features i recognize like the immaculate led screen from the factory sticker freshly peeled and a scratch visible on the pictures in the ad. eps told me not to meet them until the investigating officer gets back to me. what else can i do?,611,119,True,False,3,0,0.6030534351145038,1b2cdf424f89bb78,-0.0644,0.045,0.908,0.047,negative
1f2p5e6,"Car Broken Into, Luggage Stolen - Including Canes, Crutches, Cherished Necklace","**Police Report Number: 240630509**

**Officer: #1416 St Duvander** 

*(Note the name may be spelled wrong, hard to read off of the report! The number is correct though)* 

(Edited to hopefully meet rules!) I'm absolutely devastated. Some time the night before last (the night of August 25th), someone broke into my girlfriend's parents car, with all of her things to travel tomorrow sitting inside. This included 2 large duffel bags filled with all of her clothing, art supplies (needle felting), mobility aids (Cane, Crutch), and a necklace her great grandmother gave her. The two duffel bags are red and yellow, and are quite large. 

The thieves broke the window of the car, and must have had a vehicle of their own to take away everything, as it weighed over 100lbs total. 

Additionally, some of the clothes she had made by hand were inside the bags, and cannot simply be replaced with money. The police have been informed, and insurance has been filed. 

The theft occurred around the Highlands neighbourhood, though we don't know at what time at night. 


If anyone sees:

- a large amount of size-small women's clothing

- a [clear acrylic cane with a shepherds crook](https://www.neo-walk.com/wp-content/uploads/2021/11/IMG_3958-scaled.jpg), a [""gutter crutch""
](https://cdn.shoplightspeed.com/shops/619612/files/39632903/800x800x3/md-mobility-design-mobility-designed-forearm-comfo.jpg)
- riding equipment (helmet, boots, gloves, breeches, show jacket, and shirts)

- Jewlery making and felting tools

- yellow[ fluvogs](https://www.fluevog.com/images/nimbus-yellow-contrast-loafer-heel-quarter-view-colour_image-0000023835-retina_detail.jpg) 

- lots of antique/vintage jewellery 

- Either of the duffel bags

Please let us know. Although she's already left Edmonton, I want to do everything I can to help, and to hopefully find the keepsake from her great grandmother. She has other family in town that will be able to follow up!

Thank you so much to everyone who reads and keeps an eye out for these things, it means so much to us ❤",1724785160.0,44,22,Question,0.79,/r/Edmonton/comments/1f2p5e6/car_broken_into_luggage_stolen_including_canes/,https://www.reddit.com/r/Edmonton/comments/1f2p5e6/car_broken_into_luggage_stolen_including_canes/,True,Edmonton,"Car Broken Into, Luggage Stolen - Including Canes, Crutches, Cherished Necklace **Police Report Number: 240630509**

**Officer: #1416 St Duvander** 

*(Note the name may be spelled wrong, hard to read off of the report! The number is correct though)* 

(Edited to hopefully meet rules!) I'm absolutely devastated. Some time the night before last (the night of August 25th), someone broke into my girlfriend's parents car, with all of her things to travel tomorrow sitting inside. This included 2 large duffel bags filled with all of her clothing, art supplies (needle felting), mobility aids (Cane, Crutch), and a necklace her great grandmother gave her. The two duffel bags are red and yellow, and are quite large. 

The thieves broke the window of the car, and must have had a vehicle of their own to take away everything, as it weighed over 100lbs total. 

Additionally, some of the clothes she had made by hand were inside the bags, and cannot simply be replaced with money. The police have been informed, and insurance has been filed. 

The theft occurred around the Highlands neighbourhood, though we don't know at what time at night. 


If anyone sees:

- a large amount of size-small women's clothing

- a [clear acrylic cane with a shepherds crook](https://www.neo-walk.com/wp-content/uploads/2021/11/IMG_3958-scaled.jpg), a [""gutter crutch""
](https://cdn.shoplightspeed.com/shops/619612/files/39632903/800x800x3/md-mobility-design-mobility-designed-forearm-comfo.jpg)
- riding equipment (helmet, boots, gloves, breeches, show jacket, and shirts)

- Jewlery making and felting tools

- yellow[ fluvogs](https://www.fluevog.com/images/nimbus-yellow-contrast-loafer-heel-quarter-view-colour_image-0000023835-retina_detail.jpg) 

- lots of antique/vintage jewellery 

- Either of the duffel bags

Please let us know. Although she's already left Edmonton, I want to do everything I can to help, and to hopefully find the keepsake from her great grandmother. She has other family in town that will be able to follow up!

Thank you so much to everyone who reads and keeps an eye out for these things, it means so much to us ❤",2024-08-27 18:59:20+00:00,2024,8,27,1,Tuesday,35,summer,post_api,False,car broken into luggage stolen including canes crutches cherished necklace police report number officer st duvander note the name may be spelled wrong hard to read off of the report! the number is correct though edited to hopefully meet rules! i m absolutely devastated. some time the night before last the night of august th someone broke into my girlfriend s parents car with all of her things to travel tomorrow sitting inside. this included large duffel bags filled with all of her clothing art supplies needle felting mobility aids cane crutch and a necklace her great grandmother gave her. the two duffel bags are red and yellow and are quite large. the thieves broke the window of the car and must have had a vehicle of their own to take away everything as it weighed over lbs total. additionally some of the clothes she had made by hand were inside the bags and cannot simply be replaced with money. the police have been informed and insurance has been filed. the theft occurred around the highlands neighbourhood though we don t know at what time at night. if anyone sees a large amount of size small women s clothing a clear acrylic cane with a shepherds crook a gutter crutch riding equipment helmet boots gloves breeches show jacket and shirts jewlery making and felting tools yellow fluvogs lots of antique vintage jewellery either of the duffel bags please let us know. although she s already left edmonton i want to do everything i can to help and to hopefully find the keepsake from her great grandmother. she has other family in town that will be able to follow up! thank you so much to everyone who reads and keeps an eye out for these things it means so much to us,1683,301,True,False,4,0,0.4888888888888889,ecfcdf0b631ed4de,0.828,0.103,0.825,0.072,positive
1ex3lh0,Duct cleaning cold calls,"I keep receiving cold calls for duct cleaning. I’ve heard it’s probably a scam, but… I don’t see the angle? Anyone else getting these?",1724179710.0,25,37,General,0.9,/r/Edmonton/comments/1ex3lh0/duct_cleaning_cold_calls/,https://www.reddit.com/r/Edmonton/comments/1ex3lh0/duct_cleaning_cold_calls/,True,Edmonton,"Duct cleaning cold calls I keep receiving cold calls for duct cleaning. I’ve heard it’s probably a scam, but… I don’t see the angle? Anyone else getting these?",2024-08-20 18:48:30+00:00,2024,8,20,1,Tuesday,34,summer,post_api,False,duct cleaning cold calls i keep receiving cold calls for duct cleaning. i ve heard it s probably a scam but i don t see the angle? anyone else getting these?,157,31,False,True,0,1,1.4230769230769231,47354c4f68456188,-0.4039,0.0,0.917,0.083,negative
